Sheet: CostofGoodsSoldDetailwith
A1: NIS America, Inc.
A2: Cost of Goods Sold Detail with Division( SKU)
A3: Sep 2024
A5: Options: Activity Only
A6: Financial Row | B6: Type | C6: Date | D6: Document Number | E6: Name | F6: Clr | G6: Split | H6: Amount | I6: Division: Name | J6: Item | K6: Game Title: Name
A7: Ordinary Income/Expense
A8: Cost Of Sales
A9: Cost of Goods Sold
A10: Cost of Goods Sold-Anime
A11: COGS-Anime:Wholesale_Material Costs
B12: Item Fulfillment | C12: 2024-09-09T00:00:00.000 | D12: 434952 | E12: 16012 austin pickle | F12: F | G12: Inventory Asset : Finished Goods | H12: 2.18 | I12: Anime-STORE | J12: TDO1-BRD-US-SE | K12: Toradora1
B13: Item Fulfillment | C13: 2024-09-09T00:00:00.000 | D13: 434952 | E13: 16012 austin pickle | F13: F | G13: Inventory Asset : Finished Goods | H13: 1.59 | I13: Anime-STORE | J13: TDO2-BRD-US-SE | K13: Toradora2
B14: Item Fulfillment | C14: 2024-09-10T00:00:00.000 | D14: 433652 | E14: THE RIGHT STUF INC | F14: F | G14: Inventory Asset : Finished Goods | H14: 285.66 | I14: Anime | J14: CCS1-BRD-US-SE | K14: Cardcaptor Sakura
B15: Item Fulfillment | C15: 2024-09-10T00:00:00.000 | D15: 433652 | E15: THE RIGHT STUF INC | F15: F | G15: Inventory Asset : Finished Goods | H15: 65.3 | I15: Anime | J15: TDO1-BRD-US-SE | K15: Toradora1
B16: Item Fulfillment | C16: 2024-09-10T00:00:00.000 | D16: 433652 | E16: THE RIGHT STUF INC | F16: F | G16: Inventory Asset : Finished Goods | H16: 64.8 | I16: Anime | J16: IRO1-BRD-US-SE | K16: Hanasaku Iroha 1
B17: Item Fulfillment | C17: 2024-09-10T00:00:00.000 | D17: 433652 | E17: THE RIGHT STUF INC | F17: F | G17: Inventory Asset : Finished Goods | H17: 57.42 | I17: Anime | J17: IRO2-BRD-US-SE | K17: Hanasaku Iroha 2
B18: Item Fulfillment | C18: 2024-09-23T00:00:00.000 | D18: 434751 | E18: THE RIGHT STUF INC | F18: F | G18: Inventory Asset : Finished Goods | H18: 174.79 | I18: Anime | J18: KNT2-BRD-US-SE | K18: Kimi Ni Todoke 2
A19: Total - COGS-Anime:Wholesale_Material Costs | H19: SUM(R[-7]C:R[-1]C) -> 651.74
A20: Total - Cost of Goods Sold-Anime | H20: SUM(R[-1]C) -> 651.74
A21: Cost of Goods Sold-Europe
A22: COGS-Europe:Online Store_Material Cost
B23: Bill | C23: 2024-09-04T00:00:00.000 | D23: Sonopress 1090757516 | E23: Sonopress GmbH, Gutersloh | F23: F | G23: Accounts Payable : Accounts Payable:Vendors | H23: 65.62 | I23: EU Games-STORE | J23: ZGEN-GDS-EU-CVR | K23: - No Game Title -
B24: Bill | C24: 2024-09-04T00:00:00.000 | D24: Sonopress 1090757519 | E24: Sonopress GmbH, Gutersloh | F24: F | G24: Accounts Payable : Accounts Payable:Vendors | H24: 10.23 | I24: EU Games-STORE | J24: ZGEN-GDS-EU-CVR | K24: - No Game Title -
B25: Item Fulfillment | C25: 2024-09-10T00:00:00.000 | D25: 434942 | E25: Reef Entertainment Limited | F25: F | G25: Inventory Asset : Finished Goods | H25: 71.85 | I25: EU Games-STORE | J25: TTD2-OTH-EU-KEY1 | K25: Goods
B26: Item Fulfillment | C26: 2024-09-10T00:00:00.000 | D26: 434942 | E26: Reef Entertainment Limited | F26: F | G26: Inventory Asset : Finished Goods | H26: 71.85 | I26: EU Games-STORE | J26: TTD2-OTH-EU-KEY2 | K26: Goods
B27: Item Fulfillment | C27: 2024-09-17T00:00:00.000 | D27: 433678 | E27: Reef Entertainment Limited | F27: F | G27: Inventory Asset : Finished Goods | H27: 504.0 | I27: EU Games-STORE | J27: RNT1-GDS-EU-VG-PE-BOX | K27: REYNATIS
B28: Item Fulfillment | C28: 2024-09-17T00:00:00.000 | D28: 433678 | E28: Reef Entertainment Limited | F28: F | G28: Inventory Asset : Finished Goods | H28: 852.0 | I28: EU Games-STORE | J28: RNT1-GDS-EU-ABK1 | K28: REYNATIS
B29: Item Fulfillment | C29: 2024-09-17T00:00:00.000 | D29: 433678 | E29: Reef Entertainment Limited | F29: F | G29: Inventory Asset : Finished Goods | H29: 534.0 | I29: EU Games-STORE | J29: RNT1-GDS-EU-FIB1 | K29: REYNATIS
B30: Item Fulfillment | C30: 2024-09-17T00:00:00.000 | D30: 433678 | E30: Reef Entertainment Limited | F30: F | G30: Inventory Asset : Finished Goods | H30: 2426.96 | I30: EU Games-STORE | J30: RNT1-GDS-EU-STD1 | K30: REYNATIS
B31: Bill | C31: 2024-09-19T00:00:00.000 | D31: Sonopress 1090758773 | E31: Sonopress GmbH, Gutersloh | F31: F | G31: Accounts Payable : Accounts Payable:Vendors | H31: 9.4 | I31: EU Games-SAMPLES | J31: ZGEN-GDS-EU-CVR | K31: - No Game Title -
B32: Item Fulfillment | C32: 2024-09-19T00:00:00.000 | D32: 434941 | E32: Reef Entertainment Limited | F32: F | G32: Inventory Asset : Finished Goods | H32: 35.93 | I32: EU Games-STORE | J32: YSN1-OTH-EU-KEY1 | K32: Goods
B33: Bill | C33: 2024-09-20T00:00:00.000 | D33: Sonopress 1090758785 | E33: Sonopress GmbH, Gutersloh | F33: F | G33: Accounts Payable : Accounts Payable:Vendors | H33: 542.43 | I33: EU Games-STORE | J33: ZGEN-GDS-EU-CVR | K33: Ys 10 PS5
B34: Bill | C34: 2024-09-20T00:00:00.000 | D34: Sonopress 1012646407 | E34: Sonopress GmbH, Gutersloh | F34: F | G34: Accounts Payable : Accounts Payable:Vendors | H34: 136.82 | I34: EU Games-STORE | J34: ZGEN-GDS-EU-CVR | K34: Ys 10 NSW
B35: Bill | C35: 2024-09-23T00:00:00.000 | D35: SDADC EU CZ00732396 (A) | E35: SDADC-EUROPE | F35: F | G35: Accounts Payable : Accounts Payable:Vendors | H35: 60.3 | I35: EU Games-STORE | J35: ZGEN-GDS-EU-CVR | K35: Ys 10 PS4
B36: Bill | C36: 2024-09-23T00:00:00.000 | D36: SDADC EU CZ00732396 (B) | E36: SDADC-EUROPE | F36: F | G36: Accounts Payable : Accounts Payable:Vendors | H36: 40.2 | I36: EU Games-STORE | J36: ZGEN-GDS-EU-CVR | K36: - No Game Title -
B37: Bill | C37: 2024-09-25T00:00:00.000 | D37: Sonopress 1090759226 / 26.09.2024 | E37: Sonopress GmbH, Gutersloh | F37: F | G37: Accounts Payable : Accounts Payable:Vendors | H37: 29.94 | I37: EU Games | J37: ZGEN-GDS-EU-CVR | K37: 2024-09_REYNATIS EU Replace
B38: Bill | C38: 2024-09-25T00:00:00.000 | D38: Sonopress 1090759225 / 26.09.2024 | E38: Sonopress GmbH, Gutersloh | F38: F | G38: Accounts Payable : Accounts Payable:Vendors | H38: 1666.08 | I38: EU Games | J38: ZGEN-GDS-EU-CVR | K38: 2024-09_REYNATIS EU Replace
B39: Inventory Adjustment | C39: 2024-09-30T00:00:00.000 | D39: 3151 | F39: F | G39: Cost of Goods Sold : Cost of Goods Sold-North America : COGS-U.S. Online Store : COGS-Online Store:Goods_Material Costs | H39: 0.15 | I39: EU Games-STORE | J39: TTD2-OTH-EU-KEY2 | K39: Goods
B40: Inventory Adjustment | C40: 2024-09-30T00:00:00.000 | D40: 3151 | F40: F | G40: Cost of Goods Sold : Cost of Goods Sold-North America : COGS-U.S. Online Store : COGS-Online Store:Goods_Material Costs | H40: 0.07 | I40: EU Games-STORE | J40: YSN1-OTH-EU-KEY1 | K40: Goods
B41: Inventory Adjustment | C41: 2024-09-30T00:00:00.000 | D41: 3151 | F41: F | G41: Cost of Goods Sold : Cost of Goods Sold-North America : COGS-U.S. Online Store : COGS-Online Store:Goods_Material Costs | H41: 0.15 | I41: EU Games-STORE | J41: TTD2-OTH-EU-KEY1 | K41: Goods
A42: Total - COGS-Europe:Online Store_Material Cost | H42: SUM(R[-19]C:R[-1]C) -> 7057.979999999999
A43: COGS-Europe:Wholesale_Material Cost
B44: Assembly Build | C44: 2024-09-02T00:00:00.000 | D44: 754 | F44: F | G44: Inventory Asset : Finished Goods | H44: -1108.02 | I44: EU Games | J44: RNT1-NSW-EU-VG-ASM : RNT1-NSW-EU-VG-ASM-SP | K44: REYNATIS NSW
B45: Assembly Build | C45: 2024-09-02T00:00:00.000 | D45: 757 | F45: F | G45: Inventory Asset : Finished Goods | H45: -805.83 | I45: EU Games | J45: YSD1-NSW-EU-VG-ASM | K45: Ys VIII Lacrimosa of Dana NSW
B46: Assembly Build | C46: 2024-09-02T00:00:00.000 | D46: 750 | F46: F | G46: Inventory Asset : Finished Goods | H46: -2129.23 | I46: EU Games | J46: RNT1-NSW-EU-VG-ASM : RNT1-NSW-EU-VG-ASM-AU | K46: REYNATIS NSW
B47: Assembly Build | C47: 2024-09-02T00:00:00.000 | D47: 761 | F47: F | G47: Inventory Asset : Finished Goods | H47: -2.56 | I47: EU Games | J47: RNT1-NSW-EU-VG-ASM : RNT1-NSW-EU-VG-ASM-DE | K47: REYNATIS NSW
B48: Assembly Build | C48: 2024-09-02T00:00:00.000 | D48: 755 | F48: F | G48: Inventory Asset : Finished Goods | H48: -785.91 | I48: EU Games | J48: SNA1-NSW-EU-VG-ASM | K48: Ys VIII Lacrimosa of Dana NSW
B49: Assembly Build | C49: 2024-09-02T00:00:00.000 | D49: 751 | F49: F | G49: Inventory Asset : Finished Goods | H49: -678.18 | I49: EU Games | J49: RNT1-NSW-EU-VG-ASM : RNT1-NSW-EU-VG-ASM-AU | K49: REYNATIS NSW
B50: Assembly Build | C50: 2024-09-02T00:00:00.000 | D50: 753 | F50: F | G50: Inventory Asset : Finished Goods | H50: -626.07 | I50: EU Games | J50: RNT1-NSW-EU-VG-ASM : RNT1-NSW-EU-VG-ASM-IT | K50: REYNATIS NSW
B51: Assembly Build | C51: 2024-09-02T00:00:00.000 | D51: 752 | F51: F | G51: Inventory Asset : Finished Goods | H51: -639.79 | I51: EU Games | J51: RNT1-NSW-EU-VG-ASM : RNT1-NSW-EU-VG-ASM-AU | K51: - No Game Title -
B52: Bill | C52: 2024-09-02T00:00:00.000 | D52: Sonopress 1090757510 | E52: Sonopress GmbH, Gutersloh | F52: F | G52: Accounts Payable : Accounts Payable:Vendors | H52: 237.99 | I52: EU Games | J52: - No Item - | K52: SNK 40th Anniversary NSW
B53: Bill | C53: 2024-09-02T00:00:00.000 | D53: Sonopress 1090757510 | E53: Sonopress GmbH, Gutersloh | F53: F | G53: Accounts Payable : Accounts Payable:Vendors | H53: 805.83 | I53: Operations | J53: YSD1-NSW-EU-VG-ASM | K53: Ys VIII Lacrimosa of Dana NSW
B54: Bill | C54: 2024-09-02T00:00:00.000 | D54: Sonopress 1090757510 | E54: Sonopress GmbH, Gutersloh | F54: F | G54: Accounts Payable : Accounts Payable:Vendors | H54: 785.91 | I54: Operations | J54: SNA1-NSW-EU-VG-ASM | K54: SNK 40th Anniversary NSW
B55: Bill | C55: 2024-09-02T00:00:00.000 | D55: Sonopress 1090757510 | E55: Sonopress GmbH, Gutersloh | F55: F | G55: Accounts Payable : Accounts Payable:Vendors | H55: 22.14 | I55: EU Games | J55: - No Item - | K55: Ys VIII Lacrimosa of Dana NSW
B56: Item Fulfillment | C56: 2024-09-02T00:00:00.000 | D56: 433631 | E56: Reef Entertainment Limited | F56: F | G56: Inventory Asset : Finished Goods | H56: 2659.88 | I56: EU Games | J56: RNT1-NSW-EU-VG-DX : RNT1-NSW-EU-VG-DX-UK | K56: REYNATIS NSW
B57: Item Fulfillment | C57: 2024-09-02T00:00:00.000 | D57: 433633 | E57: Reef Entertainment Limited | F57: F | G57: Inventory Asset : Finished Goods | H57: 18885.14 | I57: EU Games | J57: RNT1-NSW-EU-VG-DX : RNT1-NSW-EU-VG-DX-UK | K57: REYNATIS NSW
B58: Item Fulfillment | C58: 2024-09-02T00:00:00.000 | D58: 433543 | E58: Reef Entertainment Limited | F58: F | G58: Inventory Asset : Finished Goods | H58: 8478.77 | I58: EU Games | J58: SNA1-NSW-EU-VG | K58: SNK 40th Anniversary NSW
B59: Item Fulfillment | C59: 2024-09-02T00:00:00.000 | D59: 433543 | E59: Reef Entertainment Limited | F59: F | G59: Inventory Asset : Finished Goods | H59: 12894.61 | I59: EU Games | J59: YSD1-NSW-EU-VG | K59: Ys VIII LacrimosaofDana NSW PAL
B60: Item Fulfillment | C60: 2024-09-02T00:00:00.000 | D60: 433634 | E60: Bandai Namco Games Iberica | F60: F | G60: Inventory Asset : Finished Goods | H60: 13127.83 | I60: EU Games | J60: RNT1-NSW-EU-VG-DX : RNT1-NSW-EU-VG-DX-SP | K60: REYNATIS NSW
B61: Bill | C61: 2024-09-04T00:00:00.000 | D61: Sonopress 1090757516 | E61: Sonopress GmbH, Gutersloh | F61: F | G61: Accounts Payable : Accounts Payable:Vendors | H61: 179.06 | I61: EU Games | J61: - No Item - | K61: REYNATIS NSW
B62: Bill | C62: 2024-09-04T00:00:00.000 | D62: Sonopress 1090757515 | E62: Sonopress GmbH, Gutersloh | F62: F | G62: Accounts Payable : Accounts Payable:Vendors | H62: 625.17 | I62: EU Games | J62: RNT1-NSW-EU-VG-ASM : RNT1-NSW-EU-VG-ASM-IT | K62: REYNATIS NSW
B63: Bill | C63: 2024-09-04T00:00:00.000 | D63: Sonopress 1090757515 | E63: Sonopress GmbH, Gutersloh | F63: F | G63: Accounts Payable : Accounts Payable:Vendors | H63: 698.57 | I63: EU Games | J63: RNT1-NSW-EU-VG-ASM : RNT1-NSW-EU-VG-ASM-FR | K63: REYNATIS NSW
B64: Bill | C64: 2024-09-04T00:00:00.000 | D64: Sonopress 1090757515 | E64: Sonopress GmbH, Gutersloh | F64: F | G64: Accounts Payable : Accounts Payable:Vendors | H64: 90.64 | I64: EU Games | J64: - No Item - | K64: REYNATIS NSW
B65: Bill | C65: 2024-09-04T00:00:00.000 | D65: Sonopress 1090757520 | E65: Sonopress GmbH, Gutersloh | F65: F | G65: Accounts Payable : Accounts Payable:Vendors | H65: 100.47 | I65: EU Games | J65: - No Item - | K65: REYNATIS NSW
B66: Bill | C66: 2024-09-04T00:00:00.000 | D66: Sonopress 1090757517 | E66: Sonopress GmbH, Gutersloh | F66: F | G66: Accounts Payable : Accounts Payable:Vendors | H66: 138.5 | I66: EU Games | J66: - No Item - | K66: REYNATIS NSW
B67: Bill | C67: 2024-09-04T00:00:00.000 | D67: Sonopress 1090757516 | E67: Sonopress GmbH, Gutersloh | F67: F | G67: Accounts Payable : Accounts Payable:Vendors | H67: 1792.43 | I67: EU Games | J67: RNT1-NSW-EU-VG-ASM : RNT1-NSW-EU-VG-ASM-UK | K67: REYNATIS NSW
B68: Bill | C68: 2024-09-04T00:00:00.000 | D68: Sonopress 1090757519 | E68: Sonopress GmbH, Gutersloh | F68: F | G68: Accounts Payable : Accounts Payable:Vendors | H68: 14.81 | I68: EU Games | J68: - No Item - | K68: REYNATIS NSW
B69: Bill | C69: 2024-09-04T00:00:00.000 | D69: Sonopress 1090757519 | E69: Sonopress GmbH, Gutersloh | F69: F | G69: Accounts Payable : Accounts Payable:Vendors | H69: 1.11 | I69: EU Games | J69: RNT1-NSW-EU-VG-ASM : RNT1-NSW-EU-VG-ASM-UK | K69: REYNATIS NSW
B70: Bill | C70: 2024-09-04T00:00:00.000 | D70: Sonopress 1090757518 | E70: Sonopress GmbH, Gutersloh | F70: F | G70: Accounts Payable : Accounts Payable:Vendors | H70: 1106.44 | I70: EU Games | J70: RNT1-NSW-EU-VG-ASM : RNT1-NSW-EU-VG-ASM-SP | K70: REYNATIS NSW
B71: Bill | C71: 2024-09-04T00:00:00.000 | D71: Sonopress 1090757521 | E71: Sonopress GmbH, Gutersloh | F71: F | G71: Accounts Payable : Accounts Payable:Vendors | H71: 44.26 | I71: EU Games | J71: RNT1-NSW-EU-VG-ASM : RNT1-NSW-EU-VG-ASM-UK | K71: REYNATIS NSW
B72: Bill | C72: 2024-09-04T00:00:00.000 | D72: Sonopress 1090757517 | E72: Sonopress GmbH, Gutersloh | F72: F | G72: Accounts Payable : Accounts Payable:Vendors | H72: 3.32 | I72: EU Games | J72: RNT1-NSW-EU-VG-ASM : RNT1-NSW-EU-VG-ASM-UK | K72: REYNATIS NSW
B73: Bill | C73: 2024-09-04T00:00:00.000 | D73: Sonopress 1090757515 | E73: Sonopress GmbH, Gutersloh | F73: F | G73: Accounts Payable : Accounts Payable:Vendors | H73: 677.21 | I73: EU Games | J73: RNT1-NSW-EU-VG-ASM : RNT1-NSW-EU-VG-ASM-DE | K73: REYNATIS NSW
B74: Bill | C74: 2024-09-04T00:00:00.000 | D74: Sonopress 1090757517 | E74: Sonopress GmbH, Gutersloh | F74: F | G74: Accounts Payable : Accounts Payable:Vendors | H74: 2.55 | I74: EU Games | J74: RNT1-NSW-EU-VG-ASM : RNT1-NSW-EU-VG-ASM-DE | K74: REYNATIS NSW
B75: Item Fulfillment | C75: 2024-09-04T00:00:00.000 | D75: 433617 | E75: KOCH Media S.A.S.:PLAION GmbH | F75: F | G75: Inventory Asset : Finished Goods | H75: 7048.68 | I75: EU Games | J75: RNT1-NSW-EU-VG-DX : RNT1-NSW-EU-VG-DX-DE | K75: REYNATIS NSW
B76: Item Fulfillment | C76: 2024-09-04T00:00:00.000 | D76: 433617 | E76: KOCH Media S.A.S.:PLAION GmbH | F76: F | G76: Inventory Asset : Finished Goods | H76: 6649.7 | I76: EU Games | J76: RNT1-NSW-EU-VG-DX : RNT1-NSW-EU-VG-DX-FR | K76: REYNATIS NSW
B77: Item Fulfillment | C77: 2024-09-04T00:00:00.000 | D77: 433617 | E77: KOCH Media S.A.S.:PLAION GmbH | F77: F | G77: Inventory Asset : Finished Goods | H77: 5433.99 | I77: EU Games | J77: RNT1-NSW-EU-VG-DX : RNT1-NSW-EU-VG-DX-IT | K77: REYNATIS NSW
B78: Assembly Build | C78: 2024-09-16T00:00:00.000 | D78: 762 | F78: F | G78: Inventory Asset : Finished Goods | H78: -971.5 | I78: EU Games | J78: RMM2-NSW-EU-VG-ASM : RMM2-NSW-EU-VG-ASM-UK | K78: RPG MAKER WITH NSW
B79: Item Fulfillment | C79: 2024-09-16T00:00:00.000 | D79: 433667 | E79: Reef Entertainment Limited | F79: F | G79: Inventory Asset : Finished Goods | H79: 10290.38 | I79: EU Games | J79: RMM2-NSW-EU-VG : RMM2-NSW-EU-VG-UK | K79: RPG MAKER WITH NSW
B80: Assembly Build | C80: 2024-09-17T00:00:00.000 | D80: 763 | F80: F | G80: Inventory Asset : Finished Goods | H80: -590.1 | I80: EU Games | J80: RMM2-NSW-EU-VG-ASM : RMM2-NSW-EU-VG-ASM-SP | K80: RPG MAKER WITH NSW
B81: Item Fulfillment | C81: 2024-09-17T00:00:00.000 | D81: 433677 | E81: Bandai Namco Games Iberica | F81: F | G81: Inventory Asset : Finished Goods | H81: 5249.54 | I81: EU Games | J81: RMM2-NSW-EU-VG : RMM2-NSW-EU-VG-SP | K81: RPG MAKER WITH NSW
B82: Assembly Build | C82: 2024-09-19T00:00:00.000 | D82: 769 | F82: F | G82: Inventory Asset : Finished Goods | H82: -620.37 | I82: EU Games | J82: RMM2-NSW-EU-VG-ASM : RMM2-NSW-EU-VG-ASM-IT | K82: RPG MAKER WITH NSW
B83: Assembly Build | C83: 2024-09-19T00:00:00.000 | D83: 768 | F83: F | G83: Inventory Asset : Finished Goods | H83: -996.95 | I83: EU Games | J83: RMM2-NSW-EU-VG-ASM : RMM2-NSW-EU-VG-ASM-FR | K83: RPG MAKER WITH NSW
B84: Assembly Build | C84: 2024-09-19T00:00:00.000 | D84: 767 | F84: F | G84: Inventory Asset : Finished Goods | H84: -565.08 | I84: EU Games | J84: RMM2-NSW-EU-VG-ASM : RMM2-NSW-EU-VG-ASM-DE | K84: RPG MAKER WITH NSW
B85: Assembly Build | C85: 2024-09-19T00:00:00.000 | D85: 770 | F85: F | G85: Inventory Asset : Finished Goods | H85: -0.81 | I85: EU Games | J85: RMM2-NSW-EU-VG-ASM : RMM2-NSW-EU-VG-ASM-UK | K85: RPG MAKER WITH NSW
B86: Bill | C86: 2024-09-19T00:00:00.000 | D86: Sonopress 1090758772 | E86: Sonopress GmbH, Gutersloh | F86: F | G86: Accounts Payable : Accounts Payable:Vendors | H86: 120.72 | I86: EU Games | J86: - No Item - | K86: RPG MAKER WITH NSW
B87: Bill | C87: 2024-09-19T00:00:00.000 | D87: Sonopress 1090758769 | E87: Sonopress GmbH, Gutersloh | F87: F | G87: Accounts Payable : Accounts Payable:Vendors | H87: 996.95 | I87: EU Games | J87: RMM2-NSW-EU-VG-ASM : RMM2-NSW-EU-VG-ASM-FR | K87: RPG MAKER WITH NSW
B88: Bill | C88: 2024-09-19T00:00:00.000 | D88: Sonopress 1090758769 | E88: Sonopress GmbH, Gutersloh | F88: F | G88: Accounts Payable : Accounts Payable:Vendors | H88: 565.08 | I88: EU Games | J88: RMM2-NSW-EU-VG-ASM : RMM2-NSW-EU-VG-ASM-DE | K88: RPG MAKER WITH NSW
B89: Bill | C89: 2024-09-19T00:00:00.000 | D89: Sonopress 1090758770 | E89: Sonopress GmbH, Gutersloh | F89: F | G89: Accounts Payable : Accounts Payable:Vendors | H89: 52.98 | I89: EU Games | J89: - No Item - | K89: RPG MAKER WITH NSW
B90: Bill | C90: 2024-09-19T00:00:00.000 | D90: Sonopress 1090758771 | E90: Sonopress GmbH, Gutersloh | F90: F | G90: Accounts Payable : Accounts Payable:Vendors | H90: 7.32 | I90: EU Games | J90: RMM2-NSW-EU-VG-ASM : RMM2-NSW-EU-VG-ASM-UK | K90: RPG MAKER WITH NSW
B91: Bill | C91: 2024-09-19T00:00:00.000 | D91: Sonopress 1090758771 | E91: Sonopress GmbH, Gutersloh | F91: F | G91: Accounts Payable : Accounts Payable:Vendors | H91: 123.35 | I91: EU Games | J91: - No Item - | K91: RPG MAKER WITH NSW
B92: Bill | C92: 2024-09-19T00:00:00.000 | D92: Sonopress 1090758769 | E92: Sonopress GmbH, Gutersloh | F92: F | G92: Accounts Payable : Accounts Payable:Vendors | H92: 113.5 | I92: EU Games | J92: - No Item - | K92: RPG MAKER WITH NSW
B93: Bill | C93: 2024-09-19T00:00:00.000 | D93: Sonopress 1090758772 | E93: Sonopress GmbH, Gutersloh | F93: F | G93: Accounts Payable : Accounts Payable:Vendors | H93: 976.49 | I93: EU Games | J93: RMM2-NSW-EU-VG-ASM : RMM2-NSW-EU-VG-ASM-UK | K93: RPG MAKER WITH NSW
B94: Bill | C94: 2024-09-19T00:00:00.000 | D94: Sonopress 1090758771 | E94: Sonopress GmbH, Gutersloh | F94: F | G94: Accounts Payable : Accounts Payable:Vendors | H94: 11.05 | I94: EU Games | J94: RMM2-NSW-EU-VG-ASM : RMM2-NSW-EU-VG-ASM-DE | K94: RPG MAKER WITH NSW
B95: Bill | C95: 2024-09-19T00:00:00.000 | D95: Sonopress 1090758773 | E95: Sonopress GmbH, Gutersloh | F95: F | G95: Accounts Payable : Accounts Payable:Vendors | H95: 0.82 | I95: EU Games | J95: RMM2-NSW-EU-VG-ASM : RMM2-NSW-EU-VG-ASM-UK | K95: RPG MAKER WITH NSW
B96: Bill | C96: 2024-09-19T00:00:00.000 | D96: Sonopress 1090758769 | E96: Sonopress GmbH, Gutersloh | F96: F | G96: Accounts Payable : Accounts Payable:Vendors | H96: 620.37 | I96: EU Games | J96: RMM2-NSW-EU-VG-ASM : RMM2-NSW-EU-VG-ASM-IT | K96: RPG MAKER WITH NSW
B97: Bill | C97: 2024-09-19T00:00:00.000 | D97: Sonopress 1090758770 | E97: Sonopress GmbH, Gutersloh | F97: F | G97: Accounts Payable : Accounts Payable:Vendors | H97: 592.2 | I97: EU Games | J97: RMM2-NSW-EU-VG-ASM : RMM2-NSW-EU-VG-ASM-SP | K97: RPG MAKER WITH NSW
B98: Bill | C98: 2024-09-19T00:00:00.000 | D98: Sonopress 1090758773 | E98: Sonopress GmbH, Gutersloh | F98: F | G98: Accounts Payable : Accounts Payable:Vendors | H98: 22.47 | I98: EU Games | J98: - No Item - | K98: RPG MAKER WITH NSW
B99: Item Fulfillment | C99: 2024-09-19T00:00:00.000 | D99: 433708 | E99: KOCH Media S.A.S.:PLAION GmbH | F99: F | G99: Inventory Asset : Finished Goods | H99: 5279.81 | I99: EU Games | J99: RMM2-NSW-EU-VG : RMM2-NSW-EU-VG-IT | K99: RPG MAKER WITH NSW
B100: Item Fulfillment | C100: 2024-09-19T00:00:00.000 | D100: 433708 | E100: KOCH Media S.A.S.:PLAION GmbH | F100: F | G100: Inventory Asset : Finished Goods | H100: 7986.11 | I100: EU Games | J100: RMM2-NSW-EU-VG : RMM2-NSW-EU-VG-FR | K100: RPG MAKER WITH NSW
B101: Item Fulfillment | C101: 2024-09-19T00:00:00.000 | D101: 433707 | E101: KOCH Media S.A.S.:PLAION GmbH | F101: F | G101: Inventory Asset : Finished Goods | H101: 4137.31 | I101: EU Games | J101: RMM2-NSW-EU-VG : RMM2-NSW-EU-VG-DE | K101: RPG MAKER WITH NSW
B102: Assembly Build | C102: 2024-09-20T00:00:00.000 | D102: 777 | F102: F | G102: Inventory Asset : Finished Goods | H102: -7.31 | I102: EU Games | J102: RMM2-NSW-EU-VG-ASM : RMM2-NSW-EU-VG-ASM-UK | K102: RPG MAKER WITH NSW
B103: Assembly Build | C103: 2024-09-20T00:00:00.000 | D103: 776 | F103: F | G103: Inventory Asset : Finished Goods | H103: -11.04 | I103: EU Games | J103: RMM2-NSW-EU-VG-ASM : RMM2-NSW-EU-VG-ASM-DE | K103: RPG MAKER WITH NSW
B104: Bill | C104: 2024-09-20T00:00:00.000 | D104: Sonopress 1012646407 | E104: Sonopress GmbH, Gutersloh | F104: F | G104: Accounts Payable : Accounts Payable:Vendors | H104: 1115.56 | I104: EU Games | J104: YSN1-NSW-EU-VG-ASM : YSN1-NSW-EU-VG-ASM-DE | K104: Ys 10 NSW
B105: Bill | C105: 2024-09-20T00:00:00.000 | D105: Sonopress 1012646407 | E105: Sonopress GmbH, Gutersloh | F105: F | G105: Accounts Payable : Accounts Payable:Vendors | H105: 681.93 | I105: EU Games | J105: YSN1-NSW-EU-VG-ASM : YSN1-NSW-EU-VG-ASM-IT | K105: Ys 10 NSW
B106: Bill | C106: 2024-09-20T00:00:00.000 | D106: Sonopress 1012646407 | E106: Sonopress GmbH, Gutersloh | F106: F | G106: Accounts Payable : Accounts Payable:Vendors | H106: 1146.11 | I106: EU Games | J106: YSN1-NSW-EU-VG-ASM : YSN1-NSW-EU-VG-ASM-SP | K106: Ys 10 NSW
B107: Bill | C107: 2024-09-20T00:00:00.000 | D107: Sonopress 1012646407 | E107: Sonopress GmbH, Gutersloh | F107: F | G107: Accounts Payable : Accounts Payable:Vendors | H107: 1309.84 | I107: EU Games | J107: YSN1-NSW-EU-VG-ASM : YSN1-NSW-EU-VG-ASM-AU | K107: Ys 10 NSW
B108: Bill | C108: 2024-09-20T00:00:00.000 | D108: Sonopress 1012646407 | E108: Sonopress GmbH, Gutersloh | F108: F | G108: Accounts Payable : Accounts Payable:Vendors | H108: 2983.93 | I108: EU Games | J108: YSN1-NSW-EU-VG-ASM : YSN1-NSW-EU-VG-ASM-UK | K108: Ys 10 NSW
B109: Bill | C109: 2024-09-20T00:00:00.000 | D109: Sonopress 1012646407 | E109: Sonopress GmbH, Gutersloh | F109: F | G109: Accounts Payable : Accounts Payable:Vendors | H109: 4196.5 | I109: EU Games | J109: YSN1-NSW-EU-VG-ASM : YSN1-NSW-EU-VG-ASM-FR | K109: Ys 10 NSW
B110: Bill | C110: 2024-09-20T00:00:00.000 | D110: Sonopress 1012646407 | E110: Sonopress GmbH, Gutersloh | F110: F | G110: Accounts Payable : Accounts Payable:Vendors | H110: 1402.75 | I110: EU Games | J110: - No Item - | K110: Ys 10 NSW
B111: Bill | C111: 2024-09-20T00:00:00.000 | D111: Sonopress 1012646407 | E111: Sonopress GmbH, Gutersloh | F111: F | G111: Accounts Payable : Accounts Payable:Vendors | H111: 632.26 | I111: EU Games | J111: YSN1-NSW-EU-VG-ASM : YSN1-NSW-EU-VG-ASM-BLX | K111: Ys 10 NSW
B112: Item Fulfillment | C112: 2024-09-20T00:00:00.000 | D112: 433717 | E112: CLD-EUR | F112: F | G112: Inventory Asset : Finished Goods | H112: 4991.36 | I112: EU Games | J112: YSN1-NSW-EU-VG-DX : YSN1-NSW-EU-VG-DX-BLX | K112: Ys 10 NSW
B113: Item Fulfillment | C113: 2024-09-20T00:00:00.000 | D113: 433716 | E113: KOCH Media S.A.S.:PLAION GmbH | F113: F | G113: Inventory Asset : Finished Goods | H113: 10182.36 | I113: EU Games | J113: YSN1-NSW-EU-VG-DX : YSN1-NSW-EU-VG-DX-DE | K113: Ys 10 NSW
B114: Item Fulfillment | C114: 2024-09-20T00:00:00.000 | D114: 433715 | E114: BANDAI NAMCO AUS | F114: F | G114: Inventory Asset : Finished Goods | H114: 11979.25 | I114: EU Games | J114: YSN1-NSW-EU-VG-DX : YSN1-NSW-EU-VG-DX-AU | K114: Ys 10 NSW
B115: Item Fulfillment | C115: 2024-09-20T00:00:00.000 | D115: 433716 | E115: KOCH Media S.A.S.:PLAION GmbH | F115: F | G115: Inventory Asset : Finished Goods | H115: 39930.84 | I115: EU Games | J115: YSN1-NSW-EU-VG-DX : YSN1-NSW-EU-VG-DX-FR | K115: Ys 10 NSW
B116: Item Fulfillment | C116: 2024-09-23T00:00:00.000 | D116: 434288 | E116: KOCH Media S.A.S.:PLAION GmbH | F116: F | G116: Inventory Asset : Finished Goods | H116: 5191.01 | I116: EU Games | J116: YSN1-NSW-EU-VG-DX : YSN1-NSW-EU-VG-DX-IT | K116: Ys 10 NSW
B117: Item Fulfillment | C117: 2024-09-23T00:00:00.000 | D117: 434290 | E117: KOCH Media S.A.S.:PLAION GmbH | F117: F | G117: Inventory Asset : Finished Goods | H117: 10201.17 | I117: EU Games | J117: YSN1-PS5-EU-VG-DX : YSN1-PS5-EU-VG-DX-DE | K117: Ys 10 PS5
B118: Item Fulfillment | C118: 2024-09-23T00:00:00.000 | D118: 434289 | E118: Bandai Namco Games Iberica | F118: F | G118: Inventory Asset : Finished Goods | H118: 10481.84 | I118: EU Games | J118: YSN1-NSW-EU-VG-DX : YSN1-NSW-EU-VG-DX-SP | K118: Ys 10 NSW
B119: Bill | C119: 2024-09-24T00:00:00.000 | D119: HANKYU HANSHIN SHHAJ02449720 | E119: HANKYU HANSHIN EXPRESS (USA) INC-LAX | F119: F | G119: Accounts Payable : Accounts Payable:Vendors | H119: 649.83 | I119: EU Games | J119: - No Item - | K119: Ys 10 NSW
B120: Item Fulfillment | C120: 2024-09-24T00:00:00.000 | D120: 434795 | E120: Reef Entertainment Limited | F120: F | G120: Inventory Asset : Finished Goods | H120: 22760.58 | I120: EU Games | J120: YSN1-NSW-EU-VG-DX : YSN1-NSW-EU-VG-DX-UK | K120: Ys 10 NSW
B121: Item Fulfillment | C121: 2024-09-24T00:00:00.000 | D121: 434794 | E121: Reef Entertainment Limited | F121: F | G121: Inventory Asset : Finished Goods | H121: 7187.55 | I121: EU Games | J121: YSN1-NSW-EU-VG-DX : YSN1-NSW-EU-VG-DX-UK | K121: Ys 10 NSW
B122: Item Fulfillment | C122: 2024-09-24T00:00:00.000 | D122: 434906 | E122: Bandai Namco Games Iberica | F122: F | G122: Inventory Asset : Finished Goods | H122: 3368.46 | I122: EU Games | J122: YSN1-PS4-EU-VG-DX : YSN1-PS4-EU-VG-DX-SP | K122: Ys 10 PS4
B123: Item Fulfillment | C123: 2024-09-24T00:00:00.000 | D123: 434906 | E123: Bandai Namco Games Iberica | F123: F | G123: Inventory Asset : Finished Goods | H123: 7429.11 | I123: EU Games | J123: YSN1-PS5-EU-VG-DX : YSN1-PS5-EU-VG-DX-SP | K123: Ys 10 PS5
B124: Item Fulfillment | C124: 2024-09-24T00:00:00.000 | D124: 434905 | E124: CLD-EUR | F124: F | G124: Inventory Asset : Finished Goods | H124: 2511.84 | I124: EU Games | J124: YSN1-PS5-EU-VG-DX : YSN1-PS5-EU-VG-DX-BLX | K124: Ys 10 PS5
B125: Item Fulfillment | C125: 2024-09-24T00:00:00.000 | D125: 434797 | E125: Reef Entertainment Limited | F125: F | G125: Inventory Asset : Finished Goods | H125: 34827.56 | I125: EU Games | J125: YSN1-PS5-EU-VG-DX : YSN1-PS5-EU-VG-DX-UK | K125: Ys 10 PS5
B126: Item Fulfillment | C126: 2024-09-24T00:00:00.000 | D126: 434796 | E126: Reef Entertainment Limited | F126: F | G126: Inventory Asset : Finished Goods | H126: 8347.1 | I126: EU Games | J126: YSN1-PS5-EU-VG-DX : YSN1-PS5-EU-VG-DX-UK | K126: Ys 10 PS5
B127: Item Fulfillment | C127: 2024-09-24T00:00:00.000 | D127: 434905 | E127: CLD-EUR | F127: F | G127: Inventory Asset : Finished Goods | H127: 2488.52 | I127: EU Games | J127: YSN1-PS4-EU-VG-DX : YSN1-PS4-EU-VG-DX-BLX | K127: Ys 10 PS4
B128: Bill | C128: 2024-09-25T00:00:00.000 | D128: Sonopress 1090759226 / 26.09.2024 | E128: Sonopress GmbH, Gutersloh | F128: F | G128: Accounts Payable : Accounts Payable:Vendors | H128: 448.07 | I128: EU Games | J128: - No Item - | K128: 2024-09_REYNATIS EU Replace
B129: Bill | C129: 2024-09-25T00:00:00.000 | D129: Sonopress 1090759225 / 26.09.2024 | E129: Sonopress GmbH, Gutersloh | F129: F | G129: Accounts Payable : Accounts Payable:Vendors | H129: 117.43 | I129: EU Games | J129: - No Item - | K129: 2024-09_REYNATIS EU Replace
B130: Item Fulfillment | C130: 2024-09-25T00:00:00.000 | D130: 434909 | E130: KOCH Media S.A.S.:PLAION GmbH | F130: F | G130: Inventory Asset : Finished Goods | H130: 18422.28 | I130: EU Games | J130: YSN1-PS5-EU-VG-DX : YSN1-PS5-EU-VG-DX-FR | K130: Ys 10 PS5
B131: Item Fulfillment | C131: 2024-09-25T00:00:00.000 | D131: 434909 | E131: KOCH Media S.A.S.:PLAION GmbH | F131: F | G131: Inventory Asset : Finished Goods | H131: 4014.72 | I131: EU Games | J131: YSN1-PS5-EU-VG-DX : YSN1-PS5-EU-VG-DX-IT | K131: Ys 10 PS5
B132: Item Fulfillment | C132: 2024-09-25T00:00:00.000 | D132: 434909 | E132: KOCH Media S.A.S.:PLAION GmbH | F132: F | G132: Inventory Asset : Finished Goods | H132: 2515.93 | I132: EU Games | J132: YSN1-PS4-EU-VG-DX : YSN1-PS4-EU-VG-DX-IT | K132: Ys 10 PS4
B133: Item Fulfillment | C133: 2024-09-25T00:00:00.000 | D133: 434908 | E133: Reef Entertainment Limited | F133: F | G133: Inventory Asset : Finished Goods | H133: 3093.2 | I133: EU Games | J133: YSN1-PS4-EU-VG-DX : YSN1-PS4-EU-VG-DX-UK | K133: Ys 10 PS4
B134: Item Fulfillment | C134: 2024-09-25T00:00:00.000 | D134: 434907 | E134: Reef Entertainment Limited | F134: F | G134: Inventory Asset : Finished Goods | H134: 5744.51 | I134: EU Games | J134: YSN1-PS4-EU-VG-DX : YSN1-PS4-EU-VG-DX-UK | K134: Ys 10 PS4
B135: Item Fulfillment | C135: 2024-09-25T00:00:00.000 | D135: 434909 | E135: KOCH Media S.A.S.:PLAION GmbH | F135: F | G135: Inventory Asset : Finished Goods | H135: 3359.51 | I135: EU Games | J135: YSN1-PS4-EU-VG-DX : YSN1-PS4-EU-VG-DX-FR | K135: Ys 10 PS4
B136: Inventory Adjustment | C136: 2024-09-30T00:00:00.000 | D136: 3161 | F136: F | G136: Inventory Asset : Finished Goods | H136: 166.71 | I136: - No Division - | J136: - No Item - | K136: - No Game Title -
B137: Inventory Adjustment | C137: 2024-09-30T00:00:00.000 | D137: 3163 | F137: F | G137: Inventory Asset : Finished Goods | H137: 110.47 | I137: - No Division - | J137: - No Item - | K137: - No Game Title -
B138: Inventory Adjustment | C138: 2024-09-30T00:00:00.000 | D138: 3159 | F138: F | G138: Inventory Asset : Finished Goods | H138: 229.04 | I138: - No Division - | J138: - No Item - | K138: - No Game Title -
B139: Inventory Adjustment | C139: 2024-09-30T00:00:00.000 | D139: 3165 | F139: F | G139: Inventory Asset : Finished Goods | H139: 218.82 | I139: - No Division - | J139: - No Item - | K139: - No Game Title -
B140: Inventory Adjustment | C140: 2024-09-30T00:00:00.000 | D140: 3158 | F140: F | G140: Inventory Asset : Finished Goods | H140: 79.8 | I140: - No Division - | J140: - No Item - | K140: - No Game Title -
B141: Inventory Adjustment | C141: 2024-09-30T00:00:00.000 | D141: 3162 | F141: F | G141: Inventory Asset : Finished Goods | H141: 59.9 | I141: - No Division - | J141: - No Item - | K141: - No Game Title -
A142: Total - COGS-Europe:Wholesale_Material Cost | H142: SUM(R[-98]C:R[-1]C) -> 343690.36
A143: Total - Cost of Goods Sold-Europe | H143: SUM(R[-101]C,R[-1]C) -> 350748.33999999997
A144: Cost of Goods Sold-North America
A145: COGS-N. America:Wholesale_Material Cost
B146: Item Fulfillment | C146: 2024-09-06T00:00:00.000 | D146: 433644 | E146: NISA Operations | F146: F | G146: Inventory Asset : Finished Goods | H146: 144.0 | I146: NA Games | J146: RNT1-NSW-US-VG-DX | K146: REYNATIS NSW
B147: Item Fulfillment | C147: 2024-09-06T00:00:00.000 | D147: 433644 | E147: NISA Operations | F147: F | G147: Inventory Asset : Finished Goods | H147: 115.44 | I147: NA Games | J147: RNT1-PS5-US-VG-DX | K147: REYNATIS PS5
B148: Item Fulfillment | C148: 2024-09-06T00:00:00.000 | D148: 433645 | E148: NISA Operations | F148: F | G148: Inventory Asset : Finished Goods | H148: 288.0 | I148: NA Games | J148: RNT1-NSW-US-VG-DX | K148: REYNATIS NSW
B149: Item Fulfillment | C149: 2024-09-06T00:00:00.000 | D149: 433644 | E149: NISA Operations | F149: F | G149: Inventory Asset : Finished Goods | H149: 115.44 | I149: NA Games | J149: RNT1-PS4-US-VG-DX | K149: REYNATIS PS4
B150: Bill | C150: 2024-09-13T00:00:00.000 | D150: Qualpac QD16654 | E150: Professional Packaging Systems, LLC | F150: F | G150: Accounts Payable : Accounts Payable:Vendors | H150: 1193.4 | I150: NA Games | J150: ZGEN-GDS-US-CVR | K150: RPG MAKER WITH NSW
B151: Bill | C151: 2024-09-13T00:00:00.000 | D151: HANKYU HANSHIN SHHAJ02466682 | E151: HANKYU HANSHIN EXPRESS (USA) INC-LAX | F151: F | G151: Accounts Payable : Accounts Payable:Vendors | H151: 1378.99 | I151: NA Games | J151: - No Item - | K151: Ys 10 NSW
B152: Bill | C152: 2024-09-13T00:00:00.000 | D152: Qualpac QD16654 | E152: Professional Packaging Systems, LLC | F152: F | G152: Accounts Payable : Accounts Payable:Vendors | H152: 5778.0 | I152: NA Games | J152: RMM2-NSW-US-VG-ASM | K152: RPG MAKER WITH NSW
B153: Item Fulfillment | C153: 2024-09-13T00:00:00.000 | D153: 433665 | E153: KOEI TECMO AMERICA CORPORATION | F153: F | G153: Inventory Asset : Finished Goods | H153: 8160.0 | I153: NA Games | J153: RMM2-NSW-US-VG | K153: RPG MAKER WITH NSW
B154: Item Fulfillment | C154: 2024-09-16T00:00:00.000 | D154: 433668 | E154: KOEI TECMO AMERICA CORPORATION | F154: F | G154: Inventory Asset : Finished Goods | H154: 24000.0 | I154: NA Games | J154: RMM2-NSW-US-VG | K154: RPG MAKER WITH NSW
B155: Bill Credit | C155: 2024-09-18T00:00:00.000 | D155: SDADC US 5740212 | E155: SDADC-USA | F155: F | G155: Accounts Payable : Accounts Payable:Vendors | H155: -21.67 | I155: NA Games | J155: - No Item - | K155: Labyrinth of Galleria PS5
B156: Item Fulfillment | C156: 2024-09-18T00:00:00.000 | D156: 433702 | E156: KOEI TECMO AMERICA CORPORATION | F156: F | G156: Inventory Asset : Finished Goods | H156: 5761.34 | I156: NA Games | J156: RNT1-PS5-US-VG-DX | K156: REYNATIS PS5
B157: Item Fulfillment | C157: 2024-09-18T00:00:00.000 | D157: 433700 | E157: KOEI TECMO AMERICA CORPORATION | F157: F | G157: Inventory Asset : Finished Goods | H157: 3456.8 | I157: NA Games | J157: RNT1-PS5-US-VG-DX | K157: REYNATIS PS5
B158: Item Fulfillment | C158: 2024-09-18T00:00:00.000 | D158: 433701 | E158: KOEI TECMO AMERICA CORPORATION | F158: F | G158: Inventory Asset : Finished Goods | H158: 1019.39 | I158: NA Games | J158: DIS7-NSW-US-VG-DX | K158: Disgaea 7 NSW
B159: Bill | C159: 2024-09-24T00:00:00.000 | D159: SDADC US 5822489 | E159: SDADC-USA | F159: F | G159: Accounts Payable : Accounts Payable:Vendors | H159: 5353.36 | I159: NA Games | J159: ZGEN-GDS-US-CVR | K159: Ys 10 PS5
B160: Bill | C160: 2024-09-24T00:00:00.000 | D160: SDADC US 5822488 | E160: SDADC-USA | F160: F | G160: Accounts Payable : Accounts Payable:Vendors | H160: 795.93 | I160: NA Games | J160: ZGEN-GDS-US-CVR | K160: Ys 10 PS4
B161: Bill | C161: 2024-09-24T00:00:00.000 | D161: SDADC US 5822489 | E161: SDADC-USA | F161: F | G161: Accounts Payable : Accounts Payable:Vendors | H161: 1145.01 | I161: NA Games | J161: - No Item - | K161: Ys 10 PS5
B162: Bill | C162: 2024-09-24T00:00:00.000 | D162: SDADC US 5822488 | E162: SDADC-USA | F162: F | G162: Accounts Payable : Accounts Payable:Vendors | H162: 337.0 | I162: NA Games | J162: - No Item - | K162: Ys 10 PS4
B163: Item Fulfillment | C163: 2024-09-24T00:00:00.000 | D163: 434880 | E163: NISA Operations | F163: F | H163: 9.62 | I163: NA Games | J163: RNT1-PS4-US-VG-DX | K163: REYNATIS PS4
B164: Item Fulfillment | C164: 2024-09-24T00:00:00.000 | D164: 434882 | E164: NISA Operations | F164: F | G164: Inventory Asset : Finished Goods | H164: 192.0 | I164: NA Games | J164: RMM2-NSW-US-VG | K164: RPG MAKER WITH NSW
B165: Item Fulfillment | C165: 2024-09-24T00:00:00.000 | D165: 434792 | E165: KOEI TECMO AMERICA CORPORATION | F165: F | G165: Inventory Asset : Finished Goods | H165: 153894.41 | I165: NA Games | J165: YSN1-PS5-US-VG-DX | K165: Ys 10 PS5
B166: Item Fulfillment | C166: 2024-09-24T00:00:00.000 | D166: 434793 | E166: KOEI TECMO AMERICA CORPORATION | F166: F | G166: Inventory Asset : Finished Goods | H166: 19121.01 | I166: NA Games | J166: YSN1-PS4-US-VG-DX | K166: Ys 10 PS4
B167: Item Fulfillment | C167: 2024-09-24T00:00:00.000 | D167: 434880 | E167: NISA Operations | F167: F | H167: 12.0 | I167: NA Games | J167: RNT1-NSW-US-VG-DX | K167: REYNATIS NSW
B168: Item Fulfillment | C168: 2024-09-24T00:00:00.000 | D168: 434880 | E168: NISA Operations | F168: F | H168: 9.62 | I168: NA Games | J168: RNT1-PS5-US-VG-DX | K168: REYNATIS PS5
B169: Item Fulfillment | C169: 2024-09-24T00:00:00.000 | D169: 434883 | E169: NISA Operations | F169: F | G169: Inventory Asset : Finished Goods | H169: 96.0 | I169: NA Games | J169: RMM2-NSW-US-VG | K169: RPG MAKER WITH NSW
B170: Bill | C170: 2024-09-25T00:00:00.000 | D170: SDADC US 5822487 | E170: SDADC-USA | F170: F | G170: Accounts Payable : Accounts Payable:Vendors | H170: 201.54 | I170: NA Games | J170: - No Item - | K170: REYNATIS PS5
B171: Bill | C171: 2024-09-25T00:00:00.000 | D171: SDADC US 5822486 | E171: SDADC-USA | F171: F | G171: Accounts Payable : Accounts Payable:Vendors | H171: 39.25 | I171: NA Games | J171: - No Item - | K171: REYNATIS PS4
B172: Bill | C172: 2024-09-26T00:00:00.000 | D172: Qualpac QD16656 | E172: Professional Packaging Systems, LLC | F172: F | G172: Accounts Payable : Accounts Payable:Vendors | H172: 12496.68 | I172: NA Games | J172: ZGEN-GDS-US-CVR | K172: - No Game Title -
B173: Bill | C173: 2024-09-26T00:00:00.000 | D173: Qualpac QD16656 | E173: Professional Packaging Systems, LLC | F173: F | G173: Accounts Payable : Accounts Payable:Vendors | H173: 17695.54 | I173: NA Games | J173: YSN1-NSW-US-VG-ASM | K173: Ys 10 NSW
B174: Item Fulfillment | C174: 2024-09-27T00:00:00.000 | D174: 434945 | E174: KOEI TECMO AMERICA CORPORATION | F174: F | G174: Inventory Asset : Finished Goods | H174: 679.6 | I174: NA Games | J174: DIS7-NSW-US-VG-DX | K174: Disgaea 7 NSW
B175: Item Fulfillment | C175: 2024-09-27T00:00:00.000 | D175: 434923 | E175: KOEI TECMO AMERICA CORPORATION | F175: F | G175: Inventory Asset : Finished Goods | H175: 150000.0 | I175: NA Games | J175: YSN1-NSW-US-VG-DX | K175: Ys 10 NSW
B176: Bill | C176: 2024-09-30T00:00:00.000 | D176: Technicolor 7138247 | E176: Technicolor Home Entertainment Services Southeast, LLC | F176: F | G176: Accounts Payable : Accounts Payable:Vendors | H176: 26.0 | I176: NA Games | J176: - No Item - | K176: - No Game Title -
B177: Inventory Adjustment | C177: 2024-09-30T00:00:00.000 | D177: 3164 | F177: F | G177: Inventory Asset : Finished Goods | H177: 285.39 | I177: - No Division - | J177: - No Item - | K177: - No Game Title -
B178: Inventory Adjustment | C178: 2024-09-30T00:00:00.000 | D178: 3166 | F178: F | G178: Inventory Asset : Finished Goods | H178: 288.19 | I178: - No Division - | J178: - No Item - | K178: - No Game Title -
B179: Inventory Adjustment | C179: 2024-09-30T00:00:00.000 | D179: 3160 | F179: F | G179: Inventory Asset : Finished Goods | H179: 287.75 | I179: - No Division - | J179: - No Item - | K179: - No Game Title -
B180: Item Fulfillment | C180: 2024-09-30T00:00:00.000 | D180: 434962 | E180: NISA Operations | F180: F | H180: 96.0 | I180: NA Games | J180: RNT1-NSW-US-VG-DX | K180: REYNATIS NSW
B181: Item Fulfillment | C181: 2024-09-30T00:00:00.000 | D181: 434962 | E181: NISA Operations | F181: F | H181: 38.48 | I181: NA Games | J181: RNT1-PS5-US-VG-DX | K181: REYNATIS PS5
B182: Item Fulfillment | C182: 2024-09-30T00:00:00.000 | D182: 434962 | E182: NISA Operations | F182: F | H182: 38.48 | I182: NA Games | J182: RNT1-PS4-US-VG-DX | K182: REYNATIS PS4
B183: Item Fulfillment | C183: 2024-09-30T00:00:00.000 | D183: 434962 | E183: NISA Operations | F183: F | H183: 64.0 | I183: NA Games | J183: RMM2-NSW-US-VG | K183: RPG MAKER WITH NSW
A184: Total - COGS-N. America:Wholesale_Material Cost | H184: SUM(R[-38]C:R[-1]C) -> 414591.99
A185: COGS-U.S. Online Store
A186: COGS-Online Store:Games_Material Costs
B187: Item Receipt | C187: 2024-09-01T00:00:00.000 | D187: 14199 | E187: Edward Kim [191666] | F187: F | G187: Online Store Expenses : Online Store-Other expenses | H187: -22.46 | I187: NA Games-STORE | J187: TIR1-PS5-WS-VG-PE | K187: Trails into Reverie PS5
B188: Invoice | C188: 2024-09-02T00:00:00.000 | D188: NISINV-68389 | E188: Event and Convention Sales | F188: F | G188: Accounts Receivable : Accounts Receivable: Online Store | H188: 119.23 | I188: NA Games-STORE | J188: MMB1-PS5-WS-VG-PE | K188: Monochrome Mobius
B189: Invoice | C189: 2024-09-02T00:00:00.000 | D189: NISINV-68389 | E189: Event and Convention Sales | F189: F | G189: Accounts Receivable : Accounts Receivable: Online Store | H189: 131.53 | I189: NA Games-STORE | J189: DIS7-PS4-WS-VG-PE | K189: Disgaea 7 PS4
B190: Invoice | C190: 2024-09-02T00:00:00.000 | D190: NISINV-68389 | E190: Event and Convention Sales | F190: F | G190: Accounts Receivable : Accounts Receivable: Online Store | H190: 117.51 | I190: NA Games-STORE | J190: POE1-NSW-WS-VG-PE | K190: Process of Elimination NSW
B191: Invoice | C191: 2024-09-02T00:00:00.000 | D191: NISINV-68389 | E191: Event and Convention Sales | F191: F | G191: Accounts Receivable : Accounts Receivable: Online Store | H191: 271.73 | I191: NA Games-STORE | J191: RTF3-PS5-WS-VG-PE | K191: R-Type Final 3 PS5
B192: Invoice | C192: 2024-09-02T00:00:00.000 | D192: NISINV-68389 | E192: Event and Convention Sales | F192: F | G192: Accounts Receivable : Accounts Receivable: Online Store | H192: 272.74 | I192: NA Games-STORE | J192: MME1-NSW-WS-VG-PE | K192: Monster Menu NSW
B193: Invoice | C193: 2024-09-02T00:00:00.000 | D193: NISINV-68389 | E193: Event and Convention Sales | F193: F | G193: Accounts Receivable : Accounts Receivable: Online Store | H193: 107.17 | I193: NA Games-STORE | J193: D6C1-PS5-WS-VG-PE | K193: Disgaea 6 Complete PS5
B194: Invoice | C194: 2024-09-02T00:00:00.000 | D194: NISINV-68389 | E194: Event and Convention Sales | F194: F | G194: Accounts Receivable : Accounts Receivable: Online Store | H194: 119.22 | I194: NA Games-STORE | J194: MMB1-PS4-WS-VG-PE | K194: Monochrome Mobius
B195: Invoice | C195: 2024-09-02T00:00:00.000 | D195: NISINV-68389 | E195: Event and Convention Sales | F195: F | G195: Accounts Receivable : Accounts Receivable: Online Store | H195: 393.74 | I195: NA Games-STORE | J195: DIS7-PS5-WS-VG-PE | K195: Disgaea 7 PS5
B196: Invoice | C196: 2024-09-02T00:00:00.000 | D196: NISINV-68389 | E196: Event and Convention Sales | F196: F | G196: Accounts Receivable : Accounts Receivable: Online Store | H196: 53.49 | I196: NA Games-STORE | J196: D6C1-PS4-WS-VG-PE | K196: Disgaea 6 Complete PS4
B197: Invoice | C197: 2024-09-02T00:00:00.000 | D197: NISINV-68389 | E197: Event and Convention Sales | F197: F | G197: Accounts Receivable : Accounts Receivable: Online Store | H197: 124.7 | I197: NA Games-STORE | J197: LOL1-PS5-WS-VG-PE | K197: Legend of Legacy HD PS5
B198: Invoice | C198: 2024-09-02T00:00:00.000 | D198: NISINV-68389 | E198: Event and Convention Sales | F198: F | G198: Accounts Receivable : Accounts Receivable: Online Store | H198: 35.63 | I198: NA Games-STORE | J198: LOL1-PS4-WS-VG-PE | K198: Legend of Legacy HD PS4
B199: Invoice | C199: 2024-09-02T00:00:00.000 | D199: NISINV-68389 | E199: Event and Convention Sales | F199: F | G199: Accounts Receivable : Accounts Receivable: Online Store | H199: 107.52 | I199: NA Games-STORE | J199: LON1-PS4-WS-VG-PE | K199: Legend of Nayuta PS4
B200: Invoice | C200: 2024-09-02T00:00:00.000 | D200: NISINV-68389 | E200: Event and Convention Sales | F200: F | G200: Accounts Receivable : Accounts Receivable: Online Store | H200: 41.77 | I200: NA Games-STORE | J200: GGR1-PS4-WS-VG-PE | K200: Grim Grimoire OnceMore PS4
B201: Invoice | C201: 2024-09-02T00:00:00.000 | D201: NISINV-68389 | E201: Event and Convention Sales | F201: F | G201: Accounts Receivable : Accounts Receivable: Online Store | H201: 638.6 | I201: NA Games-STORE | J201: DIS7-NSW-WS-VG-PE | K201: Disgaea 7 NSW
B202: Invoice | C202: 2024-09-02T00:00:00.000 | D202: NISINV-68389 | E202: Event and Convention Sales | F202: F | G202: Accounts Receivable : Accounts Receivable: Online Store | H202: 182.55 | I202: NA Games-STORE | J202: MME1-PS5-WS-VG-PE | K202: Monster Menu PS5
B203: Invoice | C203: 2024-09-02T00:00:00.000 | D203: NISINV-68389 | E203: Event and Convention Sales | F203: F | G203: Accounts Receivable : Accounts Receivable: Online Store | H203: 235.13 | I203: NA Games-STORE | J203: LOL1-NSW-WS-VG-PE | K203: Legend of Legacy HD NSW
B204: Invoice | C204: 2024-09-02T00:00:00.000 | D204: NISINV-68389 | E204: Event and Convention Sales | F204: F | G204: Accounts Receivable : Accounts Receivable: Online Store | H204: 344.38 | I204: NA Games-STORE | J204: GGR1-NSW-WS-VG-PE | K204: Grim Grimoire OnceMore NSW
B205: Invoice | C205: 2024-09-02T00:00:00.000 | D205: NISINV-68389 | E205: Event and Convention Sales | F205: F | G205: Accounts Receivable : Accounts Receivable: Online Store | H205: 258.9 | I205: NA Games-STORE | J205: GGR1-PS5-WS-VG-PE | K205: Grim Grimoire OnceMore PS5
B206: Credit Memo | C206: 2024-09-03T00:00:00.000 | D206: NISCM-4265 | E206: Wesley Dodson | F206: F | G206: Accounts Receivable : Accounts Receivable: Online Store | H206: -22.87 | I206: NA Games-STORE | J206: TTD1-PS5-WS-VG-PE | K206: Trails through Daybreak PS5
B207: Item Fulfillment | C207: 2024-09-03T00:00:00.000 | D207: 433585 | E207: Michael Summers | F207: F | G207: Inventory Asset : Finished Goods | H207: 22.96 | I207: NA Games-STORE | J207: GGR1-NSW-WS-VG-PE | K207: Grim Grimoire OnceMore NSW
B208: Item Fulfillment | C208: 2024-09-03T00:00:00.000 | D208: 433611 | E208: Brandon Ellena | F208: F | G208: Inventory Asset : Finished Goods | H208: 21.51 | I208: NA Games-STORE | J208: LON1-PS4-WS-VG-PE | K208: Legend of Nayuta PS4
B209: Item Fulfillment | C209: 2024-09-03T00:00:00.000 | D209: 433565 | E209: 22530 John Ball | F209: F | G209: Inventory Asset : Finished Goods | H209: 20.12 | I209: NA Games-STORE | J209: TC34-PS5-WS-VG-PE | K209: Trails of Cold Steel 3+4 PS5
B210: Item Fulfillment | C210: 2024-09-03T00:00:00.000 | D210: 433609 | E210: James Melton | F210: F | G210: Inventory Asset : Finished Goods | H210: 21.57 | I210: NA Games-STORE | J210: GGR1-PS5-WS-VG-PE | K210: Grim Grimoire OnceMore PS5
B211: Item Fulfillment | C211: 2024-09-03T00:00:00.000 | D211: 433585 | E211: Michael Summers | F211: F | G211: Inventory Asset : Finished Goods | H211: 26.74 | I211: NA Games-STORE | J211: D6C1-PS4-WS-VG-PE | K211: Disgaea 6 Complete PS4
B212: Item Fulfillment | C212: 2024-09-03T00:00:00.000 | D212: 433660 | E212: Tim Mclaughlin | F212: F | G212: Inventory Asset : Finished Goods | H212: 27.76 | I212: NA Games-STORE | J212: DIS7-NSW-WS-VG-PE | K212: Disgaea 7 NSW
B213: Item Fulfillment | C213: 2024-09-03T00:00:00.000 | D213: 433602 | E213: Michael Martin [1000351449] | F213: F | G213: Inventory Asset : Finished Goods | H213: 16.62 | I213: NA Games-STORE | J213: POE1-PS4-WS-VG-PE | K213: Process of Elimination PS4
B214: Item Fulfillment | C214: 2024-09-03T00:00:00.000 | D214: 433574 | E214: gabriel castaneda | F214: F | G214: Inventory Asset : Finished Goods | H214: 26.25 | I214: NA Games-STORE | J214: DIS7-PS5-WS-VG-PE | K214: Disgaea 7 PS5
B215: Item Fulfillment | C215: 2024-09-03T00:00:00.000 | D215: 433609 | E215: James Melton | F215: F | G215: Inventory Asset : Finished Goods | H215: 23.85 | I215: NA Games-STORE | J215: MMB1-PS5-WS-VG-PE | K215: Monochrome Mobius
B216: Item Fulfillment | C216: 2024-09-03T00:00:00.000 | D216: 433571 | E216: Harold Arrance | F216: F | G216: Inventory Asset : Finished Goods | H216: 17.81 | I216: NA Games-STORE | J216: LOL1-PS5-WS-VG-PE | K216: Legend of Legacy HD PS5
B217: Item Fulfillment | C217: 2024-09-03T00:00:00.000 | D217: 433611 | E217: Brandon Ellena | F217: F | G217: Inventory Asset : Finished Goods | H217: 21.58 | I217: NA Games-STORE | J217: GGR1-PS5-WS-VG-PE | K217: Grim Grimoire OnceMore PS5
B218: Item Fulfillment | C218: 2024-09-03T00:00:00.000 | D218: 433596 | E218: Travis Graf | F218: F | G218: Inventory Asset : Finished Goods | H218: 21.51 | I218: NA Games-STORE | J218: LON1-PS4-WS-VG-PE | K218: Legend of Nayuta PS4
B219: Item Fulfillment | C219: 2024-09-03T00:00:00.000 | D219: 433584 | E219: Joseph Baca | F219: F | G219: Inventory Asset : Finished Goods | H219: 26.79 | I219: NA Games-STORE | J219: D6C1-PS5-WS-VG-PE | K219: Disgaea 6 Complete PS5
B220: Item Fulfillment | C220: 2024-09-03T00:00:00.000 | D220: 433579 | E220: 19706 Michael Ross | F220: F | G220: Inventory Asset : Finished Goods | H220: 23.85 | I220: NA Games-STORE | J220: MMB1-PS5-WS-VG-PE | K220: Monochrome Mobius
B221: Item Fulfillment | C221: 2024-09-03T00:00:00.000 | D221: 433564 | E221: Jared Johnson [1000221718] | F221: F | G221: Inventory Asset : Finished Goods | H221: 68.88 | I221: NA Games-STORE | J221: GGR1-NSW-WS-VG-PE | K221: Grim Grimoire OnceMore NSW
B222: Item Fulfillment | C222: 2024-09-03T00:00:00.000 | D222: 433585 | E222: Michael Summers | F222: F | G222: Inventory Asset : Finished Goods | H222: 27.77 | I222: NA Games-STORE | J222: DIS7-NSW-WS-VG-PE | K222: Disgaea 7 NSW
B223: Item Fulfillment | C223: 2024-09-03T00:00:00.000 | D223: 433613 | E223: Phillip Perez | F223: F | G223: Inventory Asset : Finished Goods | H223: 26.25 | I223: NA Games-STORE | J223: DIS7-PS5-WS-VG-PE | K223: Disgaea 7 PS5
B224: Item Fulfillment | C224: 2024-09-03T00:00:00.000 | D224: 433573 | E224: Hao-Yiing Kuo | F224: F | G224: Inventory Asset : Finished Goods | H224: 26.25 | I224: NA Games-STORE | J224: DIS7-PS5-WS-VG-PE | K224: Disgaea 7 PS5
B225: Item Fulfillment | C225: 2024-09-03T00:00:00.000 | D225: 433600 | E225: Kyle Marshall | F225: F | H225: 21.37 | I225: NA Games-STORE | J225: LOL1-NSW-WS-VG-PE | K225: Legend of Legacy HD NSW
B226: Item Fulfillment | C226: 2024-09-03T00:00:00.000 | D226: 433588 | E226: ruperto estala | F226: F | G226: Inventory Asset : Finished Goods | H226: 27.76 | I226: NA Games-STORE | J226: DIS7-NSW-WS-VG-PE | K226: Disgaea 7 NSW
B227: Item Fulfillment | C227: 2024-09-03T00:00:00.000 | D227: 433582 | E227: 23509 Groon Smith | F227: F | G227: Inventory Asset : Finished Goods | H227: 26.25 | I227: NA Games-STORE | J227: DIS7-PS5-WS-VG-PE | K227: Disgaea 7 PS5
B228: Item Fulfillment | C228: 2024-09-03T00:00:00.000 | D228: 433567 | E228: 23411 Moe Sett | F228: F | G228: Inventory Asset : Finished Goods | H228: 21.5 | I228: NA Games-STORE | J228: LON1-PS4-WS-VG-PE | K228: Legend of Nayuta PS4
B229: Item Fulfillment | C229: 2024-09-03T00:00:00.000 | D229: 433562 | E229: Suta Suddhiprakarn | F229: F | G229: Inventory Asset : Finished Goods | H229: 51.95 | I229: NA Games-STORE | J229: HMO4-PS4-WS-VG-PE | K229: Harvest Moon: Winds of Anthos PS4
B230: Item Fulfillment | C230: 2024-09-03T00:00:00.000 | D230: 433611 | E230: Brandon Ellena | F230: F | G230: Inventory Asset : Finished Goods | H230: 22.96 | I230: NA Games-STORE | J230: GGR1-NSW-WS-VG-PE | K230: Grim Grimoire OnceMore NSW
B231: Item Fulfillment | C231: 2024-09-03T00:00:00.000 | D231: 433575 | E231: Justin Garrett | F231: F | G231: Inventory Asset : Finished Goods | H231: 22.96 | I231: NA Games-STORE | J231: GGR1-NSW-WS-VG-PE | K231: Grim Grimoire OnceMore NSW
B232: Item Fulfillment | C232: 2024-09-03T00:00:00.000 | D232: 433615 | E232: Matthew Hovsepian | F232: F | G232: Inventory Asset : Finished Goods | H232: 22.96 | I232: NA Games-STORE | J232: GGR1-NSW-WS-VG-PE | K232: Grim Grimoire OnceMore NSW
B233: Item Fulfillment | C233: 2024-09-03T00:00:00.000 | D233: 433572 | E233: Scott Demonbrun | F233: F | G233: Inventory Asset : Finished Goods | H233: 114.79 | I233: NA Games-STORE | J233: GGR1-NSW-WS-VG-PE | K233: Grim Grimoire OnceMore NSW
B234: Item Fulfillment | C234: 2024-09-03T00:00:00.000 | D234: 433566 | E234: Justin Lu | F234: F | G234: Inventory Asset : Finished Goods | H234: 17.82 | I234: NA Games-STORE | J234: LOL1-PS4-WS-VG-PE | K234: Legend of Legacy HD PS4
B235: Item Fulfillment | C235: 2024-09-03T00:00:00.000 | D235: 433605 | E235: 23473 John Francis | F235: F | G235: Inventory Asset : Finished Goods | H235: 16.61 | I235: NA Games-STORE | J235: POE1-PS4-WS-VG-PE | K235: Process of Elimination PS4
B236: Item Fulfillment | C236: 2024-09-03T00:00:00.000 | D236: 433602 | E236: Michael Martin [1000351449] | F236: F | G236: Inventory Asset : Finished Goods | H236: 22.82 | I236: NA Games-STORE | J236: MME1-PS5-WS-VG-PE | K236: Monster Menu PS5
B237: Item Fulfillment | C237: 2024-09-03T00:00:00.000 | D237: 433598 | E237: Vincent Garcia [1000209189] | F237: F | G237: Inventory Asset : Finished Goods | H237: 21.5 | I237: NA Games-STORE | J237: LON1-PS4-WS-VG-PE | K237: Legend of Nayuta PS4
B238: Item Fulfillment | C238: 2024-09-03T00:00:00.000 | D238: 433597 | E238: Rodrigo Pessoa | F238: F | G238: Inventory Asset : Finished Goods | H238: 21.38 | I238: NA Games-STORE | J238: LOL1-NSW-WS-VG-PE | K238: Legend of Legacy HD NSW
B239: Item Fulfillment | C239: 2024-09-03T00:00:00.000 | D239: 433583 | E239: Joseph Baca | F239: F | G239: Inventory Asset : Finished Goods | H239: 21.51 | I239: NA Games-STORE | J239: LON1-PS4-WS-VG-PE | K239: Legend of Nayuta PS4
B240: Item Fulfillment | C240: 2024-09-03T00:00:00.000 | D240: 433562 | E240: Suta Suddhiprakarn | F240: F | G240: Inventory Asset : Finished Goods | H240: 21.38 | I240: NA Games-STORE | J240: LOL1-NSW-WS-VG-PE | K240: Legend of Legacy HD NSW
B241: Item Fulfillment | C241: 2024-09-03T00:00:00.000 | D241: 433575 | E241: Justin Garrett | F241: F | G241: Inventory Asset : Finished Goods | H241: 18.8 | I241: NA Games-STORE | J241: VOT2-NSW-WS-VG-PE | K241: Void Terrarium 2 NSW
B242: Item Fulfillment | C242: 2024-09-03T00:00:00.000 | D242: 433562 | E242: Suta Suddhiprakarn | F242: F | G242: Inventory Asset : Finished Goods | H242: 17.81 | I242: NA Games-STORE | J242: LOL1-PS4-WS-VG-PE | K242: Legend of Legacy HD PS4
B243: Item Fulfillment | C243: 2024-09-03T00:00:00.000 | D243: 433605 | E243: 23473 John Francis | F243: F | G243: Inventory Asset : Finished Goods | H243: 21.58 | I243: NA Games-STORE | J243: GGR1-PS5-WS-VG-PE | K243: Grim Grimoire OnceMore PS5
B244: Item Fulfillment | C244: 2024-09-03T00:00:00.000 | D244: 433608 | E244: 23549 Michael Bitting | F244: F | G244: Inventory Asset : Finished Goods | H244: 23.85 | I244: NA Games-STORE | J244: MMB1-PS5-WS-VG-PE | K244: Monochrome Mobius
B245: Item Fulfillment | C245: 2024-09-03T00:00:00.000 | D245: 433594 | E245: 23525 Aaron Bailey | F245: F | G245: Inventory Asset : Finished Goods | H245: 26.74 | I245: NA Games-STORE | J245: D6C1-PS4-WS-VG-PE | K245: Disgaea 6 Complete PS4
B246: Item Fulfillment | C246: 2024-09-03T00:00:00.000 | D246: 433568 | E246: Dorian Zdrinc | F246: F | G246: Inventory Asset : Finished Goods | H246: 21.51 | I246: NA Games-STORE | J246: LON1-PS4-WS-VG-PE | K246: Legend of Nayuta PS4
B247: Item Fulfillment | C247: 2024-09-03T00:00:00.000 | D247: 433582 | E247: 23509 Groon Smith | F247: F | G247: Inventory Asset : Finished Goods | H247: 23.85 | I247: NA Games-STORE | J247: MMB1-PS4-WS-VG-PE | K247: Monochrome Mobius
B248: Item Fulfillment | C248: 2024-09-03T00:00:00.000 | D248: 433570 | E248: 21522 Aidan Crum Crum | F248: F | G248: Inventory Asset : Finished Goods | H248: 21.57 | I248: NA Games-STORE | J248: GGR1-PS5-WS-VG-PE | K248: Grim Grimoire OnceMore PS5
B249: Item Fulfillment | C249: 2024-09-03T00:00:00.000 | D249: 433590 | E249: Nathaniel Yates | F249: F | G249: Inventory Asset : Finished Goods | H249: 21.57 | I249: NA Games-STORE | J249: GGR1-PS5-WS-VG-PE | K249: Grim Grimoire OnceMore PS5
B250: Item Fulfillment | C250: 2024-09-03T00:00:00.000 | D250: 433581 | E250: Huang | F250: F | G250: Inventory Asset : Finished Goods | H250: 27.76 | I250: NA Games-STORE | J250: DIS7-NSW-WS-VG-PE | K250: Disgaea 7 NSW
B251: Item Fulfillment | C251: 2024-09-03T00:00:00.000 | D251: 433570 | E251: 21522 Aidan Crum Crum | F251: F | G251: Inventory Asset : Finished Goods | H251: 24.08 | I251: NA Games-STORE | J251: RHP3-PS5-WS-VG-PE | K251: Rhapsody Legacy PS5
B252: Item Fulfillment | C252: 2024-09-03T00:00:00.000 | D252: 433582 | E252: 23509 Groon Smith | F252: F | G252: Inventory Asset : Finished Goods | H252: 22.96 | I252: NA Games-STORE | J252: GGR1-NSW-WS-VG-PE | K252: Grim Grimoire OnceMore NSW
B253: Item Fulfillment | C253: 2024-09-03T00:00:00.000 | D253: 433606 | E253: Jared Knapp | F253: F | G253: Inventory Asset : Finished Goods | H253: 23.85 | I253: NA Games-STORE | J253: MMB1-PS5-WS-VG-PE | K253: Monochrome Mobius
B254: Item Fulfillment | C254: 2024-09-03T00:00:00.000 | D254: 433602 | E254: Michael Martin [1000351449] | F254: F | G254: Inventory Asset : Finished Goods | H254: 17.4 | I254: NA Games-STORE | J254: VOT2-PS4-WS-VG-PE | K254: Void Terrarium 2 PS4
B255: Item Fulfillment | C255: 2024-09-03T00:00:00.000 | D255: 433568 | E255: Dorian Zdrinc | F255: F | G255: Inventory Asset : Finished Goods | H255: 21.58 | I255: NA Games-STORE | J255: GGR1-PS5-WS-VG-PE | K255: Grim Grimoire OnceMore PS5
B256: Item Fulfillment | C256: 2024-09-03T00:00:00.000 | D256: 433581 | E256: Huang | F256: F | G256: Inventory Asset : Finished Goods | H256: 21.37 | I256: NA Games-STORE | J256: LOL1-NSW-WS-VG-PE | K256: Legend of Legacy HD NSW
B257: Item Fulfillment | C257: 2024-09-03T00:00:00.000 | D257: 433566 | E257: Justin Lu | F257: F | G257: Inventory Asset : Finished Goods | H257: 27.76 | I257: NA Games-STORE | J257: DIS7-NSW-WS-VG-PE | K257: Disgaea 7 NSW
B258: Item Fulfillment | C258: 2024-09-03T00:00:00.000 | D258: 433564 | E258: Jared Johnson [1000221718] | F258: F | G258: Inventory Asset : Finished Goods | H258: 23.19 | I258: NA Games-STORE | J258: MME1-PS4-WS-VG-PE | K258: Monster Menu PS4
B259: Item Fulfillment | C259: 2024-09-03T00:00:00.000 | D259: 433563 | E259: Justin Hayes | F259: F | H259: 27.77 | I259: NA Games-STORE | J259: DIS7-NSW-WS-VG-PE | K259: Disgaea 7 NSW
B260: Item Fulfillment | C260: 2024-09-03T00:00:00.000 | D260: 433578 | E260: 23381 Cheuk Chan | F260: F | G260: Inventory Asset : Finished Goods | H260: 24.08 | I260: NA Games-STORE | J260: RHP3-PS5-WS-VG-PE | K260: Rhapsody Legacy PS5
B261: Item Fulfillment | C261: 2024-09-03T00:00:00.000 | D261: 433564 | E261: Jared Johnson [1000221718] | F261: F | G261: Inventory Asset : Finished Goods | H261: 49.59 | I261: NA Games-STORE | J261: MME1-NSW-WS-VG-PE | K261: Monster Menu NSW
B262: Item Fulfillment | C262: 2024-09-03T00:00:00.000 | D262: 433562 | E262: Suta Suddhiprakarn | F262: F | G262: Inventory Asset : Finished Goods | H262: 52.1 | I262: NA Games-STORE | J262: HMO4-NSW-WS-VG-PE | K262: Harvest Moon: Winds of Anthos NSW
B263: Item Fulfillment | C263: 2024-09-03T00:00:00.000 | D263: 433584 | E263: Joseph Baca | F263: F | G263: Inventory Asset : Finished Goods | H263: 26.25 | I263: NA Games-STORE | J263: DIS7-PS5-WS-VG-PE | K263: Disgaea 7 PS5
B264: Item Fulfillment | C264: 2024-09-03T00:00:00.000 | D264: 433561 | E264: Matthew Payte | F264: F | H264: 20.12 | I264: NA Games-STORE | J264: TC34-PS5-WS-VG-PE | K264: Trails of Cold Steel 3+4 PS5
B265: Item Fulfillment | C265: 2024-09-03T00:00:00.000 | D265: 433591 | E265: Kevin Suarez | F265: F | G265: Inventory Asset : Finished Goods | H265: 22.96 | I265: NA Games-STORE | J265: GGR1-NSW-WS-VG-PE | K265: Grim Grimoire OnceMore NSW
B266: Item Fulfillment | C266: 2024-09-03T00:00:00.000 | D266: 433583 | E266: Joseph Baca | F266: F | G266: Inventory Asset : Finished Goods | H266: 21.58 | I266: NA Games-STORE | J266: GGR1-PS5-WS-VG-PE | K266: Grim Grimoire OnceMore PS5
B267: Item Fulfillment | C267: 2024-09-03T00:00:00.000 | D267: 433609 | E267: James Melton | F267: F | G267: Inventory Asset : Finished Goods | H267: 22.82 | I267: NA Games-STORE | J267: MME1-PS5-WS-VG-PE | K267: Monster Menu PS5
B268: Item Fulfillment | C268: 2024-09-03T00:00:00.000 | D268: 433599 | E268: Joe Williams | F268: F | G268: Inventory Asset : Finished Goods | H268: 25.14 | I268: NA Games-STORE | J268: YSD1-PS5-WS-VG-PE | K268: Ys VIII Lacrimosa of Dana PS5
B269: Item Fulfillment | C269: 2024-09-03T00:00:00.000 | D269: 433571 | E269: Harold Arrance | F269: F | G269: Inventory Asset : Finished Goods | H269: 21.5 | I269: NA Games-STORE | J269: LON1-PS4-WS-VG-PE | K269: Legend of Nayuta PS4
B270: Item Fulfillment | C270: 2024-09-03T00:00:00.000 | D270: 433582 | E270: 23509 Groon Smith | F270: F | G270: Inventory Asset : Finished Goods | H270: 21.5 | I270: NA Games-STORE | J270: LON1-PS4-WS-VG-PE | K270: Legend of Nayuta PS4
B271: Item Fulfillment | C271: 2024-09-03T00:00:00.000 | D271: 433575 | E271: Justin Garrett | F271: F | G271: Inventory Asset : Finished Goods | H271: 27.77 | I271: NA Games-STORE | J271: DIS7-NSW-WS-VG-PE | K271: Disgaea 7 NSW
B272: Item Fulfillment | C272: 2024-09-03T00:00:00.000 | D272: 433561 | E272: Matthew Payte | F272: F | H272: 25.14 | I272: NA Games-STORE | J272: YSD1-PS5-WS-VG-PE | K272: Ys VIII Lacrimosa of Dana PS5
B273: Item Fulfillment | C273: 2024-09-03T00:00:00.000 | D273: 433614 | E273: 19313 Anthony Angulo | F273: F | G273: Inventory Asset : Finished Goods | H273: 22.96 | I273: NA Games-STORE | J273: GGR1-NSW-WS-VG-PE | K273: Grim Grimoire OnceMore NSW
B274: Item Fulfillment | C274: 2024-09-03T00:00:00.000 | D274: 433577 | E274: 21750 Marc Daryl Estioko | F274: F | G274: Inventory Asset : Finished Goods | H274: 19.59 | I274: NA Games-STORE | J274: POE1-NSW-WS-VG-PE | K274: Process of Elimination NSW
B275: Item Fulfillment | C275: 2024-09-03T00:00:00.000 | D275: 433573 | E275: Hao-Yiing Kuo | F275: F | G275: Inventory Asset : Finished Goods | H275: 26.79 | I275: NA Games-STORE | J275: D6C1-PS5-WS-VG-PE | K275: Disgaea 6 Complete PS5
B276: Item Fulfillment | C276: 2024-09-03T00:00:00.000 | D276: 433595 | E276: 23526 Robert Martti | F276: F | G276: Inventory Asset : Finished Goods | H276: 25.13 | I276: NA Games-STORE | J276: YSD1-PS5-WS-VG-PE | K276: Ys VIII Lacrimosa of Dana PS5
B277: Item Fulfillment | C277: 2024-09-03T00:00:00.000 | D277: 433593 | E277: Michael Mays | F277: F | G277: Inventory Asset : Finished Goods | H277: 21.37 | I277: NA Games-STORE | J277: LOL1-NSW-WS-VG-PE | K277: Legend of Legacy HD NSW
B278: Item Fulfillment | C278: 2024-09-03T00:00:00.000 | D278: 433585 | E278: Michael Summers | F278: F | G278: Inventory Asset : Finished Goods | H278: 18.11 | I278: NA Games-STORE | J278: RTF3-PS5-WS-VG-PE | K278: R-Type Final 3 PS5
B279: Item Fulfillment | C279: 2024-09-03T00:00:00.000 | D279: 433567 | E279: 23411 Moe Sett | F279: F | G279: Inventory Asset : Finished Goods | H279: 21.57 | I279: NA Games-STORE | J279: GGR1-PS5-WS-VG-PE | K279: Grim Grimoire OnceMore PS5
B280: Item Fulfillment | C280: 2024-09-03T00:00:00.000 | D280: 433603 | E280: Eddie Delgado [1000292046] | F280: F | G280: Inventory Asset : Finished Goods | H280: 21.38 | I280: NA Games-STORE | J280: LOL1-NSW-WS-VG-PE | K280: Legend of Legacy HD NSW
B281: Item Fulfillment | C281: 2024-09-03T00:00:00.000 | D281: 433586 | E281: Nic Stein | F281: F | G281: Inventory Asset : Finished Goods | H281: 19.58 | I281: NA Games-STORE | J281: POE1-NSW-WS-VG-PE | K281: Process of Elimination NSW
B282: Item Fulfillment | C282: 2024-09-03T00:00:00.000 | D282: 433564 | E282: Jared Johnson [1000221718] | F282: F | G282: Inventory Asset : Finished Goods | H282: 20.88 | I282: NA Games-STORE | J282: GGR1-PS4-WS-VG-PE | K282: Grim Grimoire OnceMore PS4
B283: Item Fulfillment | C283: 2024-09-03T00:00:00.000 | D283: 433576 | E283: Eric Beasley | F283: F | G283: Inventory Asset : Finished Goods | H283: 22.96 | I283: NA Games-STORE | J283: GGR1-NSW-WS-VG-PE | K283: Grim Grimoire OnceMore NSW
B284: Item Fulfillment | C284: 2024-09-03T00:00:00.000 | D284: 433576 | E284: Eric Beasley | F284: F | G284: Inventory Asset : Finished Goods | H284: 24.09 | I284: NA Games-STORE | J284: RHP3-PS5-WS-VG-PE | K284: Rhapsody Legacy PS5
B285: Item Fulfillment | C285: 2024-09-03T00:00:00.000 | D285: 433592 | E285: 21750 Marc Daryl Estioko | F285: F | G285: Inventory Asset : Finished Goods | H285: 21.5 | I285: NA Games-STORE | J285: LON1-PS4-WS-VG-PE | K285: Legend of Nayuta PS4
B286: Item Fulfillment | C286: 2024-09-03T00:00:00.000 | D286: 433567 | E286: 23411 Moe Sett | F286: F | G286: Inventory Asset : Finished Goods | H286: 26.74 | I286: NA Games-STORE | J286: D6C1-PS4-WS-VG-PE | K286: Disgaea 6 Complete PS4
B287: Item Fulfillment | C287: 2024-09-03T00:00:00.000 | D287: 433597 | E287: Rodrigo Pessoa | F287: F | G287: Inventory Asset : Finished Goods | H287: 24.79 | I287: NA Games-STORE | J287: MME1-NSW-WS-VG-PE | K287: Monster Menu NSW
B288: Item Fulfillment | C288: 2024-09-03T00:00:00.000 | D288: 433601 | E288: 23533 Mark Hodges | F288: F | G288: Inventory Asset : Finished Goods | H288: 24.09 | I288: NA Games-STORE | J288: RHP3-PS5-WS-VG-PE | K288: Rhapsody Legacy PS5
B289: Item Fulfillment | C289: 2024-09-03T00:00:00.000 | D289: 433593 | E289: Michael Mays | F289: F | G289: Inventory Asset : Finished Goods | H289: 22.96 | I289: NA Games-STORE | J289: GGR1-NSW-WS-VG-PE | K289: Grim Grimoire OnceMore NSW
B290: Item Fulfillment | C290: 2024-09-03T00:00:00.000 | D290: 433582 | E290: 23509 Groon Smith | F290: F | G290: Inventory Asset : Finished Goods | H290: 23.19 | I290: NA Games-STORE | J290: MME1-PS4-WS-VG-PE | K290: Monster Menu PS4
B291: Item Fulfillment | C291: 2024-09-03T00:00:00.000 | D291: 433579 | E291: 19706 Michael Ross | F291: F | G291: Inventory Asset : Finished Goods | H291: 21.51 | I291: NA Games-STORE | J291: LON1-PS4-WS-VG-PE | K291: Legend of Nayuta PS4
B292: Item Fulfillment | C292: 2024-09-03T00:00:00.000 | D292: 433584 | E292: Joseph Baca | F292: F | G292: Inventory Asset : Finished Goods | H292: 21.38 | I292: NA Games-STORE | J292: LOL1-NSW-WS-VG-PE | K292: Legend of Legacy HD NSW
B293: Item Fulfillment | C293: 2024-09-03T00:00:00.000 | D293: 433615 | E293: Matthew Hovsepian | F293: F | G293: Inventory Asset : Finished Goods | H293: 27.77 | I293: NA Games-STORE | J293: DIS7-NSW-WS-VG-PE | K293: Disgaea 7 NSW
B294: Item Fulfillment | C294: 2024-09-03T00:00:00.000 | D294: 433607 | E294: Arthur Klinkon [1000299105] | F294: F | G294: Inventory Asset : Finished Goods | H294: 21.51 | I294: NA Games-STORE | J294: LON1-PS4-WS-VG-PE | K294: Legend of Nayuta PS4
B295: Item Fulfillment | C295: 2024-09-03T00:00:00.000 | D295: 433608 | E295: 23549 Michael Bitting | F295: F | G295: Inventory Asset : Finished Goods | H295: 21.5 | I295: NA Games-STORE | J295: LON1-PS4-WS-VG-PE | K295: Legend of Nayuta PS4
B296: Item Fulfillment | C296: 2024-09-03T00:00:00.000 | D296: 433607 | E296: Arthur Klinkon [1000299105] | F296: F | G296: Inventory Asset : Finished Goods | H296: 23.85 | I296: NA Games-STORE | J296: MMB1-PS5-WS-VG-PE | K296: Monochrome Mobius
B297: Item Fulfillment | C297: 2024-09-03T00:00:00.000 | D297: 433582 | E297: 23509 Groon Smith | F297: F | G297: Inventory Asset : Finished Goods | H297: 26.79 | I297: NA Games-STORE | J297: D6C1-PS5-WS-VG-PE | K297: Disgaea 6 Complete PS5
B298: Item Fulfillment | C298: 2024-09-03T00:00:00.000 | D298: 433574 | E298: gabriel castaneda | F298: F | G298: Inventory Asset : Finished Goods | H298: 22.82 | I298: NA Games-STORE | J298: MME1-PS5-WS-VG-PE | K298: Monster Menu PS5
B299: Item Fulfillment | C299: 2024-09-03T00:00:00.000 | D299: 433594 | E299: 23525 Aaron Bailey | F299: F | G299: Inventory Asset : Finished Goods | H299: 26.3 | I299: NA Games-STORE | J299: DIS7-PS4-WS-VG-PE | K299: Disgaea 7 PS4
B300: Item Fulfillment | C300: 2024-09-03T00:00:00.000 | D300: 433613 | E300: Phillip Perez | F300: F | G300: Inventory Asset : Finished Goods | H300: 21.5 | I300: NA Games-STORE | J300: LON1-PS4-WS-VG-PE | K300: Legend of Nayuta PS4
B301: Item Fulfillment | C301: 2024-09-04T00:00:00.000 | D301: 433625 | E301: C Nathan Randell | F301: F | G301: Inventory Asset : Finished Goods | H301: 26.25 | I301: NA Games-STORE | J301: DIS7-PS5-WS-VG-PE | K301: Disgaea 7 PS5
B302: Item Fulfillment | C302: 2024-09-04T00:00:00.000 | D302: 433629 | E302: Bryan Rittenberry 5 | F302: F | G302: Inventory Asset : Finished Goods | H302: 25.14 | I302: NA Games-STORE | J302: YSD1-PS5-WS-VG-PE | K302: Ys VIII Lacrimosa of Dana PS5
B303: Item Fulfillment | C303: 2024-09-04T00:00:00.000 | D303: 433621 | E303: David Grossman | F303: F | G303: Inventory Asset : Finished Goods | H303: 16.62 | I303: NA Games-STORE | J303: POE1-PS4-WS-VG-PE | K303: Process of Elimination PS4
B304: Item Fulfillment | C304: 2024-09-04T00:00:00.000 | D304: 433626 | E304: 23567 Parker Kline | F304: F | G304: Inventory Asset : Finished Goods | H304: 19.59 | I304: NA Games-STORE | J304: POE1-NSW-WS-VG-PE | K304: Process of Elimination NSW
B305: Item Fulfillment | C305: 2024-09-04T00:00:00.000 | D305: 433626 | E305: 23567 Parker Kline | F305: F | G305: Inventory Asset : Finished Goods | H305: 25.41 | I305: NA Games-STORE | J305: YUK1-NSW-WS-VG-PE | K305: Yurukill NSW
B306: Item Fulfillment | C306: 2024-09-04T00:00:00.000 | D306: 433622 | E306: John Paul Zahary | F306: F | G306: Inventory Asset : Finished Goods | H306: 21.57 | I306: NA Games-STORE | J306: GGR1-PS5-WS-VG-PE | K306: Grim Grimoire OnceMore PS5
B307: Item Fulfillment | C307: 2024-09-04T00:00:00.000 | D307: 433627 | E307: Sara Marcuse | F307: F | G307: Inventory Asset : Finished Goods | H307: 25.13 | I307: NA Games-STORE | J307: YSD1-PS5-WS-VG-PE | K307: Ys VIII Lacrimosa of Dana PS5
B308: Item Fulfillment | C308: 2024-09-04T00:00:00.000 | D308: 433625 | E308: C Nathan Randell | F308: F | G308: Inventory Asset : Finished Goods | H308: 16.61 | I308: NA Games-STORE | J308: POE1-PS4-WS-VG-PE | K308: Process of Elimination PS4
B309: Item Fulfillment | C309: 2024-09-04T00:00:00.000 | D309: 433622 | E309: John Paul Zahary | F309: F | G309: Inventory Asset : Finished Goods | H309: 21.51 | I309: NA Games-STORE | J309: LON1-PS4-WS-VG-PE | K309: Legend of Nayuta PS4
B310: Item Fulfillment | C310: 2024-09-04T00:00:00.000 | D310: 433628 | E310: 23573 Justin Robinson | F310: F | G310: Inventory Asset : Finished Goods | H310: 22.96 | I310: NA Games-STORE | J310: GGR1-NSW-WS-VG-PE | K310: Grim Grimoire OnceMore NSW
B311: Item Fulfillment | C311: 2024-09-04T00:00:00.000 | D311: 433623 | E311: Wesley Dodson | F311: F | G311: Inventory Asset : Finished Goods | H311: 20.12 | I311: NA Games-STORE | J311: TC34-PS5-WS-VG-PE | K311: Trails of Cold Steel 3+4 PS5
B312: Credit Memo | C312: 2024-09-05T00:00:00.000 | D312: NISCM-4269 | E312: Emmanuel De Jesus | F312: F | G312: Accounts Receivable : Accounts Receivable: Online Store | H312: -22.88 | I312: NA Games-STORE | J312: TTD1-PS5-WS-VG-PE | K312: Trails through Daybreak PS5
B313: Credit Memo | C313: 2024-09-05T00:00:00.000 | D313: NISCM-4270 | E313: Emmanuel De Jesus | F313: F | G313: Accounts Receivable : Accounts Receivable: Online Store | H313: -22.88 | I313: NA Games-STORE | J313: TTD1-PS5-WS-VG-PE | K313: Trails through Daybreak PS5
B314: Item Fulfillment | C314: 2024-09-06T00:00:00.000 | D314: 433640 | E314: 22050 Jake Dotson | F314: F | G314: Inventory Asset : Finished Goods | H314: 23.85 | I314: NA Games-STORE | J314: MMB1-PS5-WS-VG-PE | K314: Monochrome Mobius
B315: Item Fulfillment | C315: 2024-09-06T00:00:00.000 | D315: 433642 | E315: 23600 Benjamin Alveo | F315: F | G315: Inventory Asset : Finished Goods | H315: 21.58 | I315: NA Games-STORE | J315: GGR1-PS5-WS-VG-PE | K315: Grim Grimoire OnceMore PS5
B316: Item Fulfillment | C316: 2024-09-06T00:00:00.000 | D316: 433643 | E316: 19766 Justin Maness | F316: F | G316: Inventory Asset : Finished Goods | H316: 25.13 | I316: NA Games-STORE | J316: YSD1-PS5-WS-VG-PE | K316: Ys VIII Lacrimosa of Dana PS5
B317: Item Fulfillment | C317: 2024-09-09T00:00:00.000 | D317: 434950 | E317: 23473 John Francis | F317: F | G317: Inventory Asset : Finished Goods | H317: 17.82 | I317: NA Games-STORE | J317: LOL1-PS5-WS-VG-PE | K317: Legend of Legacy HD PS5
B318: Item Fulfillment | C318: 2024-09-09T00:00:00.000 | D318: 434946 | E318: 23617 Colton R Harris | F318: F | G318: Inventory Asset : Finished Goods | H318: 21.5 | I318: NA Games-STORE | J318: LON1-PS4-WS-VG-PE | K318: Legend of Nayuta PS4
B319: Item Fulfillment | C319: 2024-09-09T00:00:00.000 | D319: 434948 | E319: 23621 Michael Taihutu | F319: F | G319: Inventory Asset : Finished Goods | H319: 20.12 | I319: NA Games-STORE | J319: TC34-PS5-WS-VG-PE | K319: Trails of Cold Steel 3+4 PS5
B320: Item Fulfillment | C320: 2024-09-09T00:00:00.000 | D320: 434956 | E320: 23632 Ewan Plummer | F320: F | G320: Inventory Asset : Finished Goods | H320: 20.12 | I320: NA Games-STORE | J320: TC34-PS5-WS-VG-PE | K320: Trails of Cold Steel 3+4 PS5
B321: Item Fulfillment | C321: 2024-09-09T00:00:00.000 | D321: 434950 | E321: 23473 John Francis | F321: F | G321: Inventory Asset : Finished Goods | H321: 21.57 | I321: NA Games-STORE | J321: KAM1-PS4-WS-VG-PE | K321: Kamiwaza PS4
B322: Item Fulfillment | C322: 2024-09-09T00:00:00.000 | D322: 434949 | E322: 23625 james D riddle | F322: F | G322: Inventory Asset : Finished Goods | H322: 25.14 | I322: NA Games-STORE | J322: YSD1-PS5-WS-VG-PE | K322: Ys VIII Lacrimosa of Dana PS5
B323: Item Fulfillment | C323: 2024-09-09T00:00:00.000 | D323: 434960 | E323: 23246 Nathaniel Salada | F323: F | H323: 21.37 | I323: NA Games-STORE | J323: LOL1-NSW-WS-VG-PE | K323: Legend of Legacy HD NSW
B324: Item Fulfillment | C324: 2024-09-09T00:00:00.000 | D324: 434953 | E324: carlos soto | F324: F | G324: Inventory Asset : Finished Goods | H324: 25.14 | I324: NA Games-STORE | J324: YSD1-PS5-WS-VG-PE | K324: Ys VIII Lacrimosa of Dana PS5
B325: Item Fulfillment | C325: 2024-09-09T00:00:00.000 | D325: 434951 | E325: Donny Powell | F325: F | G325: Inventory Asset : Finished Goods | H325: 25.13 | I325: NA Games-STORE | J325: YSD1-PS5-WS-VG-PE | K325: Ys VIII Lacrimosa of Dana PS5
B326: Item Fulfillment | C326: 2024-09-09T00:00:00.000 | D326: 434944 | E326: 23616 Duncan Ward | F326: F | G326: Inventory Asset : Finished Goods | H326: 26.63 | I326: NA Games-STORE | J326: RHP3-NSW-WS-VG-PE | K326: Rhapsody Legacy NSW
B327: Item Fulfillment | C327: 2024-09-09T00:00:00.000 | D327: 434943 | E327: 23613 MINAH HWANG | F327: F | G327: Inventory Asset : Finished Goods | H327: 26.63 | I327: NA Games-STORE | J327: RHP3-NSW-WS-VG-PE | K327: Rhapsody Legacy NSW
B328: Item Fulfillment | C328: 2024-09-09T00:00:00.000 | D328: 434957 | E328: 23636 Jing Smith Monsanto | F328: F | G328: Inventory Asset : Finished Goods | H328: 21.51 | I328: NA Games-STORE | J328: LON1-PS4-WS-VG-PE | K328: Legend of Nayuta PS4
B329: Item Fulfillment | C329: 2024-09-09T00:00:00.000 | D329: 434958 | E329: 23637 Sam Cruckson | F329: F | G329: Inventory Asset : Finished Goods | H329: 27.77 | I329: NA Games-STORE | J329: DIS7-NSW-WS-VG-PE | K329: Disgaea 7 NSW
B330: Item Fulfillment | C330: 2024-09-09T00:00:00.000 | D330: 434960 | E330: 23246 Nathaniel Salada | F330: F | H330: 27.36 | I330: NA Games-STORE | J330: TIR1-NSW-WS-VG-PE | K330: Trails into Reverie NSW
B331: Item Fulfillment | C331: 2024-09-10T00:00:00.000 | D331: 433651 | E331: Nicole Youmans | F331: F | G331: Inventory Asset : Finished Goods | H331: 25.13 | I331: NA Games-STORE | J331: YSD1-PS5-WS-VG-PE | K331: Ys VIII Lacrimosa of Dana PS5
B332: Item Fulfillment | C332: 2024-09-10T00:00:00.000 | D332: 433655 | E332: RICHARD CHEN | F332: F | G332: Inventory Asset : Finished Goods | H332: 25.13 | I332: NA Games-STORE | J332: YSD1-PS5-WS-VG-PE | K332: Ys VIII Lacrimosa of Dana PS5
B333: Item Fulfillment | C333: 2024-09-10T00:00:00.000 | D333: 433647 | E333: Aaron Khouli | F333: F | G333: Inventory Asset : Finished Goods | H333: 208.85 | I333: NA Games-STORE | J333: GGR1-PS4-WS-VG-PE | K333: Grim Grimoire OnceMore PS4
B334: Item Fulfillment | C334: 2024-09-10T00:00:00.000 | D334: 433649 | E334: Jesus Hinojosa | F334: F | G334: Inventory Asset : Finished Goods | H334: 22.96 | I334: NA Games-STORE | J334: GGR1-NSW-WS-VG-PE | K334: Grim Grimoire OnceMore NSW
B335: Item Fulfillment | C335: 2024-09-10T00:00:00.000 | D335: 433648 | E335: Aaron Khouli | F335: F | G335: Inventory Asset : Finished Goods | H335: 229.74 | I335: NA Games-STORE | J335: GGR1-PS4-WS-VG-PE | K335: Grim Grimoire OnceMore PS4
B336: Item Fulfillment | C336: 2024-09-10T00:00:00.000 | D336: 433653 | E336: 19604 Grant Kimsey | F336: F | G336: Inventory Asset : Finished Goods | H336: 25.14 | I336: NA Games-STORE | J336: YSD1-PS5-WS-VG-PE | K336: Ys VIII Lacrimosa of Dana PS5
B337: Item Fulfillment | C337: 2024-09-10T00:00:00.000 | D337: 433646 | E337: Aaron Khouli | F337: F | G337: Inventory Asset : Finished Goods | H337: 208.85 | I337: NA Games-STORE | J337: GGR1-PS4-WS-VG-PE | K337: Grim Grimoire OnceMore PS4
B338: Item Fulfillment | C338: 2024-09-11T00:00:00.000 | D338: 433656 | E338: Aaron Khouli | F338: F | G338: Inventory Asset : Finished Goods | H338: 208.85 | I338: NA Games-STORE | J338: GGR1-PS4-WS-VG-PE | K338: Grim Grimoire OnceMore PS4
B339: Item Fulfillment | C339: 2024-09-11T00:00:00.000 | D339: 433658 | E339: Tyriq Williams | F339: F | G339: Inventory Asset : Finished Goods | H339: 20.12 | I339: NA Games-STORE | J339: TC34-PS5-WS-VG-PE | K339: Trails of Cold Steel 3+4 PS5
B340: Item Fulfillment | C340: 2024-09-11T00:00:00.000 | D340: 433657 | E340: Robert Richards | F340: F | G340: Inventory Asset : Finished Goods | H340: 23.84 | I340: NA Games-STORE | J340: MMB1-PS4-WS-VG-PE | K340: Monochrome Mobius
B341: Item Fulfillment | C341: 2024-09-11T00:00:00.000 | D341: 433659 | E341: 23650 Manuel Valentino | F341: F | G341: Inventory Asset : Finished Goods | H341: 25.14 | I341: NA Games-STORE | J341: YSD1-PS5-WS-VG-PE | K341: Ys VIII Lacrimosa of Dana PS5
B342: Item Fulfillment | C342: 2024-09-12T00:00:00.000 | D342: 433662 | E342: Tung Duong | F342: F | G342: Inventory Asset : Finished Goods | H342: 21.57 | I342: NA Games-STORE | J342: GGR1-PS5-WS-VG-PE | K342: Grim Grimoire OnceMore PS5
B343: Item Fulfillment | C343: 2024-09-12T00:00:00.000 | D343: 433663 | E343: Daniel Gonzalez [1000257778] | F343: F | G343: Inventory Asset : Finished Goods | H343: 18.12 | I343: NA Games-STORE | J343: RTF3-PS5-WS-VG-PE | K343: R-Type Final 3 PS5
B344: Item Fulfillment | C344: 2024-09-12T00:00:00.000 | D344: 433661 | E344: 19775 Edgar Rosas | F344: F | G344: Inventory Asset : Finished Goods | H344: 20.12 | I344: NA Games-STORE | J344: TC34-PS5-WS-VG-PE | K344: Trails of Cold Steel 3+4 PS5
B345: Item Fulfillment | C345: 2024-09-12T00:00:00.000 | D345: 433662 | E345: Tung Duong | F345: F | G345: Inventory Asset : Finished Goods | H345: 51.95 | I345: NA Games-STORE | J345: HMO4-PS4-WS-VG-PE | K345: Harvest Moon: Winds of Anthos PS4
B346: Item Fulfillment | C346: 2024-09-13T00:00:00.000 | D346: 433666 | E346: 23662 Joua Vue | F346: F | G346: Inventory Asset : Finished Goods | H346: 25.13 | I346: NA Games-STORE | J346: YSD1-PS5-WS-VG-PE | K346: Ys VIII Lacrimosa of Dana PS5
B347: Item Fulfillment | C347: 2024-09-13T00:00:00.000 | D347: 433664 | E347: 21389 Vernon Porter | F347: F | H347: 21.5 | I347: NA Games-STORE | J347: LON1-PS4-WS-VG-PE | K347: Legend of Nayuta PS4
B348: Item Fulfillment | C348: 2024-09-13T00:00:00.000 | D348: 433664 | E348: 21389 Vernon Porter | F348: F | H348: 20.12 | I348: NA Games-STORE | J348: TC34-PS5-WS-VG-PE | K348: Trails of Cold Steel 3+4 PS5
B349: Item Fulfillment | C349: 2024-09-13T00:00:00.000 | D349: 433664 | E349: 21389 Vernon Porter | F349: F | H349: 22.88 | I349: NA Games-STORE | J349: TTD1-PS5-WS-VG-PE | K349: Trails through Daybreak PS5
B350: Item Fulfillment | C350: 2024-09-16T00:00:00.000 | D350: 433676 | E350: 19772 Rhys Harries | F350: F | G350: Inventory Asset : Finished Goods | H350: 25.14 | I350: NA Games-STORE | J350: YSD1-PS5-WS-VG-PE | K350: Ys VIII Lacrimosa of Dana PS5
B351: Item Fulfillment | C351: 2024-09-16T00:00:00.000 | D351: 433672 | E351: 23684 Aaron Bergland | F351: F | G351: Inventory Asset : Finished Goods | H351: 9.03 | I351: NA Games-STORE | J351: YSD1-PS4-WS-VG | K351: Ys VIII PS4
B352: Item Fulfillment | C352: 2024-09-16T00:00:00.000 | D352: 433669 | E352: Randy Ketchum | F352: F | G352: Inventory Asset : Finished Goods | H352: 26.61 | I352: NA Games-STORE | J352: TTD1-NSW-WS-VG-PE | K352: Trails through Daybreak NSW
B353: Item Fulfillment | C353: 2024-09-16T00:00:00.000 | D353: 433673 | E353: 20083 Zac Pines | F353: F | G353: Inventory Asset : Finished Goods | H353: 20.12 | I353: NA Games-STORE | J353: TC34-PS5-WS-VG-PE | K353: Trails of Cold Steel 3+4 PS5
B354: Item Fulfillment | C354: 2024-09-16T00:00:00.000 | D354: 433671 | E354: Ronda Warren | F354: F | H354: 26.74 | I354: NA Games-STORE | J354: D6C1-PS4-WS-VG-PE | K354: Disgaea 6 Complete PS4
B355: Item Fulfillment | C355: 2024-09-17T00:00:00.000 | D355: 433698 | E355: 21571 Laura Stokely | F355: F | G355: Inventory Asset : Finished Goods | H355: 20.12 | I355: NA Games-STORE | J355: TC34-PS5-WS-VG-PE | K355: Trails of Cold Steel 3+4 PS5
B356: Item Fulfillment | C356: 2024-09-17T00:00:00.000 | D356: 433696 | E356: Eileen Cassella | F356: F | G356: Inventory Asset : Finished Goods | H356: 26.31 | I356: NA Games-STORE | J356: DIS7-PS4-WS-VG-PE | K356: Disgaea 7 PS4
B357: Item Fulfillment | C357: 2024-09-17T00:00:00.000 | D357: 433691 | E357: NISA Operations | F357: F | G357: Inventory Asset : Finished Goods | H357: 18.1 | I357: NA Games-STORE | J357: RNT1-PS5-WS-VG-PE | K357: REYNATIS PS5
B358: Item Fulfillment | C358: 2024-09-17T00:00:00.000 | D358: 433695 | E358: Ky Nguyen [1000293009] | F358: F | G358: Inventory Asset : Finished Goods | H358: 20.12 | I358: NA Games-STORE | J358: TC34-PS5-WS-VG-PE | K358: Trails of Cold Steel 3+4 PS5
B359: Item Fulfillment | C359: 2024-09-17T00:00:00.000 | D359: 433697 | E359: 6222 Beatrix Peck | F359: F | G359: Inventory Asset : Finished Goods | H359: 24.8 | I359: NA Games-STORE | J359: MME1-NSW-WS-VG-PE | K359: Monster Menu NSW
B360: Item Fulfillment | C360: 2024-09-17T00:00:00.000 | D360: 433694 | E360: 21114 Daniel Baruso-Perez | F360: F | G360: Inventory Asset : Finished Goods | H360: 21.58 | I360: NA Games-STORE | J360: GGR1-PS5-WS-VG-PE | K360: Grim Grimoire OnceMore PS5
B361: Item Fulfillment | C361: 2024-09-17T00:00:00.000 | D361: 433699 | E361: Derek von Suppiny | F361: F | G361: Inventory Asset : Finished Goods | H361: 50.27 | I361: NA Games-STORE | J361: YSD1-PS5-WS-VG-PE | K361: Ys VIII Lacrimosa of Dana PS5
B362: Item Fulfillment | C362: 2024-09-17T00:00:00.000 | D362: 433693 | E362: 23709 William Wheun Jang | F362: F | G362: Inventory Asset : Finished Goods | H362: 25.13 | I362: NA Games-STORE | J362: YSD1-PS5-WS-VG-PE | K362: Ys VIII Lacrimosa of Dana PS5
B363: Inventory Transfer | C363: 2024-09-18T00:00:00.000 | D363: 1902 | F363: F | G363: Inventory Asset : Finished Goods | H363: 199.12 | I363: NA Games-STORE | J363: RNT1-PS5-WS-VG-PE | K363: REYNATIS PS5
B364: Inventory Transfer | C364: 2024-09-18T00:00:00.000 | D364: 1901 | F364: F | G364: Inventory Asset : Finished Goods | H364: 20.61 | I364: NA Games-SAMPLES | J364: RNT1-NSW-WS-VG-PE | K364: REYNATIS NSW
B365: Item Fulfillment | C365: 2024-09-18T00:00:00.000 | D365: 433705 | E365: 23722 Jermaine Gomez | F365: F | G365: Inventory Asset : Finished Goods | H365: 25.14 | I365: NA Games-STORE | J365: YSD1-PS5-WS-VG-PE | K365: Ys VIII Lacrimosa of Dana PS5
B366: Item Fulfillment | C366: 2024-09-18T00:00:00.000 | D366: 433706 | E366: Diego Martinez [1000314009] | F366: F | G366: Inventory Asset : Finished Goods | H366: 24.08 | I366: NA Games-STORE | J366: RHP3-PS5-WS-VG-PE | K366: Rhapsody Legacy PS5
B367: Item Fulfillment | C367: 2024-09-18T00:00:00.000 | D367: 434961 | E367: Sierra Haynes | F367: F | G367: Inventory Asset : Finished Goods | H367: 22.88 | I367: NA Games-STORE | J367: TTD1-PS4-WS-VG-PE | K367: Trails through Daybreak PS4
B368: Item Fulfillment | C368: 2024-09-18T00:00:00.000 | D368: 433706 | E368: Diego Martinez [1000314009] | F368: F | G368: Inventory Asset : Finished Goods | H368: 21.51 | I368: NA Games-STORE | J368: LON1-PS4-WS-VG-PE | K368: Legend of Nayuta PS4
B369: Item Fulfillment | C369: 2024-09-18T00:00:00.000 | D369: 433703 | E369: Coel John Castro | F369: F | G369: Inventory Asset : Finished Goods | H369: 22.88 | I369: NA Games-STORE | J369: TTD1-PS5-WS-VG-PE | K369: Trails through Daybreak PS5
B370: Item Fulfillment | C370: 2024-09-19T00:00:00.000 | D370: 433710 | E370: Cole Armitage | F370: F | G370: Inventory Asset : Finished Goods | H370: 22.87 | I370: NA Games-STORE | J370: TTD1-PS5-WS-VG-PE | K370: Trails through Daybreak PS5
B371: Item Fulfillment | C371: 2024-09-19T00:00:00.000 | D371: 433713 | E371: Harold Arrance | F371: F | G371: Inventory Asset : Finished Goods | H371: 25.13 | I371: NA Games-STORE | J371: YSD1-PS5-WS-VG-PE | K371: Ys VIII Lacrimosa of Dana PS5
B372: Item Fulfillment | C372: 2024-09-19T00:00:00.000 | D372: 433710 | E372: Cole Armitage | F372: F | G372: Inventory Asset : Finished Goods | H372: 20.12 | I372: NA Games-STORE | J372: TC34-PS5-WS-VG-PE | K372: Trails of Cold Steel 3+4 PS5
B373: Item Fulfillment | C373: 2024-09-19T00:00:00.000 | D373: 433714 | E373: Alberto Fidalgo | F373: F | G373: Inventory Asset : Finished Goods | H373: 21.5 | I373: NA Games-STORE | J373: LON1-PS4-WS-VG-PE | K373: Legend of Nayuta PS4
B374: Item Fulfillment | C374: 2024-09-20T00:00:00.000 | D374: 434138 | E374: 23212 Julian Ramkumar | F374: F | G374: Inventory Asset : Finished Goods | H374: 18.1 | I374: NA Games-STORE | J374: RNT1-PS5-WS-VG-PE | K374: REYNATIS PS5
B375: Item Fulfillment | C375: 2024-09-20T00:00:00.000 | D375: 433928 | E375: Gerald Rathkolb | F375: F | G375: Inventory Asset : Finished Goods | H375: 18.1 | I375: NA Games-STORE | J375: RNT1-PS5-WS-VG-PE | K375: REYNATIS PS5
B376: Item Fulfillment | C376: 2024-09-20T00:00:00.000 | D376: 433875 | E376: John Lantz | F376: F | G376: Inventory Asset : Finished Goods | H376: 18.1 | I376: NA Games-STORE | J376: RNT1-PS5-WS-VG-PE | K376: REYNATIS PS5
B377: Item Fulfillment | C377: 2024-09-20T00:00:00.000 | D377: 433869 | E377: 22418 Abir Hassan | F377: F | G377: Inventory Asset : Finished Goods | H377: 18.1 | I377: NA Games-STORE | J377: RNT1-PS5-WS-VG-PE | K377: REYNATIS PS5
B378: Item Fulfillment | C378: 2024-09-20T00:00:00.000 | D378: 434032 | E378: Francesco Melone | F378: F | G378: Inventory Asset : Finished Goods | H378: 18.1 | I378: NA Games-STORE | J378: RNT1-PS5-WS-VG-PE | K378: REYNATIS PS5
B379: Item Fulfillment | C379: 2024-09-20T00:00:00.000 | D379: 433980 | E379: Hollyanna Hoang | F379: F | G379: Inventory Asset : Finished Goods | H379: 18.1 | I379: NA Games-STORE | J379: RNT1-PS5-WS-VG-PE | K379: REYNATIS PS5
B380: Item Fulfillment | C380: 2024-09-20T00:00:00.000 | D380: 433768 | E380: 22372 Anthony Orszak | F380: F | G380: Inventory Asset : Finished Goods | H380: 18.1 | I380: NA Games-STORE | J380: RNT1-PS5-WS-VG-PE | K380: REYNATIS PS5
B381: Item Fulfillment | C381: 2024-09-20T00:00:00.000 | D381: 433762 | E381: 4505 Guillermo Restrepo | F381: F | G381: Inventory Asset : Finished Goods | H381: 18.1 | I381: NA Games-STORE | J381: RNT1-PS5-WS-VG-PE | K381: REYNATIS PS5
B382: Item Fulfillment | C382: 2024-09-20T00:00:00.000 | D382: 433726 | E382: 22359 Christian Riley | F382: F | G382: Inventory Asset : Finished Goods | H382: 18.1 | I382: NA Games-STORE | J382: RNT1-PS5-WS-VG-PE | K382: REYNATIS PS5
B383: Item Fulfillment | C383: 2024-09-20T00:00:00.000 | D383: 433916 | E383: Chandler Wall | F383: F | G383: Inventory Asset : Finished Goods | H383: 18.1 | I383: NA Games-STORE | J383: RNT1-PS5-WS-VG-PE | K383: REYNATIS PS5
B384: Item Fulfillment | C384: 2024-09-20T00:00:00.000 | D384: 434108 | E384: Nathan Nguyen [56946] | F384: F | G384: Inventory Asset : Finished Goods | H384: 18.1 | I384: NA Games-STORE | J384: RNT1-PS5-WS-VG-PE | K384: REYNATIS PS5
B385: Item Fulfillment | C385: 2024-09-20T00:00:00.000 | D385: 434071 | E385: Stephen Davis | F385: F | G385: Inventory Asset : Finished Goods | H385: 18.1 | I385: NA Games-STORE | J385: RNT1-PS5-WS-VG-PE | K385: REYNATIS PS5
B386: Item Fulfillment | C386: 2024-09-20T00:00:00.000 | D386: 434226 | E386: 23473 John Francis | F386: F | G386: Inventory Asset : Finished Goods | H386: 18.1 | I386: NA Games-STORE | J386: RNT1-PS5-WS-VG-PE | K386: REYNATIS PS5
B387: Item Fulfillment | C387: 2024-09-20T00:00:00.000 | D387: 433930 | E387: 22223 Bryan Nardiello | F387: F | G387: Inventory Asset : Finished Goods | H387: 18.1 | I387: NA Games-STORE | J387: RNT1-PS5-WS-VG-PE | K387: REYNATIS PS5
B388: Item Fulfillment | C388: 2024-09-20T00:00:00.000 | D388: 433899 | E388: 22435 Anthony Gresko | F388: F | G388: Inventory Asset : Finished Goods | H388: 18.1 | I388: NA Games-STORE | J388: RNT1-PS5-WS-VG-PE | K388: REYNATIS PS5
B389: Item Fulfillment | C389: 2024-09-20T00:00:00.000 | D389: 434063 | E389: Harold Arrance | F389: F | G389: Inventory Asset : Finished Goods | H389: 18.1 | I389: NA Games-STORE | J389: RNT1-PS5-WS-VG-PE | K389: REYNATIS PS5
B390: Item Fulfillment | C390: 2024-09-20T00:00:00.000 | D390: 434024 | E390: Zachary Morningstar | F390: F | G390: Inventory Asset : Finished Goods | H390: 18.1 | I390: NA Games-STORE | J390: RNT1-PS5-WS-VG-PE | K390: REYNATIS PS5
B391: Item Fulfillment | C391: 2024-09-20T00:00:00.000 | D391: 434159 | E391: Scott Cox [15931] | F391: F | G391: Inventory Asset : Finished Goods | H391: 18.1 | I391: NA Games-STORE | J391: RNT1-PS5-WS-VG-PE | K391: REYNATIS PS5
B392: Item Fulfillment | C392: 2024-09-20T00:00:00.000 | D392: 433954 | E392: Ricardo Chavez [1000238497] | F392: F | G392: Inventory Asset : Finished Goods | H392: 18.1 | I392: NA Games-STORE | J392: RNT1-PS5-WS-VG-PE | K392: REYNATIS PS5
B393: Item Fulfillment | C393: 2024-09-20T00:00:00.000 | D393: 433953 | E393: 22463 Seneca Hames | F393: F | G393: Inventory Asset : Finished Goods | H393: 18.1 | I393: NA Games-STORE | J393: RNT1-PS5-WS-VG-PE | K393: REYNATIS PS5
B394: Item Fulfillment | C394: 2024-09-20T00:00:00.000 | D394: 433760 | E394: Trung Le-Nguyen | F394: F | G394: Inventory Asset : Finished Goods | H394: 18.1 | I394: NA Games-STORE | J394: RNT1-PS5-WS-VG-PE | K394: REYNATIS PS5
B395: Item Fulfillment | C395: 2024-09-20T00:00:00.000 | D395: 433925 | E395: Melody Stockon [140274] | F395: F | G395: Inventory Asset : Finished Goods | H395: 18.1 | I395: NA Games-STORE | J395: RNT1-PS5-WS-VG-PE | K395: REYNATIS PS5
B396: Item Fulfillment | C396: 2024-09-20T00:00:00.000 | D396: 433913 | E396: Trey Maurer | F396: F | G396: Inventory Asset : Finished Goods | H396: 18.1 | I396: NA Games-STORE | J396: RNT1-PS5-WS-VG-PE | K396: REYNATIS PS5
B397: Item Fulfillment | C397: 2024-09-20T00:00:00.000 | D397: 434045 | E397: Christopher Paul | F397: F | G397: Inventory Asset : Finished Goods | H397: 18.1 | I397: NA Games-STORE | J397: RNT1-PS5-WS-VG-PE | K397: REYNATIS PS5
B398: Item Fulfillment | C398: 2024-09-20T00:00:00.000 | D398: 434040 | E398: Kevin Torres [1000299112] | F398: F | G398: Inventory Asset : Finished Goods | H398: 18.1 | I398: NA Games-STORE | J398: RNT1-PS5-WS-VG-PE | K398: REYNATIS PS5
B399: Item Fulfillment | C399: 2024-09-20T00:00:00.000 | D399: 433845 | E399: Matthew Burkard | F399: F | G399: Inventory Asset : Finished Goods | H399: 18.1 | I399: NA Games-STORE | J399: RNT1-PS5-WS-VG-PE | K399: REYNATIS PS5
B400: Item Fulfillment | C400: 2024-09-20T00:00:00.000 | D400: 433839 | E400: 22399 Yusif Alomeri | F400: F | G400: Inventory Asset : Finished Goods | H400: 18.1 | I400: NA Games-STORE | J400: RNT1-PS5-WS-VG-PE | K400: REYNATIS PS5
B401: Item Fulfillment | C401: 2024-09-20T00:00:00.000 | D401: 433978 | E401: 22478 Francisco Flores | F401: F | G401: Inventory Asset : Finished Goods | H401: 18.1 | I401: NA Games-STORE | J401: RNT1-PS5-WS-VG-PE | K401: REYNATIS PS5
B402: Item Fulfillment | C402: 2024-09-20T00:00:00.000 | D402: 434113 | E402: Brian Cherivtch | F402: F | G402: Inventory Asset : Finished Goods | H402: 18.1 | I402: NA Games-STORE | J402: RNT1-PS5-WS-VG-PE | K402: REYNATIS PS5
B403: Item Fulfillment | C403: 2024-09-20T00:00:00.000 | D403: 434134 | E403: 23205 Mohammad Al-Rayess | F403: F | G403: Inventory Asset : Finished Goods | H403: 18.1 | I403: NA Games-STORE | J403: RNT1-PS5-WS-VG-PE | K403: REYNATIS PS5
B404: Item Fulfillment | C404: 2024-09-20T00:00:00.000 | D404: 434129 | E404: Christiana Freeman | F404: F | G404: Inventory Asset : Finished Goods | H404: 18.1 | I404: NA Games-STORE | J404: RNT1-PS5-WS-VG-PE | K404: REYNATIS PS5
B405: Item Fulfillment | C405: 2024-09-20T00:00:00.000 | D405: 434255 | E405: Steven Button | F405: F | G405: Inventory Asset : Finished Goods | H405: 18.1 | I405: NA Games-STORE | J405: RNT1-PS5-WS-VG-PE | K405: REYNATIS PS5
B406: Item Fulfillment | C406: 2024-09-20T00:00:00.000 | D406: 434238 | E406: Will Wajert 2 | F406: F | G406: Inventory Asset : Finished Goods | H406: 18.1 | I406: NA Games-STORE | J406: RNT1-PS5-WS-VG-PE | K406: REYNATIS PS5
B407: Item Fulfillment | C407: 2024-09-20T00:00:00.000 | D407: 433773 | E407: Christopher Todora | F407: F | G407: Inventory Asset : Finished Goods | H407: 18.1 | I407: NA Games-STORE | J407: RNT1-PS5-WS-VG-PE | K407: REYNATIS PS5
B408: Item Fulfillment | C408: 2024-09-20T00:00:00.000 | D408: 433945 | E408: Jared Barr | F408: F | G408: Inventory Asset : Finished Goods | H408: 18.1 | I408: NA Games-STORE | J408: RNT1-PS5-WS-VG-PE | K408: REYNATIS PS5
B409: Item Fulfillment | C409: 2024-09-20T00:00:00.000 | D409: 433939 | E409: Ben Hackmann | F409: F | G409: Inventory Asset : Finished Goods | H409: 18.1 | I409: NA Games-STORE | J409: RNT1-PS5-WS-VG-PE | K409: REYNATIS PS5
B410: Item Fulfillment | C410: 2024-09-20T00:00:00.000 | D410: 433872 | E410: 22420 Reed Denney | F410: F | G410: Inventory Asset : Finished Goods | H410: 18.1 | I410: NA Games-STORE | J410: RNT1-PS5-WS-VG-PE | K410: REYNATIS PS5
B411: Item Fulfillment | C411: 2024-09-20T00:00:00.000 | D411: 434014 | E411: 18958 Andriy Komar | F411: F | G411: Inventory Asset : Finished Goods | H411: 18.1 | I411: NA Games-STORE | J411: RNT1-PS5-WS-VG-PE | K411: REYNATIS PS5
B412: Item Fulfillment | C412: 2024-09-20T00:00:00.000 | D412: 434093 | E412: caleb yeider | F412: F | G412: Inventory Asset : Finished Goods | H412: 18.1 | I412: NA Games-STORE | J412: RNT1-PS5-WS-VG-PE | K412: REYNATIS PS5
B413: Item Fulfillment | C413: 2024-09-20T00:00:00.000 | D413: 434223 | E413: 21916 Kevin Nunez | F413: F | G413: Inventory Asset : Finished Goods | H413: 18.1 | I413: NA Games-STORE | J413: RNT1-PS5-WS-VG-PE | K413: REYNATIS PS5
B414: Item Fulfillment | C414: 2024-09-20T00:00:00.000 | D414: 434170 | E414: 23291 Chris Spears | F414: F | G414: Inventory Asset : Finished Goods | H414: 18.1 | I414: NA Games-STORE | J414: RNT1-PS5-WS-VG-PE | K414: REYNATIS PS5
B415: Item Fulfillment | C415: 2024-09-20T00:00:00.000 | D415: 433959 | E415: Cody Mock [135963] | F415: F | G415: Inventory Asset : Finished Goods | H415: 18.1 | I415: NA Games-STORE | J415: RNT1-PS5-WS-VG-PE | K415: REYNATIS PS5
B416: Item Fulfillment | C416: 2024-09-20T00:00:00.000 | D416: 433951 | E416: 22462 Alexander Radisek | F416: F | G416: Inventory Asset : Finished Goods | H416: 18.1 | I416: NA Games-STORE | J416: RNT1-PS5-WS-VG-PE | K416: REYNATIS PS5
B417: Item Fulfillment | C417: 2024-09-20T00:00:00.000 | D417: 433934 | E417: Michael Martin [1000351449] | F417: F | G417: Inventory Asset : Finished Goods | H417: 18.1 | I417: NA Games-STORE | J417: RNT1-PS5-WS-VG-PE | K417: REYNATIS PS5
B418: Item Fulfillment | C418: 2024-09-20T00:00:00.000 | D418: 433736 | E418: 22362 Gwen Montecinos | F418: F | G418: Inventory Asset : Finished Goods | H418: 18.1 | I418: NA Games-STORE | J418: RNT1-PS5-WS-VG-PE | K418: REYNATIS PS5
B419: Item Fulfillment | C419: 2024-09-20T00:00:00.000 | D419: 433870 | E419: Drew Ferguson | F419: F | G419: Inventory Asset : Finished Goods | H419: 18.1 | I419: NA Games-STORE | J419: RNT1-PS5-WS-VG-PE | K419: REYNATIS PS5
B420: Item Fulfillment | C420: 2024-09-20T00:00:00.000 | D420: 434225 | E420: Mason Moots | F420: F | G420: Inventory Asset : Finished Goods | H420: 18.1 | I420: NA Games-STORE | J420: RNT1-PS5-WS-VG-PE | K420: REYNATIS PS5
B421: Item Fulfillment | C421: 2024-09-20T00:00:00.000 | D421: 433935 | E421: Chris Domingo | F421: F | G421: Inventory Asset : Finished Goods | H421: 18.1 | I421: NA Games-STORE | J421: RNT1-PS5-WS-VG-PE | K421: REYNATIS PS5
B422: Item Fulfillment | C422: 2024-09-20T00:00:00.000 | D422: 433989 | E422: 21753 Ariel Gonzalez | F422: F | G422: Inventory Asset : Finished Goods | H422: 18.1 | I422: NA Games-STORE | J422: RNT1-PS5-WS-VG-PE | K422: REYNATIS PS5
B423: Item Fulfillment | C423: 2024-09-20T00:00:00.000 | D423: 434240 | E423: Robert Johnson [1000250102] | F423: F | G423: Inventory Asset : Finished Goods | H423: 18.1 | I423: NA Games-STORE | J423: RNT1-PS5-WS-VG-PE | K423: REYNATIS PS5
B424: Item Fulfillment | C424: 2024-09-20T00:00:00.000 | D424: 434177 | E424: Rameez Yousefi | F424: F | G424: Inventory Asset : Finished Goods | H424: 18.1 | I424: NA Games-STORE | J424: RNT1-PS5-WS-VG-PE | K424: REYNATIS PS5
B425: Item Fulfillment | C425: 2024-09-20T00:00:00.000 | D425: 433806 | E425: Wyatt Johnson | F425: F | G425: Inventory Asset : Finished Goods | H425: 18.1 | I425: NA Games-STORE | J425: RNT1-PS5-WS-VG-PE | K425: REYNATIS PS5
B426: Item Fulfillment | C426: 2024-09-20T00:00:00.000 | D426: 433797 | E426: Donnie Huie | F426: F | G426: Inventory Asset : Finished Goods | H426: 18.1 | I426: NA Games-STORE | J426: RNT1-PS5-WS-VG-PE | K426: REYNATIS PS5
B427: Item Fulfillment | C427: 2024-09-20T00:00:00.000 | D427: 433952 | E427: nadbach | F427: F | G427: Inventory Asset : Finished Goods | H427: 18.1 | I427: NA Games-STORE | J427: RNT1-PS5-WS-VG-PE | K427: REYNATIS PS5
B428: Item Fulfillment | C428: 2024-09-20T00:00:00.000 | D428: 433937 | E428: Jon Kimbell PHZTRWPT [1000328401] | F428: F | G428: Inventory Asset : Finished Goods | H428: 18.1 | I428: NA Games-STORE | J428: RNT1-PS5-WS-VG-PE | K428: REYNATIS PS5
B429: Item Fulfillment | C429: 2024-09-20T00:00:00.000 | D429: 433730 | E429: Nicholas Mendoza | F429: F | G429: Inventory Asset : Finished Goods | H429: 18.1 | I429: NA Games-STORE | J429: RNT1-PS5-WS-VG-PE | K429: REYNATIS PS5
B430: Item Fulfillment | C430: 2024-09-20T00:00:00.000 | D430: 433886 | E430: 651 Tommy Wolford | F430: F | G430: Inventory Asset : Finished Goods | H430: 18.1 | I430: NA Games-STORE | J430: RNT1-PS5-WS-VG-PE | K430: REYNATIS PS5
B431: Item Fulfillment | C431: 2024-09-20T00:00:00.000 | D431: 434048 | E431: Delivery address | F431: F | G431: Inventory Asset : Finished Goods | H431: 18.1 | I431: NA Games-STORE | J431: RNT1-PS5-WS-VG-PE | K431: REYNATIS PS5
B432: Item Fulfillment | C432: 2024-09-20T00:00:00.000 | D432: 434031 | E432: Thomas Tabacchi | F432: F | G432: Inventory Asset : Finished Goods | H432: 18.1 | I432: NA Games-STORE | J432: RNT1-PS5-WS-VG-PE | K432: REYNATIS PS5
B433: Item Fulfillment | C433: 2024-09-20T00:00:00.000 | D433: 434017 | E433: Christopher Weech | F433: F | G433: Inventory Asset : Finished Goods | H433: 18.1 | I433: NA Games-STORE | J433: RNT1-PS5-WS-VG-PE | K433: REYNATIS PS5
B434: Item Fulfillment | C434: 2024-09-20T00:00:00.000 | D434: 434004 | E434: Ryan Reyes | F434: F | G434: Inventory Asset : Finished Goods | H434: 18.1 | I434: NA Games-STORE | J434: RNT1-PS5-WS-VG-PE | K434: REYNATIS PS5
B435: Item Fulfillment | C435: 2024-09-20T00:00:00.000 | D435: 433979 | E435: 22477 John Starnes | F435: F | G435: Inventory Asset : Finished Goods | H435: 18.1 | I435: NA Games-STORE | J435: RNT1-PS5-WS-VG-PE | K435: REYNATIS PS5
B436: Item Fulfillment | C436: 2024-09-20T00:00:00.000 | D436: 434120 | E436: Michael Harris 3 | F436: F | G436: Inventory Asset : Finished Goods | H436: 18.1 | I436: NA Games-STORE | J436: RNT1-PS5-WS-VG-PE | K436: REYNATIS PS5
B437: Item Fulfillment | C437: 2024-09-20T00:00:00.000 | D437: 434278 | E437: 23721 Lauren Watson | F437: F | G437: Inventory Asset : Finished Goods | H437: 18.1 | I437: NA Games-STORE | J437: RNT1-PS5-WS-VG-PE | K437: REYNATIS PS5
B438: Item Fulfillment | C438: 2024-09-20T00:00:00.000 | D438: 433807 | E438: Zing Moua | F438: F | G438: Inventory Asset : Finished Goods | H438: 18.1 | I438: NA Games-STORE | J438: RNT1-PS5-WS-VG-PE | K438: REYNATIS PS5
B439: Item Fulfillment | C439: 2024-09-20T00:00:00.000 | D439: 433968 | E439: 6607 Antonio Johnson | F439: F | G439: Inventory Asset : Finished Goods | H439: 18.1 | I439: NA Games-STORE | J439: RNT1-PS5-WS-VG-PE | K439: REYNATIS PS5
B440: Item Fulfillment | C440: 2024-09-20T00:00:00.000 | D440: 433754 | E440: Carla Bonora | F440: F | G440: Inventory Asset : Finished Goods | H440: 18.1 | I440: NA Games-STORE | J440: RNT1-PS5-WS-VG-PE | K440: REYNATIS PS5
B441: Item Fulfillment | C441: 2024-09-20T00:00:00.000 | D441: 433729 | E441: Kristen Prieto | F441: F | G441: Inventory Asset : Finished Goods | H441: 18.1 | I441: NA Games-STORE | J441: RNT1-PS5-WS-VG-PE | K441: REYNATIS PS5
B442: Item Fulfillment | C442: 2024-09-20T00:00:00.000 | D442: 433857 | E442: Zach Boike | F442: F | G442: Inventory Asset : Finished Goods | H442: 18.1 | I442: NA Games-STORE | J442: RNT1-PS5-WS-VG-PE | K442: REYNATIS PS5
B443: Item Fulfillment | C443: 2024-09-20T00:00:00.000 | D443: 433809 | E443: joshua lagrou | F443: F | G443: Inventory Asset : Finished Goods | H443: 18.1 | I443: NA Games-STORE | J443: RNT1-PS5-WS-VG-PE | K443: REYNATIS PS5
B444: Item Fulfillment | C444: 2024-09-20T00:00:00.000 | D444: 433756 | E444: Deborah | F444: F | G444: Inventory Asset : Finished Goods | H444: 18.1 | I444: NA Games-STORE | J444: RNT1-PS5-WS-VG-PE | K444: REYNATIS PS5
B445: Item Fulfillment | C445: 2024-09-20T00:00:00.000 | D445: 433732 | E445: Zerno | F445: F | G445: Inventory Asset : Finished Goods | H445: 18.1 | I445: NA Games-STORE | J445: RNT1-PS5-WS-VG-PE | K445: REYNATIS PS5
B446: Item Fulfillment | C446: 2024-09-20T00:00:00.000 | D446: 434012 | E446: Anthony Burke | F446: F | G446: Inventory Asset : Finished Goods | H446: 18.1 | I446: NA Games-STORE | J446: RNT1-PS5-WS-VG-PE | K446: REYNATIS PS5
B447: Item Fulfillment | C447: 2024-09-20T00:00:00.000 | D447: 433842 | E447: 22401 Matthew Mercado | F447: F | G447: Inventory Asset : Finished Goods | H447: 18.1 | I447: NA Games-STORE | J447: RNT1-PS5-WS-VG-PE | K447: REYNATIS PS5
B448: Item Fulfillment | C448: 2024-09-20T00:00:00.000 | D448: 434072 | E448: Joel Myers | F448: F | G448: Inventory Asset : Finished Goods | H448: 18.1 | I448: NA Games-STORE | J448: RNT1-PS5-WS-VG-PE | K448: REYNATIS PS5
B449: Item Fulfillment | C449: 2024-09-20T00:00:00.000 | D449: 434280 | E449: Isaiah Triumph | F449: F | G449: Inventory Asset : Finished Goods | H449: 18.1 | I449: NA Games-STORE | J449: RNT1-PS5-WS-VG-PE | K449: REYNATIS PS5
B450: Item Fulfillment | C450: 2024-09-20T00:00:00.000 | D450: 434229 | E450: 19210 Vinh Huynh | F450: F | G450: Inventory Asset : Finished Goods | H450: 18.1 | I450: NA Games-STORE | J450: RNT1-PS5-WS-VG-PE | K450: REYNATIS PS5
B451: Item Fulfillment | C451: 2024-09-20T00:00:00.000 | D451: 433971 | E451: Eriberto Vasquez | F451: F | G451: Inventory Asset : Finished Goods | H451: 18.1 | I451: NA Games-STORE | J451: RNT1-PS5-WS-VG-PE | K451: REYNATIS PS5
B452: Item Fulfillment | C452: 2024-09-20T00:00:00.000 | D452: 433795 | E452: Meng Chang | F452: F | G452: Inventory Asset : Finished Goods | H452: 18.1 | I452: NA Games-STORE | J452: RNT1-PS5-WS-VG-PE | K452: REYNATIS PS5
B453: Item Fulfillment | C453: 2024-09-20T00:00:00.000 | D453: 433827 | E453: 22395 Eugene Brown | F453: F | G453: Inventory Asset : Finished Goods | H453: 18.1 | I453: NA Games-STORE | J453: RNT1-PS5-WS-VG-PE | K453: REYNATIS PS5
B454: Item Fulfillment | C454: 2024-09-20T00:00:00.000 | D454: 433825 | E454: landcaster | F454: F | G454: Inventory Asset : Finished Goods | H454: 18.1 | I454: NA Games-STORE | J454: RNT1-PS5-WS-VG-PE | K454: REYNATIS PS5
B455: Item Fulfillment | C455: 2024-09-20T00:00:00.000 | D455: 433783 | E455: Garin Dangler [56177] | F455: F | G455: Inventory Asset : Finished Goods | H455: 18.1 | I455: NA Games-STORE | J455: RNT1-PS5-WS-VG-PE | K455: REYNATIS PS5
B456: Item Fulfillment | C456: 2024-09-20T00:00:00.000 | D456: 433779 | E456: Chris Dass | F456: F | G456: Inventory Asset : Finished Goods | H456: 18.1 | I456: NA Games-STORE | J456: RNT1-PS5-WS-VG-PE | K456: REYNATIS PS5
B457: Item Fulfillment | C457: 2024-09-20T00:00:00.000 | D457: 433746 | E457: Michael Alexander Erazo | F457: F | G457: Inventory Asset : Finished Goods | H457: 18.1 | I457: NA Games-STORE | J457: RNT1-PS5-WS-VG-PE | K457: REYNATIS PS5
B458: Item Fulfillment | C458: 2024-09-20T00:00:00.000 | D458: 433724 | E458: 22354 Matthew Reinheardt | F458: F | G458: Inventory Asset : Finished Goods | H458: 18.1 | I458: NA Games-STORE | J458: RNT1-PS5-WS-VG-PE | K458: REYNATIS PS5
B459: Item Fulfillment | C459: 2024-09-20T00:00:00.000 | D459: 433901 | E459: 22436 Christian Murvin | F459: F | G459: Inventory Asset : Finished Goods | H459: 18.1 | I459: NA Games-STORE | J459: RNT1-PS5-WS-VG-PE | K459: REYNATIS PS5
B460: Item Fulfillment | C460: 2024-09-20T00:00:00.000 | D460: 433864 | E460: 22415 Mariah Qaiser | F460: F | G460: Inventory Asset : Finished Goods | H460: 18.1 | I460: NA Games-STORE | J460: RNT1-PS5-WS-VG-PE | K460: REYNATIS PS5
B461: Item Fulfillment | C461: 2024-09-20T00:00:00.000 | D461: 433856 | E461: 22410 Jeremy Collado | F461: F | G461: Inventory Asset : Finished Goods | H461: 18.1 | I461: NA Games-STORE | J461: RNT1-PS5-WS-VG-PE | K461: REYNATIS PS5
B462: Item Fulfillment | C462: 2024-09-20T00:00:00.000 | D462: 434015 | E462: Michael Da Fonseca | F462: F | G462: Inventory Asset : Finished Goods | H462: 18.1 | I462: NA Games-STORE | J462: RNT1-PS5-WS-VG-PE | K462: REYNATIS PS5
B463: Item Fulfillment | C463: 2024-09-20T00:00:00.000 | D463: 434097 | E463: Germain Santiago | F463: F | G463: Inventory Asset : Finished Goods | H463: 18.1 | I463: NA Games-STORE | J463: RNT1-PS5-WS-VG-PE | K463: REYNATIS PS5
B464: Item Fulfillment | C464: 2024-09-20T00:00:00.000 | D464: 434282 | E464: 23731 Joshua David | F464: F | G464: Inventory Asset : Finished Goods | H464: 18.1 | I464: NA Games-STORE | J464: RNT1-PS5-WS-VG-PE | K464: REYNATIS PS5
B465: Item Fulfillment | C465: 2024-09-20T00:00:00.000 | D465: 434185 | E465: Will Ripley | F465: F | G465: Inventory Asset : Finished Goods | H465: 18.1 | I465: NA Games-STORE | J465: RNT1-PS5-WS-VG-PE | K465: REYNATIS PS5
B466: Item Fulfillment | C466: 2024-09-20T00:00:00.000 | D466: 433832 | E466: Kay Bo | F466: F | G466: Inventory Asset : Finished Goods | H466: 18.1 | I466: NA Games-STORE | J466: RNT1-PS5-WS-VG-PE | K466: REYNATIS PS5
B467: Item Fulfillment | C467: 2024-09-20T00:00:00.000 | D467: 433936 | E467: John Hydro | F467: F | G467: Inventory Asset : Finished Goods | H467: 18.1 | I467: NA Games-STORE | J467: RNT1-PS5-WS-VG-PE | K467: REYNATIS PS5
B468: Item Fulfillment | C468: 2024-09-20T00:00:00.000 | D468: 433895 | E468: Jeremy Szostak [7308] | F468: F | G468: Inventory Asset : Finished Goods | H468: 18.1 | I468: NA Games-STORE | J468: RNT1-PS5-WS-VG-PE | K468: REYNATIS PS5
B469: Item Fulfillment | C469: 2024-09-20T00:00:00.000 | D469: 434023 | E469: Chris Ticen | F469: F | G469: Inventory Asset : Finished Goods | H469: 18.1 | I469: NA Games-STORE | J469: RNT1-PS5-WS-VG-PE | K469: REYNATIS PS5
B470: Item Fulfillment | C470: 2024-09-20T00:00:00.000 | D470: 434021 | E470: 22533 Kyndal Kilbourne | F470: F | G470: Inventory Asset : Finished Goods | H470: 18.1 | I470: NA Games-STORE | J470: RNT1-PS5-WS-VG-PE | K470: REYNATIS PS5
B471: Item Fulfillment | C471: 2024-09-20T00:00:00.000 | D471: 433975 | E471: Patrick Murray [1000194052] | F471: F | G471: Inventory Asset : Finished Goods | H471: 18.1 | I471: NA Games-STORE | J471: RNT1-PS5-WS-VG-PE | K471: REYNATIS PS5
B472: Item Fulfillment | C472: 2024-09-20T00:00:00.000 | D472: 434143 | E472: Sam Lanctot | F472: F | G472: Inventory Asset : Finished Goods | H472: 18.1 | I472: NA Games-STORE | J472: RNT1-PS5-WS-VG-PE | K472: REYNATIS PS5
B473: Item Fulfillment | C473: 2024-09-20T00:00:00.000 | D473: 434121 | E473: 23165 Kenny Chang | F473: F | G473: Inventory Asset : Finished Goods | H473: 18.1 | I473: NA Games-STORE | J473: RNT1-PS5-WS-VG-PE | K473: REYNATIS PS5
B474: Item Fulfillment | C474: 2024-09-20T00:00:00.000 | D474: 434206 | E474: 23399 Josue D. | F474: F | G474: Inventory Asset : Finished Goods | H474: 18.1 | I474: NA Games-STORE | J474: RNT1-PS5-WS-VG-PE | K474: REYNATIS PS5
B475: Item Fulfillment | C475: 2024-09-20T00:00:00.000 | D475: 434169 | E475: David Hale [1000221100] | F475: F | G475: Inventory Asset : Finished Goods | H475: 18.1 | I475: NA Games-STORE | J475: RNT1-PS5-WS-VG-PE | K475: REYNATIS PS5
B476: Item Fulfillment | C476: 2024-09-20T00:00:00.000 | D476: 433774 | E476: 21869 Jason Basse | F476: F | G476: Inventory Asset : Finished Goods | H476: 18.1 | I476: NA Games-STORE | J476: RNT1-PS5-WS-VG-PE | K476: REYNATIS PS5
B477: Item Fulfillment | C477: 2024-09-20T00:00:00.000 | D477: 433742 | E477: Lamar Howard | F477: F | G477: Inventory Asset : Finished Goods | H477: 18.1 | I477: NA Games-STORE | J477: RNT1-PS5-WS-VG-PE | K477: REYNATIS PS5
B478: Item Fulfillment | C478: 2024-09-20T00:00:00.000 | D478: 433731 | E478: Trevor Kelley | F478: F | G478: Inventory Asset : Finished Goods | H478: 18.1 | I478: NA Games-STORE | J478: RNT1-PS5-WS-VG-PE | K478: REYNATIS PS5
B479: Item Fulfillment | C479: 2024-09-20T00:00:00.000 | D479: 434049 | E479: Mark Herian | F479: F | G479: Inventory Asset : Finished Goods | H479: 18.1 | I479: NA Games-STORE | J479: RNT1-PS5-WS-VG-PE | K479: REYNATIS PS5
B480: Item Fulfillment | C480: 2024-09-20T00:00:00.000 | D480: 434044 | E480: Josan Vidal | F480: F | G480: Inventory Asset : Finished Goods | H480: 18.1 | I480: NA Games-STORE | J480: RNT1-PS5-WS-VG-PE | K480: REYNATIS PS5
B481: Item Fulfillment | C481: 2024-09-20T00:00:00.000 | D481: 433985 | E481: Joshua Dodge | F481: F | G481: Inventory Asset : Finished Goods | H481: 18.1 | I481: NA Games-STORE | J481: RNT1-PS5-WS-VG-PE | K481: REYNATIS PS5
B482: Item Fulfillment | C482: 2024-09-20T00:00:00.000 | D482: 433984 | E482: Mohammad Qirnas | F482: F | G482: Inventory Asset : Finished Goods | H482: 18.1 | I482: NA Games-STORE | J482: RNT1-PS5-WS-VG-PE | K482: REYNATIS PS5
B483: Item Fulfillment | C483: 2024-09-20T00:00:00.000 | D483: 434111 | E483: 23000 Jerry Martinez-Alfonso | F483: F | G483: Inventory Asset : Finished Goods | H483: 18.1 | I483: NA Games-STORE | J483: RNT1-PS5-WS-VG-PE | K483: REYNATIS PS5
B484: Item Fulfillment | C484: 2024-09-20T00:00:00.000 | D484: 434124 | E484: Frank Laco | F484: F | G484: Inventory Asset : Finished Goods | H484: 18.1 | I484: NA Games-STORE | J484: RNT1-PS5-WS-VG-PE | K484: REYNATIS PS5
B485: Item Fulfillment | C485: 2024-09-20T00:00:00.000 | D485: 434196 | E485: Daniel Rivas | F485: F | G485: Inventory Asset : Finished Goods | H485: 18.1 | I485: NA Games-STORE | J485: RNT1-PS5-WS-VG-PE | K485: REYNATIS PS5
B486: Item Fulfillment | C486: 2024-09-20T00:00:00.000 | D486: 433892 | E486: Michael Scott 3 | F486: F | G486: Inventory Asset : Finished Goods | H486: 18.1 | I486: NA Games-STORE | J486: RNT1-PS5-WS-VG-PE | K486: REYNATIS PS5
B487: Item Fulfillment | C487: 2024-09-20T00:00:00.000 | D487: 434053 | E487: Heysonio | F487: F | G487: Inventory Asset : Finished Goods | H487: 18.1 | I487: NA Games-STORE | J487: RNT1-PS5-WS-VG-PE | K487: REYNATIS PS5
B488: Item Fulfillment | C488: 2024-09-20T00:00:00.000 | D488: 434019 | E488: 22531 Emily Rodrigues | F488: F | G488: Inventory Asset : Finished Goods | H488: 18.1 | I488: NA Games-STORE | J488: RNT1-PS5-WS-VG-PE | K488: REYNATIS PS5
B489: Item Fulfillment | C489: 2024-09-20T00:00:00.000 | D489: 433823 | E489: Alvin Mak | F489: F | G489: Inventory Asset : Finished Goods | H489: 18.1 | I489: NA Games-STORE | J489: RNT1-PS5-WS-VG-PE | K489: REYNATIS PS5
B490: Item Fulfillment | C490: 2024-09-20T00:00:00.000 | D490: 433821 | E490: Angela Berry [1000332771] | F490: F | G490: Inventory Asset : Finished Goods | H490: 18.1 | I490: NA Games-STORE | J490: RNT1-PS5-WS-VG-PE | K490: REYNATIS PS5
B491: Item Fulfillment | C491: 2024-09-20T00:00:00.000 | D491: 434274 | E491: Jeffery Harbourne | F491: F | G491: Inventory Asset : Finished Goods | H491: 18.1 | I491: NA Games-STORE | J491: RNT1-PS5-WS-VG-PE | K491: REYNATIS PS5
B492: Item Fulfillment | C492: 2024-09-20T00:00:00.000 | D492: 434184 | E492: Dalton lesher | F492: F | G492: Inventory Asset : Finished Goods | H492: 18.1 | I492: NA Games-STORE | J492: RNT1-PS5-WS-VG-PE | K492: REYNATIS PS5
B493: Item Fulfillment | C493: 2024-09-20T00:00:00.000 | D493: 434171 | E493: ZOBAR KRUK | F493: F | G493: Inventory Asset : Finished Goods | H493: 18.1 | I493: NA Games-STORE | J493: RNT1-PS5-WS-VG-PE | K493: REYNATIS PS5
B494: Item Fulfillment | C494: 2024-09-20T00:00:00.000 | D494: 434168 | E494: Patrick Calhoun | F494: F | G494: Inventory Asset : Finished Goods | H494: 18.1 | I494: NA Games-STORE | J494: RNT1-PS5-WS-VG-PE | K494: REYNATIS PS5
B495: Item Fulfillment | C495: 2024-09-20T00:00:00.000 | D495: 433972 | E495: Jose Ortiz | F495: F | G495: Inventory Asset : Finished Goods | H495: 18.1 | I495: NA Games-STORE | J495: RNT1-PS5-WS-VG-PE | K495: REYNATIS PS5
B496: Item Fulfillment | C496: 2024-09-20T00:00:00.000 | D496: 433826 | E496: D'Angelo Cameron | F496: F | G496: Inventory Asset : Finished Goods | H496: 18.1 | I496: NA Games-STORE | J496: RNT1-PS5-WS-VG-PE | K496: REYNATIS PS5
B497: Item Fulfillment | C497: 2024-09-20T00:00:00.000 | D497: 433912 | E497: Tracy Sheu | F497: F | G497: Inventory Asset : Finished Goods | H497: 18.1 | I497: NA Games-STORE | J497: RNT1-PS5-WS-VG-PE | K497: REYNATIS PS5
B498: Item Fulfillment | C498: 2024-09-20T00:00:00.000 | D498: 433876 | E498: Benjamin Ruiz-Yi | F498: F | G498: Inventory Asset : Finished Goods | H498: 18.1 | I498: NA Games-STORE | J498: RNT1-PS5-WS-VG-PE | K498: REYNATIS PS5
B499: Item Fulfillment | C499: 2024-09-20T00:00:00.000 | D499: 433814 | E499: Brett Schwartz | F499: F | G499: Inventory Asset : Finished Goods | H499: 18.1 | I499: NA Games-STORE | J499: RNT1-PS5-WS-VG-PE | K499: REYNATIS PS5
B500: Item Fulfillment | C500: 2024-09-20T00:00:00.000 | D500: 434189 | E500: Jeffrey Hill | F500: F | G500: Inventory Asset : Finished Goods | H500: 18.1 | I500: NA Games-STORE | J500: RNT1-PS5-WS-VG-PE | K500: REYNATIS PS5
B501: Item Fulfillment | C501: 2024-09-20T00:00:00.000 | D501: 433969 | E501: Amber Hernandez | F501: F | G501: Inventory Asset : Finished Goods | H501: 18.1 | I501: NA Games-STORE | J501: RNT1-PS5-WS-VG-PE | K501: REYNATIS PS5
B502: Item Fulfillment | C502: 2024-09-20T00:00:00.000 | D502: 433793 | E502: xipander | F502: F | G502: Inventory Asset : Finished Goods | H502: 18.1 | I502: NA Games-STORE | J502: RNT1-PS5-WS-VG-PE | K502: REYNATIS PS5
B503: Item Fulfillment | C503: 2024-09-20T00:00:00.000 | D503: 433787 | E503: 22379 Diego Gomez | F503: F | G503: Inventory Asset : Finished Goods | H503: 18.1 | I503: NA Games-STORE | J503: RNT1-PS5-WS-VG-PE | K503: REYNATIS PS5
B504: Item Fulfillment | C504: 2024-09-20T00:00:00.000 | D504: 433785 | E504: Lauren Blake | F504: F | G504: Inventory Asset : Finished Goods | H504: 18.1 | I504: NA Games-STORE | J504: RNT1-PS5-WS-VG-PE | K504: REYNATIS PS5
B505: Item Fulfillment | C505: 2024-09-20T00:00:00.000 | D505: 433755 | E505: 22371 Timothy Small | F505: F | G505: Inventory Asset : Finished Goods | H505: 18.1 | I505: NA Games-STORE | J505: RNT1-PS5-WS-VG-PE | K505: REYNATIS PS5
B506: Item Fulfillment | C506: 2024-09-20T00:00:00.000 | D506: 433745 | E506: Michael Jersey | F506: F | G506: Inventory Asset : Finished Goods | H506: 18.1 | I506: NA Games-STORE | J506: RNT1-PS5-WS-VG-PE | K506: REYNATIS PS5
B507: Item Fulfillment | C507: 2024-09-20T00:00:00.000 | D507: 434013 | E507: Michael Deleski | F507: F | G507: Inventory Asset : Finished Goods | H507: 18.1 | I507: NA Games-STORE | J507: RNT1-PS5-WS-VG-PE | K507: REYNATIS PS5
B508: Item Fulfillment | C508: 2024-09-20T00:00:00.000 | D508: 433999 | E508: Don Vanpay | F508: F | G508: Inventory Asset : Finished Goods | H508: 18.1 | I508: NA Games-STORE | J508: RNT1-PS5-WS-VG-PE | K508: REYNATIS PS5
B509: Item Fulfillment | C509: 2024-09-20T00:00:00.000 | D509: 433974 | E509: Brent Dennis | F509: F | G509: Inventory Asset : Finished Goods | H509: 18.1 | I509: NA Games-STORE | J509: RNT1-PS5-WS-VG-PE | K509: REYNATIS PS5
B510: Item Fulfillment | C510: 2024-09-20T00:00:00.000 | D510: 434262 | E510: 23295 Alixandria Trevino | F510: F | G510: Inventory Asset : Finished Goods | H510: 18.1 | I510: NA Games-STORE | J510: RNT1-PS5-WS-VG-PE | K510: REYNATIS PS5
B511: Item Fulfillment | C511: 2024-09-20T00:00:00.000 | D511: 434219 | E511: Nicolas De La Cruz | F511: F | G511: Inventory Asset : Finished Goods | H511: 18.1 | I511: NA Games-STORE | J511: RNT1-PS5-WS-VG-PE | K511: REYNATIS PS5
B512: Item Fulfillment | C512: 2024-09-20T00:00:00.000 | D512: 434205 | E512: 23396 Irving Gonzalez | F512: F | G512: Inventory Asset : Finished Goods | H512: 18.1 | I512: NA Games-STORE | J512: RNT1-PS5-WS-VG-PE | K512: REYNATIS PS5
B513: Item Fulfillment | C513: 2024-09-20T00:00:00.000 | D513: 433947 | E513: Oscar Villegas | F513: F | G513: Inventory Asset : Finished Goods | H513: 18.1 | I513: NA Games-STORE | J513: RNT1-PS5-WS-VG-PE | K513: REYNATIS PS5
B514: Item Fulfillment | C514: 2024-09-20T00:00:00.000 | D514: 433761 | E514: Tareq Alfadhala | F514: F | G514: Inventory Asset : Finished Goods | H514: 18.1 | I514: NA Games-STORE | J514: RNT1-PS5-WS-VG-PE | K514: REYNATIS PS5
B515: Item Fulfillment | C515: 2024-09-20T00:00:00.000 | D515: 433932 | E515: 971 John Madigan | F515: F | G515: Inventory Asset : Finished Goods | H515: 18.1 | I515: NA Games-STORE | J515: RNT1-PS5-WS-VG-PE | K515: REYNATIS PS5
B516: Item Fulfillment | C516: 2024-09-20T00:00:00.000 | D516: 433720 | E516: Nick Gerber [90349] | F516: F | G516: Inventory Asset : Finished Goods | H516: 18.1 | I516: NA Games-STORE | J516: RNT1-PS5-WS-VG-PE | K516: REYNATIS PS5
B517: Item Fulfillment | C517: 2024-09-20T00:00:00.000 | D517: 433890 | E517: Christopher Dougherty | F517: F | G517: Inventory Asset : Finished Goods | H517: 18.1 | I517: NA Games-STORE | J517: RNT1-PS5-WS-VG-PE | K517: REYNATIS PS5
B518: Item Fulfillment | C518: 2024-09-20T00:00:00.000 | D518: 434046 | E518: James Campbell | F518: F | G518: Inventory Asset : Finished Goods | H518: 18.1 | I518: NA Games-STORE | J518: RNT1-PS5-WS-VG-PE | K518: REYNATIS PS5
B519: Item Fulfillment | C519: 2024-09-20T00:00:00.000 | D519: 433848 | E519: Eddy Mingki | F519: F | G519: Inventory Asset : Finished Goods | H519: 18.1 | I519: NA Games-STORE | J519: RNT1-PS5-WS-VG-PE | K519: REYNATIS PS5
B520: Item Fulfillment | C520: 2024-09-20T00:00:00.000 | D520: 433811 | E520: Keely beal | F520: F | G520: Inventory Asset : Finished Goods | H520: 18.1 | I520: NA Games-STORE | J520: RNT1-PS5-WS-VG-PE | K520: REYNATIS PS5
B521: Item Fulfillment | C521: 2024-09-20T00:00:00.000 | D521: 434241 | E521: thermobeatz | F521: F | G521: Inventory Asset : Finished Goods | H521: 18.1 | I521: NA Games-STORE | J521: RNT1-PS5-WS-VG-PE | K521: REYNATIS PS5
B522: Item Fulfillment | C522: 2024-09-20T00:00:00.000 | D522: 434232 | E522: Chris Burnett | F522: F | G522: Inventory Asset : Finished Goods | H522: 18.1 | I522: NA Games-STORE | J522: RNT1-PS5-WS-VG-PE | K522: REYNATIS PS5
B523: Item Fulfillment | C523: 2024-09-20T00:00:00.000 | D523: 434207 | E523: Jacob Weiss | F523: F | G523: Inventory Asset : Finished Goods | H523: 18.1 | I523: NA Games-STORE | J523: RNT1-PS5-WS-VG-PE | K523: REYNATIS PS5
B524: Item Fulfillment | C524: 2024-09-20T00:00:00.000 | D524: 434154 | E524: michael pratt 2 | F524: F | G524: Inventory Asset : Finished Goods | H524: 18.1 | I524: NA Games-STORE | J524: RNT1-PS5-WS-VG-PE | K524: REYNATIS PS5
B525: Item Fulfillment | C525: 2024-09-20T00:00:00.000 | D525: 433950 | E525: Kamolnat Teeravate | F525: F | G525: Inventory Asset : Finished Goods | H525: 18.1 | I525: NA Games-STORE | J525: RNT1-PS5-WS-VG-PE | K525: REYNATIS PS5
B526: Item Fulfillment | C526: 2024-09-20T00:00:00.000 | D526: 433718 | E526: 22351 Faisal Alruways | F526: F | G526: Inventory Asset : Finished Goods | H526: 18.1 | I526: NA Games-STORE | J526: RNT1-PS5-WS-VG-PE | K526: REYNATIS PS5
B527: Item Fulfillment | C527: 2024-09-20T00:00:00.000 | D527: 433898 | E527: Zachary Neuheardt | F527: F | G527: Inventory Asset : Finished Goods | H527: 18.1 | I527: NA Games-STORE | J527: RNT1-PS5-WS-VG-PE | K527: REYNATIS PS5
B528: Item Fulfillment | C528: 2024-09-20T00:00:00.000 | D528: 434006 | E528: Zezhou Jing | F528: F | G528: Inventory Asset : Finished Goods | H528: 18.1 | I528: NA Games-STORE | J528: RNT1-PS5-WS-VG-PE | K528: REYNATIS PS5
B529: Item Fulfillment | C529: 2024-09-20T00:00:00.000 | D529: 433997 | E529: Richard Calvin | F529: F | G529: Inventory Asset : Finished Goods | H529: 18.1 | I529: NA Games-STORE | J529: RNT1-PS5-WS-VG-PE | K529: REYNATIS PS5
B530: Item Fulfillment | C530: 2024-09-20T00:00:00.000 | D530: 433988 | E530: Roman Vasallo | F530: F | G530: Inventory Asset : Finished Goods | H530: 18.1 | I530: NA Games-STORE | J530: RNT1-PS5-WS-VG-PE | K530: REYNATIS PS5
B531: Item Fulfillment | C531: 2024-09-20T00:00:00.000 | D531: 434094 | E531: Nancy Ward | F531: F | G531: Inventory Asset : Finished Goods | H531: 18.1 | I531: NA Games-STORE | J531: RNT1-PS5-WS-VG-PE | K531: REYNATIS PS5
B532: Item Fulfillment | C532: 2024-09-20T00:00:00.000 | D532: 434087 | E532: Kathryn Velicky | F532: F | G532: Inventory Asset : Finished Goods | H532: 18.1 | I532: NA Games-STORE | J532: RNT1-PS5-WS-VG-PE | K532: REYNATIS PS5
B533: Item Fulfillment | C533: 2024-09-20T00:00:00.000 | D533: 434222 | E533: David Saeger | F533: F | G533: Inventory Asset : Finished Goods | H533: 18.1 | I533: NA Games-STORE | J533: RNT1-PS5-WS-VG-PE | K533: REYNATIS PS5
B534: Item Fulfillment | C534: 2024-09-20T00:00:00.000 | D534: 434221 | E534: Gian Gracia | F534: F | G534: Inventory Asset : Finished Goods | H534: 18.1 | I534: NA Games-STORE | J534: RNT1-PS5-WS-VG-PE | K534: REYNATIS PS5
B535: Item Fulfillment | C535: 2024-09-20T00:00:00.000 | D535: 434220 | E535: Michael Novak | F535: F | G535: Inventory Asset : Finished Goods | H535: 18.1 | I535: NA Games-STORE | J535: RNT1-PS5-WS-VG-PE | K535: REYNATIS PS5
B536: Item Fulfillment | C536: 2024-09-20T00:00:00.000 | D536: 433790 | E536: Brett Campbell | F536: F | G536: Inventory Asset : Finished Goods | H536: 18.1 | I536: NA Games-STORE | J536: RNT1-PS5-WS-VG-PE | K536: REYNATIS PS5
B537: Item Fulfillment | C537: 2024-09-20T00:00:00.000 | D537: 433765 | E537: James Boerke | F537: F | G537: Inventory Asset : Finished Goods | H537: 18.1 | I537: NA Games-STORE | J537: RNT1-PS5-WS-VG-PE | K537: REYNATIS PS5
B538: Item Fulfillment | C538: 2024-09-20T00:00:00.000 | D538: 433909 | E538: Tam Nguyen [1000256440] | F538: F | G538: Inventory Asset : Finished Goods | H538: 18.1 | I538: NA Games-STORE | J538: RNT1-PS5-WS-VG-PE | K538: REYNATIS PS5
B539: Item Fulfillment | C539: 2024-09-20T00:00:00.000 | D539: 433865 | E539: Brian Miles | F539: F | G539: Inventory Asset : Finished Goods | H539: 18.1 | I539: NA Games-STORE | J539: RNT1-PS5-WS-VG-PE | K539: REYNATIS PS5
B540: Item Fulfillment | C540: 2024-09-20T00:00:00.000 | D540: 433816 | E540: chen-en chou | F540: F | G540: Inventory Asset : Finished Goods | H540: 18.1 | I540: NA Games-STORE | J540: RNT1-PS5-WS-VG-PE | K540: REYNATIS PS5
B541: Item Fulfillment | C541: 2024-09-20T00:00:00.000 | D541: 434137 | E541: Jeremy Arispe | F541: F | G541: Inventory Asset : Finished Goods | H541: 18.1 | I541: NA Games-STORE | J541: RNT1-PS5-WS-VG-PE | K541: REYNATIS PS5
B542: Item Fulfillment | C542: 2024-09-20T00:00:00.000 | D542: 434122 | E542: Tommy Nguyen | F542: F | G542: Inventory Asset : Finished Goods | H542: 18.1 | I542: NA Games-STORE | J542: RNT1-PS5-WS-VG-PE | K542: REYNATIS PS5
B543: Item Fulfillment | C543: 2024-09-20T00:00:00.000 | D543: 434172 | E543: Paul Gray Jr | F543: F | G543: Inventory Asset : Finished Goods | H543: 18.1 | I543: NA Games-STORE | J543: RNT1-PS5-WS-VG-PE | K543: REYNATIS PS5
B544: Item Fulfillment | C544: 2024-09-20T00:00:00.000 | D544: 434149 | E544: 23233 Angela Ball | F544: F | G544: Inventory Asset : Finished Goods | H544: 18.1 | I544: NA Games-STORE | J544: RNT1-PS5-WS-VG-PE | K544: REYNATIS PS5
B545: Item Fulfillment | C545: 2024-09-20T00:00:00.000 | D545: 433749 | E545: 22367 Rafael Fuentes | F545: F | G545: Inventory Asset : Finished Goods | H545: 18.1 | I545: NA Games-STORE | J545: RNT1-PS5-WS-VG-PE | K545: REYNATIS PS5
B546: Item Fulfillment | C546: 2024-09-20T00:00:00.000 | D546: 433744 | E546: 22365 Christian Adame | F546: F | G546: Inventory Asset : Finished Goods | H546: 18.1 | I546: NA Games-STORE | J546: RNT1-PS5-WS-VG-PE | K546: REYNATIS PS5
B547: Item Fulfillment | C547: 2024-09-20T00:00:00.000 | D547: 433741 | E547: Samuel Grawe | F547: F | G547: Inventory Asset : Finished Goods | H547: 18.1 | I547: NA Games-STORE | J547: RNT1-PS5-WS-VG-PE | K547: REYNATIS PS5
B548: Item Fulfillment | C548: 2024-09-20T00:00:00.000 | D548: 433877 | E548: Grady Parrott | F548: F | G548: Inventory Asset : Finished Goods | H548: 18.1 | I548: NA Games-STORE | J548: RNT1-PS5-WS-VG-PE | K548: REYNATIS PS5
B549: Item Fulfillment | C549: 2024-09-20T00:00:00.000 | D549: 434270 | E549: 23707 Clint Miller | F549: F | G549: Inventory Asset : Finished Goods | H549: 18.1 | I549: NA Games-STORE | J549: RNT1-PS5-WS-VG-PE | K549: REYNATIS PS5
B550: Item Fulfillment | C550: 2024-09-20T00:00:00.000 | D550: 433920 | E550: Jordan Castle | F550: F | G550: Inventory Asset : Finished Goods | H550: 18.1 | I550: NA Games-STORE | J550: RNT1-PS5-WS-VG-PE | K550: REYNATIS PS5
B551: Item Fulfillment | C551: 2024-09-20T00:00:00.000 | D551: 433874 | E551: Kyle Garcia | F551: F | G551: Inventory Asset : Finished Goods | H551: 18.1 | I551: NA Games-STORE | J551: RNT1-PS5-WS-VG-PE | K551: REYNATIS PS5
B552: Item Fulfillment | C552: 2024-09-20T00:00:00.000 | D552: 433859 | E552: Johnathon Salfer | F552: F | G552: Inventory Asset : Finished Goods | H552: 18.1 | I552: NA Games-STORE | J552: RNT1-PS5-WS-VG-PE | K552: REYNATIS PS5
B553: Item Fulfillment | C553: 2024-09-20T00:00:00.000 | D553: 434076 | E553: nelson delgado | F553: F | G553: Inventory Asset : Finished Goods | H553: 18.1 | I553: NA Games-STORE | J553: RNT1-PS5-WS-VG-PE | K553: REYNATIS PS5
B554: Item Fulfillment | C554: 2024-09-20T00:00:00.000 | D554: 434179 | E554: Nicholas Alfano | F554: F | G554: Inventory Asset : Finished Goods | H554: 18.1 | I554: NA Games-STORE | J554: RNT1-PS5-WS-VG-PE | K554: REYNATIS PS5
B555: Item Fulfillment | C555: 2024-09-20T00:00:00.000 | D555: 433802 | E555: Henry Lee [55581] | F555: F | G555: Inventory Asset : Finished Goods | H555: 18.1 | I555: NA Games-STORE | J555: RNT1-PS5-WS-VG-PE | K555: REYNATIS PS5
B556: Item Fulfillment | C556: 2024-09-20T00:00:00.000 | D556: 433914 | E556: 22444 Matt Buffington | F556: F | G556: Inventory Asset : Finished Goods | H556: 18.1 | I556: NA Games-STORE | J556: RNT1-PS5-WS-VG-PE | K556: REYNATIS PS5
B557: Item Fulfillment | C557: 2024-09-20T00:00:00.000 | D557: 434058 | E557: Jonathan Hernandez [1000322744] | F557: F | G557: Inventory Asset : Finished Goods | H557: 18.1 | I557: NA Games-STORE | J557: RNT1-PS5-WS-VG-PE | K557: REYNATIS PS5
B558: Item Fulfillment | C558: 2024-09-20T00:00:00.000 | D558: 434037 | E558: blueflare | F558: F | G558: Inventory Asset : Finished Goods | H558: 18.1 | I558: NA Games-STORE | J558: RNT1-PS5-WS-VG-PE | K558: REYNATIS PS5
B559: Item Fulfillment | C559: 2024-09-20T00:00:00.000 | D559: 434026 | E559: 22541 Tyler Lepack | F559: F | G559: Inventory Asset : Finished Goods | H559: 18.1 | I559: NA Games-STORE | J559: RNT1-PS5-WS-VG-PE | K559: REYNATIS PS5
B560: Item Fulfillment | C560: 2024-09-20T00:00:00.000 | D560: 433851 | E560: Mikhail | F560: F | G560: Inventory Asset : Finished Goods | H560: 18.1 | I560: NA Games-STORE | J560: RNT1-PS5-WS-VG-PE | K560: REYNATIS PS5
B561: Item Fulfillment | C561: 2024-09-20T00:00:00.000 | D561: 433838 | E561: David Mitchell [1000182215] | F561: F | G561: Inventory Asset : Finished Goods | H561: 18.1 | I561: NA Games-STORE | J561: RNT1-PS5-WS-VG-PE | K561: REYNATIS PS5
B562: Item Fulfillment | C562: 2024-09-20T00:00:00.000 | D562: 433995 | E562: Jaxon Hall | F562: F | G562: Inventory Asset : Finished Goods | H562: 18.1 | I562: NA Games-STORE | J562: RNT1-PS5-WS-VG-PE | K562: REYNATIS PS5
B563: Item Fulfillment | C563: 2024-09-20T00:00:00.000 | D563: 434141 | E563: Jason Loofburrow | F563: F | G563: Inventory Asset : Finished Goods | H563: 18.1 | I563: NA Games-STORE | J563: RNT1-PS5-WS-VG-PE | K563: REYNATIS PS5
B564: Item Fulfillment | C564: 2024-09-20T00:00:00.000 | D564: 434126 | E564: Tiiffany Urban | F564: F | G564: Inventory Asset : Finished Goods | H564: 18.1 | I564: NA Games-STORE | J564: RNT1-PS5-WS-VG-PE | K564: REYNATIS PS5
B565: Item Fulfillment | C565: 2024-09-20T00:00:00.000 | D565: 434197 | E565: 23183 Adam Baehr | F565: F | G565: Inventory Asset : Finished Goods | H565: 18.1 | I565: NA Games-STORE | J565: RNT1-PS5-WS-VG-PE | K565: REYNATIS PS5
B566: Item Fulfillment | C566: 2024-09-20T00:00:00.000 | D566: 433752 | E566: 22369 Dmitriy Lesenkoff | F566: F | G566: Inventory Asset : Finished Goods | H566: 18.1 | I566: NA Games-STORE | J566: RNT1-PS5-WS-VG-PE | K566: REYNATIS PS5
B567: Item Fulfillment | C567: 2024-09-20T00:00:00.000 | D567: 433907 | E567: 22442 Shannon Nolden | F567: F | G567: Inventory Asset : Finished Goods | H567: 18.1 | I567: NA Games-STORE | J567: RNT1-PS5-WS-VG-PE | K567: REYNATIS PS5
B568: Item Fulfillment | C568: 2024-09-20T00:00:00.000 | D568: 434101 | E568: Jameel Ali | F568: F | G568: Inventory Asset : Finished Goods | H568: 18.1 | I568: NA Games-STORE | J568: RNT1-PS5-WS-VG-PE | K568: REYNATIS PS5
B569: Item Fulfillment | C569: 2024-09-20T00:00:00.000 | D569: 434082 | E569: ArmstrongMegan Armstrong | F569: F | G569: Inventory Asset : Finished Goods | H569: 18.1 | I569: NA Games-STORE | J569: RNT1-PS5-WS-VG-PE | K569: REYNATIS PS5
B570: Item Fulfillment | C570: 2024-09-20T00:00:00.000 | D570: 434281 | E570: Alan Satkowski | F570: F | G570: Inventory Asset : Finished Goods | H570: 18.1 | I570: NA Games-STORE | J570: RNT1-PS5-WS-VG-PE | K570: REYNATIS PS5
B571: Item Fulfillment | C571: 2024-09-20T00:00:00.000 | D571: 434153 | E571: 19869 Michael Shourd | F571: F | G571: Inventory Asset : Finished Goods | H571: 18.1 | I571: NA Games-STORE | J571: RNT1-PS5-WS-VG-PE | K571: REYNATIS PS5
B572: Item Fulfillment | C572: 2024-09-20T00:00:00.000 | D572: 433962 | E572: Adel Marhoon R | F572: F | G572: Inventory Asset : Finished Goods | H572: 18.1 | I572: NA Games-STORE | J572: RNT1-PS5-WS-VG-PE | K572: REYNATIS PS5
B573: Item Fulfillment | C573: 2024-09-20T00:00:00.000 | D573: 433955 | E573: Kyle Moore Moore | F573: F | G573: Inventory Asset : Finished Goods | H573: 18.1 | I573: NA Games-STORE | J573: RNT1-PS5-WS-VG-PE | K573: REYNATIS PS5
B574: Item Fulfillment | C574: 2024-09-20T00:00:00.000 | D574: 433757 | E574: Allison R. Mayer | F574: F | G574: Inventory Asset : Finished Goods | H574: 18.1 | I574: NA Games-STORE | J574: RNT1-PS5-WS-VG-PE | K574: REYNATIS PS5
B575: Item Fulfillment | C575: 2024-09-20T00:00:00.000 | D575: 433753 | E575: Touchee Lee | F575: F | G575: Inventory Asset : Finished Goods | H575: 18.1 | I575: NA Games-STORE | J575: RNT1-PS5-WS-VG-PE | K575: REYNATIS PS5
B576: Item Fulfillment | C576: 2024-09-20T00:00:00.000 | D576: 433751 | E576: darkmonk37 | F576: F | G576: Inventory Asset : Finished Goods | H576: 18.1 | I576: NA Games-STORE | J576: RNT1-PS5-WS-VG-PE | K576: REYNATIS PS5
B577: Item Fulfillment | C577: 2024-09-20T00:00:00.000 | D577: 433750 | E577: Dane Martella Martella | F577: F | G577: Inventory Asset : Finished Goods | H577: 18.1 | I577: NA Games-STORE | J577: RNT1-PS5-WS-VG-PE | K577: REYNATIS PS5
B578: Item Fulfillment | C578: 2024-09-20T00:00:00.000 | D578: 433917 | E578: Tyishia Wright | F578: F | G578: Inventory Asset : Finished Goods | H578: 18.1 | I578: NA Games-STORE | J578: RNT1-PS5-WS-VG-PE | K578: REYNATIS PS5
B579: Item Fulfillment | C579: 2024-09-20T00:00:00.000 | D579: 433739 | E579: Chris Springer | F579: F | G579: Inventory Asset : Finished Goods | H579: 18.1 | I579: NA Games-STORE | J579: RNT1-PS5-WS-VG-PE | K579: REYNATIS PS5
B580: Item Fulfillment | C580: 2024-09-20T00:00:00.000 | D580: 433735 | E580: Jordan Tipton | F580: F | G580: Inventory Asset : Finished Goods | H580: 18.1 | I580: NA Games-STORE | J580: RNT1-PS5-WS-VG-PE | K580: REYNATIS PS5
B581: Item Fulfillment | C581: 2024-09-20T00:00:00.000 | D581: 433734 | E581: browseman | F581: F | G581: Inventory Asset : Finished Goods | H581: 18.1 | I581: NA Games-STORE | J581: RNT1-PS5-WS-VG-PE | K581: REYNATIS PS5
B582: Item Fulfillment | C582: 2024-09-20T00:00:00.000 | D582: 434062 | E582: Sally Li | F582: F | G582: Inventory Asset : Finished Goods | H582: 18.1 | I582: NA Games-STORE | J582: RNT1-PS5-WS-VG-PE | K582: REYNATIS PS5
B583: Item Fulfillment | C583: 2024-09-20T00:00:00.000 | D583: 433897 | E583: Cole Younger Younger | F583: F | G583: Inventory Asset : Finished Goods | H583: 18.1 | I583: NA Games-STORE | J583: RNT1-PS5-WS-VG-PE | K583: REYNATIS PS5
B584: Item Fulfillment | C584: 2024-09-20T00:00:00.000 | D584: 433882 | E584: 22422 Catalina Pontillo | F584: F | G584: Inventory Asset : Finished Goods | H584: 18.1 | I584: NA Games-STORE | J584: RNT1-PS5-WS-VG-PE | K584: REYNATIS PS5
B585: Item Fulfillment | C585: 2024-09-20T00:00:00.000 | D585: 433844 | E585: garywt | F585: F | G585: Inventory Asset : Finished Goods | H585: 18.1 | I585: NA Games-STORE | J585: RNT1-PS5-WS-VG-PE | K585: REYNATIS PS5
B586: Item Fulfillment | C586: 2024-09-20T00:00:00.000 | D586: 433998 | E586: 22496 Ana Karla Horta | F586: F | G586: Inventory Asset : Finished Goods | H586: 18.1 | I586: NA Games-STORE | J586: RNT1-PS5-WS-VG-PE | K586: REYNATIS PS5
B587: Item Fulfillment | C587: 2024-09-20T00:00:00.000 | D587: 434139 | E587: 1576 Robert Olcean | F587: F | G587: Inventory Asset : Finished Goods | H587: 18.1 | I587: NA Games-STORE | J587: RNT1-PS5-WS-VG-PE | K587: REYNATIS PS5
B588: Item Fulfillment | C588: 2024-09-20T00:00:00.000 | D588: 434266 | E588: Dawn Laska | F588: F | G588: Inventory Asset : Finished Goods | H588: 18.1 | I588: NA Games-STORE | J588: RNT1-PS5-WS-VG-PE | K588: REYNATIS PS5
B589: Item Fulfillment | C589: 2024-09-20T00:00:00.000 | D589: 434151 | E589: Devon McIntosh [1000263753] | F589: F | G589: Inventory Asset : Finished Goods | H589: 18.1 | I589: NA Games-STORE | J589: RNT1-PS5-WS-VG-PE | K589: REYNATIS PS5
B590: Item Fulfillment | C590: 2024-09-20T00:00:00.000 | D590: 433799 | E590: jaldrich860 | F590: F | G590: Inventory Asset : Finished Goods | H590: 18.1 | I590: NA Games-STORE | J590: RNT1-PS5-WS-VG-PE | K590: REYNATIS PS5
B591: Item Fulfillment | C591: 2024-09-20T00:00:00.000 | D591: 433970 | E591: Tung Duong | F591: F | G591: Inventory Asset : Finished Goods | H591: 18.1 | I591: NA Games-STORE | J591: RNT1-PS5-WS-VG-PE | K591: REYNATIS PS5
B592: Item Fulfillment | C592: 2024-09-20T00:00:00.000 | D592: 433763 | E592: Isabel Beaton | F592: F | G592: Inventory Asset : Finished Goods | H592: 18.1 | I592: NA Games-STORE | J592: RNT1-PS5-WS-VG-PE | K592: REYNATIS PS5
B593: Item Fulfillment | C593: 2024-09-20T00:00:00.000 | D593: 433921 | E593: Timothy Phelps | F593: F | G593: Inventory Asset : Finished Goods | H593: 18.1 | I593: NA Games-STORE | J593: RNT1-PS5-WS-VG-PE | K593: REYNATIS PS5
B594: Item Fulfillment | C594: 2024-09-20T00:00:00.000 | D594: 433891 | E594: 22431 Dallas Mohr | F594: F | G594: Inventory Asset : Finished Goods | H594: 18.1 | I594: NA Games-STORE | J594: RNT1-PS5-WS-VG-PE | K594: REYNATIS PS5
B595: Item Fulfillment | C595: 2024-09-20T00:00:00.000 | D595: 433855 | E595: 6194 Matthew Juarez | F595: F | G595: Inventory Asset : Finished Goods | H595: 18.1 | I595: NA Games-STORE | J595: RNT1-PS5-WS-VG-PE | K595: REYNATIS PS5
B596: Item Fulfillment | C596: 2024-09-20T00:00:00.000 | D596: 434110 | E596: edwardau | F596: F | G596: Inventory Asset : Finished Goods | H596: 18.1 | I596: NA Games-STORE | J596: RNT1-PS5-WS-VG-PE | K596: REYNATIS PS5
B597: Item Fulfillment | C597: 2024-09-20T00:00:00.000 | D597: 434283 | E597: Jordan Norfleet | F597: F | G597: Inventory Asset : Finished Goods | H597: 18.1 | I597: NA Games-STORE | J597: RNT1-PS5-WS-VG-PE | K597: REYNATIS PS5
B598: Item Fulfillment | C598: 2024-09-20T00:00:00.000 | D598: 434164 | E598: 22426 leslie palmer | F598: F | G598: Inventory Asset : Finished Goods | H598: 18.1 | I598: NA Games-STORE | J598: RNT1-PS5-WS-VG-PE | K598: REYNATIS PS5
B599: Item Fulfillment | C599: 2024-09-20T00:00:00.000 | D599: 434061 | E599: Mary Sunseri | F599: F | G599: Inventory Asset : Finished Goods | H599: 18.1 | I599: NA Games-STORE | J599: RNT1-PS5-WS-VG-PE | K599: REYNATIS PS5
B600: Item Fulfillment | C600: 2024-09-20T00:00:00.000 | D600: 434036 | E600: Zac Cardon | F600: F | G600: Inventory Asset : Finished Goods | H600: 18.1 | I600: NA Games-STORE | J600: RNT1-PS5-WS-VG-PE | K600: REYNATIS PS5
B601: Item Fulfillment | C601: 2024-09-20T00:00:00.000 | D601: 433847 | E601: 22403 Santiago Vera | F601: F | G601: Inventory Asset : Finished Goods | H601: 18.1 | I601: NA Games-STORE | J601: RNT1-PS5-WS-VG-PE | K601: REYNATIS PS5
B602: Item Fulfillment | C602: 2024-09-20T00:00:00.000 | D602: 434109 | E602: 22988 Edwin Vixamar | F602: F | G602: Inventory Asset : Finished Goods | H602: 18.1 | I602: NA Games-STORE | J602: RNT1-PS5-WS-VG-PE | K602: REYNATIS PS5
B603: Item Fulfillment | C603: 2024-09-20T00:00:00.000 | D603: 434103 | E603: 22875 Albert Gastaldo | F603: F | G603: Inventory Asset : Finished Goods | H603: 18.1 | I603: NA Games-STORE | J603: RNT1-PS5-WS-VG-PE | K603: REYNATIS PS5
B604: Item Fulfillment | C604: 2024-09-20T00:00:00.000 | D604: 434144 | E604: Nick's card | F604: F | G604: Inventory Asset : Finished Goods | H604: 18.1 | I604: NA Games-STORE | J604: RNT1-PS5-WS-VG-PE | K604: REYNATIS PS5
B605: Item Fulfillment | C605: 2024-09-20T00:00:00.000 | D605: 434130 | E605: 23185 Alexandria Lee | F605: F | G605: Inventory Asset : Finished Goods | H605: 18.1 | I605: NA Games-STORE | J605: RNT1-PS5-WS-VG-PE | K605: REYNATIS PS5
B606: Item Fulfillment | C606: 2024-09-20T00:00:00.000 | D606: 434287 | E606: 23735 Calvin Karnes-Kramer | F606: F | G606: Inventory Asset : Finished Goods | H606: 18.1 | I606: NA Games-STORE | J606: RNT1-PS5-WS-VG-PE | K606: REYNATIS PS5
B607: Item Fulfillment | C607: 2024-09-20T00:00:00.000 | D607: 434285 | E607: Adam Turner | F607: F | G607: Inventory Asset : Finished Goods | H607: 18.1 | I607: NA Games-STORE | J607: RNT1-PS5-WS-VG-PE | K607: REYNATIS PS5
B608: Item Fulfillment | C608: 2024-09-20T00:00:00.000 | D608: 434265 | E608: Holly Laska | F608: F | G608: Inventory Asset : Finished Goods | H608: 18.1 | I608: NA Games-STORE | J608: RNT1-PS5-WS-VG-PE | K608: REYNATIS PS5
B609: Item Fulfillment | C609: 2024-09-20T00:00:00.000 | D609: 434158 | E609: Jose Zapata [1000277190] | F609: F | G609: Inventory Asset : Finished Goods | H609: 18.1 | I609: NA Games-STORE | J609: RNT1-PS5-WS-VG-PE | K609: REYNATIS PS5
B610: Item Fulfillment | C610: 2024-09-20T00:00:00.000 | D610: 434041 | E610: Diana Nguyen [1935] | F610: F | G610: Inventory Asset : Finished Goods | H610: 18.1 | I610: NA Games-STORE | J610: RNT1-PS5-WS-VG-PE | K610: REYNATIS PS5
B611: Item Fulfillment | C611: 2024-09-20T00:00:00.000 | D611: 433853 | E611: Candace Cheung | F611: F | G611: Inventory Asset : Finished Goods | H611: 18.1 | I611: NA Games-STORE | J611: RNT1-PS5-WS-VG-PE | K611: REYNATIS PS5
B612: Item Fulfillment | C612: 2024-09-20T00:00:00.000 | D612: 433982 | E612: 22480 Anna Larson | F612: F | G612: Inventory Asset : Finished Goods | H612: 18.1 | I612: NA Games-STORE | J612: RNT1-PS5-WS-VG-PE | K612: REYNATIS PS5
B613: Item Fulfillment | C613: 2024-09-20T00:00:00.000 | D613: 433817 | E613: Aaron Brumbaugh | F613: F | G613: Inventory Asset : Finished Goods | H613: 18.1 | I613: NA Games-STORE | J613: RNT1-PS5-WS-VG-PE | K613: REYNATIS PS5
B614: Item Fulfillment | C614: 2024-09-20T00:00:00.000 | D614: 433810 | E614: 22386 Brendon Albers | F614: F | G614: Inventory Asset : Finished Goods | H614: 18.1 | I614: NA Games-STORE | J614: RNT1-PS5-WS-VG-PE | K614: REYNATIS PS5
B615: Item Fulfillment | C615: 2024-09-20T00:00:00.000 | D615: 434081 | E615: Brandon Campbell | F615: F | G615: Inventory Asset : Finished Goods | H615: 18.1 | I615: NA Games-STORE | J615: RNT1-PS5-WS-VG-PE | K615: REYNATIS PS5
B616: Item Fulfillment | C616: 2024-09-20T00:00:00.000 | D616: 434237 | E616: Joel Hernandez | F616: F | G616: Inventory Asset : Finished Goods | H616: 18.1 | I616: NA Games-STORE | J616: RNT1-PS5-WS-VG-PE | K616: REYNATIS PS5
B617: Item Fulfillment | C617: 2024-09-20T00:00:00.000 | D617: 433973 | E617: Brian Pittman | F617: F | G617: Inventory Asset : Finished Goods | H617: 18.1 | I617: NA Games-STORE | J617: RNT1-PS5-WS-VG-PE | K617: REYNATIS PS5
B618: Item Fulfillment | C618: 2024-09-20T00:00:00.000 | D618: 433829 | E618: Kristin Buchanan | F618: F | G618: Inventory Asset : Finished Goods | H618: 18.1 | I618: NA Games-STORE | J618: RNT1-PS5-WS-VG-PE | K618: REYNATIS PS5
B619: Item Fulfillment | C619: 2024-09-20T00:00:00.000 | D619: 433880 | E619: 22421 Matthew Vicars | F619: F | G619: Inventory Asset : Finished Goods | H619: 18.1 | I619: NA Games-STORE | J619: RNT1-PS5-WS-VG-PE | K619: REYNATIS PS5
B620: Item Fulfillment | C620: 2024-09-20T00:00:00.000 | D620: 434112 | E620: Justin Curry | F620: F | G620: Inventory Asset : Finished Goods | H620: 18.1 | I620: NA Games-STORE | J620: RNT1-PS5-WS-VG-PE | K620: REYNATIS PS5
B621: Item Fulfillment | C621: 2024-09-20T00:00:00.000 | D621: 434084 | E621: PabloPerez Ramirez | F621: F | G621: Inventory Asset : Finished Goods | H621: 18.1 | I621: NA Games-STORE | J621: RNT1-PS5-WS-VG-PE | K621: REYNATIS PS5
B622: Item Fulfillment | C622: 2024-09-20T00:00:00.000 | D622: 434245 | E622: Michael Torres [1000179924] | F622: F | G622: Inventory Asset : Finished Goods | H622: 18.1 | I622: NA Games-STORE | J622: RNT1-PS5-WS-VG-PE | K622: REYNATIS PS5
B623: Item Fulfillment | C623: 2024-09-20T00:00:00.000 | D623: 434178 | E623: Alexander Emery | F623: F | G623: Inventory Asset : Finished Goods | H623: 18.1 | I623: NA Games-STORE | J623: RNT1-PS5-WS-VG-PE | K623: REYNATIS PS5
B624: Item Fulfillment | C624: 2024-09-20T00:00:00.000 | D624: 433801 | E624: faiza hussain | F624: F | G624: Inventory Asset : Finished Goods | H624: 18.1 | I624: NA Games-STORE | J624: RNT1-PS5-WS-VG-PE | K624: REYNATIS PS5
B625: Item Fulfillment | C625: 2024-09-20T00:00:00.000 | D625: 433949 | E625: Dakota Kelbley | F625: F | G625: Inventory Asset : Finished Goods | H625: 18.1 | I625: NA Games-STORE | J625: RNT1-PS5-WS-VG-PE | K625: REYNATIS PS5
B626: Item Fulfillment | C626: 2024-09-20T00:00:00.000 | D626: 433948 | E626: Harley Theisen | F626: F | G626: Inventory Asset : Finished Goods | H626: 18.1 | I626: NA Games-STORE | J626: RNT1-PS5-WS-VG-PE | K626: REYNATIS PS5
B627: Item Fulfillment | C627: 2024-09-20T00:00:00.000 | D627: 433918 | E627: Cory C | F627: F | G627: Inventory Asset : Finished Goods | H627: 18.1 | I627: NA Games-STORE | J627: RNT1-PS5-WS-VG-PE | K627: REYNATIS PS5
B628: Item Fulfillment | C628: 2024-09-20T00:00:00.000 | D628: 433725 | E628: Garri Bagdasarov | F628: F | G628: Inventory Asset : Finished Goods | H628: 18.1 | I628: NA Games-STORE | J628: RNT1-PS5-WS-VG-PE | K628: REYNATIS PS5
B629: Item Fulfillment | C629: 2024-09-20T00:00:00.000 | D629: 433887 | E629: Spenser Kollath | F629: F | G629: Inventory Asset : Finished Goods | H629: 18.1 | I629: NA Games-STORE | J629: RNT1-PS5-WS-VG-PE | K629: REYNATIS PS5
B630: Item Fulfillment | C630: 2024-09-20T00:00:00.000 | D630: 434133 | E630: crimsonx4 | F630: F | G630: Inventory Asset : Finished Goods | H630: 18.1 | I630: NA Games-STORE | J630: RNT1-PS5-WS-VG-PE | K630: REYNATIS PS5
B631: Item Fulfillment | C631: 2024-09-20T00:00:00.000 | D631: 434250 | E631: Justin Hoskins [1000252556] | F631: F | G631: Inventory Asset : Finished Goods | H631: 18.1 | I631: NA Games-STORE | J631: RNT1-PS5-WS-VG-PE | K631: REYNATIS PS5
B632: Item Fulfillment | C632: 2024-09-20T00:00:00.000 | D632: 434193 | E632: 23370 Josue Puentes Rodriguez | F632: F | G632: Inventory Asset : Finished Goods | H632: 18.1 | I632: NA Games-STORE | J632: RNT1-PS5-WS-VG-PE | K632: REYNATIS PS5
B633: Item Fulfillment | C633: 2024-09-20T00:00:00.000 | D633: 434181 | E633: 23082 Tou Moua | F633: F | G633: Inventory Asset : Finished Goods | H633: 18.1 | I633: NA Games-STORE | J633: RNT1-PS5-WS-VG-PE | K633: REYNATIS PS5
B634: Item Fulfillment | C634: 2024-09-20T00:00:00.000 | D634: 434156 | E634: Nicholas Schenmeyer | F634: F | G634: Inventory Asset : Finished Goods | H634: 18.1 | I634: NA Games-STORE | J634: RNT1-PS5-WS-VG-PE | K634: REYNATIS PS5
B635: Item Fulfillment | C635: 2024-09-20T00:00:00.000 | D635: 433884 | E635: Linda Kim | F635: F | G635: Inventory Asset : Finished Goods | H635: 18.1 | I635: NA Games-STORE | J635: RNT1-PS5-WS-VG-PE | K635: REYNATIS PS5
B636: Item Fulfillment | C636: 2024-09-20T00:00:00.000 | D636: 434027 | E636: 22544 Enrique Argueta | F636: F | G636: Inventory Asset : Finished Goods | H636: 18.1 | I636: NA Games-STORE | J636: RNT1-PS5-WS-VG-PE | K636: REYNATIS PS5
B637: Item Fulfillment | C637: 2024-09-20T00:00:00.000 | D637: 434016 | E637: 22521 Mikhail Nemirovskiy | F637: F | G637: Inventory Asset : Finished Goods | H637: 18.1 | I637: NA Games-STORE | J637: RNT1-PS5-WS-VG-PE | K637: REYNATIS PS5
B638: Item Fulfillment | C638: 2024-09-20T00:00:00.000 | D638: 433976 | E638: Eric Cunningham | F638: F | G638: Inventory Asset : Finished Goods | H638: 18.1 | I638: NA Games-STORE | J638: RNT1-PS5-WS-VG-PE | K638: REYNATIS PS5
B639: Item Fulfillment | C639: 2024-09-20T00:00:00.000 | D639: 433812 | E639: Robert Kahlbaum | F639: F | G639: Inventory Asset : Finished Goods | H639: 18.1 | I639: NA Games-STORE | J639: RNT1-PS5-WS-VG-PE | K639: REYNATIS PS5
B640: Item Fulfillment | C640: 2024-09-20T00:00:00.000 | D640: 434128 | E640: Daniel Unger | F640: F | G640: Inventory Asset : Finished Goods | H640: 18.1 | I640: NA Games-STORE | J640: RNT1-PS5-WS-VG-PE | K640: REYNATIS PS5
B641: Item Fulfillment | C641: 2024-09-20T00:00:00.000 | D641: 434118 | E641: Kenneth Smith [1000181378] | F641: F | G641: Inventory Asset : Finished Goods | H641: 18.1 | I641: NA Games-STORE | J641: RNT1-PS5-WS-VG-PE | K641: REYNATIS PS5
B642: Item Fulfillment | C642: 2024-09-20T00:00:00.000 | D642: 434117 | E642: Thomas Hylton | F642: F | G642: Inventory Asset : Finished Goods | H642: 18.1 | I642: NA Games-STORE | J642: RNT1-PS5-WS-VG-PE | K642: REYNATIS PS5
B643: Item Fulfillment | C643: 2024-09-20T00:00:00.000 | D643: 434276 | E643: Christian Peavey | F643: F | G643: Inventory Asset : Finished Goods | H643: 18.1 | I643: NA Games-STORE | J643: RNT1-PS5-WS-VG-PE | K643: REYNATIS PS5
B644: Item Fulfillment | C644: 2024-09-20T00:00:00.000 | D644: 434258 | E644: Cory Ripplinger | F644: F | G644: Inventory Asset : Finished Goods | H644: 18.1 | I644: NA Games-STORE | J644: RNT1-PS5-WS-VG-PE | K644: REYNATIS PS5
B645: Item Fulfillment | C645: 2024-09-20T00:00:00.000 | D645: 434152 | E645: Beatrice Escarda [1000324163] | F645: F | G645: Inventory Asset : Finished Goods | H645: 18.1 | I645: NA Games-STORE | J645: RNT1-PS5-WS-VG-PE | K645: REYNATIS PS5
B646: Item Fulfillment | C646: 2024-09-20T00:00:00.000 | D646: 433805 | E646: Joshua Champine | F646: F | G646: Inventory Asset : Finished Goods | H646: 18.1 | I646: NA Games-STORE | J646: RNT1-PS5-WS-VG-PE | K646: REYNATIS PS5
B647: Item Fulfillment | C647: 2024-09-20T00:00:00.000 | D647: 433940 | E647: John Burdick | F647: F | G647: Inventory Asset : Finished Goods | H647: 18.1 | I647: NA Games-STORE | J647: RNT1-PS5-WS-VG-PE | K647: REYNATIS PS5
B648: Item Fulfillment | C648: 2024-09-20T00:00:00.000 | D648: 433759 | E648: xfcj | F648: F | G648: Inventory Asset : Finished Goods | H648: 18.1 | I648: NA Games-STORE | J648: RNT1-PS5-WS-VG-PE | K648: REYNATIS PS5
B649: Item Fulfillment | C649: 2024-09-20T00:00:00.000 | D649: 433904 | E649: Ariel Toledo | F649: F | G649: Inventory Asset : Finished Goods | H649: 18.1 | I649: NA Games-STORE | J649: RNT1-PS5-WS-VG-PE | K649: REYNATIS PS5
B650: Item Fulfillment | C650: 2024-09-20T00:00:00.000 | D650: 434028 | E650: Mark Wilkins | F650: F | G650: Inventory Asset : Finished Goods | H650: 18.1 | I650: NA Games-STORE | J650: RNT1-PS5-WS-VG-PE | K650: REYNATIS PS5
B651: Item Fulfillment | C651: 2024-09-20T00:00:00.000 | D651: 434114 | E651: Chandler Wall | F651: F | G651: Inventory Asset : Finished Goods | H651: 18.1 | I651: NA Games-STORE | J651: RNT1-PS5-WS-VG-PE | K651: REYNATIS PS5
B652: Item Fulfillment | C652: 2024-09-20T00:00:00.000 | D652: 434272 | E652: Nathaniel English | F652: F | G652: Inventory Asset : Finished Goods | H652: 18.1 | I652: NA Games-STORE | J652: RNT1-PS5-WS-VG-PE | K652: REYNATIS PS5
B653: Item Fulfillment | C653: 2024-09-20T00:00:00.000 | D653: 434261 | E653: Riki Elston | F653: F | G653: Inventory Asset : Finished Goods | H653: 18.1 | I653: NA Games-STORE | J653: RNT1-PS5-WS-VG-PE | K653: REYNATIS PS5
B654: Item Fulfillment | C654: 2024-09-20T00:00:00.000 | D654: 434254 | E654: 23677 Timothy Land | F654: F | G654: Inventory Asset : Finished Goods | H654: 18.1 | I654: NA Games-STORE | J654: RNT1-PS5-WS-VG-PE | K654: REYNATIS PS5
B655: Item Fulfillment | C655: 2024-09-20T00:00:00.000 | D655: 434176 | E655: 23304 Thuong Le | F655: F | G655: Inventory Asset : Finished Goods | H655: 18.1 | I655: NA Games-STORE | J655: RNT1-PS5-WS-VG-PE | K655: REYNATIS PS5
B656: Item Fulfillment | C656: 2024-09-20T00:00:00.000 | D656: 433727 | E656: Bret Liber | F656: F | G656: Inventory Asset : Finished Goods | H656: 18.1 | I656: NA Games-STORE | J656: RNT1-PS5-WS-VG-PE | K656: REYNATIS PS5
B657: Item Fulfillment | C657: 2024-09-20T00:00:00.000 | D657: 434030 | E657: Sally Arlette Garcia | F657: F | G657: Inventory Asset : Finished Goods | H657: 18.1 | I657: NA Games-STORE | J657: RNT1-PS5-WS-VG-PE | K657: REYNATIS PS5
B658: Item Fulfillment | C658: 2024-09-20T00:00:00.000 | D658: 434022 | E658: Austin Matthews [1000257241] | F658: F | G658: Inventory Asset : Finished Goods | H658: 18.1 | I658: NA Games-STORE | J658: RNT1-PS5-WS-VG-PE | K658: REYNATIS PS5
B659: Item Fulfillment | C659: 2024-09-20T00:00:00.000 | D659: 434001 | E659: 21728 Mohammed Alshamsi | F659: F | G659: Inventory Asset : Finished Goods | H659: 18.1 | I659: NA Games-STORE | J659: RNT1-PS5-WS-VG-PE | K659: REYNATIS PS5
B660: Item Fulfillment | C660: 2024-09-20T00:00:00.000 | D660: 434083 | E660: Nick Rodriguez | F660: F | G660: Inventory Asset : Finished Goods | H660: 18.1 | I660: NA Games-STORE | J660: RNT1-PS5-WS-VG-PE | K660: REYNATIS PS5
B661: Item Fulfillment | C661: 2024-09-20T00:00:00.000 | D661: 434077 | E661: Aman Ul Haque | F661: F | G661: Inventory Asset : Finished Goods | H661: 18.1 | I661: NA Games-STORE | J661: RNT1-PS5-WS-VG-PE | K661: REYNATIS PS5
B662: Item Fulfillment | C662: 2024-09-20T00:00:00.000 | D662: 434073 | E662: Brian Dyroff | F662: F | G662: Inventory Asset : Finished Goods | H662: 18.1 | I662: NA Games-STORE | J662: RNT1-PS5-WS-VG-PE | K662: REYNATIS PS5
B663: Item Fulfillment | C663: 2024-09-20T00:00:00.000 | D663: 434125 | E663: Adam Setliff | F663: F | G663: Inventory Asset : Finished Goods | H663: 18.1 | I663: NA Games-STORE | J663: RNT1-PS5-WS-VG-PE | K663: REYNATIS PS5
B664: Item Fulfillment | C664: 2024-09-20T00:00:00.000 | D664: 434260 | E664: Kyle Howlett | F664: F | G664: Inventory Asset : Finished Goods | H664: 18.1 | I664: NA Games-STORE | J664: RNT1-PS5-WS-VG-PE | K664: REYNATIS PS5
B665: Item Fulfillment | C665: 2024-09-20T00:00:00.000 | D665: 433798 | E665: brian malazarte | F665: F | G665: Inventory Asset : Finished Goods | H665: 18.1 | I665: NA Games-STORE | J665: RNT1-PS5-WS-VG-PE | K665: REYNATIS PS5
B666: Item Fulfillment | C666: 2024-09-20T00:00:00.000 | D666: 433786 | E666: Paul Nelson | F666: F | G666: Inventory Asset : Finished Goods | H666: 18.1 | I666: NA Games-STORE | J666: RNT1-PS5-WS-VG-PE | K666: REYNATIS PS5
B667: Item Fulfillment | C667: 2024-09-20T00:00:00.000 | D667: 433943 | E667: Cheyne Hurt | F667: F | G667: Inventory Asset : Finished Goods | H667: 18.1 | I667: NA Games-STORE | J667: RNT1-PS5-WS-VG-PE | K667: REYNATIS PS5
B668: Item Fulfillment | C668: 2024-09-20T00:00:00.000 | D668: 433764 | E668: Te Y Dasinger | F668: F | G668: Inventory Asset : Finished Goods | H668: 18.1 | I668: NA Games-STORE | J668: RNT1-PS5-WS-VG-PE | K668: REYNATIS PS5
B669: Item Fulfillment | C669: 2024-09-20T00:00:00.000 | D669: 434056 | E669: Ryan Powers | F669: F | G669: Inventory Asset : Finished Goods | H669: 18.1 | I669: NA Games-STORE | J669: RNT1-PS5-WS-VG-PE | K669: REYNATIS PS5
B670: Item Fulfillment | C670: 2024-09-20T00:00:00.000 | D670: 434055 | E670: joseph bommarito | F670: F | G670: Inventory Asset : Finished Goods | H670: 18.1 | I670: NA Games-STORE | J670: RNT1-PS5-WS-VG-PE | K670: REYNATIS PS5
B671: Item Fulfillment | C671: 2024-09-20T00:00:00.000 | D671: 434054 | E671: Darla Walton | F671: F | G671: Inventory Asset : Finished Goods | H671: 18.1 | I671: NA Games-STORE | J671: RNT1-PS5-WS-VG-PE | K671: REYNATIS PS5
B672: Item Fulfillment | C672: 2024-09-20T00:00:00.000 | D672: 433846 | E672: 22402 christine vipond | F672: F | G672: Inventory Asset : Finished Goods | H672: 18.1 | I672: NA Games-STORE | J672: RNT1-PS5-WS-VG-PE | K672: REYNATIS PS5
B673: Item Fulfillment | C673: 2024-09-20T00:00:00.000 | D673: 433977 | E673: Jorge Rivera [1000222127] | F673: F | G673: Inventory Asset : Finished Goods | H673: 18.1 | I673: NA Games-STORE | J673: RNT1-PS5-WS-VG-PE | K673: REYNATIS PS5
B674: Item Fulfillment | C674: 2024-09-20T00:00:00.000 | D674: 434277 | E674: Thomas MacDonald | F674: F | G674: Inventory Asset : Finished Goods | H674: 18.1 | I674: NA Games-STORE | J674: RNT1-PS5-WS-VG-PE | K674: REYNATIS PS5
B675: Item Fulfillment | C675: 2024-09-20T00:00:00.000 | D675: 434271 | E675: 23708 Hin Mak | F675: F | G675: Inventory Asset : Finished Goods | H675: 18.1 | I675: NA Games-STORE | J675: RNT1-PS5-WS-VG-PE | K675: REYNATIS PS5
B676: Item Fulfillment | C676: 2024-09-20T00:00:00.000 | D676: 434236 | E676: Stephen Wittkamp | F676: F | G676: Inventory Asset : Finished Goods | H676: 18.1 | I676: NA Games-STORE | J676: RNT1-PS5-WS-VG-PE | K676: REYNATIS PS5
B677: Item Fulfillment | C677: 2024-09-20T00:00:00.000 | D677: 434227 | E677: Blake Hart | F677: F | G677: Inventory Asset : Finished Goods | H677: 18.1 | I677: NA Games-STORE | J677: RNT1-PS5-WS-VG-PE | K677: REYNATIS PS5
B678: Item Fulfillment | C678: 2024-09-20T00:00:00.000 | D678: 434224 | E678: Joshua Moran 2 | F678: F | G678: Inventory Asset : Finished Goods | H678: 18.1 | I678: NA Games-STORE | J678: RNT1-PS5-WS-VG-PE | K678: REYNATIS PS5
B679: Item Fulfillment | C679: 2024-09-20T00:00:00.000 | D679: 434150 | E679: Chimeng Xiong | F679: F | G679: Inventory Asset : Finished Goods | H679: 18.1 | I679: NA Games-STORE | J679: RNT1-PS5-WS-VG-PE | K679: REYNATIS PS5
B680: Item Fulfillment | C680: 2024-09-20T00:00:00.000 | D680: 433835 | E680: 21447 Andrew Prompongsatorn | F680: F | G680: Inventory Asset : Finished Goods | H680: 18.1 | I680: NA Games-STORE | J680: RNT1-PS5-WS-VG-PE | K680: REYNATIS PS5
B681: Item Fulfillment | C681: 2024-09-20T00:00:00.000 | D681: 433767 | E681: Tyler Kelly | F681: F | G681: Inventory Asset : Finished Goods | H681: 18.1 | I681: NA Games-STORE | J681: RNT1-PS5-WS-VG-PE | K681: REYNATIS PS5
B682: Item Fulfillment | C682: 2024-09-20T00:00:00.000 | D682: 433900 | E682: Mark Sato | F682: F | G682: Inventory Asset : Finished Goods | H682: 18.1 | I682: NA Games-STORE | J682: RNT1-PS5-WS-VG-PE | K682: REYNATIS PS5
B683: Item Fulfillment | C683: 2024-09-20T00:00:00.000 | D683: 434059 | E683: linda ballesteros | F683: F | G683: Inventory Asset : Finished Goods | H683: 18.1 | I683: NA Games-STORE | J683: RNT1-PS5-WS-VG-PE | K683: REYNATIS PS5
B684: Item Fulfillment | C684: 2024-09-20T00:00:00.000 | D684: 434025 | E684: Shane Wemyss | F684: F | G684: Inventory Asset : Finished Goods | H684: 18.1 | I684: NA Games-STORE | J684: RNT1-PS5-WS-VG-PE | K684: REYNATIS PS5
B685: Item Fulfillment | C685: 2024-09-20T00:00:00.000 | D685: 434010 | E685: Christian Flannagan | F685: F | G685: Inventory Asset : Finished Goods | H685: 18.1 | I685: NA Games-STORE | J685: RNT1-PS5-WS-VG-PE | K685: REYNATIS PS5
B686: Item Fulfillment | C686: 2024-09-20T00:00:00.000 | D686: 434267 | E686: Carlos Solis | F686: F | G686: Inventory Asset : Finished Goods | H686: 18.1 | I686: NA Games-STORE | J686: RNT1-PS5-WS-VG-PE | K686: REYNATIS PS5
B687: Item Fulfillment | C687: 2024-09-20T00:00:00.000 | D687: 434263 | E687: David O'Neill | F687: F | G687: Inventory Asset : Finished Goods | H687: 18.1 | I687: NA Games-STORE | J687: RNT1-PS5-WS-VG-PE | K687: REYNATIS PS5
B688: Item Fulfillment | C688: 2024-09-20T00:00:00.000 | D688: 434246 | E688: James Shofner | F688: F | G688: Inventory Asset : Finished Goods | H688: 18.1 | I688: NA Games-STORE | J688: RNT1-PS5-WS-VG-PE | K688: REYNATIS PS5
B689: Item Fulfillment | C689: 2024-09-20T00:00:00.000 | D689: 434243 | E689: Amaris Lucas | F689: F | G689: Inventory Asset : Finished Goods | H689: 18.1 | I689: NA Games-STORE | J689: RNT1-PS5-WS-VG-PE | K689: REYNATIS PS5
B690: Item Fulfillment | C690: 2024-09-20T00:00:00.000 | D690: 433794 | E690: 830 Benjamin Diehl | F690: F | G690: Inventory Asset : Finished Goods | H690: 18.1 | I690: NA Games-STORE | J690: RNT1-PS5-WS-VG-PE | K690: REYNATIS PS5
B691: Item Fulfillment | C691: 2024-09-20T00:00:00.000 | D691: 433784 | E691: TKeyaha Sawyers | F691: F | G691: Inventory Asset : Finished Goods | H691: 18.1 | I691: NA Games-STORE | J691: RNT1-PS5-WS-VG-PE | K691: REYNATIS PS5
B692: Item Fulfillment | C692: 2024-09-20T00:00:00.000 | D692: 433944 | E692: David S Paradise 4 | F692: F | G692: Inventory Asset : Finished Goods | H692: 18.1 | I692: NA Games-STORE | J692: RNT1-PS5-WS-VG-PE | K692: REYNATIS PS5
B693: Item Fulfillment | C693: 2024-09-20T00:00:00.000 | D693: 433926 | E693: 22454 Daniel Nguyen | F693: F | G693: Inventory Asset : Finished Goods | H693: 18.1 | I693: NA Games-STORE | J693: RNT1-PS5-WS-VG-PE | K693: REYNATIS PS5
B694: Item Fulfillment | C694: 2024-09-20T00:00:00.000 | D694: 433888 | E694: Jason Tsang | F694: F | G694: Inventory Asset : Finished Goods | H694: 18.1 | I694: NA Games-STORE | J694: RNT1-PS5-WS-VG-PE | K694: REYNATIS PS5
B695: Item Fulfillment | C695: 2024-09-20T00:00:00.000 | D695: 434057 | E695: Van Isbell | F695: F | G695: Inventory Asset : Finished Goods | H695: 18.1 | I695: NA Games-STORE | J695: RNT1-PS5-WS-VG-PE | K695: REYNATIS PS5
B696: Item Fulfillment | C696: 2024-09-20T00:00:00.000 | D696: 434003 | E696: Michael Doucet | F696: F | G696: Inventory Asset : Finished Goods | H696: 18.1 | I696: NA Games-STORE | J696: RNT1-PS5-WS-VG-PE | K696: REYNATIS PS5
B697: Item Fulfillment | C697: 2024-09-20T00:00:00.000 | D697: 433994 | E697: Jason Holt [190458] | F697: F | G697: Inventory Asset : Finished Goods | H697: 18.1 | I697: NA Games-STORE | J697: RNT1-PS5-WS-VG-PE | K697: REYNATIS PS5
B698: Item Fulfillment | C698: 2024-09-20T00:00:00.000 | D698: 433822 | E698: Michael E Higgins | F698: F | G698: Inventory Asset : Finished Goods | H698: 18.1 | I698: NA Games-STORE | J698: RNT1-PS5-WS-VG-PE | K698: REYNATIS PS5
B699: Item Fulfillment | C699: 2024-09-20T00:00:00.000 | D699: 433873 | E699: 17596 Tony Le | F699: F | G699: Inventory Asset : Finished Goods | H699: 18.1 | I699: NA Games-STORE | J699: RNT1-PS5-WS-VG-PE | K699: REYNATIS PS5
B700: Item Fulfillment | C700: 2024-09-20T00:00:00.000 | D700: 433858 | E700: 22411 Ryan Holler | F700: F | G700: Inventory Asset : Finished Goods | H700: 18.1 | I700: NA Games-STORE | J700: RNT1-PS5-WS-VG-PE | K700: REYNATIS PS5
B701: Item Fulfillment | C701: 2024-09-20T00:00:00.000 | D701: 433991 | E701: Michael White [1000281321] | F701: F | G701: Inventory Asset : Finished Goods | H701: 18.1 | I701: NA Games-STORE | J701: RNT1-PS5-WS-VG-PE | K701: REYNATIS PS5
B702: Item Fulfillment | C702: 2024-09-20T00:00:00.000 | D702: 434173 | E702: Anthony 22 | F702: F | G702: Inventory Asset : Finished Goods | H702: 18.1 | I702: NA Games-STORE | J702: RNT1-PS5-WS-VG-PE | K702: REYNATIS PS5
B703: Item Fulfillment | C703: 2024-09-20T00:00:00.000 | D703: 434148 | E703: 23232 Jacob Milan | F703: F | G703: Inventory Asset : Finished Goods | H703: 18.1 | I703: NA Games-STORE | J703: RNT1-PS5-WS-VG-PE | K703: REYNATIS PS5
B704: Item Fulfillment | C704: 2024-09-20T00:00:00.000 | D704: 433747 | E704: James Cutillo [1000318860] | F704: F | G704: Inventory Asset : Finished Goods | H704: 18.1 | I704: NA Games-STORE | J704: RNT1-PS5-WS-VG-PE | K704: REYNATIS PS5
B705: Item Fulfillment | C705: 2024-09-20T00:00:00.000 | D705: 433908 | E705: Lawrence Pulliam | F705: F | G705: Inventory Asset : Finished Goods | H705: 18.1 | I705: NA Games-STORE | J705: RNT1-PS5-WS-VG-PE | K705: REYNATIS PS5
B706: Item Fulfillment | C706: 2024-09-20T00:00:00.000 | D706: 434065 | E706: Daniel Blount | F706: F | G706: Inventory Asset : Finished Goods | H706: 18.1 | I706: NA Games-STORE | J706: RNT1-PS5-WS-VG-PE | K706: REYNATIS PS5
B707: Item Fulfillment | C707: 2024-09-20T00:00:00.000 | D707: 433883 | E707: Mark Jeng [21188] | F707: F | G707: Inventory Asset : Finished Goods | H707: 18.1 | I707: NA Games-STORE | J707: RNT1-PS5-WS-VG-PE | K707: REYNATIS PS5
B708: Item Fulfillment | C708: 2024-09-20T00:00:00.000 | D708: 434043 | E708: Felicia Salvaty 3 | F708: F | G708: Inventory Asset : Finished Goods | H708: 18.1 | I708: NA Games-STORE | J708: RNT1-PS5-WS-VG-PE | K708: REYNATIS PS5
B709: Item Fulfillment | C709: 2024-09-20T00:00:00.000 | D709: 433861 | E709: 22412 tiffany tran | F709: F | G709: Inventory Asset : Finished Goods | H709: 18.1 | I709: NA Games-STORE | J709: RNT1-PS5-WS-VG-PE | K709: REYNATIS PS5
B710: Item Fulfillment | C710: 2024-09-20T00:00:00.000 | D710: 434228 | E710: Timothy Flanagan [1000203913] | F710: F | G710: Inventory Asset : Finished Goods | H710: 18.1 | I710: NA Games-STORE | J710: RNT1-PS5-WS-VG-PE | K710: REYNATIS PS5
B711: Item Fulfillment | C711: 2024-09-20T00:00:00.000 | D711: 434167 | E711: 20939 Brandon Hewitt | F711: F | G711: Inventory Asset : Finished Goods | H711: 18.1 | I711: NA Games-STORE | J711: RNT1-PS5-WS-VG-PE | K711: REYNATIS PS5
B712: Item Fulfillment | C712: 2024-09-20T00:00:00.000 | D712: 434157 | E712: 22433 Patrick De Jesus | F712: F | G712: Inventory Asset : Finished Goods | H712: 18.1 | I712: NA Games-STORE | J712: RNT1-PS5-WS-VG-PE | K712: REYNATIS PS5
B713: Item Fulfillment | C713: 2024-09-20T00:00:00.000 | D713: 433740 | E713: 22364 Camille Buck | F713: F | G713: Inventory Asset : Finished Goods | H713: 18.1 | I713: NA Games-STORE | J713: RNT1-PS5-WS-VG-PE | K713: REYNATIS PS5
B714: Item Fulfillment | C714: 2024-09-20T00:00:00.000 | D714: 433915 | E714: Antonio Perez | F714: F | G714: Inventory Asset : Finished Goods | H714: 18.1 | I714: NA Games-STORE | J714: RNT1-PS5-WS-VG-PE | K714: REYNATIS PS5
B715: Item Fulfillment | C715: 2024-09-20T00:00:00.000 | D715: 434060 | E715: 19550 Ernesto Duran | F715: F | G715: Inventory Asset : Finished Goods | H715: 18.1 | I715: NA Games-STORE | J715: RNT1-PS5-WS-VG-PE | K715: REYNATIS PS5
B716: Item Fulfillment | C716: 2024-09-20T00:00:00.000 | D716: 434051 | E716: Mikai Young | F716: F | G716: Inventory Asset : Finished Goods | H716: 18.1 | I716: NA Games-STORE | J716: RNT1-PS5-WS-VG-PE | K716: REYNATIS PS5
B717: Item Fulfillment | C717: 2024-09-20T00:00:00.000 | D717: 434008 | E717: Matthew Carnell | F717: F | G717: Inventory Asset : Finished Goods | H717: 18.1 | I717: NA Games-STORE | J717: RNT1-PS5-WS-VG-PE | K717: REYNATIS PS5
B718: Item Fulfillment | C718: 2024-09-20T00:00:00.000 | D718: 433987 | E718: John Schulz | F718: F | G718: Inventory Asset : Finished Goods | H718: 18.1 | I718: NA Games-STORE | J718: RNT1-PS5-WS-VG-PE | K718: REYNATIS PS5
B719: Item Fulfillment | C719: 2024-09-20T00:00:00.000 | D719: 434089 | E719: 21229 Kevin Cantu | F719: F | G719: Inventory Asset : Finished Goods | H719: 18.1 | I719: NA Games-STORE | J719: RNT1-PS5-WS-VG-PE | K719: REYNATIS PS5
B720: Item Fulfillment | C720: 2024-09-20T00:00:00.000 | D720: 434131 | E720: Ashlee Rodgers | F720: F | G720: Inventory Asset : Finished Goods | H720: 18.1 | I720: NA Games-STORE | J720: RNT1-PS5-WS-VG-PE | K720: REYNATIS PS5
B721: Item Fulfillment | C721: 2024-09-20T00:00:00.000 | D721: 434215 | E721: Michael Taylor [1000205328] | F721: F | G721: Inventory Asset : Finished Goods | H721: 18.1 | I721: NA Games-STORE | J721: RNT1-PS5-WS-VG-PE | K721: REYNATIS PS5
B722: Item Fulfillment | C722: 2024-09-20T00:00:00.000 | D722: 433963 | E722: Terry Haas [1000261741] | F722: F | G722: Inventory Asset : Finished Goods | H722: 18.1 | I722: NA Games-STORE | J722: RNT1-PS5-WS-VG-PE | K722: REYNATIS PS5
B723: Item Fulfillment | C723: 2024-09-20T00:00:00.000 | D723: 433824 | E723: Anthony Gigliotti | F723: F | G723: Inventory Asset : Finished Goods | H723: 18.1 | I723: NA Games-STORE | J723: RNT1-PS5-WS-VG-PE | K723: REYNATIS PS5
B724: Item Fulfillment | C724: 2024-09-20T00:00:00.000 | D724: 433748 | E724: Bethany Skadin [51446] | F724: F | G724: Inventory Asset : Finished Goods | H724: 18.1 | I724: NA Games-STORE | J724: RNT1-PS5-WS-VG-PE | K724: REYNATIS PS5
B725: Item Fulfillment | C725: 2024-09-20T00:00:00.000 | D725: 433837 | E725: Nicholas Fackovec | F725: F | G725: Inventory Asset : Finished Goods | H725: 18.1 | I725: NA Games-STORE | J725: RNT1-PS5-WS-VG-PE | K725: REYNATIS PS5
B726: Item Fulfillment | C726: 2024-09-20T00:00:00.000 | D726: 434140 | E726: Todd Cavanaugh | F726: F | G726: Inventory Asset : Finished Goods | H726: 18.1 | I726: NA Games-STORE | J726: RNT1-PS5-WS-VG-PE | K726: REYNATIS PS5
B727: Item Fulfillment | C727: 2024-09-20T00:00:00.000 | D727: 434147 | E727: Andrew Krisnawan | F727: F | G727: Inventory Asset : Finished Goods | H727: 18.1 | I727: NA Games-STORE | J727: RNT1-PS5-WS-VG-PE | K727: REYNATIS PS5
B728: Item Fulfillment | C728: 2024-09-20T00:00:00.000 | D728: 433804 | E728: David Ramos Romero | F728: F | G728: Inventory Asset : Finished Goods | H728: 18.1 | I728: NA Games-STORE | J728: RNT1-PS5-WS-VG-PE | K728: REYNATIS PS5
B729: Item Fulfillment | C729: 2024-09-20T00:00:00.000 | D729: 433961 | E729: Nicholas Fancher [1000353245] | F729: F | G729: Inventory Asset : Finished Goods | H729: 18.1 | I729: NA Games-STORE | J729: RNT1-PS5-WS-VG-PE | K729: REYNATIS PS5
B730: Item Fulfillment | C730: 2024-09-20T00:00:00.000 | D730: 433791 | E730: 22380 Barkev Chaghlasian | F730: F | G730: Inventory Asset : Finished Goods | H730: 18.1 | I730: NA Games-STORE | J730: RNT1-PS5-WS-VG-PE | K730: REYNATIS PS5
B731: Item Fulfillment | C731: 2024-09-20T00:00:00.000 | D731: 433922 | E731: Jen Kellner | F731: F | G731: Inventory Asset : Finished Goods | H731: 18.1 | I731: NA Games-STORE | J731: RNT1-PS5-WS-VG-PE | K731: REYNATIS PS5
B732: Item Fulfillment | C732: 2024-09-20T00:00:00.000 | D732: 433992 | E732: Grant Rivera | F732: F | G732: Inventory Asset : Finished Goods | H732: 18.1 | I732: NA Games-STORE | J732: RNT1-PS5-WS-VG-PE | K732: REYNATIS PS5
B733: Item Fulfillment | C733: 2024-09-20T00:00:00.000 | D733: 434098 | E733: 22699 Kyle Robinson | F733: F | G733: Inventory Asset : Finished Goods | H733: 18.1 | I733: NA Games-STORE | J733: RNT1-PS5-WS-VG-PE | K733: REYNATIS PS5
B734: Item Fulfillment | C734: 2024-09-20T00:00:00.000 | D734: 434136 | E734: JONATHAN Wright | F734: F | G734: Inventory Asset : Finished Goods | H734: 18.1 | I734: NA Games-STORE | J734: RNT1-PS5-WS-VG-PE | K734: REYNATIS PS5
B735: Item Fulfillment | C735: 2024-09-20T00:00:00.000 | D735: 434252 | E735: 23674 Harrison Troise | F735: F | G735: Inventory Asset : Finished Goods | H735: 18.1 | I735: NA Games-STORE | J735: RNT1-PS5-WS-VG-PE | K735: REYNATIS PS5
B736: Item Fulfillment | C736: 2024-09-20T00:00:00.000 | D736: 434218 | E736: 23500 William Glaspie | F736: F | G736: Inventory Asset : Finished Goods | H736: 18.1 | I736: NA Games-STORE | J736: RNT1-PS5-WS-VG-PE | K736: REYNATIS PS5
B737: Item Fulfillment | C737: 2024-09-20T00:00:00.000 | D737: 434162 | E737: Marc Wells | F737: F | G737: Inventory Asset : Finished Goods | H737: 18.1 | I737: NA Games-STORE | J737: RNT1-PS5-WS-VG-PE | K737: REYNATIS PS5
B738: Item Fulfillment | C738: 2024-09-20T00:00:00.000 | D738: 433938 | E738: 19048 Anthony Rush | F738: F | G738: Inventory Asset : Finished Goods | H738: 18.1 | I738: NA Games-STORE | J738: RNT1-PS5-WS-VG-PE | K738: REYNATIS PS5
B739: Item Fulfillment | C739: 2024-09-20T00:00:00.000 | D739: 434033 | E739: 20586 Vinh Nguyen | F739: F | G739: Inventory Asset : Finished Goods | H739: 18.1 | I739: NA Games-STORE | J739: RNT1-PS5-WS-VG-PE | K739: REYNATIS PS5
B740: Item Fulfillment | C740: 2024-09-20T00:00:00.000 | D740: 433993 | E740: 22264 Jonathan Edward Houston | F740: F | G740: Inventory Asset : Finished Goods | H740: 18.1 | I740: NA Games-STORE | J740: RNT1-PS5-WS-VG-PE | K740: REYNATIS PS5
B741: Item Fulfillment | C741: 2024-09-20T00:00:00.000 | D741: 434100 | E741: 22700 Preston Green | F741: F | G741: Inventory Asset : Finished Goods | H741: 18.1 | I741: NA Games-STORE | J741: RNT1-PS5-WS-VG-PE | K741: REYNATIS PS5
B742: Item Fulfillment | C742: 2024-09-20T00:00:00.000 | D742: 434264 | E742: Carlos Landa | F742: F | G742: Inventory Asset : Finished Goods | H742: 18.1 | I742: NA Games-STORE | J742: RNT1-PS5-WS-VG-PE | K742: REYNATIS PS5
B743: Item Fulfillment | C743: 2024-09-20T00:00:00.000 | D743: 434249 | E743: 23673 Alexis Aguirre | F743: F | G743: Inventory Asset : Finished Goods | H743: 18.1 | I743: NA Games-STORE | J743: RNT1-PS5-WS-VG-PE | K743: REYNATIS PS5
B744: Item Fulfillment | C744: 2024-09-20T00:00:00.000 | D744: 434145 | E744: 23226 Rutilo Lopez | F744: F | G744: Inventory Asset : Finished Goods | H744: 18.1 | I744: NA Games-STORE | J744: RNT1-PS5-WS-VG-PE | K744: REYNATIS PS5
B745: Item Fulfillment | C745: 2024-09-20T00:00:00.000 | D745: 433957 | E745: Alice Nazon | F745: F | G745: Inventory Asset : Finished Goods | H745: 18.1 | I745: NA Games-STORE | J745: RNT1-PS5-WS-VG-PE | K745: REYNATIS PS5
B746: Item Fulfillment | C746: 2024-09-20T00:00:00.000 | D746: 433833 | E746: 22397 Chris Morozin | F746: F | G746: Inventory Asset : Finished Goods | H746: 18.1 | I746: NA Games-STORE | J746: RNT1-PS5-WS-VG-PE | K746: REYNATIS PS5
B747: Item Fulfillment | C747: 2024-09-20T00:00:00.000 | D747: 433931 | E747: Brandy Stevens [1000205017] | F747: F | G747: Inventory Asset : Finished Goods | H747: 18.1 | I747: NA Games-STORE | J747: RNT1-PS5-WS-VG-PE | K747: REYNATIS PS5
B748: Item Fulfillment | C748: 2024-09-20T00:00:00.000 | D748: 434067 | E748: Terrence Singleton | F748: F | G748: Inventory Asset : Finished Goods | H748: 18.1 | I748: NA Games-STORE | J748: RNT1-PS5-WS-VG-PE | K748: REYNATIS PS5
B749: Item Fulfillment | C749: 2024-09-20T00:00:00.000 | D749: 434064 | E749: David Dang 2 | F749: F | G749: Inventory Asset : Finished Goods | H749: 18.1 | I749: NA Games-STORE | J749: RNT1-PS5-WS-VG-PE | K749: REYNATIS PS5
B750: Item Fulfillment | C750: 2024-09-20T00:00:00.000 | D750: 433896 | E750: 22434 Dario Reyes | F750: F | G750: Inventory Asset : Finished Goods | H750: 18.1 | I750: NA Games-STORE | J750: RNT1-PS5-WS-VG-PE | K750: REYNATIS PS5
B751: Item Fulfillment | C751: 2024-09-20T00:00:00.000 | D751: 434020 | E751: Gregory Little | F751: F | G751: Inventory Asset : Finished Goods | H751: 18.1 | I751: NA Games-STORE | J751: RNT1-PS5-WS-VG-PE | K751: REYNATIS PS5
B752: Item Fulfillment | C752: 2024-09-20T00:00:00.000 | D752: 434248 | E752: Anthony Romero Gaspar | F752: F | G752: Inventory Asset : Finished Goods | H752: 18.1 | I752: NA Games-STORE | J752: RNT1-PS5-WS-VG-PE | K752: REYNATIS PS5
B753: Item Fulfillment | C753: 2024-09-20T00:00:00.000 | D753: 434213 | E753: 23452 Martin Williams | F753: F | G753: Inventory Asset : Finished Goods | H753: 18.1 | I753: NA Games-STORE | J753: RNT1-PS5-WS-VG-PE | K753: REYNATIS PS5
B754: Item Fulfillment | C754: 2024-09-20T00:00:00.000 | D754: 434209 | E754: 23416 Christopher Jenkins | F754: F | G754: Inventory Asset : Finished Goods | H754: 18.1 | I754: NA Games-STORE | J754: RNT1-PS5-WS-VG-PE | K754: REYNATIS PS5
B755: Item Fulfillment | C755: 2024-09-20T00:00:00.000 | D755: 434166 | E755: Daniel Valencia | F755: F | G755: Inventory Asset : Finished Goods | H755: 18.1 | I755: NA Games-STORE | J755: RNT1-PS5-WS-VG-PE | K755: REYNATIS PS5
B756: Item Fulfillment | C756: 2024-09-20T00:00:00.000 | D756: 434160 | E756: Jeremy Hunley | F756: F | G756: Inventory Asset : Finished Goods | H756: 18.1 | I756: NA Games-STORE | J756: RNT1-PS5-WS-VG-PE | K756: REYNATIS PS5
B757: Item Fulfillment | C757: 2024-09-20T00:00:00.000 | D757: 433911 | E757: ALLEN FUNG | F757: F | G757: Inventory Asset : Finished Goods | H757: 18.1 | I757: NA Games-STORE | J757: RNT1-PS5-WS-VG-PE | K757: REYNATIS PS5
B758: Item Fulfillment | C758: 2024-09-20T00:00:00.000 | D758: 434029 | E758: Ben Williams [1000321853] | F758: F | G758: Inventory Asset : Finished Goods | H758: 18.1 | I758: NA Games-STORE | J758: RNT1-PS5-WS-VG-PE | K758: REYNATIS PS5
B759: Item Fulfillment | C759: 2024-09-20T00:00:00.000 | D759: 433860 | E759: 22414 David Harm | F759: F | G759: Inventory Asset : Finished Goods | H759: 18.1 | I759: NA Games-STORE | J759: RNT1-PS5-WS-VG-PE | K759: REYNATIS PS5
B760: Item Fulfillment | C760: 2024-09-20T00:00:00.000 | D760: 434002 | E760: 22501 Alonso Pastor | F760: F | G760: Inventory Asset : Finished Goods | H760: 18.1 | I760: NA Games-STORE | J760: RNT1-PS5-WS-VG-PE | K760: REYNATIS PS5
B761: Item Fulfillment | C761: 2024-09-20T00:00:00.000 | D761: 433818 | E761: Hunter Pitre | F761: F | G761: Inventory Asset : Finished Goods | H761: 18.1 | I761: NA Games-STORE | J761: RNT1-PS5-WS-VG-PE | K761: REYNATIS PS5
B762: Item Fulfillment | C762: 2024-09-20T00:00:00.000 | D762: 434127 | E762: Jesus Michel | F762: F | G762: Inventory Asset : Finished Goods | H762: 18.1 | I762: NA Games-STORE | J762: RNT1-PS5-WS-VG-PE | K762: REYNATIS PS5
B763: Item Fulfillment | C763: 2024-09-20T00:00:00.000 | D763: 434259 | E763: Ian Bauer | F763: F | G763: Inventory Asset : Finished Goods | H763: 18.1 | I763: NA Games-STORE | J763: RNT1-PS5-WS-VG-PE | K763: REYNATIS PS5
B764: Item Fulfillment | C764: 2024-09-20T00:00:00.000 | D764: 434201 | E764: Andrea N. Knox | F764: F | G764: Inventory Asset : Finished Goods | H764: 18.1 | I764: NA Games-STORE | J764: RNT1-PS5-WS-VG-PE | K764: REYNATIS PS5
B765: Item Fulfillment | C765: 2024-09-20T00:00:00.000 | D765: 434174 | E765: 23301 Alex Shadood | F765: F | G765: Inventory Asset : Finished Goods | H765: 18.1 | I765: NA Games-STORE | J765: RNT1-PS5-WS-VG-PE | K765: REYNATIS PS5
B766: Item Fulfillment | C766: 2024-09-20T00:00:00.000 | D766: 434146 | E766: 22432 Dylan Ross | F766: F | G766: Inventory Asset : Finished Goods | H766: 18.1 | I766: NA Games-STORE | J766: RNT1-PS5-WS-VG-PE | K766: REYNATIS PS5
B767: Item Fulfillment | C767: 2024-09-20T00:00:00.000 | D767: 433803 | E767: Timothy Adams | F767: F | G767: Inventory Asset : Finished Goods | H767: 18.1 | I767: NA Games-STORE | J767: RNT1-PS5-WS-VG-PE | K767: REYNATIS PS5
B768: Item Fulfillment | C768: 2024-09-20T00:00:00.000 | D768: 433796 | E768: 22382 Cristian Vargas | F768: F | G768: Inventory Asset : Finished Goods | H768: 18.1 | I768: NA Games-STORE | J768: RNT1-PS5-WS-VG-PE | K768: REYNATIS PS5
B769: Item Fulfillment | C769: 2024-09-20T00:00:00.000 | D769: 433769 | E769: 48 Chad Minsky | F769: F | G769: Inventory Asset : Finished Goods | H769: 18.1 | I769: NA Games-STORE | J769: RNT1-PS5-WS-VG-PE | K769: REYNATIS PS5
B770: Item Fulfillment | C770: 2024-09-20T00:00:00.000 | D770: 433719 | E770: 22353 Elise Oesterreich | F770: F | G770: Inventory Asset : Finished Goods | H770: 18.1 | I770: NA Games-STORE | J770: RNT1-PS5-WS-VG-PE | K770: REYNATIS PS5
B771: Item Fulfillment | C771: 2024-09-20T00:00:00.000 | D771: 433894 | E771: Cody Smith | F771: F | G771: Inventory Asset : Finished Goods | H771: 18.1 | I771: NA Games-STORE | J771: RNT1-PS5-WS-VG-PE | K771: REYNATIS PS5
B772: Item Fulfillment | C772: 2024-09-20T00:00:00.000 | D772: 433843 | E772: Brad Broeker | F772: F | G772: Inventory Asset : Finished Goods | H772: 18.1 | I772: NA Games-STORE | J772: RNT1-PS5-WS-VG-PE | K772: REYNATIS PS5
B773: Item Fulfillment | C773: 2024-09-20T00:00:00.000 | D773: 433983 | E773: Richard Huggins II | F773: F | G773: Inventory Asset : Finished Goods | H773: 18.1 | I773: NA Games-STORE | J773: RNT1-PS5-WS-VG-PE | K773: REYNATIS PS5
B774: Item Fulfillment | C774: 2024-09-20T00:00:00.000 | D774: 434090 | E774: musashi | F774: F | G774: Inventory Asset : Finished Goods | H774: 18.1 | I774: NA Games-STORE | J774: RNT1-PS5-WS-VG-PE | K774: REYNATIS PS5
B775: Item Fulfillment | C775: 2024-09-20T00:00:00.000 | D775: 434078 | E775: Michael Resendiz | F775: F | G775: Inventory Asset : Finished Goods | H775: 18.1 | I775: NA Games-STORE | J775: RNT1-PS5-WS-VG-PE | K775: REYNATIS PS5
B776: Item Fulfillment | C776: 2024-09-20T00:00:00.000 | D776: 434132 | E776: 23204 Joel Ledezma | F776: F | G776: Inventory Asset : Finished Goods | H776: 18.1 | I776: NA Games-STORE | J776: RNT1-PS5-WS-VG-PE | K776: REYNATIS PS5
B777: Item Fulfillment | C777: 2024-09-20T00:00:00.000 | D777: 434234 | E777: 22656 Riker Goble | F777: F | G777: Inventory Asset : Finished Goods | H777: 18.1 | I777: NA Games-STORE | J777: RNT1-PS5-WS-VG-PE | K777: REYNATIS PS5
B778: Item Fulfillment | C778: 2024-09-20T00:00:00.000 | D778: 433788 | E778: Mary McCafferty | F778: F | G778: Inventory Asset : Finished Goods | H778: 18.1 | I778: NA Games-STORE | J778: RNT1-PS5-WS-VG-PE | K778: REYNATIS PS5
B779: Item Fulfillment | C779: 2024-09-20T00:00:00.000 | D779: 433927 | E779: Justin Payne | F779: F | G779: Inventory Asset : Finished Goods | H779: 18.1 | I779: NA Games-STORE | J779: RNT1-PS5-WS-VG-PE | K779: REYNATIS PS5
B780: Item Fulfillment | C780: 2024-09-20T00:00:00.000 | D780: 433919 | E780: Brenda Serna | F780: F | G780: Inventory Asset : Finished Goods | H780: 18.1 | I780: NA Games-STORE | J780: RNT1-PS5-WS-VG-PE | K780: REYNATIS PS5
B781: Item Fulfillment | C781: 2024-09-20T00:00:00.000 | D781: 433841 | E781: 22400 Ali Vafaeian | F781: F | G781: Inventory Asset : Finished Goods | H781: 18.1 | I781: NA Games-STORE | J781: RNT1-PS5-WS-VG-PE | K781: REYNATIS PS5
B782: Item Fulfillment | C782: 2024-09-20T00:00:00.000 | D782: 434107 | E782: 5037 Richard Maxwell | F782: F | G782: Inventory Asset : Finished Goods | H782: 18.1 | I782: NA Games-STORE | J782: RNT1-PS5-WS-VG-PE | K782: REYNATIS PS5
B783: Item Fulfillment | C783: 2024-09-20T00:00:00.000 | D783: 434074 | E783: DukeBryson Duke | F783: F | G783: Inventory Asset : Finished Goods | H783: 18.1 | I783: NA Games-STORE | J783: RNT1-PS5-WS-VG-PE | K783: REYNATIS PS5
B784: Item Fulfillment | C784: 2024-09-20T00:00:00.000 | D784: 434135 | E784: Terell Brown | F784: F | G784: Inventory Asset : Finished Goods | H784: 18.1 | I784: NA Games-STORE | J784: RNT1-PS5-WS-VG-PE | K784: REYNATIS PS5
B785: Item Fulfillment | C785: 2024-09-20T00:00:00.000 | D785: 434275 | E785: 23719 Kyree Bradbury | F785: F | G785: Inventory Asset : Finished Goods | H785: 18.1 | I785: NA Games-STORE | J785: RNT1-PS5-WS-VG-PE | K785: REYNATIS PS5
B786: Item Fulfillment | C786: 2024-09-20T00:00:00.000 | D786: 434256 | E786: Louise Chanthavisouk | F786: F | G786: Inventory Asset : Finished Goods | H786: 18.1 | I786: NA Games-STORE | J786: RNT1-PS5-WS-VG-PE | K786: REYNATIS PS5
B787: Item Fulfillment | C787: 2024-09-20T00:00:00.000 | D787: 434247 | E787: David Nguyen [1000269218] | F787: F | G787: Inventory Asset : Finished Goods | H787: 18.1 | I787: NA Games-STORE | J787: RNT1-PS5-WS-VG-PE | K787: REYNATIS PS5
B788: Item Fulfillment | C788: 2024-09-20T00:00:00.000 | D788: 434202 | E788: 23391 K Thao | F788: F | G788: Inventory Asset : Finished Goods | H788: 18.1 | I788: NA Games-STORE | J788: RNT1-PS5-WS-VG-PE | K788: REYNATIS PS5
B789: Item Fulfillment | C789: 2024-09-20T00:00:00.000 | D789: 434198 | E789: Jamin Carpenter | F789: F | G789: Inventory Asset : Finished Goods | H789: 18.1 | I789: NA Games-STORE | J789: RNT1-PS5-WS-VG-PE | K789: REYNATIS PS5
B790: Item Fulfillment | C790: 2024-09-20T00:00:00.000 | D790: 433831 | E790: Sean Powers [1000233878] | F790: F | G790: Inventory Asset : Finished Goods | H790: 18.1 | I790: NA Games-STORE | J790: RNT1-PS5-WS-VG-PE | K790: REYNATIS PS5
B791: Item Fulfillment | C791: 2024-09-20T00:00:00.000 | D791: 434106 | E791: gauu | F791: F | G791: Inventory Asset : Finished Goods | H791: 18.1 | I791: NA Games-STORE | J791: RNT1-PS5-WS-VG-PE | K791: REYNATIS PS5
B792: Item Fulfillment | C792: 2024-09-20T00:00:00.000 | D792: 434102 | E792: Jason Dickison | F792: F | G792: Inventory Asset : Finished Goods | H792: 18.1 | I792: NA Games-STORE | J792: RNT1-PS5-WS-VG-PE | K792: REYNATIS PS5
B793: Item Fulfillment | C793: 2024-09-20T00:00:00.000 | D793: 434080 | E793: Jinpachi | F793: F | G793: Inventory Asset : Finished Goods | H793: 18.1 | I793: NA Games-STORE | J793: RNT1-PS5-WS-VG-PE | K793: REYNATIS PS5
B794: Item Fulfillment | C794: 2024-09-20T00:00:00.000 | D794: 434251 | E794: Cameron Yarger | F794: F | G794: Inventory Asset : Finished Goods | H794: 18.1 | I794: NA Games-STORE | J794: RNT1-PS5-WS-VG-PE | K794: REYNATIS PS5
B795: Item Fulfillment | C795: 2024-09-20T00:00:00.000 | D795: 434233 | E795: Daniel Castaneda | F795: F | G795: Inventory Asset : Finished Goods | H795: 18.1 | I795: NA Games-STORE | J795: RNT1-PS5-WS-VG-PE | K795: REYNATIS PS5
B796: Item Fulfillment | C796: 2024-09-20T00:00:00.000 | D796: 434230 | E796: 23610 Julian Bernstein | F796: F | G796: Inventory Asset : Finished Goods | H796: 18.1 | I796: NA Games-STORE | J796: RNT1-PS5-WS-VG-PE | K796: REYNATIS PS5
B797: Item Fulfillment | C797: 2024-09-20T00:00:00.000 | D797: 434217 | E797: Kat Nightray | F797: F | G797: Inventory Asset : Finished Goods | H797: 18.1 | I797: NA Games-STORE | J797: RNT1-PS5-WS-VG-PE | K797: REYNATIS PS5
B798: Item Fulfillment | C798: 2024-09-20T00:00:00.000 | D798: 434161 | E798: Aloras8BitnStuff | F798: F | G798: Inventory Asset : Finished Goods | H798: 18.1 | I798: NA Games-STORE | J798: RNT1-PS5-WS-VG-PE | K798: REYNATIS PS5
B799: Item Fulfillment | C799: 2024-09-20T00:00:00.000 | D799: 434155 | E799: keith mclean | F799: F | G799: Inventory Asset : Finished Goods | H799: 18.1 | I799: NA Games-STORE | J799: RNT1-PS5-WS-VG-PE | K799: REYNATIS PS5
B800: Item Fulfillment | C800: 2024-09-20T00:00:00.000 | D800: 433941 | E800: primalmatrix | F800: F | G800: Inventory Asset : Finished Goods | H800: 18.1 | I800: NA Games-STORE | J800: RNT1-PS5-WS-VG-PE | K800: REYNATIS PS5
B801: Item Fulfillment | C801: 2024-09-20T00:00:00.000 | D801: 433923 | E801: Nelson Poblete | F801: F | G801: Inventory Asset : Finished Goods | H801: 18.1 | I801: NA Games-STORE | J801: RNT1-PS5-WS-VG-PE | K801: REYNATIS PS5
B802: Item Fulfillment | C802: 2024-09-20T00:00:00.000 | D802: 433871 | E802: Tony Aguilar | F802: F | G802: Inventory Asset : Finished Goods | H802: 18.1 | I802: NA Games-STORE | J802: RNT1-PS5-WS-VG-PE | K802: REYNATIS PS5
B803: Item Fulfillment | C803: 2024-09-20T00:00:00.000 | D803: 433840 | E803: James Kahvajian [1000344048] | F803: F | G803: Inventory Asset : Finished Goods | H803: 18.1 | I803: NA Games-STORE | J803: RNT1-PS5-WS-VG-PE | K803: REYNATIS PS5
B804: Item Fulfillment | C804: 2024-09-20T00:00:00.000 | D804: 434104 | E804: Jimmy Soung 3 | F804: F | G804: Inventory Asset : Finished Goods | H804: 18.1 | I804: NA Games-STORE | J804: RNT1-PS5-WS-VG-PE | K804: REYNATIS PS5
B805: Item Fulfillment | C805: 2024-09-20T00:00:00.000 | D805: 434095 | E805: Maksim Tsirulnik | F805: F | G805: Inventory Asset : Finished Goods | H805: 18.1 | I805: NA Games-STORE | J805: RNT1-PS5-WS-VG-PE | K805: REYNATIS PS5
B806: Item Fulfillment | C806: 2024-09-20T00:00:00.000 | D806: 434242 | E806: 22555 Luke Muller | F806: F | G806: Inventory Asset : Finished Goods | H806: 18.1 | I806: NA Games-STORE | J806: RNT1-PS5-WS-VG-PE | K806: REYNATIS PS5
B807: Item Fulfillment | C807: 2024-09-20T00:00:00.000 | D807: 434235 | E807: John Anderson | F807: F | G807: Inventory Asset : Finished Goods | H807: 18.1 | I807: NA Games-STORE | J807: RNT1-PS5-WS-VG-PE | K807: REYNATIS PS5
B808: Item Fulfillment | C808: 2024-09-20T00:00:00.000 | D808: 433776 | E808: Patricia Smith | F808: F | G808: Inventory Asset : Finished Goods | H808: 18.1 | I808: NA Games-STORE | J808: RNT1-PS5-WS-VG-PE | K808: REYNATIS PS5
B809: Item Fulfillment | C809: 2024-09-20T00:00:00.000 | D809: 433866 | E809: Michael Willis | F809: F | G809: Inventory Asset : Finished Goods | H809: 18.1 | I809: NA Games-STORE | J809: RNT1-PS5-WS-VG-PE | K809: REYNATIS PS5
B810: Item Fulfillment | C810: 2024-09-20T00:00:00.000 | D810: 433981 | E810: Gregory Guillen Guillen | F810: F | G810: Inventory Asset : Finished Goods | H810: 18.1 | I810: NA Games-STORE | J810: RNT1-PS5-WS-VG-PE | K810: REYNATIS PS5
B811: Item Fulfillment | C811: 2024-09-20T00:00:00.000 | D811: 434123 | E811: 23169 Taylor Gathright | F811: F | G811: Inventory Asset : Finished Goods | H811: 18.1 | I811: NA Games-STORE | J811: RNT1-PS5-WS-VG-PE | K811: REYNATIS PS5
B812: Item Fulfillment | C812: 2024-09-20T00:00:00.000 | D812: 434208 | E812: 101 Christopher Taylor | F812: F | G812: Inventory Asset : Finished Goods | H812: 18.1 | I812: NA Games-STORE | J812: RNT1-PS5-WS-VG-PE | K812: REYNATIS PS5
B813: Item Fulfillment | C813: 2024-09-20T00:00:00.000 | D813: 434187 | E813: Zain Zahoor [1000202555] | F813: F | G813: Inventory Asset : Finished Goods | H813: 18.1 | I813: NA Games-STORE | J813: RNT1-PS5-WS-VG-PE | K813: REYNATIS PS5
B814: Item Fulfillment | C814: 2024-09-20T00:00:00.000 | D814: 433965 | E814: tagamethb2 | F814: F | G814: Inventory Asset : Finished Goods | H814: 18.1 | I814: NA Games-STORE | J814: RNT1-PS5-WS-VG-PE | K814: REYNATIS PS5
B815: Item Fulfillment | C815: 2024-09-20T00:00:00.000 | D815: 433933 | E815: Sharon Keeth | F815: F | G815: Inventory Asset : Finished Goods | H815: 18.1 | I815: NA Games-STORE | J815: RNT1-PS5-WS-VG-PE | K815: REYNATIS PS5
B816: Item Fulfillment | C816: 2024-09-20T00:00:00.000 | D816: 433723 | E816: 22356 David Gay | F816: F | G816: Inventory Asset : Finished Goods | H816: 18.1 | I816: NA Games-STORE | J816: RNT1-PS5-WS-VG-PE | K816: REYNATIS PS5
B817: Item Fulfillment | C817: 2024-09-20T00:00:00.000 | D817: 434047 | E817: Justin Miller | F817: F | G817: Inventory Asset : Finished Goods | H817: 18.1 | I817: NA Games-STORE | J817: RNT1-PS5-WS-VG-PE | K817: REYNATIS PS5
B818: Item Fulfillment | C818: 2024-09-20T00:00:00.000 | D818: 434035 | E818: 22562 Muhamad Haziq Bin Mustapha | F818: F | G818: Inventory Asset : Finished Goods | H818: 18.1 | I818: NA Games-STORE | J818: RNT1-PS5-WS-VG-PE | K818: REYNATIS PS5
B819: Item Fulfillment | C819: 2024-09-20T00:00:00.000 | D819: 433990 | E819: 22488 Zachary Aiello | F819: F | G819: Inventory Asset : Finished Goods | H819: 18.1 | I819: NA Games-STORE | J819: RNT1-PS5-WS-VG-PE | K819: REYNATIS PS5
B820: Item Fulfillment | C820: 2024-09-20T00:00:00.000 | D820: 433813 | E820: Luis Vazquez | F820: F | G820: Inventory Asset : Finished Goods | H820: 18.1 | I820: NA Games-STORE | J820: RNT1-PS5-WS-VG-PE | K820: REYNATIS PS5
B821: Item Fulfillment | C821: 2024-09-20T00:00:00.000 | D821: 434091 | E821: Clarence Turner | F821: F | G821: Inventory Asset : Finished Goods | H821: 18.1 | I821: NA Games-STORE | J821: RNT1-PS5-WS-VG-PE | K821: REYNATIS PS5
B822: Item Fulfillment | C822: 2024-09-20T00:00:00.000 | D822: 434115 | E822: Daniel Puerto | F822: F | G822: Inventory Asset : Finished Goods | H822: 18.1 | I822: NA Games-STORE | J822: RNT1-PS5-WS-VG-PE | K822: REYNATIS PS5
B823: Item Fulfillment | C823: 2024-09-20T00:00:00.000 | D823: 434214 | E823: Zachary Porter | F823: F | G823: Inventory Asset : Finished Goods | H823: 18.1 | I823: NA Games-STORE | J823: RNT1-PS5-WS-VG-PE | K823: REYNATIS PS5
B824: Item Fulfillment | C824: 2024-09-20T00:00:00.000 | D824: 434182 | E824: Ajamu Huggins | F824: F | G824: Inventory Asset : Finished Goods | H824: 18.1 | I824: NA Games-STORE | J824: RNT1-PS5-WS-VG-PE | K824: REYNATIS PS5
B825: Item Fulfillment | C825: 2024-09-20T00:00:00.000 | D825: 434180 | E825: Stephen Mooney | F825: F | G825: Inventory Asset : Finished Goods | H825: 18.1 | I825: NA Games-STORE | J825: RNT1-PS5-WS-VG-PE | K825: REYNATIS PS5
B826: Item Fulfillment | C826: 2024-09-20T00:00:00.000 | D826: 434165 | E826: Jimmy Moua | F826: F | G826: Inventory Asset : Finished Goods | H826: 18.1 | I826: NA Games-STORE | J826: RNT1-PS5-WS-VG-PE | K826: REYNATIS PS5
B827: Item Fulfillment | C827: 2024-09-20T00:00:00.000 | D827: 433800 | E827: Justin James [1000246991] | F827: F | G827: Inventory Asset : Finished Goods | H827: 18.1 | I827: NA Games-STORE | J827: RNT1-PS5-WS-VG-PE | K827: REYNATIS PS5
B828: Item Fulfillment | C828: 2024-09-20T00:00:00.000 | D828: 433775 | E828: John Weaver | F828: F | G828: Inventory Asset : Finished Goods | H828: 18.1 | I828: NA Games-STORE | J828: RNT1-PS5-WS-VG-PE | K828: REYNATIS PS5
B829: Item Fulfillment | C829: 2024-09-20T00:00:00.000 | D829: 433942 | E829: Roy Moya | F829: F | G829: Inventory Asset : Finished Goods | H829: 18.1 | I829: NA Games-STORE | J829: RNT1-PS5-WS-VG-PE | K829: REYNATIS PS5
B830: Item Fulfillment | C830: 2024-09-20T00:00:00.000 | D830: 433902 | E830: Jared Jackson | F830: F | G830: Inventory Asset : Finished Goods | H830: 18.1 | I830: NA Games-STORE | J830: RNT1-PS5-WS-VG-PE | K830: REYNATIS PS5
B831: Item Fulfillment | C831: 2024-09-20T00:00:00.000 | D831: 434069 | E831: Jeff Krispow | F831: F | G831: Inventory Asset : Finished Goods | H831: 18.1 | I831: NA Games-STORE | J831: RNT1-PS5-WS-VG-PE | K831: REYNATIS PS5
B832: Item Fulfillment | C832: 2024-09-20T00:00:00.000 | D832: 434068 | E832: Douglas Bishop | F832: F | G832: Inventory Asset : Finished Goods | H832: 18.1 | I832: NA Games-STORE | J832: RNT1-PS5-WS-VG-PE | K832: REYNATIS PS5
B833: Item Fulfillment | C833: 2024-09-20T00:00:00.000 | D833: 434239 | E833: Chelsea Moore | F833: F | G833: Inventory Asset : Finished Goods | H833: 18.1 | I833: NA Games-STORE | J833: RNT1-PS5-WS-VG-PE | K833: REYNATIS PS5
B834: Item Fulfillment | C834: 2024-09-20T00:00:00.000 | D834: 434204 | E834: 23395 Brandon Bartholio | F834: F | G834: Inventory Asset : Finished Goods | H834: 18.1 | I834: NA Games-STORE | J834: RNT1-PS5-WS-VG-PE | K834: REYNATIS PS5
B835: Item Fulfillment | C835: 2024-09-20T00:00:00.000 | D835: 433780 | E835: William Gunderson | F835: F | G835: Inventory Asset : Finished Goods | H835: 18.1 | I835: NA Games-STORE | J835: RNT1-PS5-WS-VG-PE | K835: REYNATIS PS5
B836: Item Fulfillment | C836: 2024-09-20T00:00:00.000 | D836: 433778 | E836: Michael Alongi | F836: F | G836: Inventory Asset : Finished Goods | H836: 18.1 | I836: NA Games-STORE | J836: RNT1-PS5-WS-VG-PE | K836: REYNATIS PS5
B837: Item Fulfillment | C837: 2024-09-20T00:00:00.000 | D837: 433721 | E837: William Krivickas | F837: F | G837: Inventory Asset : Finished Goods | H837: 18.1 | I837: NA Games-STORE | J837: RNT1-PS5-WS-VG-PE | K837: REYNATIS PS5
B838: Item Fulfillment | C838: 2024-09-20T00:00:00.000 | D838: 434269 | E838: Jonathan Rodela | F838: F | G838: Inventory Asset : Finished Goods | H838: 18.1 | I838: NA Games-STORE | J838: RNT1-PS5-WS-VG-PE | K838: REYNATIS PS5
B839: Item Fulfillment | C839: 2024-09-20T00:00:00.000 | D839: 434195 | E839: Aaron Jones [1000275029] | F839: F | G839: Inventory Asset : Finished Goods | H839: 18.1 | I839: NA Games-STORE | J839: RNT1-PS5-WS-VG-PE | K839: REYNATIS PS5
B840: Item Fulfillment | C840: 2024-09-20T00:00:00.000 | D840: 434183 | E840: 23326 Matthew Garwin | F840: F | G840: Inventory Asset : Finished Goods | H840: 18.1 | I840: NA Games-STORE | J840: RNT1-PS5-WS-VG-PE | K840: REYNATIS PS5
B841: Item Fulfillment | C841: 2024-09-20T00:00:00.000 | D841: 433792 | E841: 19964 Richard Sawyer | F841: F | G841: Inventory Asset : Finished Goods | H841: 18.1 | I841: NA Games-STORE | J841: RNT1-PS5-WS-VG-PE | K841: REYNATIS PS5
B842: Item Fulfillment | C842: 2024-09-20T00:00:00.000 | D842: 433956 | E842: Jared Knapp | F842: F | G842: Inventory Asset : Finished Goods | H842: 18.1 | I842: NA Games-STORE | J842: RNT1-PS5-WS-VG-PE | K842: REYNATIS PS5
B843: Item Fulfillment | C843: 2024-09-20T00:00:00.000 | D843: 434038 | E843: 22471 Graciela Plasencia | F843: F | G843: Inventory Asset : Finished Goods | H843: 18.1 | I843: NA Games-STORE | J843: RNT1-PS5-WS-VG-PE | K843: REYNATIS PS5
B844: Item Fulfillment | C844: 2024-09-20T00:00:00.000 | D844: 434007 | E844: 22510 Timothy Russell | F844: F | G844: Inventory Asset : Finished Goods | H844: 18.1 | I844: NA Games-STORE | J844: RNT1-PS5-WS-VG-PE | K844: REYNATIS PS5
B845: Item Fulfillment | C845: 2024-09-20T00:00:00.000 | D845: 433964 | E845: 22472 Gustavo Patino | F845: F | G845: Inventory Asset : Finished Goods | H845: 18.1 | I845: NA Games-STORE | J845: RNT1-PS5-WS-VG-PE | K845: REYNATIS PS5
B846: Item Fulfillment | C846: 2024-09-20T00:00:00.000 | D846: 433728 | E846: 22352 Arielle Haddad | F846: F | G846: Inventory Asset : Finished Goods | H846: 18.1 | I846: NA Games-STORE | J846: RNT1-PS5-WS-VG-PE | K846: REYNATIS PS5
B847: Item Fulfillment | C847: 2024-09-20T00:00:00.000 | D847: 433906 | E847: Priscilla Han [146542] | F847: F | G847: Inventory Asset : Finished Goods | H847: 18.1 | I847: NA Games-STORE | J847: RNT1-PS5-WS-VG-PE | K847: REYNATIS PS5
B848: Item Fulfillment | C848: 2024-09-20T00:00:00.000 | D848: 433881 | E848: James Huang | F848: F | G848: Inventory Asset : Finished Goods | H848: 18.1 | I848: NA Games-STORE | J848: RNT1-PS5-WS-VG-PE | K848: REYNATIS PS5
B849: Item Fulfillment | C849: 2024-09-20T00:00:00.000 | D849: 433878 | E849: Michael Bramstedt | F849: F | G849: Inventory Asset : Finished Goods | H849: 18.1 | I849: NA Games-STORE | J849: RNT1-PS5-WS-VG-PE | K849: REYNATIS PS5
B850: Item Fulfillment | C850: 2024-09-20T00:00:00.000 | D850: 434011 | E850: Hashim Sayed Yousef | F850: F | G850: Inventory Asset : Finished Goods | H850: 18.1 | I850: NA Games-STORE | J850: RNT1-PS5-WS-VG-PE | K850: REYNATIS PS5
B851: Item Fulfillment | C851: 2024-09-20T00:00:00.000 | D851: 434005 | E851: Sebastian Raaphorst | F851: F | G851: Inventory Asset : Finished Goods | H851: 18.1 | I851: NA Games-STORE | J851: RNT1-PS5-WS-VG-PE | K851: REYNATIS PS5
B852: Item Fulfillment | C852: 2024-09-20T00:00:00.000 | D852: 434119 | E852: 20260 Derick Yung | F852: F | G852: Inventory Asset : Finished Goods | H852: 18.1 | I852: NA Games-STORE | J852: RNT1-PS5-WS-VG-PE | K852: REYNATIS PS5
B853: Item Fulfillment | C853: 2024-09-20T00:00:00.000 | D853: 434257 | E853: 23681 Tong Xiong | F853: F | G853: Inventory Asset : Finished Goods | H853: 18.1 | I853: NA Games-STORE | J853: RNT1-PS5-WS-VG-PE | K853: REYNATIS PS5
B854: Item Fulfillment | C854: 2024-09-20T00:00:00.000 | D854: 433967 | E854: 17392 Rhichik Das | F854: F | G854: Inventory Asset : Finished Goods | H854: 18.1 | I854: NA Games-STORE | J854: RNT1-PS5-WS-VG-PE | K854: REYNATIS PS5
B855: Item Fulfillment | C855: 2024-09-20T00:00:00.000 | D855: 433766 | E855: Rodolfo Calumpong | F855: F | G855: Inventory Asset : Finished Goods | H855: 18.1 | I855: NA Games-STORE | J855: RNT1-PS5-WS-VG-PE | K855: REYNATIS PS5
B856: Item Fulfillment | C856: 2024-09-20T00:00:00.000 | D856: 433924 | E856: Jazzi Lawson | F856: F | G856: Inventory Asset : Finished Goods | H856: 18.1 | I856: NA Games-STORE | J856: RNT1-PS5-WS-VG-PE | K856: REYNATIS PS5
B857: Item Fulfillment | C857: 2024-09-20T00:00:00.000 | D857: 433863 | E857: Jonathan Chan | F857: F | G857: Inventory Asset : Finished Goods | H857: 18.1 | I857: NA Games-STORE | J857: RNT1-PS5-WS-VG-PE | K857: REYNATIS PS5
B858: Item Fulfillment | C858: 2024-09-20T00:00:00.000 | D858: 433862 | E858: Adam Pagano | F858: F | G858: Inventory Asset : Finished Goods | H858: 18.1 | I858: NA Games-STORE | J858: RNT1-PS5-WS-VG-PE | K858: REYNATIS PS5
B859: Item Fulfillment | C859: 2024-09-20T00:00:00.000 | D859: 434075 | E859: Jessica Manipon [196429] | F859: F | G859: Inventory Asset : Finished Goods | H859: 18.1 | I859: NA Games-STORE | J859: RNT1-PS5-WS-VG-PE | K859: REYNATIS PS5
B860: Item Fulfillment | C860: 2024-09-20T00:00:00.000 | D860: 434279 | E860: Marisa Hoffower | F860: F | G860: Inventory Asset : Finished Goods | H860: 18.1 | I860: NA Games-STORE | J860: RNT1-PS5-WS-VG-PE | K860: REYNATIS PS5
B861: Item Fulfillment | C861: 2024-09-20T00:00:00.000 | D861: 434175 | E861: Lowell Shull | F861: F | G861: Inventory Asset : Finished Goods | H861: 18.1 | I861: NA Games-STORE | J861: RNT1-PS5-WS-VG-PE | K861: REYNATIS PS5
B862: Item Fulfillment | C862: 2024-09-20T00:00:00.000 | D862: 433889 | E862: 22429 Liam Orth | F862: F | G862: Inventory Asset : Finished Goods | H862: 18.1 | I862: NA Games-STORE | J862: RNT1-PS5-WS-VG-PE | K862: REYNATIS PS5
B863: Item Fulfillment | C863: 2024-09-20T00:00:00.000 | D863: 434050 | E863: Jacob McMillen | F863: F | G863: Inventory Asset : Finished Goods | H863: 18.1 | I863: NA Games-STORE | J863: RNT1-PS5-WS-VG-PE | K863: REYNATIS PS5
B864: Item Fulfillment | C864: 2024-09-20T00:00:00.000 | D864: 433879 | E864: 22113 Kyle Astl | F864: F | G864: Inventory Asset : Finished Goods | H864: 18.1 | I864: NA Games-STORE | J864: RNT1-PS5-WS-VG-PE | K864: REYNATIS PS5
B865: Item Fulfillment | C865: 2024-09-20T00:00:00.000 | D865: 434018 | E865: Chyheim Jackson-Burgess | F865: F | G865: Inventory Asset : Finished Goods | H865: 18.1 | I865: NA Games-STORE | J865: RNT1-PS5-WS-VG-PE | K865: REYNATIS PS5
B866: Item Fulfillment | C866: 2024-09-20T00:00:00.000 | D866: 433854 | E866: Leon Thor | F866: F | G866: Inventory Asset : Finished Goods | H866: 18.1 | I866: NA Games-STORE | J866: RNT1-PS5-WS-VG-PE | K866: REYNATIS PS5
B867: Item Fulfillment | C867: 2024-09-20T00:00:00.000 | D867: 433996 | E867: 22331 Bryan Bustillos | F867: F | G867: Inventory Asset : Finished Goods | H867: 18.1 | I867: NA Games-STORE | J867: RNT1-PS5-WS-VG-PE | K867: REYNATIS PS5
B868: Item Fulfillment | C868: 2024-09-20T00:00:00.000 | D868: 433819 | E868: Michael Bove | F868: F | G868: Inventory Asset : Finished Goods | H868: 18.1 | I868: NA Games-STORE | J868: RNT1-PS5-WS-VG-PE | K868: REYNATIS PS5
B869: Item Fulfillment | C869: 2024-09-20T00:00:00.000 | D869: 434092 | E869: 18254 Jon DeAraujo | F869: F | G869: Inventory Asset : Finished Goods | H869: 18.1 | I869: NA Games-STORE | J869: RNT1-PS5-WS-VG-PE | K869: REYNATIS PS5
B870: Item Fulfillment | C870: 2024-09-20T00:00:00.000 | D870: 434086 | E870: Danny Koo | F870: F | G870: Inventory Asset : Finished Goods | H870: 18.1 | I870: NA Games-STORE | J870: RNT1-PS5-WS-VG-PE | K870: REYNATIS PS5
B871: Item Fulfillment | C871: 2024-09-20T00:00:00.000 | D871: 434085 | E871: 22678 Algin Flores | F871: F | G871: Inventory Asset : Finished Goods | H871: 18.1 | I871: NA Games-STORE | J871: RNT1-PS5-WS-VG-PE | K871: REYNATIS PS5
B872: Item Fulfillment | C872: 2024-09-20T00:00:00.000 | D872: 434286 | E872: 23734 Michael Asaro | F872: F | G872: Inventory Asset : Finished Goods | H872: 18.1 | I872: NA Games-STORE | J872: RNT1-PS5-WS-VG-PE | K872: REYNATIS PS5
B873: Item Fulfillment | C873: 2024-09-20T00:00:00.000 | D873: 434268 | E873: 23704 Angel Delgado | F873: F | G873: Inventory Asset : Finished Goods | H873: 18.1 | I873: NA Games-STORE | J873: RNT1-PS5-WS-VG-PE | K873: REYNATIS PS5
B874: Item Fulfillment | C874: 2024-09-20T00:00:00.000 | D874: 434244 | E874: Jake Mueller | F874: F | G874: Inventory Asset : Finished Goods | H874: 18.1 | I874: NA Games-STORE | J874: RNT1-PS5-WS-VG-PE | K874: REYNATIS PS5
B875: Item Fulfillment | C875: 2024-09-20T00:00:00.000 | D875: 434200 | E875: Brandon Sipes | F875: F | G875: Inventory Asset : Finished Goods | H875: 18.1 | I875: NA Games-STORE | J875: RNT1-PS5-WS-VG-PE | K875: REYNATIS PS5
B876: Item Fulfillment | C876: 2024-09-20T00:00:00.000 | D876: 433946 | E876: Bryan Mikkelson | F876: F | G876: Inventory Asset : Finished Goods | H876: 18.1 | I876: NA Games-STORE | J876: RNT1-PS5-WS-VG-PE | K876: REYNATIS PS5
B877: Item Fulfillment | C877: 2024-09-20T00:00:00.000 | D877: 434212 | E877: 23449 Steven Asselanis | F877: F | G877: Inventory Asset : Finished Goods | H877: 18.1 | I877: NA Games-STORE | J877: RNT1-PS5-WS-VG-PE | K877: REYNATIS PS5
B878: Item Fulfillment | C878: 2024-09-20T00:00:00.000 | D878: 434186 | E878: R Wright | F878: F | G878: Inventory Asset : Finished Goods | H878: 18.1 | I878: NA Games-STORE | J878: RNT1-PS5-WS-VG-PE | K878: REYNATIS PS5
B879: Item Fulfillment | C879: 2024-09-20T00:00:00.000 | D879: 433836 | E879: dennis Newell | F879: F | G879: Inventory Asset : Finished Goods | H879: 18.1 | I879: NA Games-STORE | J879: RNT1-PS5-WS-VG-PE | K879: REYNATIS PS5
B880: Item Fulfillment | C880: 2024-09-20T00:00:00.000 | D880: 433737 | E880: Kristopher Rickman | F880: F | G880: Inventory Asset : Finished Goods | H880: 18.1 | I880: NA Games-STORE | J880: RNT1-PS5-WS-VG-PE | K880: REYNATIS PS5
B881: Item Fulfillment | C881: 2024-09-20T00:00:00.000 | D881: 433905 | E881: Kristin Kapitan [1000355954] | F881: F | G881: Inventory Asset : Finished Goods | H881: 18.1 | I881: NA Games-STORE | J881: RNT1-PS5-WS-VG-PE | K881: REYNATIS PS5
B882: Item Fulfillment | C882: 2024-09-20T00:00:00.000 | D882: 434066 | E882: 22619 Kayla Guinn | F882: F | G882: Inventory Asset : Finished Goods | H882: 18.1 | I882: NA Games-STORE | J882: RNT1-PS5-WS-VG-PE | K882: REYNATIS PS5
B883: Item Fulfillment | C883: 2024-09-20T00:00:00.000 | D883: 434042 | E883: Thanh V Pham | F883: F | G883: Inventory Asset : Finished Goods | H883: 18.1 | I883: NA Games-STORE | J883: RNT1-PS5-WS-VG-PE | K883: REYNATIS PS5
B884: Item Fulfillment | C884: 2024-09-20T00:00:00.000 | D884: 434009 | E884: George Kotronis | F884: F | G884: Inventory Asset : Finished Goods | H884: 18.1 | I884: NA Games-STORE | J884: RNT1-PS5-WS-VG-PE | K884: REYNATIS PS5
B885: Item Fulfillment | C885: 2024-09-20T00:00:00.000 | D885: 434088 | E885: 22681 Audrey Gaymann | F885: F | G885: Inventory Asset : Finished Goods | H885: 18.1 | I885: NA Games-STORE | J885: RNT1-PS5-WS-VG-PE | K885: REYNATIS PS5
B886: Item Fulfillment | C886: 2024-09-20T00:00:00.000 | D886: 434079 | E886: 7154 Marcela Garcia | F886: F | G886: Inventory Asset : Finished Goods | H886: 18.1 | I886: NA Games-STORE | J886: RNT1-PS5-WS-VG-PE | K886: REYNATIS PS5
B887: Item Fulfillment | C887: 2024-09-20T00:00:00.000 | D887: 434191 | E887: 23366 Sebastian Hueso | F887: F | G887: Inventory Asset : Finished Goods | H887: 18.1 | I887: NA Games-STORE | J887: RNT1-PS5-WS-VG-PE | K887: REYNATIS PS5
B888: Item Fulfillment | C888: 2024-09-20T00:00:00.000 | D888: 434163 | E888: Justin Hayes | F888: F | G888: Inventory Asset : Finished Goods | H888: 18.1 | I888: NA Games-STORE | J888: RNT1-PS5-WS-VG-PE | K888: REYNATIS PS5
B889: Item Fulfillment | C889: 2024-09-20T00:00:00.000 | D889: 433966 | E889: Chris Pham [141193] | F889: F | G889: Inventory Asset : Finished Goods | H889: 18.1 | I889: NA Games-STORE | J889: RNT1-PS5-WS-VG-PE | K889: REYNATIS PS5
B890: Item Fulfillment | C890: 2024-09-20T00:00:00.000 | D890: 433958 | E890: Justin Clark [1000219160] | F890: F | G890: Inventory Asset : Finished Goods | H890: 18.1 | I890: NA Games-STORE | J890: RNT1-PS5-WS-VG-PE | K890: REYNATIS PS5
B891: Item Fulfillment | C891: 2024-09-20T00:00:00.000 | D891: 433758 | E891: Richard Liriano | F891: F | G891: Inventory Asset : Finished Goods | H891: 18.1 | I891: NA Games-STORE | J891: RNT1-PS5-WS-VG-PE | K891: REYNATIS PS5
B892: Item Fulfillment | C892: 2024-09-20T00:00:00.000 | D892: 433929 | E892: 22455 David chen | F892: F | G892: Inventory Asset : Finished Goods | H892: 18.1 | I892: NA Games-STORE | J892: RNT1-PS5-WS-VG-PE | K892: REYNATIS PS5
B893: Item Fulfillment | C893: 2024-09-20T00:00:00.000 | D893: 433738 | E893: 21626 Corey Nicolace | F893: F | G893: Inventory Asset : Finished Goods | H893: 18.1 | I893: NA Games-STORE | J893: RNT1-PS5-WS-VG-PE | K893: REYNATIS PS5
B894: Item Fulfillment | C894: 2024-09-20T00:00:00.000 | D894: 433850 | E894: dood | F894: F | G894: Inventory Asset : Finished Goods | H894: 18.1 | I894: NA Games-STORE | J894: RNT1-PS5-WS-VG-PE | K894: REYNATIS PS5
B895: Item Fulfillment | C895: 2024-09-20T00:00:00.000 | D895: 433986 | E895: Damien Hutley | F895: F | G895: Inventory Asset : Finished Goods | H895: 18.1 | I895: NA Games-STORE | J895: RNT1-PS5-WS-VG-PE | K895: REYNATIS PS5
B896: Item Fulfillment | C896: 2024-09-20T00:00:00.000 | D896: 434096 | E896: Jeffery Mitchell | F896: F | G896: Inventory Asset : Finished Goods | H896: 18.1 | I896: NA Games-STORE | J896: RNT1-PS5-WS-VG-PE | K896: REYNATIS PS5
B897: Item Fulfillment | C897: 2024-09-20T00:00:00.000 | D897: 434216 | E897: Sean Ounkeo | F897: F | G897: Inventory Asset : Finished Goods | H897: 18.1 | I897: NA Games-STORE | J897: RNT1-PS5-WS-VG-PE | K897: REYNATIS PS5
B898: Item Fulfillment | C898: 2024-09-20T00:00:00.000 | D898: 434210 | E898: Teran Ericksen | F898: F | G898: Inventory Asset : Finished Goods | H898: 18.1 | I898: NA Games-STORE | J898: RNT1-PS5-WS-VG-PE | K898: REYNATIS PS5
B899: Item Fulfillment | C899: 2024-09-20T00:00:00.000 | D899: 434192 | E899: James Mackrey | F899: F | G899: Inventory Asset : Finished Goods | H899: 18.1 | I899: NA Games-STORE | J899: RNT1-PS5-WS-VG-PE | K899: REYNATIS PS5
B900: Item Fulfillment | C900: 2024-09-20T00:00:00.000 | D900: 434190 | E900: Donovan Dennis | F900: F | G900: Inventory Asset : Finished Goods | H900: 18.1 | I900: NA Games-STORE | J900: RNT1-PS5-WS-VG-PE | K900: REYNATIS PS5
B901: Item Fulfillment | C901: 2024-09-20T00:00:00.000 | D901: 433789 | E901: Brian Chernoff | F901: F | G901: Inventory Asset : Finished Goods | H901: 18.1 | I901: NA Games-STORE | J901: RNT1-PS5-WS-VG-PE | K901: REYNATIS PS5
B902: Item Fulfillment | C902: 2024-09-20T00:00:00.000 | D902: 433782 | E902: 22378 Guo Qiang Huang | F902: F | G902: Inventory Asset : Finished Goods | H902: 18.1 | I902: NA Games-STORE | J902: RNT1-PS5-WS-VG-PE | K902: REYNATIS PS5
B903: Item Fulfillment | C903: 2024-09-20T00:00:00.000 | D903: 433772 | E903: Michael Watson | F903: F | G903: Inventory Asset : Finished Goods | H903: 18.1 | I903: NA Games-STORE | J903: RNT1-PS5-WS-VG-PE | K903: REYNATIS PS5
B904: Item Fulfillment | C904: 2024-09-20T00:00:00.000 | D904: 433771 | E904: Alec Blade Blade | F904: F | G904: Inventory Asset : Finished Goods | H904: 18.1 | I904: NA Games-STORE | J904: RNT1-PS5-WS-VG-PE | K904: REYNATIS PS5
B905: Item Fulfillment | C905: 2024-09-20T00:00:00.000 | D905: 433910 | E905: risogimento | F905: F | G905: Inventory Asset : Finished Goods | H905: 18.1 | I905: NA Games-STORE | J905: RNT1-PS5-WS-VG-PE | K905: REYNATIS PS5
B906: Item Fulfillment | C906: 2024-09-20T00:00:00.000 | D906: 433893 | E906: Holly Cooke | F906: F | G906: Inventory Asset : Finished Goods | H906: 18.1 | I906: NA Games-STORE | J906: RNT1-PS5-WS-VG-PE | K906: REYNATIS PS5
B907: Item Fulfillment | C907: 2024-09-20T00:00:00.000 | D907: 434039 | E907: wildcatv2 | F907: F | G907: Inventory Asset : Finished Goods | H907: 18.1 | I907: NA Games-STORE | J907: RNT1-PS5-WS-VG-PE | K907: REYNATIS PS5
B908: Item Fulfillment | C908: 2024-09-20T00:00:00.000 | D908: 433868 | E908: 22417 Zachary Gurahian | F908: F | G908: Inventory Asset : Finished Goods | H908: 18.1 | I908: NA Games-STORE | J908: RNT1-PS5-WS-VG-PE | K908: REYNATIS PS5
B909: Item Fulfillment | C909: 2024-09-20T00:00:00.000 | D909: 434116 | E909: 23122 Michael Clark | F909: F | G909: Inventory Asset : Finished Goods | H909: 18.1 | I909: NA Games-STORE | J909: RNT1-PS5-WS-VG-PE | K909: REYNATIS PS5
B910: Item Fulfillment | C910: 2024-09-20T00:00:00.000 | D910: 434284 | E910: James 28 | F910: F | G910: Inventory Asset : Finished Goods | H910: 18.1 | I910: NA Games-STORE | J910: RNT1-PS5-WS-VG-PE | K910: REYNATIS PS5
B911: Item Fulfillment | C911: 2024-09-20T00:00:00.000 | D911: 434188 | E911: Steven A Acklin | F911: F | G911: Inventory Asset : Finished Goods | H911: 18.1 | I911: NA Games-STORE | J911: RNT1-PS5-WS-VG-PE | K911: REYNATIS PS5
B912: Item Fulfillment | C912: 2024-09-20T00:00:00.000 | D912: 433808 | E912: 22388 Nicholas Hyman | F912: F | G912: Inventory Asset : Finished Goods | H912: 18.1 | I912: NA Games-STORE | J912: RNT1-PS5-WS-VG-PE | K912: REYNATIS PS5
B913: Item Fulfillment | C913: 2024-09-20T00:00:00.000 | D913: 433960 | E913: 21320 Elissa Luckett | F913: F | G913: Inventory Asset : Finished Goods | H913: 18.1 | I913: NA Games-STORE | J913: RNT1-PS5-WS-VG-PE | K913: REYNATIS PS5
B914: Item Fulfillment | C914: 2024-09-20T00:00:00.000 | D914: 433834 | E914: Beau Brady | F914: F | G914: Inventory Asset : Finished Goods | H914: 18.1 | I914: NA Games-STORE | J914: RNT1-PS5-WS-VG-PE | K914: REYNATIS PS5
B915: Item Fulfillment | C915: 2024-09-20T00:00:00.000 | D915: 433777 | E915: 22376 Chris Jagucki | F915: F | G915: Inventory Asset : Finished Goods | H915: 18.1 | I915: NA Games-STORE | J915: RNT1-PS5-WS-VG-PE | K915: REYNATIS PS5
B916: Item Fulfillment | C916: 2024-09-20T00:00:00.000 | D916: 433733 | E916: 22360 Adam Doughty | F916: F | G916: Inventory Asset : Finished Goods | H916: 18.1 | I916: NA Games-STORE | J916: RNT1-PS5-WS-VG-PE | K916: REYNATIS PS5
B917: Item Fulfillment | C917: 2024-09-20T00:00:00.000 | D917: 434034 | E917: Michael Evans [1000316195] | F917: F | G917: Inventory Asset : Finished Goods | H917: 18.1 | I917: NA Games-STORE | J917: RNT1-PS5-WS-VG-PE | K917: REYNATIS PS5
B918: Item Fulfillment | C918: 2024-09-20T00:00:00.000 | D918: 433820 | E918: Jose Fabal | F918: F | G918: Inventory Asset : Finished Goods | H918: 18.1 | I918: NA Games-STORE | J918: RNT1-PS5-WS-VG-PE | K918: REYNATIS PS5
B919: Item Fulfillment | C919: 2024-09-20T00:00:00.000 | D919: 434273 | E919: Danielle Osterberg | F919: F | G919: Inventory Asset : Finished Goods | H919: 18.1 | I919: NA Games-STORE | J919: RNT1-PS5-WS-VG-PE | K919: REYNATIS PS5
B920: Item Fulfillment | C920: 2024-09-20T00:00:00.000 | D920: 433830 | E920: 22396 Anthony Barbosa | F920: F | G920: Inventory Asset : Finished Goods | H920: 18.1 | I920: NA Games-STORE | J920: RNT1-PS5-WS-VG-PE | K920: REYNATIS PS5
B921: Item Fulfillment | C921: 2024-09-20T00:00:00.000 | D921: 433743 | E921: Brittany Hughes [174521] | F921: F | G921: Inventory Asset : Finished Goods | H921: 18.1 | I921: NA Games-STORE | J921: RNT1-PS5-WS-VG-PE | K921: REYNATIS PS5
B922: Item Fulfillment | C922: 2024-09-20T00:00:00.000 | D922: 433867 | E922: 22416 Zack Affeld | F922: F | G922: Inventory Asset : Finished Goods | H922: 18.1 | I922: NA Games-STORE | J922: RNT1-PS5-WS-VG-PE | K922: REYNATIS PS5
B923: Item Fulfillment | C923: 2024-09-20T00:00:00.000 | D923: 433852 | E923: Anthony Fudge | F923: F | G923: Inventory Asset : Finished Goods | H923: 18.1 | I923: NA Games-STORE | J923: RNT1-PS5-WS-VG-PE | K923: REYNATIS PS5
B924: Item Fulfillment | C924: 2024-09-20T00:00:00.000 | D924: 433815 | E924: Douglas Bolton | F924: F | G924: Inventory Asset : Finished Goods | H924: 18.1 | I924: NA Games-STORE | J924: RNT1-PS5-WS-VG-PE | K924: REYNATIS PS5
B925: Item Fulfillment | C925: 2024-09-20T00:00:00.000 | D925: 434231 | E925: Malcolm Lowry | F925: F | G925: Inventory Asset : Finished Goods | H925: 18.1 | I925: NA Games-STORE | J925: RNT1-PS5-WS-VG-PE | K925: REYNATIS PS5
B926: Item Fulfillment | C926: 2024-09-20T00:00:00.000 | D926: 434199 | E926: 19691 Nicholas Zavaleta | F926: F | G926: Inventory Asset : Finished Goods | H926: 18.1 | I926: NA Games-STORE | J926: RNT1-PS5-WS-VG-PE | K926: REYNATIS PS5
B927: Item Fulfillment | C927: 2024-09-20T00:00:00.000 | D927: 433781 | E927: Cody Hallock | F927: F | G927: Inventory Asset : Finished Goods | H927: 18.1 | I927: NA Games-STORE | J927: RNT1-PS5-WS-VG-PE | K927: REYNATIS PS5
B928: Item Fulfillment | C928: 2024-09-20T00:00:00.000 | D928: 433770 | E928: Alyssa Collins | F928: F | G928: Inventory Asset : Finished Goods | H928: 18.1 | I928: NA Games-STORE | J928: RNT1-PS5-WS-VG-PE | K928: REYNATIS PS5
B929: Item Fulfillment | C929: 2024-09-20T00:00:00.000 | D929: 433722 | E929: 22355 Hector Sabillon | F929: F | G929: Inventory Asset : Finished Goods | H929: 18.1 | I929: NA Games-STORE | J929: RNT1-PS5-WS-VG-PE | K929: REYNATIS PS5
B930: Item Fulfillment | C930: 2024-09-20T00:00:00.000 | D930: 434052 | E930: 21895 John Seiler | F930: F | G930: Inventory Asset : Finished Goods | H930: 18.1 | I930: NA Games-STORE | J930: RNT1-PS5-WS-VG-PE | K930: REYNATIS PS5
B931: Item Fulfillment | C931: 2024-09-20T00:00:00.000 | D931: 434142 | E931: Jennifer Gillespie 4 | F931: F | G931: Inventory Asset : Finished Goods | H931: 18.1 | I931: NA Games-STORE | J931: RNT1-PS5-WS-VG-PE | K931: REYNATIS PS5
B932: Item Fulfillment | C932: 2024-09-20T00:00:00.000 | D932: 434211 | E932: 23430 Sean Phillips | F932: F | G932: Inventory Asset : Finished Goods | H932: 18.1 | I932: NA Games-STORE | J932: RNT1-PS5-WS-VG-PE | K932: REYNATIS PS5
B933: Item Fulfillment | C933: 2024-09-20T00:00:00.000 | D933: 434203 | E933: Sammy Spradlin | F933: F | G933: Inventory Asset : Finished Goods | H933: 18.1 | I933: NA Games-STORE | J933: RNT1-PS5-WS-VG-PE | K933: REYNATIS PS5
B934: Item Fulfillment | C934: 2024-09-20T00:00:00.000 | D934: 434194 | E934: Christopher McLamb | F934: F | G934: Inventory Asset : Finished Goods | H934: 18.1 | I934: NA Games-STORE | J934: RNT1-PS5-WS-VG-PE | K934: REYNATIS PS5
B935: Item Fulfillment | C935: 2024-09-20T00:00:00.000 | D935: 433828 | E935: Chris FitzSimonds | F935: F | G935: Inventory Asset : Finished Goods | H935: 18.1 | I935: NA Games-STORE | J935: RNT1-PS5-WS-VG-PE | K935: REYNATIS PS5
B936: Item Fulfillment | C936: 2024-09-20T00:00:00.000 | D936: 433849 | E936: Xander Watkins | F936: F | G936: Inventory Asset : Finished Goods | H936: 18.1 | I936: NA Games-STORE | J936: RNT1-PS5-WS-VG-PE | K936: REYNATIS PS5
B937: Item Fulfillment | C937: 2024-09-20T00:00:00.000 | D937: 434105 | E937: Marc Morgan | F937: F | G937: Inventory Asset : Finished Goods | H937: 18.1 | I937: NA Games-STORE | J937: RNT1-PS5-WS-VG-PE | K937: REYNATIS PS5
B938: Item Fulfillment | C938: 2024-09-20T00:00:00.000 | D938: 434253 | E938: Andrew Anderson | F938: F | G938: Inventory Asset : Finished Goods | H938: 18.1 | I938: NA Games-STORE | J938: RNT1-PS5-WS-VG-PE | K938: REYNATIS PS5
B939: Item Fulfillment | C939: 2024-09-20T00:00:00.000 | D939: 433903 | E939: 22437 Rubbil Ahmed | F939: F | G939: Inventory Asset : Finished Goods | H939: 18.1 | I939: NA Games-STORE | J939: RNT1-PS5-WS-VG-PE | K939: REYNATIS PS5
B940: Item Fulfillment | C940: 2024-09-20T00:00:00.000 | D940: 433885 | E940: Stephen Kinney | F940: F | G940: Inventory Asset : Finished Goods | H940: 18.1 | I940: NA Games-STORE | J940: RNT1-PS5-WS-VG-PE | K940: REYNATIS PS5
B941: Item Fulfillment | C941: 2024-09-20T00:00:00.000 | D941: 434000 | E941: Tim Kliner | F941: F | G941: Inventory Asset : Finished Goods | H941: 18.1 | I941: NA Games-STORE | J941: RNT1-PS5-WS-VG-PE | K941: REYNATIS PS5
B942: Item Fulfillment | C942: 2024-09-20T00:00:00.000 | D942: 434099 | E942: Kelvin PICHARDO | F942: F | G942: Inventory Asset : Finished Goods | H942: 18.1 | I942: NA Games-STORE | J942: RNT1-PS5-WS-VG-PE | K942: REYNATIS PS5
B943: Item Fulfillment | C943: 2024-09-20T00:00:00.000 | D943: 434070 | E943: 22628 Thanh Nicky Dang | F943: F | G943: Inventory Asset : Finished Goods | H943: 18.1 | I943: NA Games-STORE | J943: RNT1-PS5-WS-VG-PE | K943: REYNATIS PS5
B944: Item Fulfillment | C944: 2024-09-23T00:00:00.000 | D944: 434373 | E944: jose ortega | F944: F | G944: Inventory Asset : Finished Goods | H944: 18.1 | I944: NA Games-STORE | J944: RNT1-PS4-WS-VG-PE | K944: REYNATIS PS4
B945: Item Fulfillment | C945: 2024-09-23T00:00:00.000 | D945: 434676 | E945: Cyrus Moses | F945: F | G945: Inventory Asset : Finished Goods | H945: 20.61 | I945: NA Games-STORE | J945: RNT1-NSW-WS-VG-PE | K945: REYNATIS NSW
B946: Item Fulfillment | C946: 2024-09-23T00:00:00.000 | D946: 434668 | E946: Jordan Fontice | F946: F | G946: Inventory Asset : Finished Goods | H946: 20.61 | I946: NA Games-STORE | J946: RNT1-NSW-WS-VG-PE | K946: REYNATIS NSW
B947: Item Fulfillment | C947: 2024-09-23T00:00:00.000 | D947: 434655 | E947: Kee Vang | F947: F | G947: Inventory Asset : Finished Goods | H947: 20.61 | I947: NA Games-STORE | J947: RNT1-NSW-WS-VG-PE | K947: REYNATIS NSW
B948: Item Fulfillment | C948: 2024-09-23T00:00:00.000 | D948: 434650 | E948: Jeffrey Thom [1000217176] | F948: F | G948: Inventory Asset : Finished Goods | H948: 18.1 | I948: NA Games-STORE | J948: RNT1-PS4-WS-VG-PE | K948: REYNATIS PS4
B949: Item Fulfillment | C949: 2024-09-23T00:00:00.000 | D949: 434750 | E949: Adam Villarreal | F949: F | G949: Inventory Asset : Finished Goods | H949: 18.1 | I949: NA Games-STORE | J949: RNT1-PS5-WS-VG-PE | K949: REYNATIS PS5
B950: Item Fulfillment | C950: 2024-09-23T00:00:00.000 | D950: 434719 | E950: 23699 Michael Leipold | F950: F | G950: Inventory Asset : Finished Goods | H950: 20.61 | I950: NA Games-STORE | J950: RNT1-NSW-WS-VG-PE | K950: REYNATIS NSW
B951: Item Fulfillment | C951: 2024-09-23T00:00:00.000 | D951: 434405 | E951: Lau Wei Peng | F951: F | G951: Inventory Asset : Finished Goods | H951: 20.61 | I951: NA Games-STORE | J951: RNT1-NSW-WS-VG-PE | K951: REYNATIS NSW
B952: Item Fulfillment | C952: 2024-09-23T00:00:00.000 | D952: 434694 | E952: Lauren Wallace | F952: F | G952: Inventory Asset : Finished Goods | H952: 20.61 | I952: NA Games-STORE | J952: RNT1-NSW-WS-VG-PE | K952: REYNATIS NSW
B953: Item Fulfillment | C953: 2024-09-23T00:00:00.000 | D953: 434765 | E953: 23688 Jeffrey Norris | F953: F | G953: Inventory Asset : Finished Goods | H953: 20.61 | I953: NA Games-STORE | J953: RNT1-NSW-WS-VG-PE | K953: REYNATIS NSW
B954: Item Fulfillment | C954: 2024-09-23T00:00:00.000 | D954: 434637 | E954: 23294 Justin Bryant | F954: F | G954: Inventory Asset : Finished Goods | H954: 20.61 | I954: NA Games-STORE | J954: RNT1-NSW-WS-VG-PE | K954: REYNATIS NSW
B955: Item Fulfillment | C955: 2024-09-23T00:00:00.000 | D955: 434587 | E955: 4217 Oscar Evann Villaver | F955: F | G955: Inventory Asset : Finished Goods | H955: 20.61 | I955: NA Games-STORE | J955: RNT1-NSW-WS-VG-PE | K955: REYNATIS NSW
B956: Item Fulfillment | C956: 2024-09-23T00:00:00.000 | D956: 434397 | E956: Edward Tapia [1000317583] | F956: F | G956: Inventory Asset : Finished Goods | H956: 20.61 | I956: NA Games-STORE | J956: RNT1-NSW-WS-VG-PE | K956: REYNATIS NSW
B957: Item Fulfillment | C957: 2024-09-23T00:00:00.000 | D957: 434341 | E957: Dre Lasana | F957: F | G957: Inventory Asset : Finished Goods | H957: 20.61 | I957: NA Games-STORE | J957: RNT1-NSW-WS-VG-PE | K957: REYNATIS NSW
B958: Item Fulfillment | C958: 2024-09-23T00:00:00.000 | D958: 434513 | E958: Johny Air Cargo Padala | F958: F | G958: Inventory Asset : Finished Goods | H958: 20.61 | I958: NA Games-STORE | J958: RNT1-NSW-WS-VG-PE | K958: REYNATIS NSW
B959: Item Fulfillment | C959: 2024-09-23T00:00:00.000 | D959: 434501 | E959: Louie Vang | F959: F | G959: Inventory Asset : Finished Goods | H959: 20.61 | I959: NA Games-STORE | J959: RNT1-NSW-WS-VG-PE | K959: REYNATIS NSW
B960: Item Fulfillment | C960: 2024-09-23T00:00:00.000 | D960: 434777 | E960: 23774 Trace Logan | F960: F | G960: Inventory Asset : Finished Goods | H960: 20.61 | I960: NA Games-STORE | J960: RNT1-NSW-WS-VG-PE | K960: REYNATIS NSW
B961: Item Fulfillment | C961: 2024-09-23T00:00:00.000 | D961: 434649 | E961: 23355 Mercy Garcia | F961: F | G961: Inventory Asset : Finished Goods | H961: 20.61 | I961: NA Games-STORE | J961: RNT1-NSW-WS-VG-PE | K961: REYNATIS NSW
B962: Item Fulfillment | C962: 2024-09-23T00:00:00.000 | D962: 434589 | E962: Jack Knight | F962: F | G962: Inventory Asset : Finished Goods | H962: 20.61 | I962: NA Games-STORE | J962: RNT1-NSW-WS-VG-PE | K962: REYNATIS NSW
B963: Item Fulfillment | C963: 2024-09-23T00:00:00.000 | D963: 434321 | E963: Andrew Rios Rios | F963: F | G963: Inventory Asset : Finished Goods | H963: 20.61 | I963: NA Games-STORE | J963: RNT1-NSW-WS-VG-PE | K963: REYNATIS NSW
B964: Item Fulfillment | C964: 2024-09-23T00:00:00.000 | D964: 434446 | E964: Madelaine Wong | F964: F | G964: Inventory Asset : Finished Goods | H964: 20.61 | I964: NA Games-STORE | J964: RNT1-NSW-WS-VG-PE | K964: REYNATIS NSW
B965: Item Fulfillment | C965: 2024-09-23T00:00:00.000 | D965: 434414 | E965: Mikhail Alingasa | F965: F | G965: Inventory Asset : Finished Goods | H965: 20.61 | I965: NA Games-STORE | J965: RNT1-NSW-WS-VG-PE | K965: REYNATIS NSW
B966: Item Fulfillment | C966: 2024-09-23T00:00:00.000 | D966: 434520 | E966: Len Noil | F966: F | G966: Inventory Asset : Finished Goods | H966: 18.1 | I966: NA Games-STORE | J966: RNT1-PS4-WS-VG-PE | K966: REYNATIS PS4
B967: Item Fulfillment | C967: 2024-09-23T00:00:00.000 | D967: 434507 | E967: 22509 Matthew Holcomb | F967: F | G967: Inventory Asset : Finished Goods | H967: 20.61 | I967: NA Games-STORE | J967: RNT1-NSW-WS-VG-PE | K967: REYNATIS NSW
B968: Item Fulfillment | C968: 2024-09-23T00:00:00.000 | D968: 434497 | E968: 22497 Matt Holley | F968: F | G968: Inventory Asset : Finished Goods | H968: 20.61 | I968: NA Games-STORE | J968: RNT1-NSW-WS-VG-PE | K968: REYNATIS NSW
B969: Item Fulfillment | C969: 2024-09-23T00:00:00.000 | D969: 434671 | E969: 23548 Nadia Ortiz | F969: F | G969: Inventory Asset : Finished Goods | H969: 20.61 | I969: NA Games-STORE | J969: RNT1-NSW-WS-VG-PE | K969: REYNATIS NSW
B970: Item Fulfillment | C970: 2024-09-23T00:00:00.000 | D970: 434785 | E970: Craig Powell | F970: F | G970: Inventory Asset : Finished Goods | H970: 25.14 | I970: NA Games-STORE | J970: YSD1-PS5-WS-VG-PE | K970: Ys VIII Lacrimosa of Dana PS5
B971: Item Fulfillment | C971: 2024-09-23T00:00:00.000 | D971: 434494 | E971: Ryan Ruddy | F971: F | G971: Inventory Asset : Finished Goods | H971: 20.61 | I971: NA Games-STORE | J971: RNT1-NSW-WS-VG-PE | K971: REYNATIS NSW
B972: Item Fulfillment | C972: 2024-09-23T00:00:00.000 | D972: 434773 | E972: 23769 David Soukhavong | F972: F | G972: Inventory Asset : Finished Goods | H972: 20.61 | I972: NA Games-STORE | J972: RNT1-NSW-WS-VG-PE | K972: REYNATIS NSW
B973: Item Fulfillment | C973: 2024-09-23T00:00:00.000 | D973: 434620 | E973: Rosalinda Supnet | F973: F | G973: Inventory Asset : Finished Goods | H973: 20.61 | I973: NA Games-STORE | J973: RNT1-NSW-WS-VG-PE | K973: REYNATIS NSW
B974: Item Fulfillment | C974: 2024-09-23T00:00:00.000 | D974: 434619 | E974: W Kyle Roberts | F974: F | G974: Inventory Asset : Finished Goods | H974: 18.1 | I974: NA Games-STORE | J974: RNT1-PS4-WS-VG-PE | K974: REYNATIS PS4
B975: Item Fulfillment | C975: 2024-09-23T00:00:00.000 | D975: 434444 | E975: Angel Alberto Herrera Guerra | F975: F | G975: Inventory Asset : Finished Goods | H975: 20.61 | I975: NA Games-STORE | J975: RNT1-NSW-WS-VG-PE | K975: REYNATIS NSW
B976: Item Fulfillment | C976: 2024-09-23T00:00:00.000 | D976: 434488 | E976: Michael Hall [1000193873] | F976: F | G976: Inventory Asset : Finished Goods | H976: 20.61 | I976: NA Games-STORE | J976: RNT1-NSW-WS-VG-PE | K976: REYNATIS NSW
B977: Item Fulfillment | C977: 2024-09-23T00:00:00.000 | D977: 434532 | E977: 22557 Joshua Morales-Nelson | F977: F | G977: Inventory Asset : Finished Goods | H977: 20.61 | I977: NA Games-STORE | J977: RNT1-NSW-WS-VG-PE | K977: REYNATIS NSW
B978: Item Fulfillment | C978: 2024-09-23T00:00:00.000 | D978: 434526 | E978: Jonathan Gomez | F978: F | G978: Inventory Asset : Finished Goods | H978: 20.61 | I978: NA Games-STORE | J978: RNT1-NSW-WS-VG-PE | K978: REYNATIS NSW
B979: Item Fulfillment | C979: 2024-09-23T00:00:00.000 | D979: 434510 | E979: Kevin Tse | F979: F | G979: Inventory Asset : Finished Goods | H979: 20.61 | I979: NA Games-STORE | J979: RNT1-NSW-WS-VG-PE | K979: REYNATIS NSW
B980: Item Fulfillment | C980: 2024-09-23T00:00:00.000 | D980: 434681 | E980: M Payne | F980: F | G980: Inventory Asset : Finished Goods | H980: 18.1 | I980: NA Games-STORE | J980: RNT1-PS4-WS-VG-PE | K980: REYNATIS PS4
B981: Item Fulfillment | C981: 2024-09-23T00:00:00.000 | D981: 434709 | E981: Luis Luna | F981: F | G981: Inventory Asset : Finished Goods | H981: 20.61 | I981: NA Games-STORE | J981: RNT1-NSW-WS-VG-PE | K981: REYNATIS NSW
B982: Item Fulfillment | C982: 2024-09-23T00:00:00.000 | D982: 434472 | E982: 17396 Emma Gill | F982: F | G982: Inventory Asset : Finished Goods | H982: 20.61 | I982: NA Games-STORE | J982: RNT1-NSW-WS-VG-PE | K982: REYNATIS NSW
B983: Item Fulfillment | C983: 2024-09-23T00:00:00.000 | D983: 434438 | E983: 22451 Michael Pagnotta | F983: F | G983: Inventory Asset : Finished Goods | H983: 20.61 | I983: NA Games-STORE | J983: RNT1-NSW-WS-VG-PE | K983: REYNATIS NSW
B984: Item Fulfillment | C984: 2024-09-23T00:00:00.000 | D984: 434483 | E984: Joseph Barber | F984: F | G984: Inventory Asset : Finished Goods | H984: 20.61 | I984: NA Games-STORE | J984: RNT1-NSW-WS-VG-PE | K984: REYNATIS NSW
B985: Item Fulfillment | C985: 2024-09-23T00:00:00.000 | D985: 434565 | E985: 22666 Oswaldo De Paz | F985: F | G985: Inventory Asset : Finished Goods | H985: 20.61 | I985: NA Games-STORE | J985: RNT1-NSW-WS-VG-PE | K985: REYNATIS NSW
B986: Item Fulfillment | C986: 2024-09-23T00:00:00.000 | D986: 434702 | E986: William Rose | F986: F | G986: Inventory Asset : Finished Goods | H986: 18.1 | I986: NA Games-STORE | J986: RNT1-PS4-WS-VG-PE | K986: REYNATIS PS4
B987: Item Fulfillment | C987: 2024-09-23T00:00:00.000 | D987: 434693 | E987: wzerow | F987: F | G987: Inventory Asset : Finished Goods | H987: 18.1 | I987: NA Games-STORE | J987: RNT1-PS4-WS-VG-PE | K987: REYNATIS PS4
B988: Item Fulfillment | C988: 2024-09-23T00:00:00.000 | D988: 434775 | E988: 23772 Muhammad Islam | F988: F | G988: Inventory Asset : Finished Goods | H988: 20.61 | I988: NA Games-STORE | J988: RNT1-NSW-WS-VG-PE | K988: REYNATIS NSW
B989: Item Fulfillment | C989: 2024-09-23T00:00:00.000 | D989: 434723 | E989: Ben Murphy | F989: F | G989: Inventory Asset : Finished Goods | H989: 20.61 | I989: NA Games-STORE | J989: RNT1-NSW-WS-VG-PE | K989: REYNATIS NSW
B990: Item Fulfillment | C990: 2024-09-23T00:00:00.000 | D990: 434585 | E990: hodges Council | F990: F | G990: Inventory Asset : Finished Goods | H990: 18.1 | I990: NA Games-STORE | J990: RNT1-PS4-WS-VG-PE | K990: REYNATIS PS4
B991: Item Fulfillment | C991: 2024-09-23T00:00:00.000 | D991: 434302 | E991: Eternal Claymore | F991: F | G991: Inventory Asset : Finished Goods | H991: 20.61 | I991: NA Games-STORE | J991: RNT1-NSW-WS-VG-PE | K991: REYNATIS NSW
B992: Item Fulfillment | C992: 2024-09-23T00:00:00.000 | D992: 434407 | E992: Douglas Huntley | F992: F | G992: Inventory Asset : Finished Goods | H992: 20.61 | I992: NA Games-STORE | J992: RNT1-NSW-WS-VG-PE | K992: REYNATIS NSW
B993: Item Fulfillment | C993: 2024-09-23T00:00:00.000 | D993: 434489 | E993: sam vo | F993: F | G993: Inventory Asset : Finished Goods | H993: 20.61 | I993: NA Games-STORE | J993: RNT1-NSW-WS-VG-PE | K993: REYNATIS NSW
B994: Item Fulfillment | C994: 2024-09-23T00:00:00.000 | D994: 434346 | E994: Chris St Louis | F994: F | G994: Inventory Asset : Finished Goods | H994: 18.1 | I994: NA Games-STORE | J994: RNT1-PS5-WS-VG-PE | K994: REYNATIS PS5
B995: Item Fulfillment | C995: 2024-09-23T00:00:00.000 | D995: 434543 | E995: clarence ho | F995: F | G995: Inventory Asset : Finished Goods | H995: 20.61 | I995: NA Games-STORE | J995: RNT1-NSW-WS-VG-PE | K995: REYNATIS NSW
B996: Item Fulfillment | C996: 2024-09-23T00:00:00.000 | D996: 434640 | E996: Jaime Valdez | F996: F | G996: Inventory Asset : Finished Goods | H996: 20.61 | I996: NA Games-STORE | J996: RNT1-NSW-WS-VG-PE | K996: REYNATIS NSW
B997: Item Fulfillment | C997: 2024-09-23T00:00:00.000 | D997: 434757 | E997: 23753 Ryan Taylor | F997: F | G997: Inventory Asset : Finished Goods | H997: 18.1 | I997: NA Games-STORE | J997: RNT1-PS5-WS-VG-PE | K997: REYNATIS PS5
B998: Item Fulfillment | C998: 2024-09-23T00:00:00.000 | D998: 434732 | E998: 23729 Ricky Avila | F998: F | G998: Inventory Asset : Finished Goods | H998: 20.61 | I998: NA Games-STORE | J998: RNT1-NSW-WS-VG-PE | K998: REYNATIS NSW
B999: Item Fulfillment | C999: 2024-09-23T00:00:00.000 | D999: 434471 | E999: Wilson Pascoal 2 | F999: F | G999: Inventory Asset : Finished Goods | H999: 18.1 | I999: NA Games-STORE | J999: RNT1-PS5-WS-VG-PE | K999: REYNATIS PS5
B1000: Item Fulfillment | C1000: 2024-09-23T00:00:00.000 | D1000: 434485 | E1000: Dylan Ocker | F1000: F | G1000: Inventory Asset : Finished Goods | H1000: 20.61 | I1000: NA Games-STORE | J1000: RNT1-NSW-WS-VG-PE | K1000: REYNATIS NSW
B1001: Item Fulfillment | C1001: 2024-09-23T00:00:00.000 | D1001: 434539 | E1001: 20859 Mariano Torrero | F1001: F | G1001: Inventory Asset : Finished Goods | H1001: 18.1 | I1001: NA Games-STORE | J1001: RNT1-PS5-WS-VG-PE | K1001: REYNATIS PS5
B1002: Item Fulfillment | C1002: 2024-09-23T00:00:00.000 | D1002: 434657 | E1002: Steven Popoff | F1002: F | G1002: Inventory Asset : Finished Goods | H1002: 18.1 | I1002: NA Games-STORE | J1002: RNT1-PS4-WS-VG-PE | K1002: REYNATIS PS4
B1003: Item Fulfillment | C1003: 2024-09-23T00:00:00.000 | D1003: 434621 | E1003: Peri Shope | F1003: F | G1003: Inventory Asset : Finished Goods | H1003: 20.61 | I1003: NA Games-STORE | J1003: RNT1-NSW-WS-VG-PE | K1003: REYNATIS NSW
B1004: Item Fulfillment | C1004: 2024-09-23T00:00:00.000 | D1004: 434715 | E1004: Julian Agbeke | F1004: F | G1004: Inventory Asset : Finished Goods | H1004: 20.61 | I1004: NA Games-STORE | J1004: RNT1-NSW-WS-VG-PE | K1004: REYNATIS NSW
B1005: Item Fulfillment | C1005: 2024-09-23T00:00:00.000 | D1005: 434450 | E1005: Gary Katzoff | F1005: F | G1005: Inventory Asset : Finished Goods | H1005: 20.61 | I1005: NA Games-STORE | J1005: RNT1-NSW-WS-VG-PE | K1005: REYNATIS NSW
B1006: Item Fulfillment | C1006: 2024-09-23T00:00:00.000 | D1006: 434305 | E1006: Chris Korban | F1006: F | G1006: Inventory Asset : Finished Goods | H1006: 20.61 | I1006: NA Games-STORE | J1006: RNT1-NSW-WS-VG-PE | K1006: REYNATIS NSW
B1007: Item Fulfillment | C1007: 2024-09-23T00:00:00.000 | D1007: 434430 | E1007: 22082 John Maynor | F1007: F | G1007: Inventory Asset : Finished Goods | H1007: 20.61 | I1007: NA Games-STORE | J1007: RNT1-NSW-WS-VG-PE | K1007: REYNATIS NSW
B1008: Item Fulfillment | C1008: 2024-09-23T00:00:00.000 | D1008: 434429 | E1008: Jesus Hinojosa | F1008: F | G1008: Inventory Asset : Finished Goods | H1008: 20.61 | I1008: NA Games-STORE | J1008: RNT1-NSW-WS-VG-PE | K1008: REYNATIS NSW
B1009: Item Fulfillment | C1009: 2024-09-23T00:00:00.000 | D1009: 434417 | E1009: Jalel Belaid | F1009: F | G1009: Inventory Asset : Finished Goods | H1009: 20.61 | I1009: NA Games-STORE | J1009: RNT1-NSW-WS-VG-PE | K1009: REYNATIS NSW
B1010: Item Fulfillment | C1010: 2024-09-23T00:00:00.000 | D1010: 434351 | E1010: Derek Massouda | F1010: F | G1010: Inventory Asset : Finished Goods | H1010: 18.1 | I1010: NA Games-STORE | J1010: RNT1-PS5-WS-VG-PE | K1010: REYNATIS PS5
B1011: Item Fulfillment | C1011: 2024-09-23T00:00:00.000 | D1011: 434563 | E1011: 22653 Jonathan Pitts | F1011: F | G1011: Inventory Asset : Finished Goods | H1011: 20.61 | I1011: NA Games-STORE | J1011: RNT1-NSW-WS-VG-PE | K1011: REYNATIS NSW
B1012: Item Fulfillment | C1012: 2024-09-23T00:00:00.000 | D1012: 434554 | E1012: 22623 Redwan Akther | F1012: F | G1012: Inventory Asset : Finished Goods | H1012: 20.61 | I1012: NA Games-STORE | J1012: RNT1-NSW-WS-VG-PE | K1012: REYNATIS NSW
B1013: Item Fulfillment | C1013: 2024-09-23T00:00:00.000 | D1013: 434536 | E1013: David Baisley | F1013: F | G1013: Inventory Asset : Finished Goods | H1013: 20.61 | I1013: NA Games-STORE | J1013: RNT1-NSW-WS-VG-PE | K1013: REYNATIS NSW
B1014: Item Fulfillment | C1014: 2024-09-23T00:00:00.000 | D1014: 434783 | E1014: Niles Muzyk | F1014: F | G1014: Inventory Asset : Finished Goods | H1014: 24.09 | I1014: NA Games-STORE | J1014: RHP3-PS5-WS-VG-PE | K1014: Rhapsody Legacy PS5
B1015: Item Fulfillment | C1015: 2024-09-23T00:00:00.000 | D1015: 434608 | E1015: 23206 Taylor Donnelly | F1015: F | G1015: Inventory Asset : Finished Goods | H1015: 18.1 | I1015: NA Games-STORE | J1015: RNT1-PS5-WS-VG-PE | K1015: REYNATIS PS5
B1016: Item Fulfillment | C1016: 2024-09-23T00:00:00.000 | D1016: 434371 | E1016: 20586 Vinh Nguyen | F1016: F | G1016: Inventory Asset : Finished Goods | H1016: 20.61 | I1016: NA Games-STORE | J1016: RNT1-NSW-WS-VG-PE | K1016: REYNATIS NSW
B1017: Item Fulfillment | C1017: 2024-09-23T00:00:00.000 | D1017: 434631 | E1017: Justin Smith [1000284460] | F1017: F | G1017: Inventory Asset : Finished Goods | H1017: 20.61 | I1017: NA Games-STORE | J1017: RNT1-NSW-WS-VG-PE | K1017: REYNATIS NSW
B1018: Item Fulfillment | C1018: 2024-09-23T00:00:00.000 | D1018: 434581 | E1018: YEE WEI QIANG | F1018: F | G1018: Inventory Asset : Finished Goods | H1018: 20.61 | I1018: NA Games-STORE | J1018: RNT1-NSW-WS-VG-PE | K1018: REYNATIS NSW
B1019: Item Fulfillment | C1019: 2024-09-23T00:00:00.000 | D1019: 434460 | E1019: Sierra Haynes | F1019: F | G1019: Inventory Asset : Finished Goods | H1019: 18.1 | I1019: NA Games-STORE | J1019: RNT1-PS4-WS-VG-PE | K1019: REYNATIS PS4
B1020: Item Fulfillment | C1020: 2024-09-23T00:00:00.000 | D1020: 434449 | E1020: Nicholas Martiniuk-Frigo | F1020: F | G1020: Inventory Asset : Finished Goods | H1020: 18.1 | I1020: NA Games-STORE | J1020: RNT1-PS5-WS-VG-PE | K1020: REYNATIS PS5
B1021: Item Fulfillment | C1021: 2024-09-23T00:00:00.000 | D1021: 434476 | E1021: Kwabena Osei-Bonsu | F1021: F | G1021: Inventory Asset : Finished Goods | H1021: 20.61 | I1021: NA Games-STORE | J1021: RNT1-NSW-WS-VG-PE | K1021: REYNATIS NSW
B1022: Item Fulfillment | C1022: 2024-09-23T00:00:00.000 | D1022: 434541 | E1022: skye tibbits | F1022: F | G1022: Inventory Asset : Finished Goods | H1022: 18.1 | I1022: NA Games-STORE | J1022: RNT1-PS5-WS-VG-PE | K1022: REYNATIS PS5
B1023: Item Fulfillment | C1023: 2024-09-23T00:00:00.000 | D1023: 434534 | E1023: kurtdog | F1023: F | G1023: Inventory Asset : Finished Goods | H1023: 18.1 | I1023: NA Games-STORE | J1023: RNT1-PS4-WS-VG-PE | K1023: REYNATIS PS4
B1024: Item Fulfillment | C1024: 2024-09-23T00:00:00.000 | D1024: 434685 | E1024: 1067 Timothy Kelley | F1024: F | G1024: Inventory Asset : Finished Goods | H1024: 20.61 | I1024: NA Games-STORE | J1024: RNT1-NSW-WS-VG-PE | K1024: REYNATIS NSW
B1025: Item Fulfillment | C1025: 2024-09-23T00:00:00.000 | D1025: 434789 | E1025: 23783 Alexander Custodio | F1025: F | G1025: Inventory Asset : Finished Goods | H1025: 18.1 | I1025: NA Games-STORE | J1025: RNT1-PS5-WS-VG-PE | K1025: REYNATIS PS5
B1026: Item Fulfillment | C1026: 2024-09-23T00:00:00.000 | D1026: 434772 | E1026: George Lam AX17 | F1026: F | G1026: Inventory Asset : Finished Goods | H1026: 18.1 | I1026: NA Games-STORE | J1026: RNT1-PS5-WS-VG-PE | K1026: REYNATIS PS5
B1027: Item Fulfillment | C1027: 2024-09-23T00:00:00.000 | D1027: 434643 | E1027: Samuel Miranda | F1027: F | G1027: Inventory Asset : Finished Goods | H1027: 20.61 | I1027: NA Games-STORE | J1027: RNT1-NSW-WS-VG-PE | K1027: REYNATIS NSW
B1028: Item Fulfillment | C1028: 2024-09-23T00:00:00.000 | D1028: 434573 | E1028: Cristobal Lange | F1028: F | G1028: Inventory Asset : Finished Goods | H1028: 17.81 | I1028: NA Games-STORE | J1028: LOL1-PS5-WS-VG-PE | K1028: Legend of Legacy HD PS5
B1029: Item Fulfillment | C1029: 2024-09-23T00:00:00.000 | D1029: 434498 | E1029: Nicole Quintanilla | F1029: F | G1029: Inventory Asset : Finished Goods | H1029: 20.61 | I1029: NA Games-STORE | J1029: RNT1-NSW-WS-VG-PE | K1029: REYNATIS NSW
B1030: Item Fulfillment | C1030: 2024-09-23T00:00:00.000 | D1030: 434788 | E1030: Adrian Sirbike | F1030: F | G1030: Inventory Asset : Finished Goods | H1030: 20.61 | I1030: NA Games-STORE | J1030: RNT1-NSW-WS-VG-PE | K1030: REYNATIS NSW
B1031: Item Fulfillment | C1031: 2024-09-23T00:00:00.000 | D1031: 434644 | E1031: 341 sammy trieu | F1031: F | G1031: Inventory Asset : Finished Goods | H1031: 20.61 | I1031: NA Games-STORE | J1031: RNT1-NSW-WS-VG-PE | K1031: REYNATIS NSW
B1032: Item Fulfillment | C1032: 2024-09-23T00:00:00.000 | D1032: 434745 | E1032: 21856 Andrew Chavez | F1032: F | G1032: Inventory Asset : Finished Goods | H1032: 20.61 | I1032: NA Games-STORE | J1032: RNT1-NSW-WS-VG-PE | K1032: REYNATIS NSW
B1033: Item Fulfillment | C1033: 2024-09-23T00:00:00.000 | D1033: 434395 | E1033: David Guiot | F1033: F | G1033: Inventory Asset : Finished Goods | H1033: 20.61 | I1033: NA Games-STORE | J1033: RNT1-NSW-WS-VG-PE | K1033: REYNATIS NSW
B1034: Item Fulfillment | C1034: 2024-09-23T00:00:00.000 | D1034: 434379 | E1034: 22406 Bethany Guarilia | F1034: F | G1034: Inventory Asset : Finished Goods | H1034: 20.61 | I1034: NA Games-STORE | J1034: RNT1-NSW-WS-VG-PE | K1034: REYNATIS NSW
B1035: Item Fulfillment | C1035: 2024-09-23T00:00:00.000 | D1035: 434363 | E1035: 19562 April Frazer | F1035: F | G1035: Inventory Asset : Finished Goods | H1035: 20.61 | I1035: NA Games-STORE | J1035: RNT1-NSW-WS-VG-PE | K1035: REYNATIS NSW
B1036: Item Fulfillment | C1036: 2024-09-23T00:00:00.000 | D1036: 434559 | E1036: 22634 Maverick Ly | F1036: F | G1036: Inventory Asset : Finished Goods | H1036: 20.61 | I1036: NA Games-STORE | J1036: RNT1-NSW-WS-VG-PE | K1036: REYNATIS NSW
B1037: Item Fulfillment | C1037: 2024-09-23T00:00:00.000 | D1037: 434726 | E1037: Jesse Tisdale | F1037: F | G1037: Inventory Asset : Finished Goods | H1037: 20.61 | I1037: NA Games-STORE | J1037: RNT1-NSW-WS-VG-PE | K1037: REYNATIS NSW
B1038: Item Fulfillment | C1038: 2024-09-23T00:00:00.000 | D1038: 434609 | E1038: Vianey Bustos | F1038: F | G1038: Inventory Asset : Finished Goods | H1038: 20.61 | I1038: NA Games-STORE | J1038: RNT1-NSW-WS-VG-PE | K1038: REYNATIS NSW
B1039: Item Fulfillment | C1039: 2024-09-23T00:00:00.000 | D1039: 434453 | E1039: Ryan D Friend | F1039: F | G1039: Inventory Asset : Finished Goods | H1039: 18.1 | I1039: NA Games-STORE | J1039: RNT1-PS4-WS-VG-PE | K1039: REYNATIS PS4
B1040: Item Fulfillment | C1040: 2024-09-23T00:00:00.000 | D1040: 434441 | E1040: Jonathan Vargas [1000292322] | F1040: F | G1040: Inventory Asset : Finished Goods | H1040: 20.61 | I1040: NA Games-STORE | J1040: RNT1-NSW-WS-VG-PE | K1040: REYNATIS NSW
B1041: Item Fulfillment | C1041: 2024-09-23T00:00:00.000 | D1041: 434296 | E1041: William Chang [1000284113] | F1041: F | G1041: Inventory Asset : Finished Goods | H1041: 20.61 | I1041: NA Games-STORE | J1041: RNT1-NSW-WS-VG-PE | K1041: REYNATIS NSW
B1042: Item Fulfillment | C1042: 2024-09-23T00:00:00.000 | D1042: 434402 | E1042: 22423 Antonio Salas | F1042: F | G1042: Inventory Asset : Finished Goods | H1042: 20.61 | I1042: NA Games-STORE | J1042: RNT1-NSW-WS-VG-PE | K1042: REYNATIS NSW
B1043: Item Fulfillment | C1043: 2024-09-23T00:00:00.000 | D1043: 434330 | E1043: Anish Dayal | F1043: F | G1043: Inventory Asset : Finished Goods | H1043: 20.61 | I1043: NA Games-STORE | J1043: RNT1-NSW-WS-VG-PE | K1043: REYNATIS NSW
B1044: Item Fulfillment | C1044: 2024-09-23T00:00:00.000 | D1044: 434557 | E1044: 22632 Roberto Tadashi Wakita Soares | F1044: F | G1044: Inventory Asset : Finished Goods | H1044: 20.61 | I1044: NA Games-STORE | J1044: RNT1-NSW-WS-VG-PE | K1044: REYNATIS NSW
B1045: Item Fulfillment | C1045: 2024-09-23T00:00:00.000 | D1045: 434542 | E1045: Derrck Hurley | F1045: F | G1045: Inventory Asset : Finished Goods | H1045: 20.61 | I1045: NA Games-STORE | J1045: RNT1-NSW-WS-VG-PE | K1045: REYNATIS NSW
B1046: Item Fulfillment | C1046: 2024-09-23T00:00:00.000 | D1046: 434515 | E1046: 18312 Oswaldo Razo | F1046: F | G1046: Inventory Asset : Finished Goods | H1046: 18.1 | I1046: NA Games-STORE | J1046: RNT1-PS5-WS-VG-PE | K1046: REYNATIS PS5
B1047: Item Fulfillment | C1047: 2024-09-23T00:00:00.000 | D1047: 434689 | E1047: Matthew Berger | F1047: F | G1047: Inventory Asset : Finished Goods | H1047: 20.61 | I1047: NA Games-STORE | J1047: RNT1-NSW-WS-VG-PE | K1047: REYNATIS NSW
B1048: Item Fulfillment | C1048: 2024-09-23T00:00:00.000 | D1048: 434499 | E1048: 21196 Dayron Bishop | F1048: F | G1048: Inventory Asset : Finished Goods | H1048: 20.61 | I1048: NA Games-STORE | J1048: RNT1-NSW-WS-VG-PE | K1048: REYNATIS NSW
B1049: Item Fulfillment | C1049: 2024-09-23T00:00:00.000 | D1049: 434679 | E1049: 23594 Julie Reynolds | F1049: F | G1049: Inventory Asset : Finished Goods | H1049: 20.61 | I1049: NA Games-STORE | J1049: RNT1-NSW-WS-VG-PE | K1049: REYNATIS NSW
B1050: Item Fulfillment | C1050: 2024-09-23T00:00:00.000 | D1050: 434720 | E1050: 23702 Saul Escobar Jr. | F1050: F | G1050: Inventory Asset : Finished Goods | H1050: 18.1 | I1050: NA Games-STORE | J1050: RNT1-PS4-WS-VG-PE | K1050: REYNATIS PS4
B1051: Item Fulfillment | C1051: 2024-09-23T00:00:00.000 | D1051: 434323 | E1051: 22368 Melvin Jacoby | F1051: F | G1051: Inventory Asset : Finished Goods | H1051: 20.61 | I1051: NA Games-STORE | J1051: RNT1-NSW-WS-VG-PE | K1051: REYNATIS NSW
B1052: Item Fulfillment | C1052: 2024-09-23T00:00:00.000 | D1052: 434454 | E1052: Scott Miller 3 | F1052: F | G1052: Inventory Asset : Finished Goods | H1052: 20.61 | I1052: NA Games-STORE | J1052: RNT1-NSW-WS-VG-PE | K1052: REYNATIS NSW
B1053: Item Fulfillment | C1053: 2024-09-23T00:00:00.000 | D1053: 434391 | E1053: Mark Hensley | F1053: F | G1053: Inventory Asset : Finished Goods | H1053: 20.61 | I1053: NA Games-STORE | J1053: RNT1-NSW-WS-VG-PE | K1053: REYNATIS NSW
B1054: Item Fulfillment | C1054: 2024-09-23T00:00:00.000 | D1054: 434540 | E1054: Jason Kasprzyk | F1054: F | G1054: Inventory Asset : Finished Goods | H1054: 20.61 | I1054: NA Games-STORE | J1054: RNT1-NSW-WS-VG-PE | K1054: REYNATIS NSW
B1055: Item Fulfillment | C1055: 2024-09-23T00:00:00.000 | D1055: 434691 | E1055: 23411 Moe Sett | F1055: F | G1055: Inventory Asset : Finished Goods | H1055: 18.1 | I1055: NA Games-STORE | J1055: RNT1-PS4-WS-VG-PE | K1055: REYNATIS PS4
B1056: Item Fulfillment | C1056: 2024-09-23T00:00:00.000 | D1056: 434524 | E1056: Clarissa Krisnawan | F1056: F | G1056: Inventory Asset : Finished Goods | H1056: 20.61 | I1056: NA Games-STORE | J1056: RNT1-NSW-WS-VG-PE | K1056: REYNATIS NSW
B1057: Item Fulfillment | C1057: 2024-09-23T00:00:00.000 | D1057: 434782 | E1057: clmahan | F1057: F | G1057: Inventory Asset : Finished Goods | H1057: 18.1 | I1057: NA Games-STORE | J1057: RNT1-PS4-WS-VG-PE | K1057: REYNATIS PS4
B1058: Item Fulfillment | C1058: 2024-09-23T00:00:00.000 | D1058: 434492 | E1058: George Myers | F1058: F | G1058: Inventory Asset : Finished Goods | H1058: 20.61 | I1058: NA Games-STORE | J1058: RNT1-NSW-WS-VG-PE | K1058: REYNATIS NSW
B1059: Item Fulfillment | C1059: 2024-09-23T00:00:00.000 | D1059: 434749 | E1059: Brian Reynolds | F1059: F | G1059: Inventory Asset : Finished Goods | H1059: 20.61 | I1059: NA Games-STORE | J1059: RNT1-NSW-WS-VG-PE | K1059: REYNATIS NSW
B1060: Item Fulfillment | C1060: 2024-09-23T00:00:00.000 | D1060: 434588 | E1060: Jaykub Hardman | F1060: F | G1060: Inventory Asset : Finished Goods | H1060: 20.61 | I1060: NA Games-STORE | J1060: RNT1-NSW-WS-VG-PE | K1060: REYNATIS NSW
B1061: Item Fulfillment | C1061: 2024-09-23T00:00:00.000 | D1061: 434316 | E1061: 22363 Devin West | F1061: F | G1061: Inventory Asset : Finished Goods | H1061: 20.61 | I1061: NA Games-STORE | J1061: RNT1-NSW-WS-VG-PE | K1061: REYNATIS NSW
B1062: Item Fulfillment | C1062: 2024-09-23T00:00:00.000 | D1062: 434420 | E1062: 22438 Abdullah Rehman | F1062: F | G1062: Inventory Asset : Finished Goods | H1062: 20.61 | I1062: NA Games-STORE | J1062: RNT1-NSW-WS-VG-PE | K1062: REYNATIS NSW
B1063: Item Fulfillment | C1063: 2024-09-23T00:00:00.000 | D1063: 434403 | E1063: 19854 Dierre Williams | F1063: F | G1063: Inventory Asset : Finished Goods | H1063: 20.61 | I1063: NA Games-STORE | J1063: RNT1-NSW-WS-VG-PE | K1063: REYNATIS NSW
B1064: Item Fulfillment | C1064: 2024-09-23T00:00:00.000 | D1064: 434367 | E1064: 222 Albert Le-Nguyen | F1064: F | G1064: Inventory Asset : Finished Goods | H1064: 20.61 | I1064: NA Games-STORE | J1064: RNT1-NSW-WS-VG-PE | K1064: REYNATIS NSW
B1065: Item Fulfillment | C1065: 2024-09-23T00:00:00.000 | D1065: 434352 | E1065: Edward Liu | F1065: F | G1065: Inventory Asset : Finished Goods | H1065: 20.61 | I1065: NA Games-STORE | J1065: RNT1-NSW-WS-VG-PE | K1065: REYNATIS NSW
B1066: Item Fulfillment | C1066: 2024-09-23T00:00:00.000 | D1066: 434697 | E1066: Robert Richards | F1066: F | G1066: Inventory Asset : Finished Goods | H1066: 18.1 | I1066: NA Games-STORE | J1066: RNT1-PS4-WS-VG-PE | K1066: REYNATIS PS4
B1067: Item Fulfillment | C1067: 2024-09-23T00:00:00.000 | D1067: 434781 | E1067: Matthew Appuhn 30 | F1067: F | G1067: Inventory Asset : Finished Goods | H1067: 18.1 | I1067: NA Games-STORE | J1067: RNT1-PS5-WS-VG-PE | K1067: REYNATIS PS5
B1068: Item Fulfillment | C1068: 2024-09-23T00:00:00.000 | D1068: 434639 | E1068: Helping Hand | F1068: F | G1068: Inventory Asset : Finished Goods | H1068: 20.61 | I1068: NA Games-STORE | J1068: RNT1-NSW-WS-VG-PE | K1068: REYNATIS NSW
B1069: Item Fulfillment | C1069: 2024-09-23T00:00:00.000 | D1069: 434623 | E1069: Virgil Nadasan | F1069: F | G1069: Inventory Asset : Finished Goods | H1069: 20.61 | I1069: NA Games-STORE | J1069: RNT1-NSW-WS-VG-PE | K1069: REYNATIS NSW
B1070: Item Fulfillment | C1070: 2024-09-23T00:00:00.000 | D1070: 434605 | E1070: M K | F1070: F | G1070: Inventory Asset : Finished Goods | H1070: 20.61 | I1070: NA Games-STORE | J1070: RNT1-NSW-WS-VG-PE | K1070: REYNATIS NSW
B1071: Item Fulfillment | C1071: 2024-09-23T00:00:00.000 | D1071: 434463 | E1071: Xavier Martinez | F1071: F | G1071: Inventory Asset : Finished Goods | H1071: 18.1 | I1071: NA Games-STORE | J1071: RNT1-PS4-WS-VG-PE | K1071: REYNATIS PS4
B1072: Item Fulfillment | C1072: 2024-09-23T00:00:00.000 | D1072: 434687 | E1072: Amy Yeung [1000270005] | F1072: F | G1072: Inventory Asset : Finished Goods | H1072: 18.1 | I1072: NA Games-STORE | J1072: RNT1-PS4-WS-VG-PE | K1072: REYNATIS PS4
B1073: Item Fulfillment | C1073: 2024-09-23T00:00:00.000 | D1073: 434672 | E1073: Jacob Beard | F1073: F | G1073: Inventory Asset : Finished Goods | H1073: 20.61 | I1073: NA Games-STORE | J1073: RNT1-NSW-WS-VG-PE | K1073: REYNATIS NSW
B1074: Item Fulfillment | C1074: 2024-09-23T00:00:00.000 | D1074: 434590 | E1074: 19263 Gregory Thomas | F1074: F | G1074: Inventory Asset : Finished Goods | H1074: 20.61 | I1074: NA Games-STORE | J1074: RNT1-NSW-WS-VG-PE | K1074: REYNATIS NSW
B1075: Item Fulfillment | C1075: 2024-09-23T00:00:00.000 | D1075: 434311 | E1075: Leslie Buzzell | F1075: F | G1075: Inventory Asset : Finished Goods | H1075: 18.1 | I1075: NA Games-STORE | J1075: RNT1-PS5-WS-VG-PE | K1075: REYNATIS PS5
B1076: Item Fulfillment | C1076: 2024-09-23T00:00:00.000 | D1076: 434447 | E1076: 22441 Jose manuel Silva Olmedo | F1076: F | G1076: Inventory Asset : Finished Goods | H1076: 18.1 | I1076: NA Games-STORE | J1076: RNT1-PS5-WS-VG-PE | K1076: REYNATIS PS5
B1077: Item Fulfillment | C1077: 2024-09-23T00:00:00.000 | D1077: 434437 | E1077: Philip Kinney 4 | F1077: F | G1077: Inventory Asset : Finished Goods | H1077: 20.61 | I1077: NA Games-STORE | J1077: RNT1-NSW-WS-VG-PE | K1077: REYNATIS NSW
B1078: Item Fulfillment | C1078: 2024-09-23T00:00:00.000 | D1078: 434426 | E1078: Kenneth Smith [1000181378] | F1078: F | G1078: Inventory Asset : Finished Goods | H1078: 18.1 | I1078: NA Games-STORE | J1078: RNT1-PS4-WS-VG-PE | K1078: REYNATIS PS4
B1079: Item Fulfillment | C1079: 2024-09-23T00:00:00.000 | D1079: 434350 | E1079: Jason McClure | F1079: F | G1079: Inventory Asset : Finished Goods | H1079: 20.61 | I1079: NA Games-STORE | J1079: RNT1-NSW-WS-VG-PE | K1079: REYNATIS NSW
B1080: Item Fulfillment | C1080: 2024-09-23T00:00:00.000 | D1080: 434339 | E1080: Nathan Graff 14 | F1080: F | G1080: Inventory Asset : Finished Goods | H1080: 20.61 | I1080: NA Games-STORE | J1080: RNT1-NSW-WS-VG-PE | K1080: REYNATIS NSW
B1081: Item Fulfillment | C1081: 2024-09-23T00:00:00.000 | D1081: 434327 | E1081: 22373 brandon dennison | F1081: F | G1081: Inventory Asset : Finished Goods | H1081: 20.61 | I1081: NA Games-STORE | J1081: RNT1-NSW-WS-VG-PE | K1081: REYNATIS NSW
B1082: Item Fulfillment | C1082: 2024-09-23T00:00:00.000 | D1082: 434508 | E1082: Helen Fuentes | F1082: F | G1082: Inventory Asset : Finished Goods | H1082: 20.61 | I1082: NA Games-STORE | J1082: RNT1-NSW-WS-VG-PE | K1082: REYNATIS NSW
B1083: Item Fulfillment | C1083: 2024-09-23T00:00:00.000 | D1083: 434506 | E1083: Joseph Hawkins [1000229513] | F1083: F | G1083: Inventory Asset : Finished Goods | H1083: 41.22 | I1083: NA Games-STORE | J1083: RNT1-NSW-WS-VG-PE | K1083: REYNATIS NSW
B1084: Item Fulfillment | C1084: 2024-09-23T00:00:00.000 | D1084: 434670 | E1084: Omar Serrano | F1084: F | G1084: Inventory Asset : Finished Goods | H1084: 20.61 | I1084: NA Games-STORE | J1084: RNT1-NSW-WS-VG-PE | K1084: REYNATIS NSW
B1085: Item Fulfillment | C1085: 2024-09-23T00:00:00.000 | D1085: 434659 | E1085: Virgil Schrom | F1085: F | G1085: Inventory Asset : Finished Goods | H1085: 20.61 | I1085: NA Games-STORE | J1085: RNT1-NSW-WS-VG-PE | K1085: REYNATIS NSW
B1086: Item Fulfillment | C1086: 2024-09-23T00:00:00.000 | D1086: 434753 | E1086: Kent Springborn | F1086: F | G1086: Inventory Asset : Finished Goods | H1086: 20.61 | I1086: NA Games-STORE | J1086: RNT1-NSW-WS-VG-PE | K1086: REYNATIS NSW
B1087: Item Fulfillment | C1087: 2024-09-23T00:00:00.000 | D1087: 434737 | E1087: 22087 Harrison Moccio | F1087: F | G1087: Inventory Asset : Finished Goods | H1087: 21.51 | I1087: NA Games-STORE | J1087: LON1-PS4-WS-VG-PE | K1087: Legend of Nayuta PS4
B1088: Item Fulfillment | C1088: 2024-09-23T00:00:00.000 | D1088: 434300 | E1088: Chris Wheeler [1000201803] | F1088: F | G1088: Inventory Asset : Finished Goods | H1088: 20.61 | I1088: NA Games-STORE | J1088: RNT1-NSW-WS-VG-PE | K1088: REYNATIS NSW
B1089: Item Fulfillment | C1089: 2024-09-23T00:00:00.000 | D1089: 434357 | E1089: Christopher Turner | F1089: F | G1089: Inventory Asset : Finished Goods | H1089: 18.1 | I1089: NA Games-STORE | J1089: RNT1-PS5-WS-VG-PE | K1089: REYNATIS PS5
B1090: Item Fulfillment | C1090: 2024-09-23T00:00:00.000 | D1090: 434779 | E1090: 22920 Matthew Gaffney | F1090: F | G1090: Inventory Asset : Finished Goods | H1090: 20.12 | I1090: NA Games-STORE | J1090: TC34-PS5-WS-VG-PE | K1090: Trails of Cold Steel 3+4 PS5
B1091: Item Fulfillment | C1091: 2024-09-23T00:00:00.000 | D1091: 434752 | E1091: 17762 Juan Olguin | F1091: F | G1091: Inventory Asset : Finished Goods | H1091: 20.12 | I1091: NA Games-STORE | J1091: TC34-PS5-WS-VG-PE | K1091: Trails of Cold Steel 3+4 PS5
B1092: Item Fulfillment | C1092: 2024-09-23T00:00:00.000 | D1092: 434743 | E1092: Polsak Mungmanakij | F1092: F | G1092: Inventory Asset : Finished Goods | H1092: 18.1 | I1092: NA Games-STORE | J1092: RNT1-PS5-WS-VG-PE | K1092: REYNATIS PS5
B1093: Item Fulfillment | C1093: 2024-09-23T00:00:00.000 | D1093: 434728 | E1093: brian smith | F1093: F | G1093: Inventory Asset : Finished Goods | H1093: 18.1 | I1093: NA Games-STORE | J1093: RNT1-PS4-WS-VG-PE | K1093: REYNATIS PS4
B1094: Item Fulfillment | C1094: 2024-09-23T00:00:00.000 | D1094: 434462 | E1094: Joseph Johnson | F1094: F | G1094: Inventory Asset : Finished Goods | H1094: 20.61 | I1094: NA Games-STORE | J1094: RNT1-NSW-WS-VG-PE | K1094: REYNATIS NSW
B1095: Item Fulfillment | C1095: 2024-09-23T00:00:00.000 | D1095: 434461 | E1095: Armando Lizardo [135229] | F1095: F | G1095: Inventory Asset : Finished Goods | H1095: 20.61 | I1095: NA Games-STORE | J1095: RNT1-NSW-WS-VG-PE | K1095: REYNATIS NSW
B1096: Item Fulfillment | C1096: 2024-09-23T00:00:00.000 | D1096: 434427 | E1096: Karen Gagliano | F1096: F | G1096: Inventory Asset : Finished Goods | H1096: 20.61 | I1096: NA Games-STORE | J1096: RNT1-NSW-WS-VG-PE | K1096: REYNATIS NSW
B1097: Item Fulfillment | C1097: 2024-09-23T00:00:00.000 | D1097: 434381 | E1097: Mikhail | F1097: F | G1097: Inventory Asset : Finished Goods | H1097: 20.61 | I1097: NA Games-STORE | J1097: RNT1-NSW-WS-VG-PE | K1097: REYNATIS NSW
B1098: Item Fulfillment | C1098: 2024-09-23T00:00:00.000 | D1098: 434356 | E1098: Carlos J Martinez | F1098: F | G1098: Inventory Asset : Finished Goods | H1098: 20.61 | I1098: NA Games-STORE | J1098: RNT1-NSW-WS-VG-PE | K1098: REYNATIS NSW
B1099: Item Fulfillment | C1099: 2024-09-23T00:00:00.000 | D1099: 434558 | E1099: Oscar Anguiano | F1099: F | G1099: Inventory Asset : Finished Goods | H1099: 20.61 | I1099: NA Games-STORE | J1099: RNT1-NSW-WS-VG-PE | K1099: REYNATIS NSW
B1100: Item Fulfillment | C1100: 2024-09-23T00:00:00.000 | D1100: 434533 | E1100: 20437 Prince Hicks | F1100: F | G1100: Inventory Asset : Finished Goods | H1100: 20.61 | I1100: NA Games-STORE | J1100: RNT1-NSW-WS-VG-PE | K1100: REYNATIS NSW
B1101: Item Fulfillment | C1101: 2024-09-23T00:00:00.000 | D1101: 434522 | E1101: Phil Grigsby [1000339514] | F1101: F | G1101: Inventory Asset : Finished Goods | H1101: 18.1 | I1101: NA Games-STORE | J1101: RNT1-PS4-WS-VG-PE | K1101: REYNATIS PS4
B1102: Item Fulfillment | C1102: 2024-09-23T00:00:00.000 | D1102: 434684 | E1102: 23618 Elizabeth Brubaker | F1102: F | G1102: Inventory Asset : Finished Goods | H1102: 20.61 | I1102: NA Games-STORE | J1102: RNT1-NSW-WS-VG-PE | K1102: REYNATIS NSW
B1103: Item Fulfillment | C1103: 2024-09-23T00:00:00.000 | D1103: 434618 | E1103: Dillon Galloway | F1103: F | G1103: Inventory Asset : Finished Goods | H1103: 20.61 | I1103: NA Games-STORE | J1103: RNT1-NSW-WS-VG-PE | K1103: REYNATIS NSW
B1104: Item Fulfillment | C1104: 2024-09-23T00:00:00.000 | D1104: 434706 | E1104: 23679 Andrew Somers | F1104: F | G1104: Inventory Asset : Finished Goods | H1104: 20.61 | I1104: NA Games-STORE | J1104: RNT1-NSW-WS-VG-PE | K1104: REYNATIS NSW
B1105: Item Fulfillment | C1105: 2024-09-23T00:00:00.000 | D1105: 434439 | E1105: Phillip Fitchew | F1105: F | G1105: Inventory Asset : Finished Goods | H1105: 20.61 | I1105: NA Games-STORE | J1105: RNT1-NSW-WS-VG-PE | K1105: REYNATIS NSW
B1106: Item Fulfillment | C1106: 2024-09-23T00:00:00.000 | D1106: 434329 | E1106: Brian Nathanson [55135] | F1106: F | G1106: Inventory Asset : Finished Goods | H1106: 20.61 | I1106: NA Games-STORE | J1106: RNT1-NSW-WS-VG-PE | K1106: REYNATIS NSW
B1107: Item Fulfillment | C1107: 2024-09-23T00:00:00.000 | D1107: 434699 | E1107: 23649 Tyler Odekirk | F1107: F | G1107: Inventory Asset : Finished Goods | H1107: 18.1 | I1107: NA Games-STORE | J1107: RNT1-PS4-WS-VG-PE | K1107: REYNATIS PS4
B1108: Item Fulfillment | C1108: 2024-09-23T00:00:00.000 | D1108: 434548 | E1108: Eric Goess | F1108: F | G1108: Inventory Asset : Finished Goods | H1108: 20.61 | I1108: NA Games-STORE | J1108: RNT1-NSW-WS-VG-PE | K1108: REYNATIS NSW
B1109: Item Fulfillment | C1109: 2024-09-23T00:00:00.000 | D1109: 434656 | E1109: Fernando F Flores Martínez | F1109: F | G1109: Inventory Asset : Finished Goods | H1109: 20.61 | I1109: NA Games-STORE | J1109: RNT1-NSW-WS-VG-PE | K1109: REYNATIS NSW
B1110: Item Fulfillment | C1110: 2024-09-23T00:00:00.000 | D1110: 434646 | E1110: Joseph Ross [45433] | F1110: F | G1110: Inventory Asset : Finished Goods | H1110: 20.61 | I1110: NA Games-STORE | J1110: RNT1-NSW-WS-VG-PE | K1110: REYNATIS NSW
B1111: Item Fulfillment | C1111: 2024-09-23T00:00:00.000 | D1111: 434634 | E1111: Tri Pham [1000247301] | F1111: F | G1111: Inventory Asset : Finished Goods | H1111: 20.61 | I1111: NA Games-STORE | J1111: RNT1-NSW-WS-VG-PE | K1111: REYNATIS NSW
B1112: Item Fulfillment | C1112: 2024-09-23T00:00:00.000 | D1112: 434610 | E1112: Elizabeth Nguyen | F1112: F | G1112: Inventory Asset : Finished Goods | H1112: 20.61 | I1112: NA Games-STORE | J1112: RNT1-NSW-WS-VG-PE | K1112: REYNATIS NSW
B1113: Item Fulfillment | C1113: 2024-09-23T00:00:00.000 | D1113: 434606 | E1113: 23191 Paula BaileyStine | F1113: F | G1113: Inventory Asset : Finished Goods | H1113: 20.61 | I1113: NA Games-STORE | J1113: RNT1-NSW-WS-VG-PE | K1113: REYNATIS NSW
B1114: Item Fulfillment | C1114: 2024-09-23T00:00:00.000 | D1114: 434317 | E1114: Charles Hale | F1114: F | G1114: Inventory Asset : Finished Goods | H1114: 20.61 | I1114: NA Games-STORE | J1114: RNT1-NSW-WS-VG-PE | K1114: REYNATIS NSW
B1115: Item Fulfillment | C1115: 2024-09-23T00:00:00.000 | D1115: 434428 | E1115: 20157 ng ming | F1115: F | G1115: Inventory Asset : Finished Goods | H1115: 20.61 | I1115: NA Games-STORE | J1115: RNT1-NSW-WS-VG-PE | K1115: REYNATIS NSW
B1116: Item Fulfillment | C1116: 2024-09-23T00:00:00.000 | D1116: 434389 | E1116: Michael Fritz | F1116: F | G1116: Inventory Asset : Finished Goods | H1116: 20.61 | I1116: NA Games-STORE | J1116: RNT1-NSW-WS-VG-PE | K1116: REYNATIS NSW
B1117: Item Fulfillment | C1117: 2024-09-23T00:00:00.000 | D1117: 434503 | E1117: Nathanial Post | F1117: F | G1117: Inventory Asset : Finished Goods | H1117: 20.61 | I1117: NA Games-STORE | J1117: RNT1-NSW-WS-VG-PE | K1117: REYNATIS NSW
B1118: Item Fulfillment | C1118: 2024-09-23T00:00:00.000 | D1118: 434716 | E1118: 23693 Jeffrey James | F1118: F | G1118: Inventory Asset : Finished Goods | H1118: 18.1 | I1118: NA Games-STORE | J1118: RNT1-PS5-WS-VG-PE | K1118: REYNATIS PS5
B1119: Item Fulfillment | C1119: 2024-09-23T00:00:00.000 | D1119: 434711 | E1119: David Devaty | F1119: F | G1119: Inventory Asset : Finished Goods | H1119: 20.61 | I1119: NA Games-STORE | J1119: RNT1-NSW-WS-VG-PE | K1119: REYNATIS NSW
B1120: Item Fulfillment | C1120: 2024-09-23T00:00:00.000 | D1120: 434579 | E1120: Darnel Turbides | F1120: F | G1120: Inventory Asset : Finished Goods | H1120: 20.61 | I1120: NA Games-STORE | J1120: RNT1-NSW-WS-VG-PE | K1120: REYNATIS NSW
B1121: Item Fulfillment | C1121: 2024-09-23T00:00:00.000 | D1121: 434419 | E1121: Erik Eid [1000326045] | F1121: F | G1121: Inventory Asset : Finished Goods | H1121: 20.61 | I1121: NA Games-STORE | J1121: RNT1-NSW-WS-VG-PE | K1121: REYNATIS NSW
B1122: Item Fulfillment | C1122: 2024-09-23T00:00:00.000 | D1122: 434531 | E1122: 243 Phi Le | F1122: F | G1122: Inventory Asset : Finished Goods | H1122: 20.61 | I1122: NA Games-STORE | J1122: RNT1-NSW-WS-VG-PE | K1122: REYNATIS NSW
B1123: Item Fulfillment | C1123: 2024-09-23T00:00:00.000 | D1123: 434525 | E1123: Sook Kuan Goh | F1123: F | G1123: Inventory Asset : Finished Goods | H1123: 20.61 | I1123: NA Games-STORE | J1123: RNT1-NSW-WS-VG-PE | K1123: REYNATIS NSW
B1124: Item Fulfillment | C1124: 2024-09-23T00:00:00.000 | D1124: 434614 | E1124: Tyrick | F1124: F | G1124: Inventory Asset : Finished Goods | H1124: 20.61 | I1124: NA Games-STORE | J1124: RNT1-NSW-WS-VG-PE | K1124: REYNATIS NSW
B1125: Item Fulfillment | C1125: 2024-09-23T00:00:00.000 | D1125: 434574 | E1125: Justin Lu | F1125: F | G1125: Inventory Asset : Finished Goods | H1125: 18.1 | I1125: NA Games-STORE | J1125: RNT1-PS4-WS-VG-PE | K1125: REYNATIS PS4
B1126: Item Fulfillment | C1126: 2024-09-23T00:00:00.000 | D1126: 434383 | E1126: Christian Shelton | F1126: F | G1126: Inventory Asset : Finished Goods | H1126: 20.61 | I1126: NA Games-STORE | J1126: RNT1-NSW-WS-VG-PE | K1126: REYNATIS NSW
B1127: Item Fulfillment | C1127: 2024-09-23T00:00:00.000 | D1127: 434365 | E1127: Kelly 2 | F1127: F | G1127: Inventory Asset : Finished Goods | H1127: 20.61 | I1127: NA Games-STORE | J1127: RNT1-NSW-WS-VG-PE | K1127: REYNATIS NSW
B1128: Item Fulfillment | C1128: 2024-09-23T00:00:00.000 | D1128: 434568 | E1128: Vincent Mahoney | F1128: F | G1128: Inventory Asset : Finished Goods | H1128: 20.61 | I1128: NA Games-STORE | J1128: RNT1-NSW-WS-VG-PE | K1128: REYNATIS NSW
B1129: Item Fulfillment | C1129: 2024-09-23T00:00:00.000 | D1129: 434566 | E1129: Lily Huon | F1129: F | G1129: Inventory Asset : Finished Goods | H1129: 20.61 | I1129: NA Games-STORE | J1129: RNT1-NSW-WS-VG-PE | K1129: REYNATIS NSW
B1130: Item Fulfillment | C1130: 2024-09-23T00:00:00.000 | D1130: 434562 | E1130: 22652 Eduardo Diaz | F1130: F | G1130: Inventory Asset : Finished Goods | H1130: 18.1 | I1130: NA Games-STORE | J1130: RNT1-PS4-WS-VG-PE | K1130: REYNATIS PS4
B1131: Item Fulfillment | C1131: 2024-09-23T00:00:00.000 | D1131: 434529 | E1131: Tyler Voyles [1000247825] | F1131: F | G1131: Inventory Asset : Finished Goods | H1131: 18.1 | I1131: NA Games-STORE | J1131: RNT1-PS4-WS-VG-PE | K1131: REYNATIS PS4
B1132: Item Fulfillment | C1132: 2024-09-23T00:00:00.000 | D1132: 434673 | E1132: Nicholas Loughrey | F1132: F | G1132: Inventory Asset : Finished Goods | H1132: 20.61 | I1132: NA Games-STORE | J1132: RNT1-NSW-WS-VG-PE | K1132: REYNATIS NSW
B1133: Item Fulfillment | C1133: 2024-09-23T00:00:00.000 | D1133: 434653 | E1133: Sandra Fisher | F1133: F | G1133: Inventory Asset : Finished Goods | H1133: 18.1 | I1133: NA Games-STORE | J1133: RNT1-PS4-WS-VG-PE | K1133: REYNATIS PS4
B1134: Item Fulfillment | C1134: 2024-09-23T00:00:00.000 | D1134: 434636 | E1134: 23290 Durell Plunkett | F1134: F | G1134: Inventory Asset : Finished Goods | H1134: 20.61 | I1134: NA Games-STORE | J1134: RNT1-NSW-WS-VG-PE | K1134: REYNATIS NSW
B1135: Item Fulfillment | C1135: 2024-09-23T00:00:00.000 | D1135: 434727 | E1135: Steven Wang | F1135: F | G1135: Inventory Asset : Finished Goods | H1135: 18.1 | I1135: NA Games-STORE | J1135: RNT1-PS4-WS-VG-PE | K1135: REYNATIS PS4
B1136: Item Fulfillment | C1136: 2024-09-23T00:00:00.000 | D1136: 434718 | E1136: Vianey Bustos | F1136: F | G1136: Inventory Asset : Finished Goods | H1136: 20.61 | I1136: NA Games-STORE | J1136: RNT1-NSW-WS-VG-PE | K1136: REYNATIS NSW
B1137: Item Fulfillment | C1137: 2024-09-23T00:00:00.000 | D1137: 434584 | E1137: Michael Hoo [129981] | F1137: F | G1137: Inventory Asset : Finished Goods | H1137: 20.61 | I1137: NA Games-STORE | J1137: RNT1-NSW-WS-VG-PE | K1137: REYNATIS NSW
B1138: Item Fulfillment | C1138: 2024-09-23T00:00:00.000 | D1138: 434320 | E1138: David 41 | F1138: F | G1138: Inventory Asset : Finished Goods | H1138: 20.61 | I1138: NA Games-STORE | J1138: RNT1-NSW-WS-VG-PE | K1138: REYNATIS NSW
B1139: Item Fulfillment | C1139: 2024-09-23T00:00:00.000 | D1139: 434364 | E1139: Michael Summers | F1139: F | G1139: Inventory Asset : Finished Goods | H1139: 41.22 | I1139: NA Games-STORE | J1139: RNT1-NSW-WS-VG-PE | K1139: REYNATIS NSW
B1140: Item Fulfillment | C1140: 2024-09-23T00:00:00.000 | D1140: 434698 | E1140: Brian Pinizotto | F1140: F | G1140: Inventory Asset : Finished Goods | H1140: 18.1 | I1140: NA Games-STORE | J1140: RNT1-PS4-WS-VG-PE | K1140: REYNATIS PS4
B1141: Item Fulfillment | C1141: 2024-09-23T00:00:00.000 | D1141: 434690 | E1141: Sean Bosh | F1141: F | G1141: Inventory Asset : Finished Goods | H1141: 20.61 | I1141: NA Games-STORE | J1141: RNT1-NSW-WS-VG-PE | K1141: REYNATIS NSW
B1142: Item Fulfillment | C1142: 2024-09-23T00:00:00.000 | D1142: 434724 | E1142: 23710 Laurent Kang | F1142: F | G1142: Inventory Asset : Finished Goods | H1142: 18.1 | I1142: NA Games-STORE | J1142: RNT1-PS5-WS-VG-PE | K1142: REYNATIS PS5
B1143: Item Fulfillment | C1143: 2024-09-23T00:00:00.000 | D1143: 434600 | E1143: 23138 Devonte Bellamy | F1143: F | G1143: Inventory Asset : Finished Goods | H1143: 20.61 | I1143: NA Games-STORE | J1143: RNT1-NSW-WS-VG-PE | K1143: REYNATIS NSW
B1144: Item Fulfillment | C1144: 2024-09-23T00:00:00.000 | D1144: 434721 | E1144: Anthony Dyer | F1144: F | G1144: Inventory Asset : Finished Goods | H1144: 20.61 | I1144: NA Games-STORE | J1144: RNT1-NSW-WS-VG-PE | K1144: REYNATIS NSW
B1145: Item Fulfillment | C1145: 2024-09-23T00:00:00.000 | D1145: 434594 | E1145: Alex Aranovsky | F1145: F | G1145: Inventory Asset : Finished Goods | H1145: 18.1 | I1145: NA Games-STORE | J1145: RNT1-PS4-WS-VG-PE | K1145: REYNATIS PS4
B1146: Item Fulfillment | C1146: 2024-09-23T00:00:00.000 | D1146: 434707 | E1146: Cory Burchette Burchette | F1146: F | G1146: Inventory Asset : Finished Goods | H1146: 20.61 | I1146: NA Games-STORE | J1146: RNT1-NSW-WS-VG-PE | K1146: REYNATIS NSW
B1147: Item Fulfillment | C1147: 2024-09-23T00:00:00.000 | D1147: 434314 | E1147: 22361 Ross Just | F1147: F | G1147: Inventory Asset : Finished Goods | H1147: 20.61 | I1147: NA Games-STORE | J1147: RNT1-NSW-WS-VG-PE | K1147: REYNATIS NSW
B1148: Item Fulfillment | C1148: 2024-09-23T00:00:00.000 | D1148: 434459 | E1148: François Le Hénaff | F1148: F | G1148: Inventory Asset : Finished Goods | H1148: 18.1 | I1148: NA Games-STORE | J1148: RNT1-PS5-WS-VG-PE | K1148: REYNATIS PS5
B1149: Item Fulfillment | C1149: 2024-09-23T00:00:00.000 | D1149: 434458 | E1149: Jeff Hernandez | F1149: F | G1149: Inventory Asset : Finished Goods | H1149: 20.61 | I1149: NA Games-STORE | J1149: RNT1-NSW-WS-VG-PE | K1149: REYNATIS NSW
B1150: Item Fulfillment | C1150: 2024-09-23T00:00:00.000 | D1150: 434457 | E1150: Sebastian Bednarek | F1150: F | G1150: Inventory Asset : Finished Goods | H1150: 20.61 | I1150: NA Games-STORE | J1150: RNT1-NSW-WS-VG-PE | K1150: REYNATIS NSW
B1151: Item Fulfillment | C1151: 2024-09-23T00:00:00.000 | D1151: 434298 | E1151: Warren Kong | F1151: F | G1151: Inventory Asset : Finished Goods | H1151: 18.1 | I1151: NA Games-STORE | J1151: RNT1-PS5-WS-VG-PE | K1151: REYNATIS PS5
B1152: Item Fulfillment | C1152: 2024-09-23T00:00:00.000 | D1152: 434370 | E1152: 590 Miguel Medina-Gomez | F1152: F | G1152: Inventory Asset : Finished Goods | H1152: 18.1 | I1152: NA Games-STORE | J1152: RNT1-PS4-WS-VG-PE | K1152: REYNATIS PS4
B1153: Item Fulfillment | C1153: 2024-09-23T00:00:00.000 | D1153: 434362 | E1153: Toby Fine | F1153: F | G1153: Inventory Asset : Finished Goods | H1153: 20.61 | I1153: NA Games-STORE | J1153: RNT1-NSW-WS-VG-PE | K1153: REYNATIS NSW
B1154: Item Fulfillment | C1154: 2024-09-23T00:00:00.000 | D1154: 434537 | E1154: Boun Thao | F1154: F | G1154: Inventory Asset : Finished Goods | H1154: 20.61 | I1154: NA Games-STORE | J1154: RNT1-NSW-WS-VG-PE | K1154: REYNATIS NSW
B1155: Item Fulfillment | C1155: 2024-09-23T00:00:00.000 | D1155: 434509 | E1155: 22516 Amber Mieles | F1155: F | G1155: Inventory Asset : Finished Goods | H1155: 20.61 | I1155: NA Games-STORE | J1155: RNT1-NSW-WS-VG-PE | K1155: REYNATIS NSW
B1156: Item Fulfillment | C1156: 2024-09-23T00:00:00.000 | D1156: 434505 | E1156: 22507 Kirsten McNiff | F1156: F | G1156: Inventory Asset : Finished Goods | H1156: 20.61 | I1156: NA Games-STORE | J1156: RNT1-NSW-WS-VG-PE | K1156: REYNATIS NSW
B1157: Item Fulfillment | C1157: 2024-09-23T00:00:00.000 | D1157: 434786 | E1157: roy eubank | F1157: F | G1157: Inventory Asset : Finished Goods | H1157: 18.1 | I1157: NA Games-STORE | J1157: RNT1-PS5-WS-VG-PE | K1157: REYNATIS PS5
B1158: Item Fulfillment | C1158: 2024-09-23T00:00:00.000 | D1158: 434662 | E1158: Brent Farrow | F1158: F | G1158: Inventory Asset : Finished Goods | H1158: 20.61 | I1158: NA Games-STORE | J1158: RNT1-NSW-WS-VG-PE | K1158: REYNATIS NSW
B1159: Item Fulfillment | C1159: 2024-09-23T00:00:00.000 | D1159: 434748 | E1159: 22780 Cole Podolsky | F1159: F | G1159: Inventory Asset : Finished Goods | H1159: 21.37 | I1159: NA Games-STORE | J1159: LOL1-NSW-WS-VG-PE | K1159: Legend of Legacy HD NSW
B1160: Item Fulfillment | C1160: 2024-09-23T00:00:00.000 | D1160: 434416 | E1160: james strickland | F1160: F | G1160: Inventory Asset : Finished Goods | H1160: 20.61 | I1160: NA Games-STORE | J1160: RNT1-NSW-WS-VG-PE | K1160: REYNATIS NSW
B1161: Item Fulfillment | C1161: 2024-09-23T00:00:00.000 | D1161: 434368 | E1161: Joaquin De Cordova | F1161: F | G1161: Inventory Asset : Finished Goods | H1161: 18.1 | I1161: NA Games-STORE | J1161: RNT1-PS5-WS-VG-PE | K1161: REYNATIS PS5
B1162: Item Fulfillment | C1162: 2024-09-23T00:00:00.000 | D1162: 434353 | E1162: 22384 Daniel Friess | F1162: F | G1162: Inventory Asset : Finished Goods | H1162: 20.61 | I1162: NA Games-STORE | J1162: RNT1-NSW-WS-VG-PE | K1162: REYNATIS NSW
B1163: Item Fulfillment | C1163: 2024-09-23T00:00:00.000 | D1163: 434595 | E1163: Ian Seemungal [21339] | F1163: F | G1163: Inventory Asset : Finished Goods | H1163: 18.1 | I1163: NA Games-STORE | J1163: RNT1-PS4-WS-VG-PE | K1163: REYNATIS PS4
B1164: Item Fulfillment | C1164: 2024-09-23T00:00:00.000 | D1164: 434297 | E1164: Venkata Meduri | F1164: F | G1164: Inventory Asset : Finished Goods | H1164: 20.61 | I1164: NA Games-STORE | J1164: RNT1-NSW-WS-VG-PE | K1164: REYNATIS NSW
B1165: Item Fulfillment | C1165: 2024-09-23T00:00:00.000 | D1165: 434369 | E1165: Jeremy Talaoc | F1165: F | G1165: Inventory Asset : Finished Goods | H1165: 20.61 | I1165: NA Games-STORE | J1165: RNT1-NSW-WS-VG-PE | K1165: REYNATIS NSW
B1166: Item Fulfillment | C1166: 2024-09-23T00:00:00.000 | D1166: 434572 | E1166: 22003 Luis E Dones | F1166: F | G1166: Inventory Asset : Finished Goods | H1166: 20.61 | I1166: NA Games-STORE | J1166: RNT1-NSW-WS-VG-PE | K1166: REYNATIS NSW
B1167: Item Fulfillment | C1167: 2024-09-23T00:00:00.000 | D1167: 434675 | E1167: 23584 Jacline Summa | F1167: F | G1167: Inventory Asset : Finished Goods | H1167: 20.61 | I1167: NA Games-STORE | J1167: RNT1-NSW-WS-VG-PE | K1167: REYNATIS NSW
B1168: Item Fulfillment | C1168: 2024-09-23T00:00:00.000 | D1168: 434442 | E1168: jonoser | F1168: F | G1168: Inventory Asset : Finished Goods | H1168: 18.1 | I1168: NA Games-STORE | J1168: RNT1-PS4-WS-VG-PE | K1168: REYNATIS PS4
B1169: Item Fulfillment | C1169: 2024-09-23T00:00:00.000 | D1169: 434292 | E1169: Chris Chan [1000344641] | F1169: F | G1169: Inventory Asset : Finished Goods | H1169: 21.38 | I1169: NA Games-STORE | J1169: LOL1-NSW-WS-VG-PE | K1169: Legend of Legacy HD NSW
B1170: Item Fulfillment | C1170: 2024-09-23T00:00:00.000 | D1170: 434423 | E1170: Nick Beierle | F1170: F | G1170: Inventory Asset : Finished Goods | H1170: 20.61 | I1170: NA Games-STORE | J1170: RNT1-NSW-WS-VG-PE | K1170: REYNATIS NSW
B1171: Item Fulfillment | C1171: 2024-09-23T00:00:00.000 | D1171: 434573 | E1171: Cristobal Lange | F1171: F | G1171: Inventory Asset : Finished Goods | H1171: 18.1 | I1171: NA Games-STORE | J1171: RNT1-PS5-WS-VG-PE | K1171: REYNATIS PS5
B1172: Item Fulfillment | C1172: 2024-09-23T00:00:00.000 | D1172: 434556 | E1172: SyedIfrah Syed | F1172: F | G1172: Inventory Asset : Finished Goods | H1172: 20.61 | I1172: NA Games-STORE | J1172: RNT1-NSW-WS-VG-PE | K1172: REYNATIS NSW
B1173: Item Fulfillment | C1173: 2024-09-23T00:00:00.000 | D1173: 434654 | E1173: 23382 Jose Lira Tapia | F1173: F | G1173: Inventory Asset : Finished Goods | H1173: 20.61 | I1173: NA Games-STORE | J1173: RNT1-NSW-WS-VG-PE | K1173: REYNATIS NSW
B1174: Item Fulfillment | C1174: 2024-09-23T00:00:00.000 | D1174: 434603 | E1174: Brandon Clement | F1174: F | G1174: Inventory Asset : Finished Goods | H1174: 18.1 | I1174: NA Games-STORE | J1174: RNT1-PS4-WS-VG-PE | K1174: REYNATIS PS4
B1175: Item Fulfillment | C1175: 2024-09-23T00:00:00.000 | D1175: 434592 | E1175: Dennis Shy [158118] | F1175: F | G1175: Inventory Asset : Finished Goods | H1175: 20.61 | I1175: NA Games-STORE | J1175: RNT1-NSW-WS-VG-PE | K1175: REYNATIS NSW
B1176: Item Fulfillment | C1176: 2024-09-23T00:00:00.000 | D1176: 434465 | E1176: Marlon Rubio | F1176: F | G1176: Inventory Asset : Finished Goods | H1176: 20.61 | I1176: NA Games-STORE | J1176: RNT1-NSW-WS-VG-PE | K1176: REYNATIS NSW
B1177: Item Fulfillment | C1177: 2024-09-23T00:00:00.000 | D1177: 434291 | E1177: adrian 5 | F1177: F | G1177: Inventory Asset : Finished Goods | H1177: 22.87 | I1177: NA Games-STORE | J1177: TTD1-PS5-WS-VG-PE | K1177: Trails through Daybreak PS5
B1178: Item Fulfillment | C1178: 2024-09-23T00:00:00.000 | D1178: 434432 | E1178: 22447 Mike Tickler Jr | F1178: F | G1178: Inventory Asset : Finished Goods | H1178: 20.61 | I1178: NA Games-STORE | J1178: RNT1-NSW-WS-VG-PE | K1178: REYNATIS NSW
B1179: Item Fulfillment | C1179: 2024-09-23T00:00:00.000 | D1179: 434527 | E1179: Saul Flores [1000249520] | F1179: F | G1179: Inventory Asset : Finished Goods | H1179: 20.61 | I1179: NA Games-STORE | J1179: RNT1-NSW-WS-VG-PE | K1179: REYNATIS NSW
B1180: Item Fulfillment | C1180: 2024-09-23T00:00:00.000 | D1180: 434774 | E1180: 23770 Adam Gripp | F1180: F | G1180: Inventory Asset : Finished Goods | H1180: 21.57 | I1180: NA Games-STORE | J1180: GGR1-PS5-WS-VG-PE | K1180: Grim Grimoire OnceMore PS5
B1181: Item Fulfillment | C1181: 2024-09-23T00:00:00.000 | D1181: 434769 | E1181: Cristian Galvez CHI-11131 | F1181: F | G1181: Inventory Asset : Finished Goods | H1181: 21.51 | I1181: NA Games-STORE | J1181: LON1-PS4-WS-VG-PE | K1181: Legend of Nayuta PS4
B1182: Item Fulfillment | C1182: 2024-09-23T00:00:00.000 | D1182: 434452 | E1182: Danny DeBernardo | F1182: F | G1182: Inventory Asset : Finished Goods | H1182: 18.1 | I1182: NA Games-STORE | J1182: RNT1-PS4-WS-VG-PE | K1182: REYNATIS PS4
B1183: Item Fulfillment | C1183: 2024-09-23T00:00:00.000 | D1183: 434451 | E1183: John Gosse | F1183: F | G1183: Inventory Asset : Finished Goods | H1183: 20.61 | I1183: NA Games-STORE | J1183: RNT1-NSW-WS-VG-PE | K1183: REYNATIS NSW
B1184: Item Fulfillment | C1184: 2024-09-23T00:00:00.000 | D1184: 434445 | E1184: Shane Larsen | F1184: F | G1184: Inventory Asset : Finished Goods | H1184: 20.61 | I1184: NA Games-STORE | J1184: RNT1-NSW-WS-VG-PE | K1184: REYNATIS NSW
B1185: Item Fulfillment | C1185: 2024-09-23T00:00:00.000 | D1185: 434293 | E1185: Diana Daklala [1000299620] | F1185: F | G1185: Inventory Asset : Finished Goods | H1185: 20.61 | I1185: NA Games-STORE | J1185: RNT1-NSW-WS-VG-PE | K1185: REYNATIS NSW
B1186: Item Fulfillment | C1186: 2024-09-23T00:00:00.000 | D1186: 434291 | E1186: adrian 5 | F1186: F | G1186: Inventory Asset : Finished Goods | H1186: 20.12 | I1186: NA Games-STORE | J1186: TC34-PS5-WS-VG-PE | K1186: Trails of Cold Steel 3+4 PS5
B1187: Item Fulfillment | C1187: 2024-09-23T00:00:00.000 | D1187: 434567 | E1187: Adam Gates | F1187: F | G1187: Inventory Asset : Finished Goods | H1187: 20.61 | I1187: NA Games-STORE | J1187: RNT1-NSW-WS-VG-PE | K1187: REYNATIS NSW
B1188: Item Fulfillment | C1188: 2024-09-23T00:00:00.000 | D1188: 434761 | E1188: Jamar Melrose [16513] | F1188: F | G1188: Inventory Asset : Finished Goods | H1188: 18.1 | I1188: NA Games-STORE | J1188: RNT1-PS5-WS-VG-PE | K1188: REYNATIS PS5
B1189: Item Fulfillment | C1189: 2024-09-23T00:00:00.000 | D1189: 434754 | E1189: Tris Mendoza Mendoza | F1189: F | G1189: Inventory Asset : Finished Goods | H1189: 18.1 | I1189: NA Games-STORE | J1189: RNT1-PS5-WS-VG-PE | K1189: REYNATIS PS5
B1190: Item Fulfillment | C1190: 2024-09-23T00:00:00.000 | D1190: 434712 | E1190: 23687 Ian Francis Roldan | F1190: F | G1190: Inventory Asset : Finished Goods | H1190: 20.61 | I1190: NA Games-STORE | J1190: RNT1-NSW-WS-VG-PE | K1190: REYNATIS NSW
B1191: Item Fulfillment | C1191: 2024-09-23T00:00:00.000 | D1191: 434359 | E1191: David Hong [58739] | F1191: F | G1191: Inventory Asset : Finished Goods | H1191: 20.61 | I1191: NA Games-STORE | J1191: RNT1-NSW-WS-VG-PE | K1191: REYNATIS NSW
B1192: Item Fulfillment | C1192: 2024-09-23T00:00:00.000 | D1192: 434771 | E1192: Matthew Bridwell | F1192: F | G1192: Inventory Asset : Finished Goods | H1192: 24.04 | I1192: NA Games-STORE | J1192: KAM1-NSW-WS-VG-PE | K1192: Kamiwaza NSW
B1193: Item Fulfillment | C1193: 2024-09-23T00:00:00.000 | D1193: 434738 | E1193: Nicholas Clark [170113] | F1193: F | G1193: Inventory Asset : Finished Goods | H1193: 20.61 | I1193: NA Games-STORE | J1193: RNT1-NSW-WS-VG-PE | K1193: REYNATIS NSW
B1194: Item Fulfillment | C1194: 2024-09-23T00:00:00.000 | D1194: 434591 | E1194: 23046 Alice Young | F1194: F | G1194: Inventory Asset : Finished Goods | H1194: 18.1 | I1194: NA Games-STORE | J1194: RNT1-PS4-WS-VG-PE | K1194: REYNATIS PS4
B1195: Item Fulfillment | C1195: 2024-09-23T00:00:00.000 | D1195: 434580 | E1195: 18884 Colton Sandifar | F1195: F | G1195: Inventory Asset : Finished Goods | H1195: 20.61 | I1195: NA Games-STORE | J1195: RNT1-NSW-WS-VG-PE | K1195: REYNATIS NSW
B1196: Item Fulfillment | C1196: 2024-09-23T00:00:00.000 | D1196: 434448 | E1196: Brad Elkins | F1196: F | G1196: Inventory Asset : Finished Goods | H1196: 20.61 | I1196: NA Games-STORE | J1196: RNT1-NSW-WS-VG-PE | K1196: REYNATIS NSW
B1197: Item Fulfillment | C1197: 2024-09-23T00:00:00.000 | D1197: 434374 | E1197: 21129 Joe Lepore | F1197: F | G1197: Inventory Asset : Finished Goods | H1197: 18.1 | I1197: NA Games-STORE | J1197: RNT1-PS4-WS-VG-PE | K1197: REYNATIS PS4
B1198: Item Fulfillment | C1198: 2024-09-23T00:00:00.000 | D1198: 434701 | E1198: mazha IGMCLY | F1198: F | G1198: Inventory Asset : Finished Goods | H1198: 20.61 | I1198: NA Games-STORE | J1198: RNT1-NSW-WS-VG-PE | K1198: REYNATIS NSW
B1199: Item Fulfillment | C1199: 2024-09-23T00:00:00.000 | D1199: 434544 | E1199: Justin Huang [1000284958] | F1199: F | G1199: Inventory Asset : Finished Goods | H1199: 20.61 | I1199: NA Games-STORE | J1199: RNT1-NSW-WS-VG-PE | K1199: REYNATIS NSW
B1200: Item Fulfillment | C1200: 2024-09-23T00:00:00.000 | D1200: 434511 | E1200: Alexander Durham | F1200: F | G1200: Inventory Asset : Finished Goods | H1200: 20.61 | I1200: NA Games-STORE | J1200: RNT1-NSW-WS-VG-PE | K1200: REYNATIS NSW
B1201: Item Fulfillment | C1201: 2024-09-23T00:00:00.000 | D1201: 434688 | E1201: Ryan Marte | F1201: F | G1201: Inventory Asset : Finished Goods | H1201: 20.61 | I1201: NA Games-STORE | J1201: RNT1-NSW-WS-VG-PE | K1201: REYNATIS NSW
B1202: Item Fulfillment | C1202: 2024-09-23T00:00:00.000 | D1202: 434770 | E1202: 23765 Ali Rana | F1202: F | G1202: Inventory Asset : Finished Goods | H1202: 18.1 | I1202: NA Games-STORE | J1202: RNT1-PS5-WS-VG-PE | K1202: REYNATIS PS5
B1203: Item Fulfillment | C1203: 2024-09-23T00:00:00.000 | D1203: 434708 | E1203: 217 Ethan Graves | F1203: F | G1203: Inventory Asset : Finished Goods | H1203: 20.61 | I1203: NA Games-STORE | J1203: RNT1-NSW-WS-VG-PE | K1203: REYNATIS NSW
B1204: Item Fulfillment | C1204: 2024-09-23T00:00:00.000 | D1204: 434577 | E1204: 22769 Alex Icon | F1204: F | G1204: Inventory Asset : Finished Goods | H1204: 20.61 | I1204: NA Games-STORE | J1204: RNT1-NSW-WS-VG-PE | K1204: REYNATIS NSW
B1205: Item Fulfillment | C1205: 2024-09-23T00:00:00.000 | D1205: 434306 | E1205: Ethan Clever | F1205: F | G1205: Inventory Asset : Finished Goods | H1205: 20.61 | I1205: NA Games-STORE | J1205: RNT1-NSW-WS-VG-PE | K1205: REYNATIS NSW
B1206: Item Fulfillment | C1206: 2024-09-23T00:00:00.000 | D1206: 434406 | E1206: 22427 Angel Monterrosas | F1206: F | G1206: Inventory Asset : Finished Goods | H1206: 20.61 | I1206: NA Games-STORE | J1206: RNT1-NSW-WS-VG-PE | K1206: REYNATIS NSW
B1207: Item Fulfillment | C1207: 2024-09-23T00:00:00.000 | D1207: 434393 | E1207: Paul Wong | F1207: F | G1207: Inventory Asset : Finished Goods | H1207: 20.61 | I1207: NA Games-STORE | J1207: RNT1-NSW-WS-VG-PE | K1207: REYNATIS NSW
B1208: Item Fulfillment | C1208: 2024-09-23T00:00:00.000 | D1208: 434366 | E1208: Craig Sheldon [1000335711] | F1208: F | G1208: Inventory Asset : Finished Goods | H1208: 20.61 | I1208: NA Games-STORE | J1208: RNT1-NSW-WS-VG-PE | K1208: REYNATIS NSW
B1209: Item Fulfillment | C1209: 2024-09-23T00:00:00.000 | D1209: 434486 | E1209: Josh Vaught | F1209: F | G1209: Inventory Asset : Finished Goods | H1209: 20.61 | I1209: NA Games-STORE | J1209: RNT1-NSW-WS-VG-PE | K1209: REYNATIS NSW
B1210: Item Fulfillment | C1210: 2024-09-23T00:00:00.000 | D1210: 434546 | E1210: Jennifer Gerdes | F1210: F | G1210: Inventory Asset : Finished Goods | H1210: 18.1 | I1210: NA Games-STORE | J1210: RNT1-PS4-WS-VG-PE | K1210: REYNATIS PS4
B1211: Item Fulfillment | C1211: 2024-09-23T00:00:00.000 | D1211: 434512 | E1211: Brian Pinizotto | F1211: F | G1211: Inventory Asset : Finished Goods | H1211: 20.61 | I1211: NA Games-STORE | J1211: RNT1-NSW-WS-VG-PE | K1211: REYNATIS NSW
B1212: Item Fulfillment | C1212: 2024-09-23T00:00:00.000 | D1212: 434647 | E1212: 23348 Avery Judd | F1212: F | G1212: Inventory Asset : Finished Goods | H1212: 20.61 | I1212: NA Games-STORE | J1212: RNT1-NSW-WS-VG-PE | K1212: REYNATIS NSW
B1213: Item Fulfillment | C1213: 2024-09-23T00:00:00.000 | D1213: 434597 | E1213: Randy Graham [1000312503] | F1213: F | G1213: Inventory Asset : Finished Goods | H1213: 18.1 | I1213: NA Games-STORE | J1213: RNT1-PS4-WS-VG-PE | K1213: REYNATIS PS4
B1214: Item Fulfillment | C1214: 2024-09-23T00:00:00.000 | D1214: 434521 | E1214: Richard Laux | F1214: F | G1214: Inventory Asset : Finished Goods | H1214: 20.61 | I1214: NA Games-STORE | J1214: RNT1-NSW-WS-VG-PE | K1214: REYNATIS NSW
B1215: Item Fulfillment | C1215: 2024-09-23T00:00:00.000 | D1215: 434683 | E1215: Matthew Ammann | F1215: F | G1215: Inventory Asset : Finished Goods | H1215: 18.1 | I1215: NA Games-STORE | J1215: RNT1-PS4-WS-VG-PE | K1215: REYNATIS PS4
B1216: Item Fulfillment | C1216: 2024-09-23T00:00:00.000 | D1216: 434747 | E1216: 23746 Jacob Anderson | F1216: F | G1216: Inventory Asset : Finished Goods | H1216: 18.1 | I1216: NA Games-STORE | J1216: RNT1-PS5-WS-VG-PE | K1216: REYNATIS PS5
B1217: Item Fulfillment | C1217: 2024-09-23T00:00:00.000 | D1217: 434617 | E1217: Liovardo Monjaras | F1217: F | G1217: Inventory Asset : Finished Goods | H1217: 20.61 | I1217: NA Games-STORE | J1217: RNT1-NSW-WS-VG-PE | K1217: REYNATIS NSW
B1218: Item Fulfillment | C1218: 2024-09-23T00:00:00.000 | D1218: 434473 | E1218: astartelea | F1218: F | G1218: Inventory Asset : Finished Goods | H1218: 20.61 | I1218: NA Games-STORE | J1218: RNT1-NSW-WS-VG-PE | K1218: REYNATIS NSW
B1219: Item Fulfillment | C1219: 2024-09-23T00:00:00.000 | D1219: 434292 | E1219: Chris Chan [1000344641] | F1219: F | G1219: Inventory Asset : Finished Goods | H1219: 22.87 | I1219: NA Games-STORE | J1219: TTD1-PS5-WS-VG-PE | K1219: Trails through Daybreak PS5
B1220: Item Fulfillment | C1220: 2024-09-23T00:00:00.000 | D1220: 434361 | E1220: 22393 ANI LAO | F1220: F | G1220: Inventory Asset : Finished Goods | H1220: 20.61 | I1220: NA Games-STORE | J1220: RNT1-NSW-WS-VG-PE | K1220: REYNATIS NSW
B1221: Item Fulfillment | C1221: 2024-09-23T00:00:00.000 | D1221: 434348 | E1221: Dawn Aucoin | F1221: F | G1221: Inventory Asset : Finished Goods | H1221: 20.61 | I1221: NA Games-STORE | J1221: RNT1-NSW-WS-VG-PE | K1221: REYNATIS NSW
B1222: Item Fulfillment | C1222: 2024-09-23T00:00:00.000 | D1222: 434696 | E1222: Rashid Scott | F1222: F | G1222: Inventory Asset : Finished Goods | H1222: 18.1 | I1222: NA Games-STORE | J1222: RNT1-PS4-WS-VG-PE | K1222: REYNATIS PS4
B1223: Item Fulfillment | C1223: 2024-09-23T00:00:00.000 | D1223: 434561 | E1223: Kenneth Jiang | F1223: F | G1223: Inventory Asset : Finished Goods | H1223: 20.61 | I1223: NA Games-STORE | J1223: RNT1-NSW-WS-VG-PE | K1223: REYNATIS NSW
B1224: Item Fulfillment | C1224: 2024-09-23T00:00:00.000 | D1224: 434791 | E1224: Dominick Grillo | F1224: F | G1224: Inventory Asset : Finished Goods | H1224: 18.1 | I1224: NA Games-STORE | J1224: RNT1-PS5-WS-VG-PE | K1224: REYNATIS PS5
B1225: Item Fulfillment | C1225: 2024-09-23T00:00:00.000 | D1225: 434309 | E1225: Naveed Mohebbi | F1225: F | G1225: Inventory Asset : Finished Goods | H1225: 20.61 | I1225: NA Games-STORE | J1225: RNT1-NSW-WS-VG-PE | K1225: REYNATIS NSW
B1226: Item Fulfillment | C1226: 2024-09-23T00:00:00.000 | D1226: 434425 | E1226: Jules Kim | F1226: F | G1226: Inventory Asset : Finished Goods | H1226: 20.61 | I1226: NA Games-STORE | J1226: RNT1-NSW-WS-VG-PE | K1226: REYNATIS NSW
B1227: Item Fulfillment | C1227: 2024-09-23T00:00:00.000 | D1227: 434422 | E1227: 22441 Jose manuel Silva Olmedo | F1227: F | G1227: Inventory Asset : Finished Goods | H1227: 20.61 | I1227: NA Games-STORE | J1227: RNT1-NSW-WS-VG-PE | K1227: REYNATIS NSW
B1228: Item Fulfillment | C1228: 2024-09-23T00:00:00.000 | D1228: 434401 | E1228: Laura Nguyen | F1228: F | G1228: Inventory Asset : Finished Goods | H1228: 20.61 | I1228: NA Games-STORE | J1228: RNT1-NSW-WS-VG-PE | K1228: REYNATIS NSW
B1229: Item Fulfillment | C1229: 2024-09-23T00:00:00.000 | D1229: 434400 | E1229: Jason Costa | F1229: F | G1229: Inventory Asset : Finished Goods | H1229: 20.61 | I1229: NA Games-STORE | J1229: RNT1-NSW-WS-VG-PE | K1229: REYNATIS NSW
B1230: Item Fulfillment | C1230: 2024-09-23T00:00:00.000 | D1230: 434482 | E1230: 20231 Nicolas Cantu | F1230: F | G1230: Inventory Asset : Finished Goods | H1230: 20.61 | I1230: NA Games-STORE | J1230: RNT1-NSW-WS-VG-PE | K1230: REYNATIS NSW
B1231: Item Fulfillment | C1231: 2024-09-23T00:00:00.000 | D1231: 434474 | E1231: galen peer | F1231: F | G1231: Inventory Asset : Finished Goods | H1231: 20.61 | I1231: NA Games-STORE | J1231: RNT1-NSW-WS-VG-PE | K1231: REYNATIS NSW
B1232: Item Fulfillment | C1232: 2024-09-23T00:00:00.000 | D1232: 434535 | E1232: sajo | F1232: F | G1232: Inventory Asset : Finished Goods | H1232: 18.1 | I1232: NA Games-STORE | J1232: RNT1-PS4-WS-VG-PE | K1232: REYNATIS PS4
B1233: Item Fulfillment | C1233: 2024-09-23T00:00:00.000 | D1233: 434680 | E1233: Eric Goess | F1233: F | G1233: Inventory Asset : Finished Goods | H1233: 18.1 | I1233: NA Games-STORE | J1233: RNT1-PS4-WS-VG-PE | K1233: REYNATIS PS4
B1234: Item Fulfillment | C1234: 2024-09-23T00:00:00.000 | D1234: 434780 | E1234: 23775 Javlonbek Zaynetdinov | F1234: F | G1234: Inventory Asset : Finished Goods | H1234: 25.13 | I1234: NA Games-STORE | J1234: YSD1-PS5-WS-VG-PE | K1234: Ys VIII Lacrimosa of Dana PS5
B1235: Item Fulfillment | C1235: 2024-09-23T00:00:00.000 | D1235: 434651 | E1235: Nicholas Campea | F1235: F | G1235: Inventory Asset : Finished Goods | H1235: 18.1 | I1235: NA Games-STORE | J1235: RNT1-PS5-WS-VG-PE | K1235: REYNATIS PS5
B1236: Item Fulfillment | C1236: 2024-09-23T00:00:00.000 | D1236: 434635 | E1236: 22610 Wilmer Estrada | F1236: F | G1236: Inventory Asset : Finished Goods | H1236: 20.61 | I1236: NA Games-STORE | J1236: RNT1-NSW-WS-VG-PE | K1236: REYNATIS NSW
B1237: Item Fulfillment | C1237: 2024-09-23T00:00:00.000 | D1237: 434729 | E1237: 23724 Joseph Deluca | F1237: F | G1237: Inventory Asset : Finished Goods | H1237: 20.61 | I1237: NA Games-STORE | J1237: RNT1-NSW-WS-VG-PE | K1237: REYNATIS NSW
B1238: Item Fulfillment | C1238: 2024-09-23T00:00:00.000 | D1238: 434710 | E1238: 23685 Nicholas Reynolds | F1238: F | G1238: Inventory Asset : Finished Goods | H1238: 18.1 | I1238: NA Games-STORE | J1238: RNT1-PS5-WS-VG-PE | K1238: REYNATIS PS5
B1239: Item Fulfillment | C1239: 2024-09-23T00:00:00.000 | D1239: 434409 | E1239: 21215 Ronald Novero | F1239: F | G1239: Inventory Asset : Finished Goods | H1239: 20.61 | I1239: NA Games-STORE | J1239: RNT1-NSW-WS-VG-PE | K1239: REYNATIS NSW
B1240: Item Fulfillment | C1240: 2024-09-23T00:00:00.000 | D1240: 434372 | E1240: 22398 Ravinder Gill | F1240: F | G1240: Inventory Asset : Finished Goods | H1240: 20.61 | I1240: NA Games-STORE | J1240: RNT1-NSW-WS-VG-PE | K1240: REYNATIS NSW
B1241: Item Fulfillment | C1241: 2024-09-23T00:00:00.000 | D1241: 434347 | E1241: strippinheat | F1241: F | G1241: Inventory Asset : Finished Goods | H1241: 18.1 | I1241: NA Games-STORE | J1241: RNT1-PS4-WS-VG-PE | K1241: REYNATIS PS4
B1242: Item Fulfillment | C1242: 2024-09-23T00:00:00.000 | D1242: 434547 | E1242: Samantha Lienhard | F1242: F | G1242: Inventory Asset : Finished Goods | H1242: 20.61 | I1242: NA Games-STORE | J1242: RNT1-NSW-WS-VG-PE | K1242: REYNATIS NSW
B1243: Item Fulfillment | C1243: 2024-09-23T00:00:00.000 | D1243: 434514 | E1243: Christopher Kozusko | F1243: F | G1243: Inventory Asset : Finished Goods | H1243: 18.1 | I1243: NA Games-STORE | J1243: RNT1-PS5-WS-VG-PE | K1243: REYNATIS PS5
B1244: Item Fulfillment | C1244: 2024-09-23T00:00:00.000 | D1244: 434752 | E1244: 17762 Juan Olguin | F1244: F | G1244: Inventory Asset : Finished Goods | H1244: 21.5 | I1244: NA Games-STORE | J1244: LON1-PS4-WS-VG-PE | K1244: Legend of Nayuta PS4
B1245: Item Fulfillment | C1245: 2024-09-23T00:00:00.000 | D1245: 434744 | E1245: 21542 Marcello Rodgers-Powell | F1245: F | G1245: Inventory Asset : Finished Goods | H1245: 18.1 | I1245: NA Games-STORE | J1245: RNT1-PS5-WS-VG-PE | K1245: REYNATIS PS5
B1246: Item Fulfillment | C1246: 2024-09-23T00:00:00.000 | D1246: 434737 | E1246: 22087 Harrison Moccio | F1246: F | G1246: Inventory Asset : Finished Goods | H1246: 25.14 | I1246: NA Games-STORE | J1246: YSD1-PS5-WS-VG-PE | K1246: Ys VIII Lacrimosa of Dana PS5
B1247: Item Fulfillment | C1247: 2024-09-23T00:00:00.000 | D1247: 434611 | E1247: Matthew Garza | F1247: F | G1247: Inventory Asset : Finished Goods | H1247: 20.61 | I1247: NA Games-STORE | J1247: RNT1-NSW-WS-VG-PE | K1247: REYNATIS NSW
B1248: Item Fulfillment | C1248: 2024-09-23T00:00:00.000 | D1248: 434713 | E1248: 21835 Andrew Dornback | F1248: F | G1248: Inventory Asset : Finished Goods | H1248: 20.61 | I1248: NA Games-STORE | J1248: RNT1-NSW-WS-VG-PE | K1248: REYNATIS NSW
B1249: Item Fulfillment | C1249: 2024-09-23T00:00:00.000 | D1249: 434468 | E1249: 19693 JB Buchanan | F1249: F | G1249: Inventory Asset : Finished Goods | H1249: 20.61 | I1249: NA Games-STORE | J1249: RNT1-NSW-WS-VG-PE | K1249: REYNATIS NSW
B1250: Item Fulfillment | C1250: 2024-09-23T00:00:00.000 | D1250: 434467 | E1250: Michael Mays | F1250: F | G1250: Inventory Asset : Finished Goods | H1250: 20.61 | I1250: NA Games-STORE | J1250: RNT1-NSW-WS-VG-PE | K1250: REYNATIS NSW
B1251: Item Fulfillment | C1251: 2024-09-23T00:00:00.000 | D1251: 434455 | E1251: Paul Jacob | F1251: F | G1251: Inventory Asset : Finished Goods | H1251: 20.61 | I1251: NA Games-STORE | J1251: RNT1-NSW-WS-VG-PE | K1251: REYNATIS NSW
B1252: Item Fulfillment | C1252: 2024-09-23T00:00:00.000 | D1252: 434304 | E1252: Rachel Rameau | F1252: F | G1252: Inventory Asset : Finished Goods | H1252: 20.61 | I1252: NA Games-STORE | J1252: RNT1-NSW-WS-VG-PE | K1252: REYNATIS NSW
B1253: Item Fulfillment | C1253: 2024-09-23T00:00:00.000 | D1253: 434299 | E1253: Justin Le | F1253: F | G1253: Inventory Asset : Finished Goods | H1253: 20.61 | I1253: NA Games-STORE | J1253: RNT1-NSW-WS-VG-PE | K1253: REYNATIS NSW
B1254: Item Fulfillment | C1254: 2024-09-23T00:00:00.000 | D1254: 434424 | E1254: Karen Matic | F1254: F | G1254: Inventory Asset : Finished Goods | H1254: 20.61 | I1254: NA Games-STORE | J1254: RNT1-NSW-WS-VG-PE | K1254: REYNATIS NSW
B1255: Item Fulfillment | C1255: 2024-09-23T00:00:00.000 | D1255: 434345 | E1255: Wang Chi Wong | F1255: F | G1255: Inventory Asset : Finished Goods | H1255: 20.61 | I1255: NA Games-STORE | J1255: RNT1-NSW-WS-VG-PE | K1255: REYNATIS NSW
B1256: Item Fulfillment | C1256: 2024-09-23T00:00:00.000 | D1256: 434552 | E1256: Freddy Velasquez [1000201743] | F1256: F | G1256: Inventory Asset : Finished Goods | H1256: 20.61 | I1256: NA Games-STORE | J1256: RNT1-NSW-WS-VG-PE | K1256: REYNATIS NSW
B1257: Item Fulfillment | C1257: 2024-09-23T00:00:00.000 | D1257: 434549 | E1257: Sepehr Tehrani | F1257: F | G1257: Inventory Asset : Finished Goods | H1257: 20.61 | I1257: NA Games-STORE | J1257: RNT1-NSW-WS-VG-PE | K1257: REYNATIS NSW
B1258: Item Fulfillment | C1258: 2024-09-23T00:00:00.000 | D1258: 434493 | E1258: Taylor Brey [1000254468] | F1258: F | G1258: Inventory Asset : Finished Goods | H1258: 20.61 | I1258: NA Games-STORE | J1258: RNT1-NSW-WS-VG-PE | K1258: REYNATIS NSW
B1259: Item Fulfillment | C1259: 2024-09-23T00:00:00.000 | D1259: 434741 | E1259: Palm, Devon | F1259: F | G1259: Inventory Asset : Finished Goods | H1259: 18.1 | I1259: NA Games-STORE | J1259: RNT1-PS5-WS-VG-PE | K1259: REYNATIS PS5
B1260: Item Fulfillment | C1260: 2024-09-23T00:00:00.000 | D1260: 434700 | E1260: Sergio Betancourt | F1260: F | G1260: Inventory Asset : Finished Goods | H1260: 18.1 | I1260: NA Games-STORE | J1260: RNT1-PS4-WS-VG-PE | K1260: REYNATIS PS4
B1261: Item Fulfillment | C1261: 2024-09-23T00:00:00.000 | D1261: 434495 | E1261: 22492 Nathaniel Hastings | F1261: F | G1261: Inventory Asset : Finished Goods | H1261: 20.61 | I1261: NA Games-STORE | J1261: RNT1-NSW-WS-VG-PE | K1261: REYNATIS NSW
B1262: Item Fulfillment | C1262: 2024-09-23T00:00:00.000 | D1262: 434596 | E1262: 22907 Min Tala Htaw | F1262: F | G1262: Inventory Asset : Finished Goods | H1262: 20.61 | I1262: NA Games-STORE | J1262: RNT1-NSW-WS-VG-PE | K1262: REYNATIS NSW
B1263: Item Fulfillment | C1263: 2024-09-23T00:00:00.000 | D1263: 434586 | E1263: 23002 Angelus Brownell | F1263: F | G1263: Inventory Asset : Finished Goods | H1263: 20.61 | I1263: NA Games-STORE | J1263: RNT1-NSW-WS-VG-PE | K1263: REYNATIS NSW
B1264: Item Fulfillment | C1264: 2024-09-23T00:00:00.000 | D1264: 434578 | E1264: Kimberly Jimenez | F1264: F | G1264: Inventory Asset : Finished Goods | H1264: 20.61 | I1264: NA Games-STORE | J1264: RNT1-NSW-WS-VG-PE | K1264: REYNATIS NSW
B1265: Item Fulfillment | C1265: 2024-09-23T00:00:00.000 | D1265: 434484 | E1265: sn517 | F1265: F | G1265: Inventory Asset : Finished Goods | H1265: 20.61 | I1265: NA Games-STORE | J1265: RNT1-NSW-WS-VG-PE | K1265: REYNATIS NSW
B1266: Item Fulfillment | C1266: 2024-09-23T00:00:00.000 | D1266: 434337 | E1266: Lou Gwen Pacheco | F1266: F | G1266: Inventory Asset : Finished Goods | H1266: 20.61 | I1266: NA Games-STORE | J1266: RNT1-NSW-WS-VG-PE | K1266: REYNATIS NSW
B1267: Item Fulfillment | C1267: 2024-09-23T00:00:00.000 | D1267: 434518 | E1267: Pheter Nguyen | F1267: F | G1267: Inventory Asset : Finished Goods | H1267: 20.61 | I1267: NA Games-STORE | J1267: RNT1-NSW-WS-VG-PE | K1267: REYNATIS NSW
B1268: Item Fulfillment | C1268: 2024-09-23T00:00:00.000 | D1268: 434632 | E1268: Damian Fandrey | F1268: F | G1268: Inventory Asset : Finished Goods | H1268: 20.61 | I1268: NA Games-STORE | J1268: RNT1-NSW-WS-VG-PE | K1268: REYNATIS NSW
B1269: Item Fulfillment | C1269: 2024-09-23T00:00:00.000 | D1269: 434464 | E1269: Nickolas Howe | F1269: F | G1269: Inventory Asset : Finished Goods | H1269: 20.61 | I1269: NA Games-STORE | J1269: RNT1-NSW-WS-VG-PE | K1269: REYNATIS NSW
B1270: Item Fulfillment | C1270: 2024-09-23T00:00:00.000 | D1270: 434312 | E1270: Wayland Bryan [1000262721] | F1270: F | G1270: Inventory Asset : Finished Goods | H1270: 18.1 | I1270: NA Games-STORE | J1270: RNT1-PS4-WS-VG-PE | K1270: REYNATIS PS4
B1271: Item Fulfillment | C1271: 2024-09-23T00:00:00.000 | D1271: 434380 | E1271: 22407 Zechariah Rogers | F1271: F | G1271: Inventory Asset : Finished Goods | H1271: 20.61 | I1271: NA Games-STORE | J1271: RNT1-NSW-WS-VG-PE | K1271: REYNATIS NSW
B1272: Item Fulfillment | C1272: 2024-09-23T00:00:00.000 | D1272: 434377 | E1272: Clifton Enard 2 | F1272: F | G1272: Inventory Asset : Finished Goods | H1272: 20.61 | I1272: NA Games-STORE | J1272: RNT1-NSW-WS-VG-PE | K1272: REYNATIS NSW
B1273: Item Fulfillment | C1273: 2024-09-23T00:00:00.000 | D1273: 434571 | E1273: Yai Chang [1000233779] | F1273: F | G1273: Inventory Asset : Finished Goods | H1273: 18.1 | I1273: NA Games-STORE | J1273: RNT1-PS4-WS-VG-PE | K1273: REYNATIS PS4
B1274: Item Fulfillment | C1274: 2024-09-23T00:00:00.000 | D1274: 434538 | E1274: Chris Moolayil | F1274: F | G1274: Inventory Asset : Finished Goods | H1274: 18.1 | I1274: NA Games-STORE | J1274: RNT1-PS4-WS-VG-PE | K1274: REYNATIS PS4
B1275: Item Fulfillment | C1275: 2024-09-23T00:00:00.000 | D1275: 434776 | E1275: Victor Cano | F1275: F | G1275: Inventory Asset : Finished Goods | H1275: 20.61 | I1275: NA Games-STORE | J1275: RNT1-NSW-WS-VG-PE | K1275: REYNATIS NSW
B1276: Item Fulfillment | C1276: 2024-09-23T00:00:00.000 | D1276: 434641 | E1276: Stuart Chester | F1276: F | G1276: Inventory Asset : Finished Goods | H1276: 20.61 | I1276: NA Games-STORE | J1276: RNT1-NSW-WS-VG-PE | K1276: REYNATIS NSW
B1277: Item Fulfillment | C1277: 2024-09-23T00:00:00.000 | D1277: 434736 | E1277: Alexander Jolly 2 | F1277: F | G1277: Inventory Asset : Finished Goods | H1277: 18.1 | I1277: NA Games-STORE | J1277: RNT1-PS5-WS-VG-PE | K1277: REYNATIS PS5
B1278: Item Fulfillment | C1278: 2024-09-23T00:00:00.000 | D1278: 434613 | E1278: Douglas Mcfetridge | F1278: F | G1278: Inventory Asset : Finished Goods | H1278: 20.61 | I1278: NA Games-STORE | J1278: RNT1-NSW-WS-VG-PE | K1278: REYNATIS NSW
B1279: Item Fulfillment | C1279: 2024-09-23T00:00:00.000 | D1279: 434440 | E1279: Samuel Summerford | F1279: F | G1279: Inventory Asset : Finished Goods | H1279: 20.61 | I1279: NA Games-STORE | J1279: RNT1-NSW-WS-VG-PE | K1279: REYNATIS NSW
B1280: Item Fulfillment | C1280: 2024-09-23T00:00:00.000 | D1280: 434392 | E1280: Jeremiah Flemming | F1280: F | G1280: Inventory Asset : Finished Goods | H1280: 20.61 | I1280: NA Games-STORE | J1280: RNT1-NSW-WS-VG-PE | K1280: REYNATIS NSW
B1281: Item Fulfillment | C1281: 2024-09-23T00:00:00.000 | D1281: 434326 | E1281: Ian McLaughlin | F1281: F | G1281: Inventory Asset : Finished Goods | H1281: 20.61 | I1281: NA Games-STORE | J1281: RNT1-NSW-WS-VG-PE | K1281: REYNATIS NSW
B1282: Item Fulfillment | C1282: 2024-09-23T00:00:00.000 | D1282: 434551 | E1282: 1558 Amartur Rahim Bin Yahya | F1282: F | G1282: Inventory Asset : Finished Goods | H1282: 20.61 | I1282: NA Games-STORE | J1282: RNT1-NSW-WS-VG-PE | K1282: REYNATIS NSW
B1283: Item Fulfillment | C1283: 2024-09-23T00:00:00.000 | D1283: 434660 | E1283: David Rapp | F1283: F | G1283: Inventory Asset : Finished Goods | H1283: 20.61 | I1283: NA Games-STORE | J1283: RNT1-NSW-WS-VG-PE | K1283: REYNATIS NSW
B1284: Item Fulfillment | C1284: 2024-09-23T00:00:00.000 | D1284: 434762 | E1284: Sean Effendi | F1284: F | G1284: Inventory Asset : Finished Goods | H1284: 18.1 | I1284: NA Games-STORE | J1284: RNT1-PS5-WS-VG-PE | K1284: REYNATIS PS5
B1285: Item Fulfillment | C1285: 2024-09-23T00:00:00.000 | D1285: 434630 | E1285: Oliver Wesson III | F1285: F | G1285: Inventory Asset : Finished Goods | H1285: 18.1 | I1285: NA Games-STORE | J1285: RNT1-PS4-WS-VG-PE | K1285: REYNATIS PS4
B1286: Item Fulfillment | C1286: 2024-09-23T00:00:00.000 | D1286: 434615 | E1286: Adam Gilbert [1000208599] | F1286: F | G1286: Inventory Asset : Finished Goods | H1286: 20.61 | I1286: NA Games-STORE | J1286: RNT1-NSW-WS-VG-PE | K1286: REYNATIS NSW
B1287: Item Fulfillment | C1287: 2024-09-23T00:00:00.000 | D1287: 434722 | E1287: 23705 Sarah Lopez | F1287: F | G1287: Inventory Asset : Finished Goods | H1287: 20.61 | I1287: NA Games-STORE | J1287: RNT1-NSW-WS-VG-PE | K1287: REYNATIS NSW
B1288: Item Fulfillment | C1288: 2024-09-23T00:00:00.000 | D1288: 434411 | E1288: Pablo Larios | F1288: F | G1288: Inventory Asset : Finished Goods | H1288: 20.61 | I1288: NA Games-STORE | J1288: RNT1-NSW-WS-VG-PE | K1288: REYNATIS NSW
B1289: Item Fulfillment | C1289: 2024-09-23T00:00:00.000 | D1289: 434487 | E1289: 22483 Timothy CUBERO | F1289: F | G1289: Inventory Asset : Finished Goods | H1289: 18.1 | I1289: NA Games-STORE | J1289: RNT1-PS4-WS-VG-PE | K1289: REYNATIS PS4
B1290: Item Fulfillment | C1290: 2024-09-23T00:00:00.000 | D1290: 434475 | E1290: 658 Artjoseph Caballero | F1290: F | G1290: Inventory Asset : Finished Goods | H1290: 20.61 | I1290: NA Games-STORE | J1290: RNT1-NSW-WS-VG-PE | K1290: REYNATIS NSW
B1291: Item Fulfillment | C1291: 2024-09-23T00:00:00.000 | D1291: 434740 | E1291: 23742 Bryan McNair | F1291: F | G1291: Inventory Asset : Finished Goods | H1291: 18.1 | I1291: NA Games-STORE | J1291: RNT1-PS5-WS-VG-PE | K1291: REYNATIS PS5
B1292: Item Fulfillment | C1292: 2024-09-23T00:00:00.000 | D1292: 434625 | E1292: Robert Batchelder | F1292: F | G1292: Inventory Asset : Finished Goods | H1292: 20.61 | I1292: NA Games-STORE | J1292: RNT1-NSW-WS-VG-PE | K1292: REYNATIS NSW
B1293: Item Fulfillment | C1293: 2024-09-23T00:00:00.000 | D1293: 434622 | E1293: Jacob Stafford | F1293: F | G1293: Inventory Asset : Finished Goods | H1293: 20.61 | I1293: NA Games-STORE | J1293: RNT1-NSW-WS-VG-PE | K1293: REYNATIS NSW
B1294: Item Fulfillment | C1294: 2024-09-23T00:00:00.000 | D1294: 434734 | E1294: Alex Clawson | F1294: F | G1294: Inventory Asset : Finished Goods | H1294: 18.1 | I1294: NA Games-STORE | J1294: RNT1-PS4-WS-VG-PE | K1294: REYNATIS PS4
B1295: Item Fulfillment | C1295: 2024-09-23T00:00:00.000 | D1295: 434598 | E1295: Worldy Worldy | F1295: F | G1295: Inventory Asset : Finished Goods | H1295: 18.1 | I1295: NA Games-STORE | J1295: RNT1-PS4-WS-VG-PE | K1295: REYNATIS PS4
B1296: Item Fulfillment | C1296: 2024-09-23T00:00:00.000 | D1296: 434703 | E1296: 23663 Victor Grimaldo | F1296: F | G1296: Inventory Asset : Finished Goods | H1296: 20.61 | I1296: NA Games-STORE | J1296: RNT1-NSW-WS-VG-PE | K1296: REYNATIS NSW
B1297: Item Fulfillment | C1297: 2024-09-23T00:00:00.000 | D1297: 434301 | E1297: Selby, Ralph | F1297: F | G1297: Inventory Asset : Finished Goods | H1297: 20.61 | I1297: NA Games-STORE | J1297: RNT1-NSW-WS-VG-PE | K1297: REYNATIS NSW
B1298: Item Fulfillment | C1298: 2024-09-23T00:00:00.000 | D1298: 434382 | E1298: Regis Sims [1000275810] | F1298: F | G1298: Inventory Asset : Finished Goods | H1298: 20.61 | I1298: NA Games-STORE | J1298: RNT1-NSW-WS-VG-PE | K1298: REYNATIS NSW
B1299: Item Fulfillment | C1299: 2024-09-23T00:00:00.000 | D1299: 434481 | E1299: 22479 Colton Tetzlaff | F1299: F | G1299: Inventory Asset : Finished Goods | H1299: 20.61 | I1299: NA Games-STORE | J1299: RNT1-NSW-WS-VG-PE | K1299: REYNATIS NSW
B1300: Item Fulfillment | C1300: 2024-09-23T00:00:00.000 | D1300: 434778 | E1300: James Austin | F1300: F | G1300: Inventory Asset : Finished Goods | H1300: 20.61 | I1300: NA Games-STORE | J1300: RNT1-NSW-WS-VG-PE | K1300: REYNATIS NSW
B1301: Item Fulfillment | C1301: 2024-09-23T00:00:00.000 | D1301: 434607 | E1301: Eileen Yoo | F1301: F | G1301: Inventory Asset : Finished Goods | H1301: 41.22 | I1301: NA Games-STORE | J1301: RNT1-NSW-WS-VG-PE | K1301: REYNATIS NSW
B1302: Item Fulfillment | C1302: 2024-09-23T00:00:00.000 | D1302: 434418 | E1302: Douglas Silva | F1302: F | G1302: Inventory Asset : Finished Goods | H1302: 18.1 | I1302: NA Games-STORE | J1302: RNT1-PS5-WS-VG-PE | K1302: REYNATIS PS5
B1303: Item Fulfillment | C1303: 2024-09-23T00:00:00.000 | D1303: 434355 | E1303: Andrew Nowak | F1303: F | G1303: Inventory Asset : Finished Goods | H1303: 20.61 | I1303: NA Games-STORE | J1303: RNT1-NSW-WS-VG-PE | K1303: REYNATIS NSW
B1304: Item Fulfillment | C1304: 2024-09-23T00:00:00.000 | D1304: 434343 | E1304: John Salinas | F1304: F | G1304: Inventory Asset : Finished Goods | H1304: 20.61 | I1304: NA Games-STORE | J1304: RNT1-NSW-WS-VG-PE | K1304: REYNATIS NSW
B1305: Item Fulfillment | C1305: 2024-09-23T00:00:00.000 | D1305: 434666 | E1305: Francisco Romero | F1305: F | G1305: Inventory Asset : Finished Goods | H1305: 18.1 | I1305: NA Games-STORE | J1305: RNT1-PS4-WS-VG-PE | K1305: REYNATIS PS4
B1306: Item Fulfillment | C1306: 2024-09-23T00:00:00.000 | D1306: 434490 | E1306: Jose Miranda [1000292073] | F1306: F | G1306: Inventory Asset : Finished Goods | H1306: 20.61 | I1306: NA Games-STORE | J1306: RNT1-NSW-WS-VG-PE | K1306: REYNATIS NSW
B1307: Item Fulfillment | C1307: 2024-09-23T00:00:00.000 | D1307: 434742 | E1307: 23744 Aleksei Chávez | F1307: F | G1307: Inventory Asset : Finished Goods | H1307: 18.1 | I1307: NA Games-STORE | J1307: RNT1-PS5-WS-VG-PE | K1307: REYNATIS PS5
B1308: Item Fulfillment | C1308: 2024-09-23T00:00:00.000 | D1308: 434604 | E1308: Jaime Caballero | F1308: F | G1308: Inventory Asset : Finished Goods | H1308: 20.61 | I1308: NA Games-STORE | J1308: RNT1-NSW-WS-VG-PE | K1308: REYNATIS NSW
B1309: Item Fulfillment | C1309: 2024-09-23T00:00:00.000 | D1309: 434601 | E1309: Jason Filip | F1309: F | G1309: Inventory Asset : Finished Goods | H1309: 20.61 | I1309: NA Games-STORE | J1309: RNT1-NSW-WS-VG-PE | K1309: REYNATIS NSW
B1310: Item Fulfillment | C1310: 2024-09-23T00:00:00.000 | D1310: 434575 | E1310: Dang Lam | F1310: F | G1310: Inventory Asset : Finished Goods | H1310: 18.1 | I1310: NA Games-STORE | J1310: RNT1-PS4-WS-VG-PE | K1310: REYNATIS PS4
B1311: Item Fulfillment | C1311: 2024-09-23T00:00:00.000 | D1311: 434396 | E1311: Armando Brito | F1311: F | G1311: Inventory Asset : Finished Goods | H1311: 20.61 | I1311: NA Games-STORE | J1311: RNT1-NSW-WS-VG-PE | K1311: REYNATIS NSW
B1312: Item Fulfillment | C1312: 2024-09-23T00:00:00.000 | D1312: 434335 | E1312: Timothy Miller | F1312: F | G1312: Inventory Asset : Finished Goods | H1312: 20.61 | I1312: NA Games-STORE | J1312: RNT1-NSW-WS-VG-PE | K1312: REYNATIS NSW
B1313: Item Fulfillment | C1313: 2024-09-23T00:00:00.000 | D1313: 434569 | E1313: Teo Guan Te | F1313: F | G1313: Inventory Asset : Finished Goods | H1313: 18.1 | I1313: NA Games-STORE | J1313: RNT1-PS4-WS-VG-PE | K1313: REYNATIS PS4
B1314: Item Fulfillment | C1314: 2024-09-23T00:00:00.000 | D1314: 434692 | E1314: 17644 Justin Lee | F1314: F | G1314: Inventory Asset : Finished Goods | H1314: 20.61 | I1314: NA Games-STORE | J1314: RNT1-NSW-WS-VG-PE | K1314: REYNATIS NSW
B1315: Item Fulfillment | C1315: 2024-09-23T00:00:00.000 | D1315: 434516 | E1315: Aren Patel | F1315: F | G1315: Inventory Asset : Finished Goods | H1315: 20.61 | I1315: NA Games-STORE | J1315: RNT1-NSW-WS-VG-PE | K1315: REYNATIS NSW
B1316: Item Fulfillment | C1316: 2024-09-23T00:00:00.000 | D1316: 434496 | E1316: Chris Zarazua [1000292128] | F1316: F | G1316: Inventory Asset : Finished Goods | H1316: 20.61 | I1316: NA Games-STORE | J1316: RNT1-NSW-WS-VG-PE | K1316: REYNATIS NSW
B1317: Item Fulfillment | C1317: 2024-09-23T00:00:00.000 | D1317: 434766 | E1317: Jason Takeru | F1317: F | G1317: Inventory Asset : Finished Goods | H1317: 18.1 | I1317: NA Games-STORE | J1317: RNT1-PS4-WS-VG-PE | K1317: REYNATIS PS4
B1318: Item Fulfillment | C1318: 2024-09-23T00:00:00.000 | D1318: 434628 | E1318: Raul Guzman [167449] | F1318: F | G1318: Inventory Asset : Finished Goods | H1318: 20.61 | I1318: NA Games-STORE | J1318: RNT1-NSW-WS-VG-PE | K1318: REYNATIS NSW
B1319: Item Fulfillment | C1319: 2024-09-23T00:00:00.000 | D1319: 434616 | E1319: JoAnne Minter | F1319: F | G1319: Inventory Asset : Finished Goods | H1319: 20.61 | I1319: NA Games-STORE | J1319: RNT1-NSW-WS-VG-PE | K1319: REYNATIS NSW
B1320: Item Fulfillment | C1320: 2024-09-23T00:00:00.000 | D1320: 434307 | E1320: Heath LeBoeuf [1000321456] | F1320: F | G1320: Inventory Asset : Finished Goods | H1320: 20.61 | I1320: NA Games-STORE | J1320: RNT1-NSW-WS-VG-PE | K1320: REYNATIS NSW
B1321: Item Fulfillment | C1321: 2024-09-23T00:00:00.000 | D1321: 434434 | E1321: Justin Lee [138793] | F1321: F | G1321: Inventory Asset : Finished Goods | H1321: 20.61 | I1321: NA Games-STORE | J1321: RNT1-NSW-WS-VG-PE | K1321: REYNATIS NSW
B1322: Item Fulfillment | C1322: 2024-09-23T00:00:00.000 | D1322: 434412 | E1322: Freddie Montalvo | F1322: F | G1322: Inventory Asset : Finished Goods | H1322: 20.61 | I1322: NA Games-STORE | J1322: RNT1-NSW-WS-VG-PE | K1322: REYNATIS NSW
B1323: Item Fulfillment | C1323: 2024-09-23T00:00:00.000 | D1323: 434384 | E1323: John Brancolassi | F1323: F | G1323: Inventory Asset : Finished Goods | H1323: 20.61 | I1323: NA Games-STORE | J1323: RNT1-NSW-WS-VG-PE | K1323: REYNATIS NSW
B1324: Item Fulfillment | C1324: 2024-09-23T00:00:00.000 | D1324: 434340 | E1324: Lisa Wowk | F1324: F | G1324: Inventory Asset : Finished Goods | H1324: 18.1 | I1324: NA Games-STORE | J1324: RNT1-PS5-WS-VG-PE | K1324: REYNATIS PS5
B1325: Item Fulfillment | C1325: 2024-09-23T00:00:00.000 | D1325: 434480 | E1325: Fahim Ali [1000328481] | F1325: F | G1325: Inventory Asset : Finished Goods | H1325: 18.1 | I1325: NA Games-STORE | J1325: RNT1-PS5-WS-VG-PE | K1325: REYNATIS PS5
B1326: Item Fulfillment | C1326: 2024-09-23T00:00:00.000 | D1326: 434479 | E1326: 21750 Marc Daryl Estioko | F1326: F | G1326: Inventory Asset : Finished Goods | H1326: 20.61 | I1326: NA Games-STORE | J1326: RNT1-NSW-WS-VG-PE | K1326: REYNATIS NSW
B1327: Item Fulfillment | C1327: 2024-09-23T00:00:00.000 | D1327: 434328 | E1327: b_lanpham_sympatico_ca | F1327: F | G1327: Inventory Asset : Finished Goods | H1327: 18.1 | I1327: NA Games-STORE | J1327: RNT1-PS5-WS-VG-PE | K1327: REYNATIS PS5
B1328: Item Fulfillment | C1328: 2024-09-23T00:00:00.000 | D1328: 434502 | E1328: 22136 Christopher Sailstad | F1328: F | G1328: Inventory Asset : Finished Goods | H1328: 20.61 | I1328: NA Games-STORE | J1328: RNT1-NSW-WS-VG-PE | K1328: REYNATIS NSW
B1329: Item Fulfillment | C1329: 2024-09-23T00:00:00.000 | D1329: 434678 | E1329: Christopher Sarazin | F1329: F | G1329: Inventory Asset : Finished Goods | H1329: 20.61 | I1329: NA Games-STORE | J1329: RNT1-NSW-WS-VG-PE | K1329: REYNATIS NSW
B1330: Item Fulfillment | C1330: 2024-09-23T00:00:00.000 | D1330: 434784 | E1330: Barney Nguyen | F1330: F | G1330: Inventory Asset : Finished Goods | H1330: 27.76 | I1330: NA Games-STORE | J1330: DIS7-NSW-WS-VG-PE | K1330: Disgaea 7 NSW
B1331: Item Fulfillment | C1331: 2024-09-23T00:00:00.000 | D1331: 434663 | E1331: Ian Emmendorfer | F1331: F | G1331: Inventory Asset : Finished Goods | H1331: 18.1 | I1331: NA Games-STORE | J1331: RNT1-PS4-WS-VG-PE | K1331: REYNATIS PS4
B1332: Item Fulfillment | C1332: 2024-09-23T00:00:00.000 | D1332: 434755 | E1332: 23749 Dannette Tillery | F1332: F | G1332: Inventory Asset : Finished Goods | H1332: 18.1 | I1332: NA Games-STORE | J1332: RNT1-PS5-WS-VG-PE | K1332: REYNATIS PS5
B1333: Item Fulfillment | C1333: 2024-09-23T00:00:00.000 | D1333: 434739 | E1333: 23740 keni williams | F1333: F | G1333: Inventory Asset : Finished Goods | H1333: 20.61 | I1333: NA Games-STORE | J1333: RNT1-NSW-WS-VG-PE | K1333: REYNATIS NSW
B1334: Item Fulfillment | C1334: 2024-09-23T00:00:00.000 | D1334: 434583 | E1334: Megan Westphal | F1334: F | G1334: Inventory Asset : Finished Goods | H1334: 20.61 | I1334: NA Games-STORE | J1334: RNT1-NSW-WS-VG-PE | K1334: REYNATIS NSW
B1335: Item Fulfillment | C1335: 2024-09-23T00:00:00.000 | D1335: 434466 | E1335: Linda Jackson | F1335: F | G1335: Inventory Asset : Finished Goods | H1335: 20.61 | I1335: NA Games-STORE | J1335: RNT1-NSW-WS-VG-PE | K1335: REYNATIS NSW
B1336: Item Fulfillment | C1336: 2024-09-23T00:00:00.000 | D1336: 434456 | E1336: Morgandy Seu | F1336: F | G1336: Inventory Asset : Finished Goods | H1336: 18.1 | I1336: NA Games-STORE | J1336: RNT1-PS5-WS-VG-PE | K1336: REYNATIS PS5
B1337: Item Fulfillment | C1337: 2024-09-23T00:00:00.000 | D1337: 434358 | E1337: Jason Dunscombe | F1337: F | G1337: Inventory Asset : Finished Goods | H1337: 18.1 | I1337: NA Games-STORE | J1337: RNT1-PS4-WS-VG-PE | K1337: REYNATIS PS4
B1338: Item Fulfillment | C1338: 2024-09-23T00:00:00.000 | D1338: 434545 | E1338: Jon Work | F1338: F | G1338: Inventory Asset : Finished Goods | H1338: 20.61 | I1338: NA Games-STORE | J1338: RNT1-NSW-WS-VG-PE | K1338: REYNATIS NSW
B1339: Item Fulfillment | C1339: 2024-09-23T00:00:00.000 | D1339: 434528 | E1339: Zachary Everman | F1339: F | G1339: Inventory Asset : Finished Goods | H1339: 20.61 | I1339: NA Games-STORE | J1339: RNT1-NSW-WS-VG-PE | K1339: REYNATIS NSW
B1340: Item Fulfillment | C1340: 2024-09-23T00:00:00.000 | D1340: 434714 | E1340: Austin Alexander | F1340: F | G1340: Inventory Asset : Finished Goods | H1340: 20.61 | I1340: NA Games-STORE | J1340: RNT1-NSW-WS-VG-PE | K1340: REYNATIS NSW
B1341: Item Fulfillment | C1341: 2024-09-23T00:00:00.000 | D1341: 434704 | E1341: 23670 Tariq Huggins | F1341: F | G1341: Inventory Asset : Finished Goods | H1341: 20.61 | I1341: NA Games-STORE | J1341: RNT1-NSW-WS-VG-PE | K1341: REYNATIS NSW
B1342: Item Fulfillment | C1342: 2024-09-23T00:00:00.000 | D1342: 434342 | E1342: Kareem Franklin | F1342: F | G1342: Inventory Asset : Finished Goods | H1342: 20.61 | I1342: NA Games-STORE | J1342: RNT1-NSW-WS-VG-PE | K1342: REYNATIS NSW
B1343: Item Fulfillment | C1343: 2024-09-23T00:00:00.000 | D1343: 434336 | E1343: Julia Tan | F1343: F | G1343: Inventory Asset : Finished Goods | H1343: 20.61 | I1343: NA Games-STORE | J1343: RNT1-NSW-WS-VG-PE | K1343: REYNATIS NSW
B1344: Item Fulfillment | C1344: 2024-09-23T00:00:00.000 | D1344: 434787 | E1344: Jake Azucenas | F1344: F | G1344: Inventory Asset : Finished Goods | H1344: 18.1 | I1344: NA Games-STORE | J1344: RNT1-PS5-WS-VG-PE | K1344: REYNATIS PS5
B1345: Item Fulfillment | C1345: 2024-09-23T00:00:00.000 | D1345: 434664 | E1345: 23453 David North | F1345: F | G1345: Inventory Asset : Finished Goods | H1345: 20.61 | I1345: NA Games-STORE | J1345: RNT1-NSW-WS-VG-PE | K1345: REYNATIS NSW
B1346: Item Fulfillment | C1346: 2024-09-23T00:00:00.000 | D1346: 434658 | E1346: 6700 Carlos Fernando Hernández Porras | F1346: F | G1346: Inventory Asset : Finished Goods | H1346: 20.61 | I1346: NA Games-STORE | J1346: RNT1-NSW-WS-VG-PE | K1346: REYNATIS NSW
B1347: Item Fulfillment | C1347: 2024-09-23T00:00:00.000 | D1347: 434645 | E1347: Sarah R | F1347: F | G1347: Inventory Asset : Finished Goods | H1347: 20.61 | I1347: NA Games-STORE | J1347: RNT1-NSW-WS-VG-PE | K1347: REYNATIS NSW
B1348: Item Fulfillment | C1348: 2024-09-23T00:00:00.000 | D1348: 434404 | E1348: Zerin Rahman | F1348: F | G1348: Inventory Asset : Finished Goods | H1348: 20.61 | I1348: NA Games-STORE | J1348: RNT1-NSW-WS-VG-PE | K1348: REYNATIS NSW
B1349: Item Fulfillment | C1349: 2024-09-23T00:00:00.000 | D1349: 434478 | E1349: Clinton Green | F1349: F | G1349: Inventory Asset : Finished Goods | H1349: 20.61 | I1349: NA Games-STORE | J1349: RNT1-NSW-WS-VG-PE | K1349: REYNATIS NSW
B1350: Item Fulfillment | C1350: 2024-09-23T00:00:00.000 | D1350: 434555 | E1350: 22625 Allison Nicole Dorsett | F1350: F | G1350: Inventory Asset : Finished Goods | H1350: 20.61 | I1350: NA Games-STORE | J1350: RNT1-NSW-WS-VG-PE | K1350: REYNATIS NSW
B1351: Item Fulfillment | C1351: 2024-09-23T00:00:00.000 | D1351: 434669 | E1351: Ruben Cruz [1000260074] | F1351: F | G1351: Inventory Asset : Finished Goods | H1351: 20.61 | I1351: NA Games-STORE | J1351: RNT1-NSW-WS-VG-PE | K1351: REYNATIS NSW
B1352: Item Fulfillment | C1352: 2024-09-23T00:00:00.000 | D1352: 434665 | E1352: William Hard | F1352: F | G1352: Inventory Asset : Finished Goods | H1352: 20.61 | I1352: NA Games-STORE | J1352: RNT1-NSW-WS-VG-PE | K1352: REYNATIS NSW
B1353: Item Fulfillment | C1353: 2024-09-23T00:00:00.000 | D1353: 434759 | E1353: Matthew Johnson [1000223034] | F1353: F | G1353: Inventory Asset : Finished Goods | H1353: 18.1 | I1353: NA Games-STORE | J1353: RNT1-PS5-WS-VG-PE | K1353: REYNATIS PS5
B1354: Item Fulfillment | C1354: 2024-09-23T00:00:00.000 | D1354: 434730 | E1354: sockpuppet | F1354: F | G1354: Inventory Asset : Finished Goods | H1354: 20.61 | I1354: NA Games-STORE | J1354: RNT1-NSW-WS-VG-PE | K1354: REYNATIS NSW
B1355: Item Fulfillment | C1355: 2024-09-23T00:00:00.000 | D1355: 434582 | E1355: Eduardo Ruiz [1000200579] | F1355: F | G1355: Inventory Asset : Finished Goods | H1355: 20.61 | I1355: NA Games-STORE | J1355: RNT1-NSW-WS-VG-PE | K1355: REYNATIS NSW
B1356: Item Fulfillment | C1356: 2024-09-23T00:00:00.000 | D1356: 434435 | E1356: 22449 Stephen Hayes | F1356: F | G1356: Inventory Asset : Finished Goods | H1356: 18.1 | I1356: NA Games-STORE | J1356: RNT1-PS4-WS-VG-PE | K1356: REYNATIS PS4
B1357: Item Fulfillment | C1357: 2024-09-23T00:00:00.000 | D1357: 434433 | E1357: zeldanet | F1357: F | G1357: Inventory Asset : Finished Goods | H1357: 20.61 | I1357: NA Games-STORE | J1357: RNT1-NSW-WS-VG-PE | K1357: REYNATIS NSW
B1358: Item Fulfillment | C1358: 2024-09-23T00:00:00.000 | D1358: 434431 | E1358: 22446 Christian Ruelas | F1358: F | G1358: Inventory Asset : Finished Goods | H1358: 20.61 | I1358: NA Games-STORE | J1358: RNT1-NSW-WS-VG-PE | K1358: REYNATIS NSW
B1359: Item Fulfillment | C1359: 2024-09-23T00:00:00.000 | D1359: 434399 | E1359: Kyle Miller | F1359: F | G1359: Inventory Asset : Finished Goods | H1359: 20.61 | I1359: NA Games-STORE | J1359: RNT1-NSW-WS-VG-PE | K1359: REYNATIS NSW
B1360: Item Fulfillment | C1360: 2024-09-23T00:00:00.000 | D1360: 434349 | E1360: Kristopher Toppazzini | F1360: F | G1360: Inventory Asset : Finished Goods | H1360: 18.1 | I1360: NA Games-STORE | J1360: RNT1-PS5-WS-VG-PE | K1360: REYNATIS PS5
B1361: Item Fulfillment | C1361: 2024-09-23T00:00:00.000 | D1361: 434602 | E1361: Joshua Chaneske | F1361: F | G1361: Inventory Asset : Finished Goods | H1361: 20.61 | I1361: NA Games-STORE | J1361: RNT1-NSW-WS-VG-PE | K1361: REYNATIS NSW
B1362: Item Fulfillment | C1362: 2024-09-23T00:00:00.000 | D1362: 434717 | E1362: 23694 Lumi McPherson | F1362: F | G1362: Inventory Asset : Finished Goods | H1362: 20.61 | I1362: NA Games-STORE | J1362: RNT1-NSW-WS-VG-PE | K1362: REYNATIS NSW
B1363: Item Fulfillment | C1363: 2024-09-23T00:00:00.000 | D1363: 434705 | E1363: Christian Van Middlesworth | F1363: F | G1363: Inventory Asset : Finished Goods | H1363: 20.61 | I1363: NA Games-STORE | J1363: RNT1-NSW-WS-VG-PE | K1363: REYNATIS NSW
B1364: Item Fulfillment | C1364: 2024-09-23T00:00:00.000 | D1364: 434303 | E1364: 22358 David Thompson | F1364: F | G1364: Inventory Asset : Finished Goods | H1364: 20.61 | I1364: NA Games-STORE | J1364: RNT1-NSW-WS-VG-PE | K1364: REYNATIS NSW
B1365: Item Fulfillment | C1365: 2024-09-23T00:00:00.000 | D1365: 434376 | E1365: Christian Jarquin | F1365: F | G1365: Inventory Asset : Finished Goods | H1365: 18.1 | I1365: NA Games-STORE | J1365: RNT1-PS4-WS-VG-PE | K1365: REYNATIS PS4
B1366: Item Fulfillment | C1366: 2024-09-23T00:00:00.000 | D1366: 434338 | E1366: Robert Stern | F1366: F | G1366: Inventory Asset : Finished Goods | H1366: 20.61 | I1366: NA Games-STORE | J1366: RNT1-NSW-WS-VG-PE | K1366: REYNATIS NSW
B1367: Item Fulfillment | C1367: 2024-09-23T00:00:00.000 | D1367: 434530 | E1367: Lorna Daugherty | F1367: F | G1367: Inventory Asset : Finished Goods | H1367: 20.61 | I1367: NA Games-STORE | J1367: RNT1-NSW-WS-VG-PE | K1367: REYNATIS NSW
B1368: Item Fulfillment | C1368: 2024-09-23T00:00:00.000 | D1368: 434648 | E1368: 23349 Julian Lluveras | F1368: F | G1368: Inventory Asset : Finished Goods | H1368: 20.61 | I1368: NA Games-STORE | J1368: RNT1-NSW-WS-VG-PE | K1368: REYNATIS NSW
B1369: Item Fulfillment | C1369: 2024-09-23T00:00:00.000 | D1369: 434733 | E1369: si ming Lu | F1369: F | G1369: Inventory Asset : Finished Goods | H1369: 20.61 | I1369: NA Games-STORE | J1369: RNT1-NSW-WS-VG-PE | K1369: REYNATIS NSW
B1370: Item Fulfillment | C1370: 2024-09-23T00:00:00.000 | D1370: 434319 | E1370: Anmar Matar | F1370: F | G1370: Inventory Asset : Finished Goods | H1370: 20.61 | I1370: NA Games-STORE | J1370: RNT1-NSW-WS-VG-PE | K1370: REYNATIS NSW
B1371: Item Fulfillment | C1371: 2024-09-23T00:00:00.000 | D1371: 434375 | E1371: Daniel Hsiung | F1371: F | G1371: Inventory Asset : Finished Goods | H1371: 20.61 | I1371: NA Games-STORE | J1371: RNT1-NSW-WS-VG-PE | K1371: REYNATIS NSW
B1372: Item Fulfillment | C1372: 2024-09-23T00:00:00.000 | D1372: 434360 | E1372: 22391 Jonathan Bujak | F1372: F | G1372: Inventory Asset : Finished Goods | H1372: 20.61 | I1372: NA Games-STORE | J1372: RNT1-NSW-WS-VG-PE | K1372: REYNATIS NSW
B1373: Item Fulfillment | C1373: 2024-09-23T00:00:00.000 | D1373: 434331 | E1373: Abdulaziz Bukhamseen | F1373: F | G1373: Inventory Asset : Finished Goods | H1373: 20.61 | I1373: NA Games-STORE | J1373: RNT1-NSW-WS-VG-PE | K1373: REYNATIS NSW
B1374: Item Fulfillment | C1374: 2024-09-23T00:00:00.000 | D1374: 434523 | E1374: 17592 jia wang XJSSVE | F1374: F | G1374: Inventory Asset : Finished Goods | H1374: 18.1 | I1374: NA Games-STORE | J1374: RNT1-PS4-WS-VG-PE | K1374: REYNATIS PS4
B1375: Item Fulfillment | C1375: 2024-09-23T00:00:00.000 | D1375: 434725 | E1375: Darryl Roundtree | F1375: F | G1375: Inventory Asset : Finished Goods | H1375: 20.61 | I1375: NA Games-STORE | J1375: RNT1-NSW-WS-VG-PE | K1375: REYNATIS NSW
B1376: Item Fulfillment | C1376: 2024-09-23T00:00:00.000 | D1376: 434612 | E1376: 20708 Joachim Roeise | F1376: F | G1376: Inventory Asset : Finished Goods | H1376: 20.61 | I1376: NA Games-STORE | J1376: RNT1-NSW-WS-VG-PE | K1376: REYNATIS NSW
B1377: Item Fulfillment | C1377: 2024-09-23T00:00:00.000 | D1377: 434469 | E1377: Michael Menezes | F1377: F | G1377: Inventory Asset : Finished Goods | H1377: 20.61 | I1377: NA Games-STORE | J1377: RNT1-NSW-WS-VG-PE | K1377: REYNATIS NSW
B1378: Item Fulfillment | C1378: 2024-09-23T00:00:00.000 | D1378: 434324 | E1378: 22370 Michael Harris | F1378: F | G1378: Inventory Asset : Finished Goods | H1378: 20.61 | I1378: NA Games-STORE | J1378: RNT1-NSW-WS-VG-PE | K1378: REYNATIS NSW
B1379: Item Fulfillment | C1379: 2024-09-23T00:00:00.000 | D1379: 434318 | E1379: Carlos Gonzalez [1000290316] | F1379: F | G1379: Inventory Asset : Finished Goods | H1379: 18.1 | I1379: NA Games-STORE | J1379: RNT1-PS5-WS-VG-PE | K1379: REYNATIS PS5
B1380: Item Fulfillment | C1380: 2024-09-23T00:00:00.000 | D1380: 434410 | E1380: 19393 Joshua Ledet | F1380: F | G1380: Inventory Asset : Finished Goods | H1380: 20.61 | I1380: NA Games-STORE | J1380: RNT1-NSW-WS-VG-PE | K1380: REYNATIS NSW
B1381: Item Fulfillment | C1381: 2024-09-23T00:00:00.000 | D1381: 434570 | E1381: 22512 Alvin Wu | F1381: F | G1381: Inventory Asset : Finished Goods | H1381: 20.61 | I1381: NA Games-STORE | J1381: RNT1-NSW-WS-VG-PE | K1381: REYNATIS NSW
B1382: Item Fulfillment | C1382: 2024-09-23T00:00:00.000 | D1382: 434564 | E1382: Shu Kwun Lui | F1382: F | G1382: Inventory Asset : Finished Goods | H1382: 20.61 | I1382: NA Games-STORE | J1382: RNT1-NSW-WS-VG-PE | K1382: REYNATIS NSW
B1383: Item Fulfillment | C1383: 2024-09-23T00:00:00.000 | D1383: 434695 | E1383: 23643 Miranda Yang | F1383: F | G1383: Inventory Asset : Finished Goods | H1383: 20.61 | I1383: NA Games-STORE | J1383: RNT1-NSW-WS-VG-PE | K1383: REYNATIS NSW
B1384: Item Fulfillment | C1384: 2024-09-23T00:00:00.000 | D1384: 434553 | E1384: Darek Blankenbuhler | F1384: F | G1384: Inventory Asset : Finished Goods | H1384: 20.61 | I1384: NA Games-STORE | J1384: RNT1-NSW-WS-VG-PE | K1384: REYNATIS NSW
B1385: Item Fulfillment | C1385: 2024-09-23T00:00:00.000 | D1385: 434550 | E1385: 22614 Marsha Ramirez | F1385: F | G1385: Inventory Asset : Finished Goods | H1385: 20.61 | I1385: NA Games-STORE | J1385: RNT1-NSW-WS-VG-PE | K1385: REYNATIS NSW
B1386: Item Fulfillment | C1386: 2024-09-23T00:00:00.000 | D1386: 434504 | E1386: Ivan Garcia [5332] | F1386: F | G1386: Inventory Asset : Finished Goods | H1386: 18.1 | I1386: NA Games-STORE | J1386: RNT1-PS4-WS-VG-PE | K1386: REYNATIS PS4
B1387: Item Fulfillment | C1387: 2024-09-23T00:00:00.000 | D1387: 434599 | E1387: 21818 Abdulrahman Alhosani | F1387: F | G1387: Inventory Asset : Finished Goods | H1387: 20.61 | I1387: NA Games-STORE | J1387: RNT1-NSW-WS-VG-PE | K1387: REYNATIS NSW
B1388: Item Fulfillment | C1388: 2024-09-23T00:00:00.000 | D1388: 434322 | E1388: Tsz Keung Lum | F1388: F | G1388: Inventory Asset : Finished Goods | H1388: 20.61 | I1388: NA Games-STORE | J1388: RNT1-NSW-WS-VG-PE | K1388: REYNATIS NSW
B1389: Item Fulfillment | C1389: 2024-09-23T00:00:00.000 | D1389: 434315 | E1389: Hazqel Kemat | F1389: F | G1389: Inventory Asset : Finished Goods | H1389: 18.1 | I1389: NA Games-STORE | J1389: RNT1-PS5-WS-VG-PE | K1389: REYNATIS PS5
B1390: Item Fulfillment | C1390: 2024-09-23T00:00:00.000 | D1390: 434408 | E1390: 22428 Alejandra Barajas | F1390: F | G1390: Inventory Asset : Finished Goods | H1390: 18.1 | I1390: NA Games-STORE | J1390: RNT1-PS4-WS-VG-PE | K1390: REYNATIS PS4
B1391: Item Fulfillment | C1391: 2024-09-23T00:00:00.000 | D1391: 434390 | E1391: Oscar Anguiano | F1391: F | G1391: Inventory Asset : Finished Goods | H1391: 20.61 | I1391: NA Games-STORE | J1391: RNT1-NSW-WS-VG-PE | K1391: REYNATIS NSW
B1392: Item Fulfillment | C1392: 2024-09-23T00:00:00.000 | D1392: 434560 | E1392: Eduardo Plascencia | F1392: F | G1392: Inventory Asset : Finished Goods | H1392: 18.1 | I1392: NA Games-STORE | J1392: RNT1-PS4-WS-VG-PE | K1392: REYNATIS PS4
B1393: Item Fulfillment | C1393: 2024-09-23T00:00:00.000 | D1393: 434686 | E1393: Aldrey Antonio | F1393: F | G1393: Inventory Asset : Finished Goods | H1393: 20.61 | I1393: NA Games-STORE | J1393: RNT1-NSW-WS-VG-PE | K1393: REYNATIS NSW
B1394: Item Fulfillment | C1394: 2024-09-23T00:00:00.000 | D1394: 434661 | E1394: 23406 Destiny Taylor | F1394: F | G1394: Inventory Asset : Finished Goods | H1394: 18.1 | I1394: NA Games-STORE | J1394: RNT1-PS5-WS-VG-PE | K1394: REYNATIS PS5
B1395: Item Fulfillment | C1395: 2024-09-23T00:00:00.000 | D1395: 434470 | E1395: Marco Marin Juarez | F1395: F | G1395: Inventory Asset : Finished Goods | H1395: 20.61 | I1395: NA Games-STORE | J1395: RNT1-NSW-WS-VG-PE | K1395: REYNATIS NSW
B1396: Item Fulfillment | C1396: 2024-09-23T00:00:00.000 | D1396: 434421 | E1396: 22440 Santos Lira | F1396: F | G1396: Inventory Asset : Finished Goods | H1396: 20.61 | I1396: NA Games-STORE | J1396: RNT1-NSW-WS-VG-PE | K1396: REYNATIS NSW
B1397: Item Fulfillment | C1397: 2024-09-23T00:00:00.000 | D1397: 434378 | E1397: Karl Thompson | F1397: F | G1397: Inventory Asset : Finished Goods | H1397: 20.61 | I1397: NA Games-STORE | J1397: RNT1-NSW-WS-VG-PE | K1397: REYNATIS NSW
B1398: Item Fulfillment | C1398: 2024-09-23T00:00:00.000 | D1398: 434354 | E1398: La'Sheema Babbs' | F1398: F | G1398: Inventory Asset : Finished Goods | H1398: 20.61 | I1398: NA Games-STORE | J1398: RNT1-NSW-WS-VG-PE | K1398: REYNATIS NSW
B1399: Item Fulfillment | C1399: 2024-09-23T00:00:00.000 | D1399: 434477 | E1399: Johnson Nguyen [1000204806] | F1399: F | G1399: Inventory Asset : Finished Goods | H1399: 18.1 | I1399: NA Games-STORE | J1399: RNT1-PS5-WS-VG-PE | K1399: REYNATIS PS5
B1400: Item Fulfillment | C1400: 2024-09-23T00:00:00.000 | D1400: 434519 | E1400: 22538 Michael Li | F1400: F | G1400: Inventory Asset : Finished Goods | H1400: 18.1 | I1400: NA Games-STORE | J1400: RNT1-PS5-WS-VG-PE | K1400: REYNATIS PS5
B1401: Item Fulfillment | C1401: 2024-09-23T00:00:00.000 | D1401: 434491 | E1401: carlos fuentes | F1401: F | G1401: Inventory Asset : Finished Goods | H1401: 18.1 | I1401: NA Games-STORE | J1401: RNT1-PS4-WS-VG-PE | K1401: REYNATIS PS4
B1402: Item Fulfillment | C1402: 2024-09-23T00:00:00.000 | D1402: 434767 | E1402: Brandon Byrd [1000292080] | F1402: F | G1402: Inventory Asset : Finished Goods | H1402: 18.1 | I1402: NA Games-STORE | J1402: RNT1-PS5-WS-VG-PE | K1402: REYNATIS PS5
B1403: Item Fulfillment | C1403: 2024-09-23T00:00:00.000 | D1403: 434642 | E1403: 23317 Ethan Whitaker | F1403: F | G1403: Inventory Asset : Finished Goods | H1403: 20.61 | I1403: NA Games-STORE | J1403: RNT1-NSW-WS-VG-PE | K1403: REYNATIS NSW
B1404: Item Fulfillment | C1404: 2024-09-23T00:00:00.000 | D1404: 434760 | E1404: Megan Liau | F1404: F | G1404: Inventory Asset : Finished Goods | H1404: 20.61 | I1404: NA Games-STORE | J1404: RNT1-NSW-WS-VG-PE | K1404: REYNATIS NSW
B1405: Item Fulfillment | C1405: 2024-09-23T00:00:00.000 | D1405: 434325 | E1405: jean1 | F1405: F | G1405: Inventory Asset : Finished Goods | H1405: 18.1 | I1405: NA Games-STORE | J1405: RNT1-PS5-WS-VG-PE | K1405: REYNATIS PS5
B1406: Item Fulfillment | C1406: 2024-09-23T00:00:00.000 | D1406: 434388 | E1406: Lily Xie | F1406: F | G1406: Inventory Asset : Finished Goods | H1406: 20.61 | I1406: NA Games-STORE | J1406: RNT1-NSW-WS-VG-PE | K1406: REYNATIS NSW
B1407: Item Fulfillment | C1407: 2024-09-23T00:00:00.000 | D1407: 434332 | E1407: 22377 George Morgan, II | F1407: F | G1407: Inventory Asset : Finished Goods | H1407: 20.61 | I1407: NA Games-STORE | J1407: RNT1-NSW-WS-VG-PE | K1407: REYNATIS NSW
B1408: Item Fulfillment | C1408: 2024-09-23T00:00:00.000 | D1408: 434652 | E1408: 20129 Tinh Vu | F1408: F | G1408: Inventory Asset : Finished Goods | H1408: 20.61 | I1408: NA Games-STORE | J1408: RNT1-NSW-WS-VG-PE | K1408: REYNATIS NSW
B1409: Item Fulfillment | C1409: 2024-09-23T00:00:00.000 | D1409: 434758 | E1409: 23755 Alexander Sievenpiper | F1409: F | G1409: Inventory Asset : Finished Goods | H1409: 18.1 | I1409: NA Games-STORE | J1409: RNT1-PS5-WS-VG-PE | K1409: REYNATIS PS5
B1410: Item Fulfillment | C1410: 2024-09-23T00:00:00.000 | D1410: 434627 | E1410: Scott Miller | F1410: F | G1410: Inventory Asset : Finished Goods | H1410: 18.1 | I1410: NA Games-STORE | J1410: RNT1-PS4-WS-VG-PE | K1410: REYNATIS PS4
B1411: Item Fulfillment | C1411: 2024-09-23T00:00:00.000 | D1411: 434624 | E1411: Dustin Williams | F1411: F | G1411: Inventory Asset : Finished Goods | H1411: 18.1 | I1411: NA Games-STORE | J1411: RNT1-PS4-WS-VG-PE | K1411: REYNATIS PS4
B1412: Item Fulfillment | C1412: 2024-09-23T00:00:00.000 | D1412: 434310 | E1412: Julio Gomez III [1000263466] | F1412: F | G1412: Inventory Asset : Finished Goods | H1412: 20.61 | I1412: NA Games-STORE | J1412: RNT1-NSW-WS-VG-PE | K1412: REYNATIS NSW
B1413: Item Fulfillment | C1413: 2024-09-23T00:00:00.000 | D1413: 434295 | E1413: Cory McFarlane | F1413: F | G1413: Inventory Asset : Finished Goods | H1413: 20.61 | I1413: NA Games-STORE | J1413: RNT1-NSW-WS-VG-PE | K1413: REYNATIS NSW
B1414: Item Fulfillment | C1414: 2024-09-23T00:00:00.000 | D1414: 434436 | E1414: 22450 James Kinsella | F1414: F | G1414: Inventory Asset : Finished Goods | H1414: 20.61 | I1414: NA Games-STORE | J1414: RNT1-NSW-WS-VG-PE | K1414: REYNATIS NSW
B1415: Item Fulfillment | C1415: 2024-09-23T00:00:00.000 | D1415: 434394 | E1415: Ian Marshall [1000255692] | F1415: F | G1415: Inventory Asset : Finished Goods | H1415: 20.61 | I1415: NA Games-STORE | J1415: RNT1-NSW-WS-VG-PE | K1415: REYNATIS NSW
B1416: Item Fulfillment | C1416: 2024-09-23T00:00:00.000 | D1416: 434387 | E1416: Wesley Kum | F1416: F | G1416: Inventory Asset : Finished Goods | H1416: 18.1 | I1416: NA Games-STORE | J1416: RNT1-PS5-WS-VG-PE | K1416: REYNATIS PS5
B1417: Item Fulfillment | C1417: 2024-09-23T00:00:00.000 | D1417: 434385 | E1417: Wayne James | F1417: F | G1417: Inventory Asset : Finished Goods | H1417: 18.1 | I1417: NA Games-STORE | J1417: RNT1-PS4-WS-VG-PE | K1417: REYNATIS PS4
B1418: Item Fulfillment | C1418: 2024-09-23T00:00:00.000 | D1418: 434677 | E1418: 23525 Aaron Bailey | F1418: F | G1418: Inventory Asset : Finished Goods | H1418: 18.1 | I1418: NA Games-STORE | J1418: RNT1-PS4-WS-VG-PE | K1418: REYNATIS PS4
B1419: Item Fulfillment | C1419: 2024-09-23T00:00:00.000 | D1419: 434398 | E1419: 20893 Warren Rosario | F1419: F | G1419: Inventory Asset : Finished Goods | H1419: 18.1 | I1419: NA Games-STORE | J1419: RNT1-PS5-WS-VG-PE | K1419: REYNATIS PS5
B1420: Item Fulfillment | C1420: 2024-09-23T00:00:00.000 | D1420: 434344 | E1420: Bestwill Corporation | F1420: F | G1420: Inventory Asset : Finished Goods | H1420: 20.61 | I1420: NA Games-STORE | J1420: RNT1-NSW-WS-VG-PE | K1420: REYNATIS NSW
B1421: Item Fulfillment | C1421: 2024-09-23T00:00:00.000 | D1421: 434682 | E1421: Waverly Pierre III | F1421: F | G1421: Inventory Asset : Finished Goods | H1421: 20.61 | I1421: NA Games-STORE | J1421: RNT1-NSW-WS-VG-PE | K1421: REYNATIS NSW
B1422: Item Fulfillment | C1422: 2024-09-23T00:00:00.000 | D1422: 434667 | E1422: 6114 Jennie Joiner | F1422: F | G1422: Inventory Asset : Finished Goods | H1422: 20.61 | I1422: NA Games-STORE | J1422: RNT1-NSW-WS-VG-PE | K1422: REYNATIS NSW
B1423: Item Fulfillment | C1423: 2024-09-23T00:00:00.000 | D1423: 434638 | E1423: 23303 Barry Simpson | F1423: F | G1423: Inventory Asset : Finished Goods | H1423: 20.61 | I1423: NA Games-STORE | J1423: RNT1-NSW-WS-VG-PE | K1423: REYNATIS NSW
B1424: Item Fulfillment | C1424: 2024-09-23T00:00:00.000 | D1424: 434746 | E1424: 7076 Oleksii Razumov | F1424: F | G1424: Inventory Asset : Finished Goods | H1424: 25.13 | I1424: NA Games-STORE | J1424: YSD1-PS5-WS-VG-PE | K1424: Ys VIII Lacrimosa of Dana PS5
B1425: Item Fulfillment | C1425: 2024-09-23T00:00:00.000 | D1425: 434731 | E1425: 23728 Tasanee Thienpothong | F1425: F | G1425: Inventory Asset : Finished Goods | H1425: 20.61 | I1425: NA Games-STORE | J1425: RNT1-NSW-WS-VG-PE | K1425: REYNATIS NSW
B1426: Item Fulfillment | C1426: 2024-09-23T00:00:00.000 | D1426: 434443 | E1426: Zero Khoutsavanh | F1426: F | G1426: Inventory Asset : Finished Goods | H1426: 20.61 | I1426: NA Games-STORE | J1426: RNT1-NSW-WS-VG-PE | K1426: REYNATIS NSW
B1427: Item Fulfillment | C1427: 2024-09-23T00:00:00.000 | D1427: 434386 | E1427: Alya Alzaabi | F1427: F | G1427: Inventory Asset : Finished Goods | H1427: 20.61 | I1427: NA Games-STORE | J1427: RNT1-NSW-WS-VG-PE | K1427: REYNATIS NSW
B1428: Item Fulfillment | C1428: 2024-09-23T00:00:00.000 | D1428: 434333 | E1428: Michael Quintana [1000180063] | F1428: F | G1428: Inventory Asset : Finished Goods | H1428: 18.1 | I1428: NA Games-STORE | J1428: RNT1-PS5-WS-VG-PE | K1428: REYNATIS PS5
B1429: Item Fulfillment | C1429: 2024-09-23T00:00:00.000 | D1429: 434674 | E1429: Shane Mayfield | F1429: F | G1429: Inventory Asset : Finished Goods | H1429: 20.61 | I1429: NA Games-STORE | J1429: RNT1-NSW-WS-VG-PE | K1429: REYNATIS NSW
B1430: Item Fulfillment | C1430: 2024-09-23T00:00:00.000 | D1430: 434629 | E1430: 23265 Bays Smith | F1430: F | G1430: Inventory Asset : Finished Goods | H1430: 20.61 | I1430: NA Games-STORE | J1430: RNT1-NSW-WS-VG-PE | K1430: REYNATIS NSW
B1431: Item Fulfillment | C1431: 2024-09-23T00:00:00.000 | D1431: 434626 | E1431: Bradford Smith | F1431: F | G1431: Inventory Asset : Finished Goods | H1431: 20.61 | I1431: NA Games-STORE | J1431: RNT1-NSW-WS-VG-PE | K1431: REYNATIS NSW
B1432: Item Fulfillment | C1432: 2024-09-23T00:00:00.000 | D1432: 434576 | E1432: Jesse Cazun | F1432: F | G1432: Inventory Asset : Finished Goods | H1432: 20.61 | I1432: NA Games-STORE | J1432: RNT1-NSW-WS-VG-PE | K1432: REYNATIS NSW
B1433: Item Fulfillment | C1433: 2024-09-23T00:00:00.000 | D1433: 434294 | E1433: Bradley Elzinga | F1433: F | G1433: Inventory Asset : Finished Goods | H1433: 18.1 | I1433: NA Games-STORE | J1433: RNT1-PS5-WS-VG-PE | K1433: REYNATIS PS5
B1434: Item Fulfillment | C1434: 2024-09-23T00:00:00.000 | D1434: 434415 | E1434: Jeff Handy Handy | F1434: F | G1434: Inventory Asset : Finished Goods | H1434: 20.61 | I1434: NA Games-STORE | J1434: RNT1-NSW-WS-VG-PE | K1434: REYNATIS NSW
B1435: Item Fulfillment | C1435: 2024-09-23T00:00:00.000 | D1435: 434413 | E1435: Daniel Peak | F1435: F | G1435: Inventory Asset : Finished Goods | H1435: 20.61 | I1435: NA Games-STORE | J1435: RNT1-NSW-WS-VG-PE | K1435: REYNATIS NSW
B1436: Item Fulfillment | C1436: 2024-09-23T00:00:00.000 | D1436: 434517 | E1436: Monica Seu | F1436: F | G1436: Inventory Asset : Finished Goods | H1436: 18.1 | I1436: NA Games-STORE | J1436: RNT1-PS5-WS-VG-PE | K1436: REYNATIS PS5
B1437: Item Fulfillment | C1437: 2024-09-23T00:00:00.000 | D1437: 434500 | E1437: 1286 Fernando Preciado | F1437: F | G1437: Inventory Asset : Finished Goods | H1437: 20.61 | I1437: NA Games-STORE | J1437: RNT1-NSW-WS-VG-PE | K1437: REYNATIS NSW
B1438: Item Fulfillment | C1438: 2024-09-23T00:00:00.000 | D1438: 434774 | E1438: 23770 Adam Gripp | F1438: F | G1438: Inventory Asset : Finished Goods | H1438: 25.14 | I1438: NA Games-STORE | J1438: YSD1-PS5-WS-VG-PE | K1438: Ys VIII Lacrimosa of Dana PS5
B1439: Item Fulfillment | C1439: 2024-09-23T00:00:00.000 | D1439: 434593 | E1439: 23067 Diego Mancilla Leiva | F1439: F | G1439: Inventory Asset : Finished Goods | H1439: 20.61 | I1439: NA Games-STORE | J1439: RNT1-NSW-WS-VG-PE | K1439: REYNATIS NSW
B1440: Item Fulfillment | C1440: 2024-09-23T00:00:00.000 | D1440: 434313 | E1440: Chris 24 | F1440: F | G1440: Inventory Asset : Finished Goods | H1440: 20.61 | I1440: NA Games-STORE | J1440: RNT1-NSW-WS-VG-PE | K1440: REYNATIS NSW
B1441: Item Fulfillment | C1441: 2024-09-23T00:00:00.000 | D1441: 434308 | E1441: Timothy Harp | F1441: F | G1441: Inventory Asset : Finished Goods | H1441: 20.61 | I1441: NA Games-STORE | J1441: RNT1-NSW-WS-VG-PE | K1441: REYNATIS NSW
B1442: Item Fulfillment | C1442: 2024-09-23T00:00:00.000 | D1442: 434334 | E1442: Jan Tan | F1442: F | G1442: Inventory Asset : Finished Goods | H1442: 20.61 | I1442: NA Games-STORE | J1442: RNT1-NSW-WS-VG-PE | K1442: REYNATIS NSW
B1443: Item Fulfillment | C1443: 2024-09-23T00:00:00.000 | D1443: 434790 | E1443: 23784 James Hisbadhorse | F1443: F | G1443: Inventory Asset : Finished Goods | H1443: 18.1 | I1443: NA Games-STORE | J1443: RNT1-PS5-WS-VG-PE | K1443: REYNATIS PS5
B1444: Item Fulfillment | C1444: 2024-09-23T00:00:00.000 | D1444: 434763 | E1444: Alex Savage | F1444: F | G1444: Inventory Asset : Finished Goods | H1444: 18.1 | I1444: NA Games-STORE | J1444: RNT1-PS5-WS-VG-PE | K1444: REYNATIS PS5
B1445: Item Fulfillment | C1445: 2024-09-23T00:00:00.000 | D1445: 434633 | E1445: 898 NATHAN ADAMS | F1445: F | G1445: Inventory Asset : Finished Goods | H1445: 20.61 | I1445: NA Games-STORE | J1445: RNT1-NSW-WS-VG-PE | K1445: REYNATIS NSW
B1446: Item Fulfillment | C1446: 2024-09-24T00:00:00.000 | D1446: 434819 | E1446: 2154 Mohamed alnuaimi | F1446: F | G1446: Inventory Asset : Finished Goods | H1446: 22.88 | I1446: NA Games-STORE | J1446: TTD1-PS4-WS-VG-PE | K1446: Trails through Daybreak PS4
B1447: Item Fulfillment | C1447: 2024-09-24T00:00:00.000 | D1447: 434879 | E1447: Jordan Edgar 2 | F1447: F | G1447: Inventory Asset : Finished Goods | H1447: 20.61 | I1447: NA Games-STORE | J1447: RNT1-NSW-WS-VG-PE | K1447: REYNATIS NSW
B1448: Item Fulfillment | C1448: 2024-09-24T00:00:00.000 | D1448: 434878 | E1448: Jeremie Arthur | F1448: F | G1448: Inventory Asset : Finished Goods | H1448: 18.1 | I1448: NA Games-STORE | J1448: RNT1-PS4-WS-VG-PE | K1448: REYNATIS PS4
B1449: Item Fulfillment | C1449: 2024-09-24T00:00:00.000 | D1449: 434849 | E1449: Stuwart Chen | F1449: F | G1449: Inventory Asset : Finished Goods | H1449: 18.79 | I1449: NA Games-STORE | J1449: VOT2-NSW-WS-VG-PE | K1449: Void Terrarium 2 NSW
B1450: Item Fulfillment | C1450: 2024-09-24T00:00:00.000 | D1450: 434811 | E1450: rishiraja | F1450: F | G1450: Inventory Asset : Finished Goods | H1450: 18.1 | I1450: NA Games-STORE | J1450: RNT1-PS5-WS-VG-PE | K1450: REYNATIS PS5
B1451: Item Fulfillment | C1451: 2024-09-24T00:00:00.000 | D1451: 434802 | E1451: gamelore | F1451: F | G1451: Inventory Asset : Finished Goods | H1451: 26.61 | I1451: NA Games-STORE | J1451: TTD1-NSW-WS-VG-PE | K1451: Trails through Daybreak NSW
B1452: Item Fulfillment | C1452: 2024-09-24T00:00:00.000 | D1452: 434899 | E1452: exclusive nail couture professional | F1452: F | G1452: Inventory Asset : Finished Goods | H1452: 20.61 | I1452: NA Games-STORE | J1452: RNT1-NSW-WS-VG-PE | K1452: REYNATIS NSW
B1453: Item Fulfillment | C1453: 2024-09-24T00:00:00.000 | D1453: 434865 | E1453: Carolyn Rolbiecki | F1453: F | H1453: 18.1 | I1453: NA Games-STORE | J1453: RNT1-PS5-WS-VG-PE | K1453: REYNATIS PS5
B1454: Item Fulfillment | C1454: 2024-09-24T00:00:00.000 | D1454: 434862 | E1454: 23128 M McKee | F1454: F | G1454: Inventory Asset : Finished Goods | H1454: 21.58 | I1454: NA Games-STORE | J1454: GGR1-PS5-WS-VG-PE | K1454: Grim Grimoire OnceMore PS5
B1455: Item Fulfillment | C1455: 2024-09-24T00:00:00.000 | D1455: 434804 | E1455: ben pasqua | F1455: F | G1455: Inventory Asset : Finished Goods | H1455: 61.83 | I1455: NA Games-STORE | J1455: RNT1-NSW-WS-VG-PE | K1455: REYNATIS NSW
B1456: Item Fulfillment | C1456: 2024-09-24T00:00:00.000 | D1456: 434801 | E1456: Adrian Soh | F1456: F | G1456: Inventory Asset : Finished Goods | H1456: 18.1 | I1456: NA Games-STORE | J1456: RNT1-PS5-WS-VG-PE | K1456: REYNATIS PS5
B1457: Item Fulfillment | C1457: 2024-09-24T00:00:00.000 | D1457: 434841 | E1457: Devesh Jainer | F1457: F | G1457: Inventory Asset : Finished Goods | H1457: 18.1 | I1457: NA Games-STORE | J1457: RNT1-PS4-WS-VG-PE | K1457: REYNATIS PS4
B1458: Item Fulfillment | C1458: 2024-09-24T00:00:00.000 | D1458: 434814 | E1458: Bradley Booms | F1458: F | G1458: Inventory Asset : Finished Goods | H1458: 20.61 | I1458: NA Games-STORE | J1458: RNT1-NSW-WS-VG-PE | K1458: REYNATIS NSW
B1459: Item Fulfillment | C1459: 2024-09-24T00:00:00.000 | D1459: 434834 | E1459: Gabriel Gotelli Adrianzen | F1459: F | G1459: Inventory Asset : Finished Goods | H1459: 20.61 | I1459: NA Games-STORE | J1459: RNT1-NSW-WS-VG-PE | K1459: REYNATIS NSW
B1460: Item Fulfillment | C1460: 2024-09-24T00:00:00.000 | D1460: 434809 | E1460: 22385 Steven Kalis | F1460: F | G1460: Inventory Asset : Finished Goods | H1460: 20.61 | I1460: NA Games-STORE | J1460: RNT1-NSW-WS-VG-PE | K1460: REYNATIS NSW
B1461: Item Fulfillment | C1461: 2024-09-24T00:00:00.000 | D1461: 434805 | E1461: Michael Da Luz | F1461: F | G1461: Inventory Asset : Finished Goods | H1461: 20.61 | I1461: NA Games-STORE | J1461: RNT1-NSW-WS-VG-PE | K1461: REYNATIS NSW
B1462: Item Fulfillment | C1462: 2024-09-24T00:00:00.000 | D1462: 434798 | E1462: Mary Green | F1462: F | G1462: Inventory Asset : Finished Goods | H1462: 20.61 | I1462: NA Games-STORE | J1462: RNT1-NSW-WS-VG-PE | K1462: REYNATIS NSW
B1463: Item Fulfillment | C1463: 2024-09-24T00:00:00.000 | D1463: 434816 | E1463: 22413 Dan Lam | F1463: F | G1463: Inventory Asset : Finished Goods | H1463: 26.61 | I1463: NA Games-STORE | J1463: TTD1-NSW-WS-VG-PE | K1463: Trails through Daybreak NSW
B1464: Item Fulfillment | C1464: 2024-09-24T00:00:00.000 | D1464: 434803 | E1464: Jason Kaminsky | F1464: F | G1464: Inventory Asset : Finished Goods | H1464: 18.1 | I1464: NA Games-STORE | J1464: RNT1-PS4-WS-VG-PE | K1464: REYNATIS PS4
B1465: Item Fulfillment | C1465: 2024-09-24T00:00:00.000 | D1465: 434824 | E1465: Adam Buchwald | F1465: F | G1465: Inventory Asset : Finished Goods | H1465: 54.32 | I1465: NA Games-STORE | J1465: RNT1-PS4-WS-VG-PE | K1465: REYNATIS PS4
B1466: Item Fulfillment | C1466: 2024-09-24T00:00:00.000 | D1466: 434811 | E1466: rishiraja | F1466: F | G1466: Inventory Asset : Finished Goods | H1466: 20.61 | I1466: NA Games-STORE | J1466: RNT1-NSW-WS-VG-PE | K1466: REYNATIS NSW
B1467: Item Fulfillment | C1467: 2024-09-24T00:00:00.000 | D1467: 434853 | E1467: Sean Dalrymple | F1467: F | G1467: Inventory Asset : Finished Goods | H1467: 20.61 | I1467: NA Games-STORE | J1467: RNT1-NSW-WS-VG-PE | K1467: REYNATIS NSW
B1468: Item Fulfillment | C1468: 2024-09-24T00:00:00.000 | D1468: 434872 | E1468: Tomica Dyer | F1468: F | G1468: Inventory Asset : Finished Goods | H1468: 20.61 | I1468: NA Games-STORE | J1468: RNT1-NSW-WS-VG-PE | K1468: REYNATIS NSW
B1469: Item Fulfillment | C1469: 2024-09-24T00:00:00.000 | D1469: 434810 | E1469: Jeremy Coy | F1469: F | G1469: Inventory Asset : Finished Goods | H1469: 20.61 | I1469: NA Games-STORE | J1469: RNT1-NSW-WS-VG-PE | K1469: REYNATIS NSW
B1470: Item Fulfillment | C1470: 2024-09-24T00:00:00.000 | D1470: 434868 | E1470: Derek von Suppiny | F1470: F | G1470: Inventory Asset : Finished Goods | H1470: 22.87 | I1470: NA Games-STORE | J1470: TTD1-PS5-WS-VG-PE | K1470: Trails through Daybreak PS5
B1471: Item Fulfillment | C1471: 2024-09-24T00:00:00.000 | D1471: 434859 | E1471: Joe Cirillo | F1471: F | G1471: Inventory Asset : Finished Goods | H1471: 18.1 | I1471: NA Games-STORE | J1471: RNT1-PS5-WS-VG-PE | K1471: REYNATIS PS5
B1472: Item Fulfillment | C1472: 2024-09-24T00:00:00.000 | D1472: 434810 | E1472: Jeremy Coy | F1472: F | G1472: Inventory Asset : Finished Goods | H1472: 18.1 | I1472: NA Games-STORE | J1472: RNT1-PS5-WS-VG-PE | K1472: REYNATIS PS5
B1473: Item Fulfillment | C1473: 2024-09-24T00:00:00.000 | D1473: 434798 | E1473: Mary Green | F1473: F | G1473: Inventory Asset : Finished Goods | H1473: 18.1 | I1473: NA Games-STORE | J1473: RNT1-PS5-WS-VG-PE | K1473: REYNATIS PS5
B1474: Item Fulfillment | C1474: 2024-09-24T00:00:00.000 | D1474: 434897 | E1474: dragoonlantz | F1474: F | G1474: Inventory Asset : Finished Goods | H1474: 20.12 | I1474: NA Games-STORE | J1474: TC34-PS5-WS-VG-PE | K1474: Trails of Cold Steel 3+4 PS5
B1475: Item Fulfillment | C1475: 2024-09-24T00:00:00.000 | D1475: 434888 | E1475: Jonathan Carroll | F1475: F | G1475: Inventory Asset : Finished Goods | H1475: 18.1 | I1475: NA Games-STORE | J1475: RNT1-PS5-WS-VG-PE | K1475: REYNATIS PS5
B1476: Item Fulfillment | C1476: 2024-09-24T00:00:00.000 | D1476: 434851 | E1476: Netten Chen [1000255251] | F1476: F | G1476: Inventory Asset : Finished Goods | H1476: 20.61 | I1476: NA Games-STORE | J1476: RNT1-NSW-WS-VG-PE | K1476: REYNATIS NSW
B1477: Item Fulfillment | C1477: 2024-09-24T00:00:00.000 | D1477: 434837 | E1477: Raul Arroyo Rodriguez | F1477: F | H1477: 20.61 | I1477: NA Games-STORE | J1477: RNT1-NSW-WS-VG-PE | K1477: REYNATIS NSW
B1478: Item Fulfillment | C1478: 2024-09-24T00:00:00.000 | D1478: 434827 | E1478: Gerry Tuczak | F1478: F | G1478: Inventory Asset : Finished Goods | H1478: 18.1 | I1478: NA Games-STORE | J1478: RNT1-PS4-WS-VG-PE | K1478: REYNATIS PS4
B1479: Item Fulfillment | C1479: 2024-09-24T00:00:00.000 | D1479: 434822 | E1479: Adam Buchwald | F1479: F | G1479: Inventory Asset : Finished Goods | H1479: 61.83 | I1479: NA Games-STORE | J1479: RNT1-NSW-WS-VG-PE | K1479: REYNATIS NSW
B1480: Item Fulfillment | C1480: 2024-09-24T00:00:00.000 | D1480: 434815 | E1480: 22409 Melissa Tow | F1480: F | G1480: Inventory Asset : Finished Goods | H1480: 61.83 | I1480: NA Games-STORE | J1480: RNT1-NSW-WS-VG-PE | K1480: REYNATIS NSW
B1481: Item Fulfillment | C1481: 2024-09-24T00:00:00.000 | D1481: 434894 | E1481: JOSE DE JESUS OVIEDO | F1481: F | G1481: Inventory Asset : Finished Goods | H1481: 20.61 | I1481: NA Games-STORE | J1481: RNT1-NSW-WS-VG-PE | K1481: REYNATIS NSW
B1482: Item Fulfillment | C1482: 2024-09-24T00:00:00.000 | D1482: 434847 | E1482: 3144 Pavel Kuznetsov | F1482: F | G1482: Inventory Asset : Finished Goods | H1482: 26.61 | I1482: NA Games-STORE | J1482: TTD1-NSW-WS-VG-PE | K1482: Trails through Daybreak NSW
B1483: Item Fulfillment | C1483: 2024-09-24T00:00:00.000 | D1483: 434885 | E1483: Felisa Wijaya [1000244513] | F1483: F | G1483: Inventory Asset : Finished Goods | H1483: 36.21 | I1483: NA Games-STORE | J1483: RNT1-PS5-WS-VG-PE | K1483: REYNATIS PS5
B1484: Item Fulfillment | C1484: 2024-09-24T00:00:00.000 | D1484: 434869 | E1484: Tomica Dyer | F1484: F | G1484: Inventory Asset : Finished Goods | H1484: 21.37 | I1484: NA Games-STORE | J1484: LOL1-NSW-WS-VG-PE | K1484: Legend of Legacy HD NSW
B1485: Item Fulfillment | C1485: 2024-09-24T00:00:00.000 | D1485: 434821 | E1485: Kevin Velez [1000287160] | F1485: F | G1485: Inventory Asset : Finished Goods | H1485: 36.21 | I1485: NA Games-STORE | J1485: RNT1-PS5-WS-VG-PE | K1485: REYNATIS PS5
B1486: Item Fulfillment | C1486: 2024-09-24T00:00:00.000 | D1486: 434869 | E1486: Tomica Dyer | F1486: F | G1486: Inventory Asset : Finished Goods | H1486: 20.61 | I1486: NA Games-STORE | J1486: RNT1-NSW-WS-VG-PE | K1486: REYNATIS NSW
B1487: Item Fulfillment | C1487: 2024-09-24T00:00:00.000 | D1487: 434850 | E1487: GUO ZHENG LEE | F1487: F | G1487: Inventory Asset : Finished Goods | H1487: 20.61 | I1487: NA Games-STORE | J1487: RNT1-NSW-WS-VG-PE | K1487: REYNATIS NSW
B1488: Item Fulfillment | C1488: 2024-09-24T00:00:00.000 | D1488: 434829 | E1488: 18949 Joanna Micco | F1488: F | G1488: Inventory Asset : Finished Goods | H1488: 21.38 | I1488: NA Games-STORE | J1488: LOL1-NSW-WS-VG-PE | K1488: Legend of Legacy HD NSW
B1489: Item Fulfillment | C1489: 2024-09-24T00:00:00.000 | D1489: 434807 | E1489: Jahn A. Vazquez | F1489: F | G1489: Inventory Asset : Finished Goods | H1489: 18.1 | I1489: NA Games-STORE | J1489: RNT1-PS5-WS-VG-PE | K1489: REYNATIS PS5
B1490: Item Fulfillment | C1490: 2024-09-24T00:00:00.000 | D1490: 434886 | E1490: Jeremy Rock | F1490: F | G1490: Inventory Asset : Finished Goods | H1490: 18.1 | I1490: NA Games-STORE | J1490: RNT1-PS5-WS-VG-PE | K1490: REYNATIS PS5
B1491: Item Fulfillment | C1491: 2024-09-24T00:00:00.000 | D1491: 434872 | E1491: Tomica Dyer | F1491: F | G1491: Inventory Asset : Finished Goods | H1491: 21.38 | I1491: NA Games-STORE | J1491: LOL1-NSW-WS-VG-PE | K1491: Legend of Legacy HD NSW
B1492: Item Fulfillment | C1492: 2024-09-24T00:00:00.000 | D1492: 434855 | E1492: Natasha Davis | F1492: F | G1492: Inventory Asset : Finished Goods | H1492: 20.61 | I1492: NA Games-STORE | J1492: RNT1-NSW-WS-VG-PE | K1492: REYNATIS NSW
B1493: Item Fulfillment | C1493: 2024-09-24T00:00:00.000 | D1493: 434814 | E1493: Bradley Booms | F1493: F | G1493: Inventory Asset : Finished Goods | H1493: 18.1 | I1493: NA Games-STORE | J1493: RNT1-PS5-WS-VG-PE | K1493: REYNATIS PS5
B1494: Item Fulfillment | C1494: 2024-09-24T00:00:00.000 | D1494: 434880 | E1494: NISA Operations | F1494: F | H1494: 18.1 | I1494: NA Games-STORE | J1494: RNT1-PS4-WS-VG-PE | K1494: REYNATIS PS4
B1495: Item Fulfillment | C1495: 2024-09-24T00:00:00.000 | D1495: 434866 | E1495: Jason Stiles | F1495: F | G1495: Inventory Asset : Finished Goods | H1495: 20.61 | I1495: NA Games-STORE | J1495: RNT1-NSW-WS-VG-PE | K1495: REYNATIS NSW
B1496: Item Fulfillment | C1496: 2024-09-24T00:00:00.000 | D1496: 434833 | E1496: Scott Buchanan | F1496: F | G1496: Inventory Asset : Finished Goods | H1496: 20.61 | I1496: NA Games-STORE | J1496: RNT1-NSW-WS-VG-PE | K1496: REYNATIS NSW
B1497: Item Fulfillment | C1497: 2024-09-24T00:00:00.000 | D1497: 434812 | E1497: Jason Capps | F1497: F | G1497: Inventory Asset : Finished Goods | H1497: 18.1 | I1497: NA Games-STORE | J1497: RNT1-PS4-WS-VG-PE | K1497: REYNATIS PS4
B1498: Item Fulfillment | C1498: 2024-09-24T00:00:00.000 | D1498: 434803 | E1498: Jason Kaminsky | F1498: F | G1498: Inventory Asset : Finished Goods | H1498: 20.61 | I1498: NA Games-STORE | J1498: RNT1-NSW-WS-VG-PE | K1498: REYNATIS NSW
B1499: Item Fulfillment | C1499: 2024-09-24T00:00:00.000 | D1499: 434799 | E1499: Xin Lau | F1499: F | G1499: Inventory Asset : Finished Goods | H1499: 36.21 | I1499: NA Games-STORE | J1499: RNT1-PS5-WS-VG-PE | K1499: REYNATIS PS5
B1500: Item Fulfillment | C1500: 2024-09-24T00:00:00.000 | D1500: 434893 | E1500: 23788 Joshua Casswell | F1500: F | G1500: Inventory Asset : Finished Goods | H1500: 27.76 | I1500: NA Games-STORE | J1500: DIS7-NSW-WS-VG-PE | K1500: Disgaea 7 NSW
B1501: Item Fulfillment | C1501: 2024-09-24T00:00:00.000 | D1501: 434891 | E1501: Ger Moua | F1501: F | G1501: Inventory Asset : Finished Goods | H1501: 18.1 | I1501: NA Games-STORE | J1501: RNT1-PS5-WS-VG-PE | K1501: REYNATIS PS5
B1502: Item Fulfillment | C1502: 2024-09-24T00:00:00.000 | D1502: 434877 | E1502: Jeremie Arthur | F1502: F | G1502: Inventory Asset : Finished Goods | H1502: 18.1 | I1502: NA Games-STORE | J1502: RNT1-PS5-WS-VG-PE | K1502: REYNATIS PS5
B1503: Item Fulfillment | C1503: 2024-09-24T00:00:00.000 | D1503: 434843 | E1503: 22536 Ghassan Brown | F1503: F | G1503: Inventory Asset : Finished Goods | H1503: 18.1 | I1503: NA Games-STORE | J1503: RNT1-PS5-WS-VG-PE | K1503: REYNATIS PS5
B1504: Item Fulfillment | C1504: 2024-09-24T00:00:00.000 | D1504: 434841 | E1504: Devesh Jainer | F1504: F | G1504: Inventory Asset : Finished Goods | H1504: 20.61 | I1504: NA Games-STORE | J1504: RNT1-NSW-WS-VG-PE | K1504: REYNATIS NSW
B1505: Item Fulfillment | C1505: 2024-09-24T00:00:00.000 | D1505: 434811 | E1505: rishiraja | F1505: F | G1505: Inventory Asset : Finished Goods | H1505: 18.1 | I1505: NA Games-STORE | J1505: RNT1-PS4-WS-VG-PE | K1505: REYNATIS PS4
B1506: Item Fulfillment | C1506: 2024-09-24T00:00:00.000 | D1506: 434873 | E1506: Stephanie Ortiz | F1506: F | G1506: Inventory Asset : Finished Goods | H1506: 20.61 | I1506: NA Games-STORE | J1506: RNT1-NSW-WS-VG-PE | K1506: REYNATIS NSW
B1507: Item Fulfillment | C1507: 2024-09-24T00:00:00.000 | D1507: 434823 | E1507: Adam Buchwald | F1507: F | G1507: Inventory Asset : Finished Goods | H1507: 54.31 | I1507: NA Games-STORE | J1507: RNT1-PS5-WS-VG-PE | K1507: REYNATIS PS5
B1508: Item Fulfillment | C1508: 2024-09-24T00:00:00.000 | D1508: 434800 | E1508: Robert McPhail | F1508: F | G1508: Inventory Asset : Finished Goods | H1508: 20.61 | I1508: NA Games-STORE | J1508: RNT1-NSW-WS-VG-PE | K1508: REYNATIS NSW
B1509: Item Fulfillment | C1509: 2024-09-24T00:00:00.000 | D1509: 434799 | E1509: Xin Lau | F1509: F | G1509: Inventory Asset : Finished Goods | H1509: 41.22 | I1509: NA Games-STORE | J1509: RNT1-NSW-WS-VG-PE | K1509: REYNATIS NSW
B1510: Item Fulfillment | C1510: 2024-09-24T00:00:00.000 | D1510: 434862 | E1510: 23128 M McKee | F1510: F | G1510: Inventory Asset : Finished Goods | H1510: 18.1 | I1510: NA Games-STORE | J1510: RNT1-PS5-WS-VG-PE | K1510: REYNATIS PS5
B1511: Item Fulfillment | C1511: 2024-09-24T00:00:00.000 | D1511: 434855 | E1511: Natasha Davis | F1511: F | G1511: Inventory Asset : Finished Goods | H1511: 27.77 | I1511: NA Games-STORE | J1511: DIS7-NSW-WS-VG-PE | K1511: Disgaea 7 NSW
B1512: Item Fulfillment | C1512: 2024-09-24T00:00:00.000 | D1512: 434846 | E1512: Joseph Cataudella [1000244169] | F1512: F | G1512: Inventory Asset : Finished Goods | H1512: 18.11 | I1512: NA Games-STORE | J1512: RNT1-PS4-WS-VG-PE | K1512: REYNATIS PS4
B1513: Item Fulfillment | C1513: 2024-09-24T00:00:00.000 | D1513: 434801 | E1513: Adrian Soh | F1513: F | G1513: Inventory Asset : Finished Goods | H1513: 20.61 | I1513: NA Games-STORE | J1513: RNT1-NSW-WS-VG-PE | K1513: REYNATIS NSW
B1514: Item Fulfillment | C1514: 2024-09-24T00:00:00.000 | D1514: 434830 | E1514: Andy Feng | F1514: F | G1514: Inventory Asset : Finished Goods | H1514: 20.61 | I1514: NA Games-STORE | J1514: RNT1-NSW-WS-VG-PE | K1514: REYNATIS NSW
B1515: Item Fulfillment | C1515: 2024-09-24T00:00:00.000 | D1515: 434875 | E1515: 23675 James Patton | F1515: F | G1515: Inventory Asset : Finished Goods | H1515: 18.1 | I1515: NA Games-STORE | J1515: RNT1-PS5-WS-VG-PE | K1515: REYNATIS PS5
B1516: Item Fulfillment | C1516: 2024-09-24T00:00:00.000 | D1516: 434870 | E1516: Suta Suddhiprakarn | F1516: F | G1516: Inventory Asset : Finished Goods | H1516: 18.1 | I1516: NA Games-STORE | J1516: RNT1-PS4-WS-VG-PE | K1516: REYNATIS PS4
B1517: Item Fulfillment | C1517: 2024-09-24T00:00:00.000 | D1517: 434850 | E1517: GUO ZHENG LEE | F1517: F | G1517: Inventory Asset : Finished Goods | H1517: 24.04 | I1517: NA Games-STORE | J1517: KAM1-NSW-WS-VG-PE | K1517: Kamiwaza NSW
B1518: Item Fulfillment | C1518: 2024-09-24T00:00:00.000 | D1518: 434904 | E1518: Eric Sare | F1518: F | G1518: Inventory Asset : Finished Goods | H1518: 20.61 | I1518: NA Games-STORE | J1518: RNT1-NSW-WS-VG-PE | K1518: REYNATIS NSW
B1519: Item Fulfillment | C1519: 2024-09-24T00:00:00.000 | D1519: 434903 | E1519: Miles Fall | F1519: F | G1519: Inventory Asset : Finished Goods | H1519: 36.21 | I1519: NA Games-STORE | J1519: RNT1-PS5-WS-VG-PE | K1519: REYNATIS PS5
B1520: Item Fulfillment | C1520: 2024-09-24T00:00:00.000 | D1520: 434867 | E1520: 23275 Marina Patella | F1520: F | G1520: Inventory Asset : Finished Goods | H1520: 36.21 | I1520: NA Games-STORE | J1520: RNT1-PS5-WS-VG-PE | K1520: REYNATIS PS5
B1521: Item Fulfillment | C1521: 2024-09-24T00:00:00.000 | D1521: 434800 | E1521: Robert McPhail | F1521: F | G1521: Inventory Asset : Finished Goods | H1521: 18.1 | I1521: NA Games-STORE | J1521: RNT1-PS4-WS-VG-PE | K1521: REYNATIS PS4
B1522: Item Fulfillment | C1522: 2024-09-24T00:00:00.000 | D1522: 434849 | E1522: Stuwart Chen | F1522: F | G1522: Inventory Asset : Finished Goods | H1522: 18.1 | I1522: NA Games-STORE | J1522: RNT1-PS5-WS-VG-PE | K1522: REYNATIS PS5
B1523: Item Fulfillment | C1523: 2024-09-24T00:00:00.000 | D1523: 434835 | E1523: Cristobal Aguilar | F1523: F | G1523: Inventory Asset : Finished Goods | H1523: 20.61 | I1523: NA Games-STORE | J1523: RNT1-NSW-WS-VG-PE | K1523: REYNATIS NSW
B1524: Item Fulfillment | C1524: 2024-09-24T00:00:00.000 | D1524: 434874 | E1524: Julius K Campbell | F1524: F | G1524: Inventory Asset : Finished Goods | H1524: 18.1 | I1524: NA Games-STORE | J1524: RNT1-PS5-WS-VG-PE | K1524: REYNATIS PS5
B1525: Item Fulfillment | C1525: 2024-09-24T00:00:00.000 | D1525: 434851 | E1525: Netten Chen [1000255251] | F1525: F | G1525: Inventory Asset : Finished Goods | H1525: 22.96 | I1525: NA Games-STORE | J1525: GGR1-NSW-WS-VG-PE | K1525: Grim Grimoire OnceMore NSW
B1526: Item Fulfillment | C1526: 2024-09-24T00:00:00.000 | D1526: 434844 | E1526: Johnny Luong [1000311849] | F1526: F | G1526: Inventory Asset : Finished Goods | H1526: 20.61 | I1526: NA Games-STORE | J1526: RNT1-NSW-WS-VG-PE | K1526: REYNATIS NSW
B1527: Item Fulfillment | C1527: 2024-09-24T00:00:00.000 | D1527: 434866 | E1527: Jason Stiles | F1527: F | G1527: Inventory Asset : Finished Goods | H1527: 20.12 | I1527: NA Games-STORE | J1527: TC34-PS5-WS-VG-PE | K1527: Trails of Cold Steel 3+4 PS5
B1528: Item Fulfillment | C1528: 2024-09-24T00:00:00.000 | D1528: 434806 | E1528: 22381 Christopher Gatehouse | F1528: F | G1528: Inventory Asset : Finished Goods | H1528: 18.1 | I1528: NA Games-STORE | J1528: RNT1-PS5-WS-VG-PE | K1528: REYNATIS PS5
B1529: Item Fulfillment | C1529: 2024-09-24T00:00:00.000 | D1529: 434876 | E1529: Mohammad Al Shalabi | F1529: F | G1529: Inventory Asset : Finished Goods | H1529: 22.87 | I1529: NA Games-STORE | J1529: TTD1-PS5-WS-VG-PE | K1529: Trails through Daybreak PS5
B1530: Item Fulfillment | C1530: 2024-09-24T00:00:00.000 | D1530: 434842 | E1530: Scott Baloun | F1530: F | G1530: Inventory Asset : Finished Goods | H1530: 26.61 | I1530: NA Games-STORE | J1530: TTD1-NSW-WS-VG-PE | K1530: Trails through Daybreak NSW
B1531: Item Fulfillment | C1531: 2024-09-24T00:00:00.000 | D1531: 434833 | E1531: Scott Buchanan | F1531: F | G1531: Inventory Asset : Finished Goods | H1531: 18.1 | I1531: NA Games-STORE | J1531: RNT1-PS5-WS-VG-PE | K1531: REYNATIS PS5
B1532: Item Fulfillment | C1532: 2024-09-24T00:00:00.000 | D1532: 434852 | E1532: Gamerz world | F1532: F | G1532: Inventory Asset : Finished Goods | H1532: 18.1 | I1532: NA Games-STORE | J1532: RNT1-PS5-WS-VG-PE | K1532: REYNATIS PS5
B1533: Item Fulfillment | C1533: 2024-09-24T00:00:00.000 | D1533: 434881 | E1533: 23737 D L | F1533: F | G1533: Inventory Asset : Finished Goods | H1533: 20.61 | I1533: NA Games-STORE | J1533: RNT1-NSW-WS-VG-PE | K1533: REYNATIS NSW
B1534: Item Fulfillment | C1534: 2024-09-24T00:00:00.000 | D1534: 434834 | E1534: Gabriel Gotelli Adrianzen | F1534: F | G1534: Inventory Asset : Finished Goods | H1534: 18.1 | I1534: NA Games-STORE | J1534: RNT1-PS5-WS-VG-PE | K1534: REYNATIS PS5
B1535: Item Fulfillment | C1535: 2024-09-24T00:00:00.000 | D1535: 434844 | E1535: Johnny Luong [1000311849] | F1535: F | G1535: Inventory Asset : Finished Goods | H1535: 17.82 | I1535: NA Games-STORE | J1535: LOL1-PS5-WS-VG-PE | K1535: Legend of Legacy HD PS5
B1536: Item Fulfillment | C1536: 2024-09-24T00:00:00.000 | D1536: 434895 | E1536: 23789 Hannah Meunier | F1536: F | G1536: Inventory Asset : Finished Goods | H1536: 18.1 | I1536: NA Games-STORE | J1536: RNT1-PS5-WS-VG-PE | K1536: REYNATIS PS5
B1537: Item Fulfillment | C1537: 2024-09-24T00:00:00.000 | D1537: 434828 | E1537: It's easy inc | F1537: F | G1537: Inventory Asset : Finished Goods | H1537: 18.1 | I1537: NA Games-STORE | J1537: RNT1-PS5-WS-VG-PE | K1537: REYNATIS PS5
B1538: Item Fulfillment | C1538: 2024-09-24T00:00:00.000 | D1538: 434848 | E1538: Jonathan Espinal [1000322036] | F1538: F | G1538: Inventory Asset : Finished Goods | H1538: 72.42 | I1538: NA Games-STORE | J1538: RNT1-PS5-WS-VG-PE | K1538: REYNATIS PS5
B1539: Item Fulfillment | C1539: 2024-09-24T00:00:00.000 | D1539: 434836 | E1539: Brian Ponce | F1539: F | G1539: Inventory Asset : Finished Goods | H1539: 20.61 | I1539: NA Games-STORE | J1539: RNT1-NSW-WS-VG-PE | K1539: REYNATIS NSW
B1540: Item Fulfillment | C1540: 2024-09-24T00:00:00.000 | D1540: 434817 | E1540: Vincent On | F1540: F | G1540: Inventory Asset : Finished Goods | H1540: 19.58 | I1540: NA Games-STORE | J1540: POE1-NSW-WS-VG-PE | K1540: Process of Elimination NSW
B1541: Item Fulfillment | C1541: 2024-09-24T00:00:00.000 | D1541: 434852 | E1541: Gamerz world | F1541: F | G1541: Inventory Asset : Finished Goods | H1541: 18.11 | I1541: NA Games-STORE | J1541: RNT1-PS4-WS-VG-PE | K1541: REYNATIS PS4
B1542: Item Fulfillment | C1542: 2024-09-24T00:00:00.000 | D1542: 434819 | E1542: 2154 Mohamed alnuaimi | F1542: F | G1542: Inventory Asset : Finished Goods | H1542: 18.1 | I1542: NA Games-STORE | J1542: RNT1-PS4-WS-VG-PE | K1542: REYNATIS PS4
B1543: Item Fulfillment | C1543: 2024-09-24T00:00:00.000 | D1543: 434860 | E1543: Rob Morgan | F1543: F | G1543: Inventory Asset : Finished Goods | H1543: 20.61 | I1543: NA Games-STORE | J1543: RNT1-NSW-WS-VG-PE | K1543: REYNATIS NSW
B1544: Item Fulfillment | C1544: 2024-09-24T00:00:00.000 | D1544: 434860 | E1544: Rob Morgan | F1544: F | G1544: Inventory Asset : Finished Goods | H1544: 18.1 | I1544: NA Games-STORE | J1544: RNT1-PS5-WS-VG-PE | K1544: REYNATIS PS5
B1545: Item Fulfillment | C1545: 2024-09-24T00:00:00.000 | D1545: 434850 | E1545: GUO ZHENG LEE | F1545: F | G1545: Inventory Asset : Finished Goods | H1545: 18.1 | I1545: NA Games-STORE | J1545: RNT1-PS5-WS-VG-PE | K1545: REYNATIS PS5
B1546: Item Fulfillment | C1546: 2024-09-24T00:00:00.000 | D1546: 434848 | E1546: Jonathan Espinal [1000322036] | F1546: F | G1546: Inventory Asset : Finished Goods | H1546: 54.31 | I1546: NA Games-STORE | J1546: RNT1-PS4-WS-VG-PE | K1546: REYNATIS PS4
B1547: Item Fulfillment | C1547: 2024-09-24T00:00:00.000 | D1547: 434830 | E1547: Andy Feng | F1547: F | G1547: Inventory Asset : Finished Goods | H1547: 18.1 | I1547: NA Games-STORE | J1547: RNT1-PS5-WS-VG-PE | K1547: REYNATIS PS5
B1548: Item Fulfillment | C1548: 2024-09-24T00:00:00.000 | D1548: 434828 | E1548: It's easy inc | F1548: F | G1548: Inventory Asset : Finished Goods | H1548: 18.11 | I1548: NA Games-STORE | J1548: RNT1-PS4-WS-VG-PE | K1548: REYNATIS PS4
B1549: Item Fulfillment | C1549: 2024-09-24T00:00:00.000 | D1549: 434813 | E1549: Nicholas Allen | F1549: F | H1549: 18.1 | I1549: NA Games-STORE | J1549: RNT1-PS5-WS-VG-PE | K1549: REYNATIS PS5
B1550: Item Fulfillment | C1550: 2024-09-24T00:00:00.000 | D1550: 434900 | E1550: Shannon Hebert | F1550: F | G1550: Inventory Asset : Finished Goods | H1550: 18.11 | I1550: NA Games-STORE | J1550: RNT1-PS5-WS-VG-PE | K1550: REYNATIS PS5
B1551: Item Fulfillment | C1551: 2024-09-24T00:00:00.000 | D1551: 434885 | E1551: Felisa Wijaya [1000244513] | F1551: F | G1551: Inventory Asset : Finished Goods | H1551: 20.61 | I1551: NA Games-STORE | J1551: RNT1-NSW-WS-VG-PE | K1551: REYNATIS NSW
B1552: Item Fulfillment | C1552: 2024-09-24T00:00:00.000 | D1552: 434854 | E1552: william winata | F1552: F | G1552: Inventory Asset : Finished Goods | H1552: 41.22 | I1552: NA Games-STORE | J1552: RNT1-NSW-WS-VG-PE | K1552: REYNATIS NSW
B1553: Item Fulfillment | C1553: 2024-09-24T00:00:00.000 | D1553: 434850 | E1553: GUO ZHENG LEE | F1553: F | G1553: Inventory Asset : Finished Goods | H1553: 25.13 | I1553: NA Games-STORE | J1553: YSD1-PS5-WS-VG-PE | K1553: Ys VIII Lacrimosa of Dana PS5
B1554: Item Fulfillment | C1554: 2024-09-24T00:00:00.000 | D1554: 434820 | E1554: 22430 Jesse Batus | F1554: F | G1554: Inventory Asset : Finished Goods | H1554: 21.38 | I1554: NA Games-STORE | J1554: LOL1-NSW-WS-VG-PE | K1554: Legend of Legacy HD NSW
B1555: Item Fulfillment | C1555: 2024-09-24T00:00:00.000 | D1555: 434800 | E1555: Robert McPhail | F1555: F | G1555: Inventory Asset : Finished Goods | H1555: 18.1 | I1555: NA Games-STORE | J1555: RNT1-PS5-WS-VG-PE | K1555: REYNATIS PS5
B1556: Item Fulfillment | C1556: 2024-09-24T00:00:00.000 | D1556: 434901 | E1556: Ben Murphy | F1556: F | G1556: Inventory Asset : Finished Goods | H1556: 19.59 | I1556: NA Games-STORE | J1556: POE1-NSW-WS-VG-PE | K1556: Process of Elimination NSW
B1557: Item Fulfillment | C1557: 2024-09-24T00:00:00.000 | D1557: 434829 | E1557: 18949 Joanna Micco | F1557: F | G1557: Inventory Asset : Finished Goods | H1557: 52.1 | I1557: NA Games-STORE | J1557: HMO4-NSW-WS-VG-PE | K1557: Harvest Moon: Winds of Anthos NSW
B1558: Item Fulfillment | C1558: 2024-09-24T00:00:00.000 | D1558: 434896 | E1558: Jose Coll | F1558: F | G1558: Inventory Asset : Finished Goods | H1558: 18.1 | I1558: NA Games-STORE | J1558: RNT1-PS5-WS-VG-PE | K1558: REYNATIS PS5
B1559: Item Fulfillment | C1559: 2024-09-24T00:00:00.000 | D1559: 434874 | E1559: Julius K Campbell | F1559: F | G1559: Inventory Asset : Finished Goods | H1559: 17.81 | I1559: NA Games-STORE | J1559: LOL1-PS5-WS-VG-PE | K1559: Legend of Legacy HD PS5
B1560: Item Fulfillment | C1560: 2024-09-24T00:00:00.000 | D1560: 434808 | E1560: Logan Moll | F1560: F | G1560: Inventory Asset : Finished Goods | H1560: 36.21 | I1560: NA Games-STORE | J1560: RNT1-PS5-WS-VG-PE | K1560: REYNATIS PS5
B1561: Item Fulfillment | C1561: 2024-09-24T00:00:00.000 | D1561: 434863 | E1561: 23189 James Matthews | F1561: F | G1561: Inventory Asset : Finished Goods | H1561: 25.14 | I1561: NA Games-STORE | J1561: YSD1-PS5-WS-VG-PE | K1561: Ys VIII Lacrimosa of Dana PS5
B1562: Item Fulfillment | C1562: 2024-09-24T00:00:00.000 | D1562: 434860 | E1562: Rob Morgan | F1562: F | G1562: Inventory Asset : Finished Goods | H1562: 18.11 | I1562: NA Games-STORE | J1562: RNT1-PS4-WS-VG-PE | K1562: REYNATIS PS4
B1563: Item Fulfillment | C1563: 2024-09-24T00:00:00.000 | D1563: 434898 | E1563: 23642 David Bailey | F1563: F | G1563: Inventory Asset : Finished Goods | H1563: 20.61 | I1563: NA Games-STORE | J1563: RNT1-NSW-WS-VG-PE | K1563: REYNATIS NSW
B1564: Item Fulfillment | C1564: 2024-09-24T00:00:00.000 | D1564: 434892 | E1564: 23787 Koll, Katie | F1564: F | G1564: Inventory Asset : Finished Goods | H1564: 20.61 | I1564: NA Games-STORE | J1564: RNT1-NSW-WS-VG-PE | K1564: REYNATIS NSW
B1565: Item Fulfillment | C1565: 2024-09-24T00:00:00.000 | D1565: 434818 | E1565: Suvaporn NingKaowline | F1565: F | G1565: Inventory Asset : Finished Goods | H1565: 36.21 | I1565: NA Games-STORE | J1565: RNT1-PS5-WS-VG-PE | K1565: REYNATIS PS5
B1566: Item Fulfillment | C1566: 2024-09-24T00:00:00.000 | D1566: 434812 | E1566: Jason Capps | F1566: F | G1566: Inventory Asset : Finished Goods | H1566: 20.12 | I1566: NA Games-STORE | J1566: TC34-PS5-WS-VG-PE | K1566: Trails of Cold Steel 3+4 PS5
B1567: Item Fulfillment | C1567: 2024-09-24T00:00:00.000 | D1567: 434799 | E1567: Xin Lau | F1567: F | G1567: Inventory Asset : Finished Goods | H1567: 36.21 | I1567: NA Games-STORE | J1567: RNT1-PS4-WS-VG-PE | K1567: REYNATIS PS4
B1568: Item Fulfillment | C1568: 2024-09-24T00:00:00.000 | D1568: 434807 | E1568: Jahn A. Vazquez | F1568: F | G1568: Inventory Asset : Finished Goods | H1568: 20.61 | I1568: NA Games-STORE | J1568: RNT1-NSW-WS-VG-PE | K1568: REYNATIS NSW
B1569: Item Fulfillment | C1569: 2024-09-24T00:00:00.000 | D1569: 434873 | E1569: Stephanie Ortiz | F1569: F | G1569: Inventory Asset : Finished Goods | H1569: 22.96 | I1569: NA Games-STORE | J1569: GGR1-NSW-WS-VG-PE | K1569: Grim Grimoire OnceMore NSW
B1570: Item Fulfillment | C1570: 2024-09-24T00:00:00.000 | D1570: 434838 | E1570: Gustavo Rivera | F1570: F | G1570: Inventory Asset : Finished Goods | H1570: 17.81 | I1570: NA Games-STORE | J1570: LOL1-PS4-WS-VG-PE | K1570: Legend of Legacy HD PS4
B1571: Item Fulfillment | C1571: 2024-09-24T00:00:00.000 | D1571: 434831 | E1571: Michael Phung [189244] | F1571: F | H1571: 18.1 | I1571: NA Games-STORE | J1571: RNT1-PS4-WS-VG-PE | K1571: REYNATIS PS4
B1572: Item Fulfillment | C1572: 2024-09-24T00:00:00.000 | D1572: 434826 | E1572: 22091 Christopher Rodriguez | F1572: F | G1572: Inventory Asset : Finished Goods | H1572: 21.37 | I1572: NA Games-STORE | J1572: LOL1-NSW-WS-VG-PE | K1572: Legend of Legacy HD NSW
B1573: Item Fulfillment | C1573: 2024-09-24T00:00:00.000 | D1573: 434884 | E1573: 23747 Justin Ponzi | F1573: F | G1573: Inventory Asset : Finished Goods | H1573: 20.61 | I1573: NA Games-STORE | J1573: RNT1-NSW-WS-VG-PE | K1573: REYNATIS NSW
B1574: Item Fulfillment | C1574: 2024-09-24T00:00:00.000 | D1574: 434881 | E1574: 23737 D L | F1574: F | G1574: Inventory Asset : Finished Goods | H1574: 18.1 | I1574: NA Games-STORE | J1574: RNT1-PS5-WS-VG-PE | K1574: REYNATIS PS5
B1575: Item Fulfillment | C1575: 2024-09-24T00:00:00.000 | D1575: 434820 | E1575: 22430 Jesse Batus | F1575: F | G1575: Inventory Asset : Finished Goods | H1575: 20.61 | I1575: NA Games-STORE | J1575: RNT1-NSW-WS-VG-PE | K1575: REYNATIS NSW
B1576: Item Fulfillment | C1576: 2024-09-24T00:00:00.000 | D1576: 434806 | E1576: 22381 Christopher Gatehouse | F1576: F | G1576: Inventory Asset : Finished Goods | H1576: 20.61 | I1576: NA Games-STORE | J1576: RNT1-NSW-WS-VG-PE | K1576: REYNATIS NSW
B1577: Item Fulfillment | C1577: 2024-09-24T00:00:00.000 | D1577: 434827 | E1577: Gerry Tuczak | F1577: F | G1577: Inventory Asset : Finished Goods | H1577: 18.1 | I1577: NA Games-STORE | J1577: RNT1-PS5-WS-VG-PE | K1577: REYNATIS PS5
B1578: Item Fulfillment | C1578: 2024-09-24T00:00:00.000 | D1578: 434825 | E1578: Denny Miyashiro | F1578: F | G1578: Inventory Asset : Finished Goods | H1578: 26.61 | I1578: NA Games-STORE | J1578: TTD1-NSW-WS-VG-PE | K1578: Trails through Daybreak NSW
B1579: Item Fulfillment | C1579: 2024-09-24T00:00:00.000 | D1579: 434817 | E1579: Vincent On | F1579: F | G1579: Inventory Asset : Finished Goods | H1579: 20.61 | I1579: NA Games-STORE | J1579: RNT1-NSW-WS-VG-PE | K1579: REYNATIS NSW
B1580: Item Fulfillment | C1580: 2024-09-24T00:00:00.000 | D1580: 434832 | E1580: Aaron Medved | F1580: F | G1580: Inventory Asset : Finished Goods | H1580: 20.61 | I1580: NA Games-STORE | J1580: RNT1-NSW-WS-VG-PE | K1580: REYNATIS NSW
B1581: Item Fulfillment | C1581: 2024-09-24T00:00:00.000 | D1581: 434829 | E1581: 18949 Joanna Micco | F1581: F | G1581: Inventory Asset : Finished Goods | H1581: 20.61 | I1581: NA Games-STORE | J1581: RNT1-NSW-WS-VG-PE | K1581: REYNATIS NSW
B1582: Item Fulfillment | C1582: 2024-09-24T00:00:00.000 | D1582: 434842 | E1582: Scott Baloun | F1582: F | G1582: Inventory Asset : Finished Goods | H1582: 18.1 | I1582: NA Games-STORE | J1582: RNT1-PS5-WS-VG-PE | K1582: REYNATIS PS5
B1583: Item Fulfillment | C1583: 2024-09-24T00:00:00.000 | D1583: 434825 | E1583: Denny Miyashiro | F1583: F | G1583: Inventory Asset : Finished Goods | H1583: 20.61 | I1583: NA Games-STORE | J1583: RNT1-NSW-WS-VG-PE | K1583: REYNATIS NSW
B1584: Item Fulfillment | C1584: 2024-09-24T00:00:00.000 | D1584: 434879 | E1584: Jordan Edgar 2 | F1584: F | G1584: Inventory Asset : Finished Goods | H1584: 18.11 | I1584: NA Games-STORE | J1584: RNT1-PS4-WS-VG-PE | K1584: REYNATIS PS4
B1585: Item Fulfillment | C1585: 2024-09-24T00:00:00.000 | D1585: 434877 | E1585: Jeremie Arthur | F1585: F | G1585: Inventory Asset : Finished Goods | H1585: 61.84 | I1585: NA Games-STORE | J1585: RNT1-NSW-WS-VG-PE | K1585: REYNATIS NSW
B1586: Item Fulfillment | C1586: 2024-09-24T00:00:00.000 | D1586: 434840 | E1586: 22515 Claudia Castrillon | F1586: F | G1586: Inventory Asset : Finished Goods | H1586: 18.1 | I1586: NA Games-STORE | J1586: RNT1-PS5-WS-VG-PE | K1586: REYNATIS PS5
B1587: Item Fulfillment | C1587: 2024-09-24T00:00:00.000 | D1587: 434803 | E1587: Jason Kaminsky | F1587: F | G1587: Inventory Asset : Finished Goods | H1587: 18.1 | I1587: NA Games-STORE | J1587: RNT1-PS5-WS-VG-PE | K1587: REYNATIS PS5
B1588: Item Fulfillment | C1588: 2024-09-24T00:00:00.000 | D1588: 434802 | E1588: gamelore | F1588: F | G1588: Inventory Asset : Finished Goods | H1588: 18.1 | I1588: NA Games-STORE | J1588: RNT1-PS4-WS-VG-PE | K1588: REYNATIS PS4
B1589: Item Fulfillment | C1589: 2024-09-24T00:00:00.000 | D1589: 434871 | E1589: 23497 ANGELYSA B ULLOA | F1589: F | G1589: Inventory Asset : Finished Goods | H1589: 18.1 | I1589: NA Games-STORE | J1589: RNT1-PS5-WS-VG-PE | K1589: REYNATIS PS5
B1590: Item Fulfillment | C1590: 2024-09-24T00:00:00.000 | D1590: 434847 | E1590: 3144 Pavel Kuznetsov | F1590: F | G1590: Inventory Asset : Finished Goods | H1590: 20.61 | I1590: NA Games-STORE | J1590: RNT1-NSW-WS-VG-PE | K1590: REYNATIS NSW
B1591: Item Fulfillment | C1591: 2024-09-24T00:00:00.000 | D1591: 434845 | E1591: 21868 Lewis Luu | F1591: F | H1591: 20.61 | I1591: NA Games-STORE | J1591: RNT1-NSW-WS-VG-PE | K1591: REYNATIS NSW
B1592: Item Fulfillment | C1592: 2024-09-24T00:00:00.000 | D1592: 434838 | E1592: Gustavo Rivera | F1592: F | G1592: Inventory Asset : Finished Goods | H1592: 18.11 | I1592: NA Games-STORE | J1592: RNT1-PS4-WS-VG-PE | K1592: REYNATIS PS4
B1593: Item Fulfillment | C1593: 2024-09-24T00:00:00.000 | D1593: 434887 | E1593: Daniel Quiros | F1593: F | G1593: Inventory Asset : Finished Goods | H1593: 20.61 | I1593: NA Games-STORE | J1593: RNT1-NSW-WS-VG-PE | K1593: REYNATIS NSW
B1594: Item Fulfillment | C1594: 2024-09-24T00:00:00.000 | D1594: 434861 | E1594: James Changaris | F1594: F | G1594: Inventory Asset : Finished Goods | H1594: 18.1 | I1594: NA Games-STORE | J1594: RNT1-PS5-WS-VG-PE | K1594: REYNATIS PS5
B1595: Item Fulfillment | C1595: 2024-09-24T00:00:00.000 | D1595: 434848 | E1595: Jonathan Espinal [1000322036] | F1595: F | G1595: Inventory Asset : Finished Goods | H1595: 82.45 | I1595: NA Games-STORE | J1595: RNT1-NSW-WS-VG-PE | K1595: REYNATIS NSW
B1596: Item Fulfillment | C1596: 2024-09-24T00:00:00.000 | D1596: 434816 | E1596: 22413 Dan Lam | F1596: F | G1596: Inventory Asset : Finished Goods | H1596: 20.61 | I1596: NA Games-STORE | J1596: RNT1-NSW-WS-VG-PE | K1596: REYNATIS NSW
B1597: Item Fulfillment | C1597: 2024-09-24T00:00:00.000 | D1597: 434901 | E1597: Ben Murphy | F1597: F | G1597: Inventory Asset : Finished Goods | H1597: 25.41 | I1597: NA Games-STORE | J1597: YUK1-NSW-WS-VG-PE | K1597: Yurukill NSW
B1598: Item Fulfillment | C1598: 2024-09-24T00:00:00.000 | D1598: 434858 | E1598: Adam Buchwald | F1598: F | G1598: Inventory Asset : Finished Goods | H1598: 90.52 | I1598: NA Games-STORE | J1598: RNT1-PS4-WS-VG-PE | K1598: REYNATIS PS4
B1599: Item Fulfillment | C1599: 2024-09-24T00:00:00.000 | D1599: 434839 | E1599: Aaron Myers | F1599: F | H1599: 36.21 | I1599: NA Games-STORE | J1599: RNT1-PS5-WS-VG-PE | K1599: REYNATIS PS5
B1600: Item Fulfillment | C1600: 2024-09-24T00:00:00.000 | D1600: 434880 | E1600: NISA Operations | F1600: F | H1600: 20.61 | I1600: NA Games-STORE | J1600: RNT1-NSW-WS-VG-PE | K1600: REYNATIS NSW
B1601: Item Fulfillment | C1601: 2024-09-24T00:00:00.000 | D1601: 434864 | E1601: Walter Villeda | F1601: F | G1601: Inventory Asset : Finished Goods | H1601: 18.1 | I1601: NA Games-STORE | J1601: RNT1-PS5-WS-VG-PE | K1601: REYNATIS PS5
B1602: Item Fulfillment | C1602: 2024-09-24T00:00:00.000 | D1602: 434863 | E1602: 23189 James Matthews | F1602: F | G1602: Inventory Asset : Finished Goods | H1602: 18.1 | I1602: NA Games-STORE | J1602: RNT1-PS5-WS-VG-PE | K1602: REYNATIS PS5
B1603: Item Fulfillment | C1603: 2024-09-24T00:00:00.000 | D1603: 434859 | E1603: Joe Cirillo | F1603: F | G1603: Inventory Asset : Finished Goods | H1603: 20.61 | I1603: NA Games-STORE | J1603: RNT1-NSW-WS-VG-PE | K1603: REYNATIS NSW
B1604: Item Fulfillment | C1604: 2024-09-24T00:00:00.000 | D1604: 434857 | E1604: Adam Buchwald | F1604: F | G1604: Inventory Asset : Finished Goods | H1604: 54.31 | I1604: NA Games-STORE | J1604: RNT1-PS5-WS-VG-PE | K1604: REYNATIS PS5
B1605: Item Fulfillment | C1605: 2024-09-24T00:00:00.000 | D1605: 434826 | E1605: 22091 Christopher Rodriguez | F1605: F | G1605: Inventory Asset : Finished Goods | H1605: 20.61 | I1605: NA Games-STORE | J1605: RNT1-NSW-WS-VG-PE | K1605: REYNATIS NSW
B1606: Item Fulfillment | C1606: 2024-09-24T00:00:00.000 | D1606: 434890 | E1606: Sharon Magee | F1606: F | G1606: Inventory Asset : Finished Goods | H1606: 18.1 | I1606: NA Games-STORE | J1606: RNT1-PS5-WS-VG-PE | K1606: REYNATIS PS5
B1607: Item Fulfillment | C1607: 2024-09-24T00:00:00.000 | D1607: 434870 | E1607: Suta Suddhiprakarn | F1607: F | G1607: Inventory Asset : Finished Goods | H1607: 20.61 | I1607: NA Games-STORE | J1607: RNT1-NSW-WS-VG-PE | K1607: REYNATIS NSW
B1608: Item Fulfillment | C1608: 2024-09-24T00:00:00.000 | D1608: 434856 | E1608: Adam Buchwald | F1608: F | G1608: Inventory Asset : Finished Goods | H1608: 103.06 | I1608: NA Games-STORE | J1608: RNT1-NSW-WS-VG-PE | K1608: REYNATIS NSW
B1609: Item Fulfillment | C1609: 2024-09-24T00:00:00.000 | D1609: 434846 | E1609: Joseph Cataudella [1000244169] | F1609: F | G1609: Inventory Asset : Finished Goods | H1609: 20.61 | I1609: NA Games-STORE | J1609: RNT1-NSW-WS-VG-PE | K1609: REYNATIS NSW
B1610: Item Fulfillment | C1610: 2024-09-24T00:00:00.000 | D1610: 434832 | E1610: Aaron Medved | F1610: F | G1610: Inventory Asset : Finished Goods | H1610: 18.1 | I1610: NA Games-STORE | J1610: RNT1-PS5-WS-VG-PE | K1610: REYNATIS PS5
B1611: Item Fulfillment | C1611: 2024-09-24T00:00:00.000 | D1611: 434827 | E1611: Gerry Tuczak | F1611: F | G1611: Inventory Asset : Finished Goods | H1611: 20.61 | I1611: NA Games-STORE | J1611: RNT1-NSW-WS-VG-PE | K1611: REYNATIS NSW
B1612: Item Fulfillment | C1612: 2024-09-24T00:00:00.000 | D1612: 434805 | E1612: Michael Da Luz | F1612: F | G1612: Inventory Asset : Finished Goods | H1612: 18.1 | I1612: NA Games-STORE | J1612: RNT1-PS5-WS-VG-PE | K1612: REYNATIS PS5
B1613: Item Fulfillment | C1613: 2024-09-24T00:00:00.000 | D1613: 434878 | E1613: Jeremie Arthur | F1613: F | G1613: Inventory Asset : Finished Goods | H1613: 18.1 | I1613: NA Games-STORE | J1613: RNT1-PS5-WS-VG-PE | K1613: REYNATIS PS5
B1614: Item Fulfillment | C1614: 2024-09-24T00:00:00.000 | D1614: 434889 | E1614: 23785 Mario Estrella Jr | F1614: F | G1614: Inventory Asset : Finished Goods | H1614: 20.61 | I1614: NA Games-STORE | J1614: RNT1-NSW-WS-VG-PE | K1614: REYNATIS NSW
B1615: Item Fulfillment | C1615: 2024-09-24T00:00:00.000 | D1615: 434877 | E1615: Jeremie Arthur | F1615: F | G1615: Inventory Asset : Finished Goods | H1615: 18.11 | I1615: NA Games-STORE | J1615: RNT1-PS4-WS-VG-PE | K1615: REYNATIS PS4
B1616: Item Fulfillment | C1616: 2024-09-24T00:00:00.000 | D1616: 434880 | E1616: NISA Operations | F1616: F | H1616: 18.1 | I1616: NA Games-STORE | J1616: RNT1-PS5-WS-VG-PE | K1616: REYNATIS PS5
B1617: Item Fulfillment | C1617: 2024-09-24T00:00:00.000 | D1617: 434853 | E1617: Sean Dalrymple | F1617: F | G1617: Inventory Asset : Finished Goods | H1617: 4.69 | I1617: NA Games-STORE | J1617: PNY1-APP-WS-PTB3 | K1617: Goods
B1618: Item Fulfillment | C1618: 2024-09-24T00:00:00.000 | D1618: 434843 | E1618: 22536 Ghassan Brown | F1618: F | G1618: Inventory Asset : Finished Goods | H1618: 26.63 | I1618: NA Games-STORE | J1618: RHP3-NSW-WS-VG-PE | K1618: Rhapsody Legacy NSW
B1619: Item Fulfillment | C1619: 2024-09-24T00:00:00.000 | D1619: 434854 | E1619: william winata | F1619: F | G1619: Inventory Asset : Finished Goods | H1619: 36.21 | I1619: NA Games-STORE | J1619: RNT1-PS5-WS-VG-PE | K1619: REYNATIS PS5
B1620: Item Fulfillment | C1620: 2024-09-24T00:00:00.000 | D1620: 434840 | E1620: 22515 Claudia Castrillon | F1620: F | G1620: Inventory Asset : Finished Goods | H1620: 20.61 | I1620: NA Games-STORE | J1620: RNT1-NSW-WS-VG-PE | K1620: REYNATIS NSW
B1621: Item Fulfillment | C1621: 2024-09-24T00:00:00.000 | D1621: 434846 | E1621: Joseph Cataudella [1000244169] | F1621: F | G1621: Inventory Asset : Finished Goods | H1621: 18.1 | I1621: NA Games-STORE | J1621: RNT1-PS5-WS-VG-PE | K1621: REYNATIS PS5
B1622: Item Fulfillment | C1622: 2024-09-24T00:00:00.000 | D1622: 434836 | E1622: Brian Ponce | F1622: F | G1622: Inventory Asset : Finished Goods | H1622: 26.61 | I1622: NA Games-STORE | J1622: TTD1-NSW-WS-VG-PE | K1622: Trails through Daybreak NSW
B1623: Item Fulfillment | C1623: 2024-09-24T00:00:00.000 | D1623: 434809 | E1623: 22385 Steven Kalis | F1623: F | G1623: Inventory Asset : Finished Goods | H1623: 26.61 | I1623: NA Games-STORE | J1623: TTD1-NSW-WS-VG-PE | K1623: Trails through Daybreak NSW
B1624: Item Fulfillment | C1624: 2024-09-25T00:00:00.000 | D1624: 434911 | E1624: Sylvanus Bloice [170248] | F1624: F | H1624: 18.1 | I1624: NA Games-STORE | J1624: RNT1-PS5-WS-VG-PE | K1624: REYNATIS PS5
B1625: Item Fulfillment | C1625: 2024-09-25T00:00:00.000 | D1625: 434910 | E1625: Kameron Norris | F1625: F | G1625: Inventory Asset : Finished Goods | H1625: 21.57 | I1625: NA Games-STORE | J1625: GGR1-PS5-WS-VG-PE | K1625: Grim Grimoire OnceMore PS5
B1626: Bill | C1626: 2024-09-26T00:00:00.000 | D1626: Qualpac QD16656 | E1626: Professional Packaging Systems, LLC | F1626: F | G1626: Accounts Payable : Accounts Payable:Vendors | H1626: 2121.46 | I1626: NA Games-STORE | J1626: YSN1-NSW-WS-VG-ASM | K1626: Ys 10 NSW
B1627: Bill | C1627: 2024-09-27T00:00:00.000 | D1627: A to Z Media V168609 | E1627: A to Z Media | F1627: F | G1627: Accounts Payable : Accounts Payable:Vendors | H1627: 125.0 | I1627: NA Games-STORE | J1627: - No Item - | K1627: Ys 10
B1628: Item Fulfillment | C1628: 2024-09-27T00:00:00.000 | D1628: 434919 | E1628: 20019 Josh Foster | F1628: F | H1628: 22.87 | I1628: NA Games-STORE | J1628: TTD1-PS5-WS-VG-PE | K1628: Trails through Daybreak PS5
B1629: Item Fulfillment | C1629: 2024-09-27T00:00:00.000 | D1629: 434936 | E1629: Matthew Morey [1] | F1629: F | G1629: Inventory Asset : Finished Goods | H1629: 20.61 | I1629: NA Games-STORE | J1629: RNT1-NSW-WS-VG-PE | K1629: REYNATIS NSW
B1630: Item Fulfillment | C1630: 2024-09-27T00:00:00.000 | D1630: 434939 | E1630: JONATHAN Wright | F1630: F | G1630: Inventory Asset : Finished Goods | H1630: 24.8 | I1630: NA Games-STORE | J1630: MME1-NSW-WS-VG-PE | K1630: Monster Menu NSW
B1631: Item Fulfillment | C1631: 2024-09-27T00:00:00.000 | D1631: 434920 | E1631: Tim Richard | F1631: F | G1631: Inventory Asset : Finished Goods | H1631: 18.11 | I1631: NA Games-STORE | J1631: RNT1-PS5-WS-VG-PE | K1631: REYNATIS PS5
B1632: Item Fulfillment | C1632: 2024-09-27T00:00:00.000 | D1632: 434935 | E1632: 23808 Jimel Haynes | F1632: F | G1632: Inventory Asset : Finished Goods | H1632: 18.1 | I1632: NA Games-STORE | J1632: RNT1-PS5-WS-VG-PE | K1632: REYNATIS PS5
B1633: Item Fulfillment | C1633: 2024-09-27T00:00:00.000 | D1633: 434921 | E1633: Daniel Romero | F1633: F | G1633: Inventory Asset : Finished Goods | H1633: 18.1 | I1633: NA Games-STORE | J1633: RNT1-PS5-WS-VG-PE | K1633: REYNATIS PS5
B1634: Item Fulfillment | C1634: 2024-09-27T00:00:00.000 | D1634: 434925 | E1634: Arturo Montemayor | F1634: F | G1634: Inventory Asset : Finished Goods | H1634: 18.1 | I1634: NA Games-STORE | J1634: RNT1-PS5-WS-VG-PE | K1634: REYNATIS PS5
B1635: Item Fulfillment | C1635: 2024-09-27T00:00:00.000 | D1635: 434938 | E1635: 23816 Jordan Ross | F1635: F | G1635: Inventory Asset : Finished Goods | H1635: 21.57 | I1635: NA Games-STORE | J1635: GGR1-PS5-WS-VG-PE | K1635: Grim Grimoire OnceMore PS5
B1636: Item Fulfillment | C1636: 2024-09-27T00:00:00.000 | D1636: 434927 | E1636: Justin E. Barto | F1636: F | G1636: Inventory Asset : Finished Goods | H1636: 18.11 | I1636: NA Games-STORE | J1636: RNT1-PS5-WS-VG-PE | K1636: REYNATIS PS5
B1637: Item Fulfillment | C1637: 2024-09-27T00:00:00.000 | D1637: 434931 | E1637: 20255 Christian Brown | F1637: F | G1637: Inventory Asset : Finished Goods | H1637: 20.61 | I1637: NA Games-STORE | J1637: RNT1-NSW-WS-VG-PE | K1637: REYNATIS NSW
B1638: Item Fulfillment | C1638: 2024-09-27T00:00:00.000 | D1638: 434929 | E1638: 21296 Alex Woeck | F1638: F | G1638: Inventory Asset : Finished Goods | H1638: 25.13 | I1638: NA Games-STORE | J1638: YSD1-PS5-WS-VG-PE | K1638: Ys VIII Lacrimosa of Dana PS5
B1639: Item Fulfillment | C1639: 2024-09-27T00:00:00.000 | D1639: 434924 | E1639: Greg Burns | F1639: F | G1639: Inventory Asset : Finished Goods | H1639: 22.88 | I1639: NA Games-STORE | J1639: TTD1-PS4-WS-VG-PE | K1639: Trails through Daybreak PS4
B1640: Item Fulfillment | C1640: 2024-09-27T00:00:00.000 | D1640: 434939 | E1640: JONATHAN Wright | F1640: F | G1640: Inventory Asset : Finished Goods | H1640: 21.37 | I1640: NA Games-STORE | J1640: LOL1-NSW-WS-VG-PE | K1640: Legend of Legacy HD NSW
B1641: Item Fulfillment | C1641: 2024-09-27T00:00:00.000 | D1641: 434939 | E1641: JONATHAN Wright | F1641: F | G1641: Inventory Asset : Finished Goods | H1641: 18.8 | I1641: NA Games-STORE | J1641: VOT2-NSW-WS-VG-PE | K1641: Void Terrarium 2 NSW
B1642: Item Fulfillment | C1642: 2024-09-27T00:00:00.000 | D1642: 434937 | E1642: Kenneth Lang | F1642: F | G1642: Inventory Asset : Finished Goods | H1642: 20.61 | I1642: NA Games-STORE | J1642: RNT1-NSW-WS-VG-PE | K1642: REYNATIS NSW
B1643: Item Fulfillment | C1643: 2024-09-27T00:00:00.000 | D1643: 434932 | E1643: 19113 Carrie Ham | F1643: F | G1643: Inventory Asset : Finished Goods | H1643: 18.11 | I1643: NA Games-STORE | J1643: RNT1-PS5-WS-VG-PE | K1643: REYNATIS PS5
B1644: Item Fulfillment | C1644: 2024-09-27T00:00:00.000 | D1644: 434934 | E1644: Joshua Bauer | F1644: F | G1644: Inventory Asset : Finished Goods | H1644: 18.11 | I1644: NA Games-STORE | J1644: RNT1-PS5-WS-VG-PE | K1644: REYNATIS PS5
B1645: Item Fulfillment | C1645: 2024-09-27T00:00:00.000 | D1645: 434928 | E1645: Jonathon Nguyen | F1645: F | G1645: Inventory Asset : Finished Goods | H1645: 18.1 | I1645: NA Games-STORE | J1645: RNT1-PS5-WS-VG-PE | K1645: REYNATIS PS5
B1646: Item Fulfillment | C1646: 2024-09-27T00:00:00.000 | D1646: 434930 | E1646: 23803 David Martinez | F1646: F | G1646: Inventory Asset : Finished Goods | H1646: 21.58 | I1646: NA Games-STORE | J1646: GGR1-PS5-WS-VG-PE | K1646: Grim Grimoire OnceMore PS5
B1647: Item Fulfillment | C1647: 2024-09-27T00:00:00.000 | D1647: 434939 | E1647: JONATHAN Wright | F1647: F | G1647: Inventory Asset : Finished Goods | H1647: 12.61 | I1647: NA Games-STORE | J1647: FAL2-XB1-WS-VG-SE | K1647: Fallen Legion 2 XB1
B1648: Item Fulfillment | C1648: 2024-09-27T00:00:00.000 | D1648: 434922 | E1648: 22389 Christopher Doyle | F1648: F | G1648: Inventory Asset : Finished Goods | H1648: 18.11 | I1648: NA Games-STORE | J1648: RNT1-PS5-WS-VG-PE | K1648: REYNATIS PS5
B1649: Item Fulfillment | C1649: 2024-09-27T00:00:00.000 | D1649: 434933 | E1649: 23805 Long Le | F1649: F | G1649: Inventory Asset : Finished Goods | H1649: 18.1 | I1649: NA Games-STORE | J1649: RNT1-PS5-WS-VG-PE | K1649: REYNATIS PS5
B1650: Bill | C1650: 2024-09-30T00:00:00.000 | D1650: Qualpac QD16655 | E1650: Professional Packaging Systems, LLC | F1650: F | G1650: Accounts Payable : Accounts Payable:Vendors | H1650: 2371.42 | I1650: NA Games-STORE | J1650: RNT1-PS5-WS-VG-PE-ASM | K1650: REYNATIS PS5
B1651: Bill | C1651: 2024-09-30T00:00:00.000 | D1651: Qualpac QD16655 | E1651: Professional Packaging Systems, LLC | F1651: F | G1651: Accounts Payable : Accounts Payable:Vendors | H1651: 1411.51 | I1651: NA Games-STORE | J1651: RNT1-NSW-WS-VG-PE-ASM | K1651: REYNATIS NSW
B1652: Bill | C1652: 2024-09-30T00:00:00.000 | D1652: Qualpac QD16655 | E1652: Professional Packaging Systems, LLC | F1652: F | G1652: Accounts Payable : Accounts Payable:Vendors | H1652: 258.06 | I1652: NA Games-STORE | J1652: RNT1-PS4-WS-VG-PE-ASM | K1652: REYNATIS PS4
B1653: Inventory Adjustment | C1653: 2024-09-30T00:00:00.000 | D1653: 3156 | F1653: F | G1653: Inventory Asset : Finished Goods | H1653: 35.63 | I1653: - No Division - | J1653: - No Item - | K1653: - No Game Title -
B1654: Inventory Adjustment | C1654: 2024-09-30T00:00:00.000 | D1654: 3169 | F1654: F | G1654: Inventory Asset : Finished Goods | H1654: 255.18 | I1654: NA Games | J1654: - No Item - | K1654: - No Game Title -
B1655: Inventory Adjustment | C1655: 2024-09-30T00:00:00.000 | D1655: 3157 | F1655: F | G1655: Inventory Asset : Finished Goods | H1655: 20.12 | I1655: - No Division - | J1655: - No Item - | K1655: - No Game Title -
B1656: Inventory Adjustment | C1656: 2024-09-30T00:00:00.000 | D1656: 3155 | F1656: F | G1656: Inventory Asset : Finished Goods | H1656: 41.77 | I1656: - No Division - | J1656: - No Item - | K1656: - No Game Title -
B1657: Inventory Adjustment | C1657: 2024-09-30T00:00:00.000 | D1657: 3153 | F1657: F | G1657: Inventory Asset : Finished Goods | H1657: -114.35 | I1657: NA Games-STORE | J1657: - No Item - | K1657: Trails through Daybreak PS5
B1658: Inventory Adjustment | C1658: 2024-09-30T00:00:00.000 | D1658: 3154 | F1658: F | G1658: Inventory Asset : Finished Goods | H1658: 53.59 | I1658: - No Division - | J1658: - No Item - | K1658: - No Game Title -
B1659: Inventory Transfer | C1659: 2024-09-30T00:00:00.000 | D1659: 2015 | F1659: F | G1659: Inventory Asset : Finished Goods | H1659: -0.01 | I1659: NA Games-STORE | J1659: TTD1-PS4-WS-VG-PE | K1659: Trails through Daybreak PS4
B1660: Inventory Transfer | C1660: 2024-09-30T00:00:00.000 | D1660: 2014 | F1660: F | G1660: Inventory Asset : Finished Goods | H1660: -0.04 | I1660: NA Games-STORE | J1660: TTD1-NSW-WS-VG-PE | K1660: Trails through Daybreak
B1661: Item Fulfillment | C1661: 2024-09-30T00:00:00.000 | D1661: 434962 | E1661: NISA Operations | F1661: F | H1661: 36.2 | I1661: NA Games-STORE | J1661: RNT1-PS5-WS-VG-PE | K1661: REYNATIS PS5
B1662: Item Fulfillment | C1662: 2024-09-30T00:00:00.000 | D1662: 434962 | E1662: NISA Operations | F1662: F | H1662: 36.21 | I1662: NA Games-STORE | J1662: RNT1-PS4-WS-VG-PE | K1662: REYNATIS PS4
B1663: Item Fulfillment | C1663: 2024-09-30T00:00:00.000 | D1663: 434962 | E1663: NISA Operations | F1663: F | H1663: 61.83 | I1663: NA Games-STORE | J1663: RNT1-NSW-WS-VG-PE | K1663: REYNATIS NSW
A1664: Total - COGS-Online Store:Games_Material Costs | H1664: SUM(R[-1477]C:R[-1]C) -> 40447.82999999993
A1665: COGS-Online Store:Goods_Material Costs
B1666: Invoice | C1666: 2024-09-02T00:00:00.000 | D1666: NISINV-68389 | E1666: Event and Convention Sales | F1666: F | G1666: Accounts Receivable : Accounts Receivable: Online Store | H1666: 32.26 | I1666: NA Games-STORE | J1666: PNY1-OTH-WS-DEC2 | K1666: Goods
B1667: Invoice | C1667: 2024-09-02T00:00:00.000 | D1667: NISINV-68389 | E1667: Event and Convention Sales | F1667: F | G1667: Accounts Receivable : Accounts Receivable: Online Store | H1667: 41.73 | I1667: NA Games-STORE | J1667: YSN1-OTH-WS-STD3 | K1667: Goods
B1668: Invoice | C1668: 2024-09-02T00:00:00.000 | D1668: NISINV-68389 | E1668: Event and Convention Sales | F1668: F | G1668: Accounts Receivable : Accounts Receivable: Online Store | H1668: 64.37 | I1668: NA Games-STORE | J1668: YSN1-OTH-WS-STD2 | K1668: Goods
B1669: Invoice | C1669: 2024-09-02T00:00:00.000 | D1669: NISINV-68389 | E1669: Event and Convention Sales | F1669: F | G1669: Accounts Receivable : Accounts Receivable: Online Store | H1669: 141.93 | I1669: NA Games-STORE | J1669: PBR2-OTH-WS-PLU1 | K1669: Goods
B1670: Invoice | C1670: 2024-09-02T00:00:00.000 | D1670: NISINV-68389 | E1670: Event and Convention Sales | F1670: F | G1670: Accounts Receivable : Accounts Receivable: Online Store | H1670: 36.77 | I1670: NA Games-STORE | J1670: TTD2-OTH-WS-KEY1 | K1670: Goods
B1671: Invoice | C1671: 2024-09-02T00:00:00.000 | D1671: NISINV-68389 | E1671: Event and Convention Sales | F1671: F | G1671: Accounts Receivable : Accounts Receivable: Online Store | H1671: 280.1 | I1671: NA Games-STORE | J1671: PNY1-OTH-WS-PTB1 | K1671: Goods
B1672: Invoice | C1672: 2024-09-02T00:00:00.000 | D1672: NISINV-68389 | E1672: Event and Convention Sales | F1672: F | G1672: Accounts Receivable : Accounts Receivable: Online Store | H1672: 64.35 | I1672: NA Games-STORE | J1672: TTD1-OTH-WS-PLU2 | K1672: Goods
B1673: Invoice | C1673: 2024-09-02T00:00:00.000 | D1673: NISINV-68389 | E1673: Event and Convention Sales | F1673: F | G1673: Accounts Receivable : Accounts Receivable: Online Store | H1673: 96.48 | I1673: NA Games-STORE | J1673: YSN1-OTH-WS-PLU1 | K1673: Goods
B1674: Invoice | C1674: 2024-09-02T00:00:00.000 | D1674: NISINV-68389 | E1674: Event and Convention Sales | F1674: F | G1674: Accounts Receivable : Accounts Receivable: Online Store | H1674: 211.96 | I1674: NA Games-STORE | J1674: NAV1-OTH-WS-PLU4 | K1674: Goods
B1675: Invoice | C1675: 2024-09-02T00:00:00.000 | D1675: NISINV-68389 | E1675: Event and Convention Sales | F1675: F | G1675: Accounts Receivable : Accounts Receivable: Online Store | H1675: 166.65 | I1675: NA Games-STORE | J1675: PBR2-OTH-WS-PLU2 | K1675: Goods
B1676: Invoice | C1676: 2024-09-02T00:00:00.000 | D1676: NISINV-68389 | E1676: Event and Convention Sales | F1676: F | G1676: Accounts Receivable : Accounts Receivable: Online Store | H1676: 116.95 | I1676: NA Games-STORE | J1676: PNY1-OTH-WS-TSH3 : PNY1-OTH-WS-TSH3-2XL | K1676: Goods
B1677: Invoice | C1677: 2024-09-02T00:00:00.000 | D1677: NISINV-68389 | E1677: Event and Convention Sales | F1677: F | G1677: Accounts Receivable : Accounts Receivable: Online Store | H1677: 236.39 | I1677: NA Games-STORE | J1677: PNY1-OTH-WS-TSH3 : PNY1-OTH-WS-TSH3-M | K1677: Goods
B1678: Invoice | C1678: 2024-09-02T00:00:00.000 | D1678: NISINV-68389 | E1678: Event and Convention Sales | F1678: F | G1678: Accounts Receivable : Accounts Receivable: Online Store | H1678: 944.01 | I1678: NA Games-STORE | J1678: PG24-OTH-WS-PLU1 | K1678: Goods
B1679: Invoice | C1679: 2024-09-02T00:00:00.000 | D1679: NISINV-68389 | E1679: Event and Convention Sales | F1679: F | G1679: Accounts Receivable : Accounts Receivable: Online Store | H1679: 710.0 | I1679: NA Games-STORE | J1679: PW23-OTH-WS-PIN1 | K1679: Goods
B1680: Invoice | C1680: 2024-09-02T00:00:00.000 | D1680: NISINV-68389 | E1680: Event and Convention Sales | F1680: F | G1680: Accounts Receivable : Accounts Receivable: Online Store | H1680: 225.63 | I1680: NA Games-STORE | J1680: PNY1-OTH-WS-TSH3 : PNY1-OTH-WS-TSH3-L | K1680: Goods
B1681: Invoice | C1681: 2024-09-02T00:00:00.000 | D1681: NISINV-68389 | E1681: Event and Convention Sales | F1681: F | G1681: Accounts Receivable : Accounts Receivable: Online Store | H1681: 84.34 | I1681: NA Games-STORE | J1681: YSN1-OTH-WS-PLU2 | K1681: Goods
B1682: Invoice | C1682: 2024-09-02T00:00:00.000 | D1682: NISINV-68389 | E1682: Event and Convention Sales | F1682: F | G1682: Accounts Receivable : Accounts Receivable: Online Store | H1682: 75.21 | I1682: NA Games-STORE | J1682: PNY1-OTH-WS-TSH3 : PNY1-OTH-WS-TSH3-S | K1682: Goods
B1683: Invoice | C1683: 2024-09-02T00:00:00.000 | D1683: NISINV-68389 | E1683: Event and Convention Sales | F1683: F | G1683: Accounts Receivable : Accounts Receivable: Online Store | H1683: 102.3 | I1683: NA Games-STORE | J1683: TTD1-OTH-WS-PGS1 | K1683: Goods
B1684: Invoice | C1684: 2024-09-02T00:00:00.000 | D1684: NISINV-68389 | E1684: Event and Convention Sales | F1684: F | G1684: Accounts Receivable : Accounts Receivable: Online Store | H1684: 44.8 | I1684: NA Games-STORE | J1684: PNY1-OTH-WS-DEC1 | K1684: Goods
B1685: Invoice | C1685: 2024-09-02T00:00:00.000 | D1685: NISINV-68389 | E1685: Event and Convention Sales | F1685: F | G1685: Accounts Receivable : Accounts Receivable: Online Store | H1685: 142.45 | I1685: NA Games-STORE | J1685: TTD1-OTH-WS-PLU1 | K1685: Goods
B1686: Invoice | C1686: 2024-09-02T00:00:00.000 | D1686: NISINV-68389 | E1686: Event and Convention Sales | F1686: F | G1686: Accounts Receivable : Accounts Receivable: Online Store | H1686: 68.09 | I1686: NA Games-STORE | J1686: NAV1-OTH-WS-PLO1 | K1686: Goods
B1687: Invoice | C1687: 2024-09-02T00:00:00.000 | D1687: NISINV-68389 | E1687: Event and Convention Sales | F1687: F | G1687: Accounts Receivable : Accounts Receivable: Online Store | H1687: 35.24 | I1687: NA Games-STORE | J1687: YSN1-OTH-WS-KEY1 | K1687: Goods
B1688: Invoice | C1688: 2024-09-02T00:00:00.000 | D1688: NISINV-68389 | E1688: Event and Convention Sales | F1688: F | G1688: Accounts Receivable : Accounts Receivable: Online Store | H1688: 534.01 | I1688: NA Games-STORE | J1688: PNY1-OTH-WS-HOD1 | K1688: Goods
B1689: Invoice | C1689: 2024-09-02T00:00:00.000 | D1689: NISINV-68389 | E1689: Event and Convention Sales | F1689: F | G1689: Accounts Receivable : Accounts Receivable: Online Store | H1689: 121.62 | I1689: NA Games-STORE | J1689: NAV1-OTH-WS-PLU1 | K1689: Goods
B1690: Invoice | C1690: 2024-09-02T00:00:00.000 | D1690: NISINV-68389 | E1690: Event and Convention Sales | F1690: F | G1690: Accounts Receivable : Accounts Receivable: Online Store | H1690: 143.54 | I1690: NA Games-STORE | J1690: PBR2-OTH-WS-PLU3 | K1690: Goods
B1691: Invoice | C1691: 2024-09-02T00:00:00.000 | D1691: NISINV-68389 | E1691: Event and Convention Sales | F1691: F | G1691: Accounts Receivable : Accounts Receivable: Online Store | H1691: 34.51 | I1691: NA Games-STORE | J1691: TTD1-OTH-WS-PUZ1 | K1691: Goods
B1692: Invoice | C1692: 2024-09-02T00:00:00.000 | D1692: NISINV-68389 | E1692: Event and Convention Sales | F1692: F | G1692: Accounts Receivable : Accounts Receivable: Online Store | H1692: 79.46 | I1692: NA Games-STORE | J1692: TTD1-OTH-WS-STD2 | K1692: Goods
B1693: Invoice | C1693: 2024-09-02T00:00:00.000 | D1693: NISINV-68389 | E1693: Event and Convention Sales | F1693: F | G1693: Accounts Receivable : Accounts Receivable: Online Store | H1693: 87.03 | I1693: NA Games-STORE | J1693: TTD1-OTH-WS-STD1 | K1693: Goods
B1694: Invoice | C1694: 2024-09-02T00:00:00.000 | D1694: NISINV-68389 | E1694: Event and Convention Sales | F1694: F | G1694: Accounts Receivable : Accounts Receivable: Online Store | H1694: 18.97 | I1694: NA Games-STORE | J1694: NAV1-OTH-WS-PUZ1 | K1694: Goods
B1695: Invoice | C1695: 2024-09-02T00:00:00.000 | D1695: NISINV-68389 | E1695: Event and Convention Sales | F1695: F | G1695: Accounts Receivable : Accounts Receivable: Online Store | H1695: 44.8 | I1695: NA Games-STORE | J1695: PNY1-OTH-WS-DEC3 | K1695: Goods
B1696: Invoice | C1696: 2024-09-02T00:00:00.000 | D1696: NISINV-68389 | E1696: Event and Convention Sales | F1696: F | G1696: Accounts Receivable : Accounts Receivable: Online Store | H1696: 626.37 | I1696: NA Games-STORE | J1696: PNY1-OTH-WS-CAP1 | K1696: Goods
B1697: Invoice | C1697: 2024-09-02T00:00:00.000 | D1697: NISINV-68389 | E1697: Event and Convention Sales | F1697: F | G1697: Accounts Receivable : Accounts Receivable: Online Store | H1697: 71.95 | I1697: NA Games-STORE | J1697: YSN1-OTH-WS-STD1 | K1697: Goods
B1698: Invoice | C1698: 2024-09-02T00:00:00.000 | D1698: NISINV-68389 | E1698: Event and Convention Sales | F1698: F | G1698: Accounts Receivable : Accounts Receivable: Online Store | H1698: 236.38 | I1698: NA Games-STORE | J1698: PNY1-OTH-WS-TSH3 : PNY1-OTH-WS-TSH3-XL | K1698: Goods
B1699: Invoice | C1699: 2024-09-02T00:00:00.000 | D1699: NISINV-68389 | E1699: Event and Convention Sales | F1699: F | G1699: Accounts Receivable : Accounts Receivable: Online Store | H1699: 35.24 | I1699: NA Games-STORE | J1699: TTD2-OTH-WS-KEY2 | K1699: Goods
B1700: Invoice | C1700: 2024-09-02T00:00:00.000 | D1700: NISINV-68389 | E1700: Event and Convention Sales | F1700: F | G1700: Accounts Receivable : Accounts Receivable: Online Store | H1700: 222.28 | I1700: NA Games-STORE | J1700: NAV1-OTH-WS-PLU3 | K1700: Goods
B1701: Invoice | C1701: 2024-09-02T00:00:00.000 | D1701: NISINV-68389 | E1701: Event and Convention Sales | F1701: F | G1701: Accounts Receivable : Accounts Receivable: Online Store | H1701: 149.65 | I1701: NA Games-STORE | J1701: NAV1-OTH-WS-PGS1 | K1701: Goods
B1702: Invoice | C1702: 2024-09-02T00:00:00.000 | D1702: NISINV-68389 | E1702: Event and Convention Sales | F1702: F | G1702: Accounts Receivable : Accounts Receivable: Online Store | H1702: 22.98 | I1702: NA Games-STORE | J1702: YSN1-OTH-WS-KEY2 | K1702: Goods
B1703: Invoice | C1703: 2024-09-02T00:00:00.000 | D1703: NISINV-68389 | E1703: Event and Convention Sales | F1703: F | G1703: Accounts Receivable : Accounts Receivable: Online Store | H1703: 457.4 | I1703: NA Games-STORE | J1703: PNY1-OTH-WS-PLU5 | K1703: Goods
B1704: Invoice | C1704: 2024-09-02T00:00:00.000 | D1704: NISINV-68389 | E1704: Event and Convention Sales | F1704: F | G1704: Accounts Receivable : Accounts Receivable: Online Store | H1704: 182.43 | I1704: NA Games-STORE | J1704: NAV1-OTH-WS-PLU2 | K1704: Goods
B1705: Invoice | C1705: 2024-09-02T00:00:00.000 | D1705: NISINV-68389 | E1705: Event and Convention Sales | F1705: F | G1705: Accounts Receivable : Accounts Receivable: Online Store | H1705: 34.68 | I1705: NA Games-STORE | J1705: DIS7-OTH-WS-MAT1 | K1705: Goods
B1706: Invoice | C1706: 2024-09-02T00:00:00.000 | D1706: NISINV-68389 | E1706: Event and Convention Sales | F1706: F | G1706: Accounts Receivable : Accounts Receivable: Online Store | H1706: 455.47 | I1706: NA Games-STORE | J1706: PG24-OTH-WS-BKT1 | K1706: Goods
B1707: Item Fulfillment | C1707: 2024-09-03T00:00:00.000 | D1707: 433616 | E1707: 22297 Alana Warner | F1707: F | G1707: Inventory Asset : Finished Goods | H1707: 4.32 | I1707: NA Games-STORE | J1707: TTD1-OTH-WS-PUZ1 | K1707: Goods
B1708: Item Fulfillment | C1708: 2024-09-03T00:00:00.000 | D1708: 433612 | E1708: 23551 Greg Scott | F1708: F | G1708: Inventory Asset : Finished Goods | H1708: 6.84 | I1708: NA Games-STORE | J1708: NAV1-OTH-WS-PLU4 | K1708: Goods
B1709: Item Fulfillment | C1709: 2024-09-03T00:00:00.000 | D1709: 433589 | E1709: 23519 Blair Strater | F1709: F | G1709: Inventory Asset : Finished Goods | H1709: 6.84 | I1709: NA Games-STORE | J1709: NAV1-OTH-WS-PLU4 | K1709: Goods
B1710: Item Fulfillment | C1710: 2024-09-03T00:00:00.000 | D1710: 433604 | E1710: 23545 Margaret Lake | F1710: F | G1710: Inventory Asset : Finished Goods | H1710: 7.91 | I1710: NA Games-STORE | J1710: TTD1-OTH-WS-PLU1 | K1710: Goods
B1711: Item Fulfillment | C1711: 2024-09-03T00:00:00.000 | D1711: 433569 | E1711: 23491 Salvatore Tranchina | F1711: F | G1711: Inventory Asset : Finished Goods | H1711: 7.91 | I1711: NA Games-STORE | J1711: TTD1-OTH-WS-PLU1 | K1711: Goods
B1712: Item Fulfillment | C1712: 2024-09-03T00:00:00.000 | D1712: 433600 | E1712: Kyle Marshall | F1712: F | H1712: 3.78 | I1712: NA Games-STORE | J1712: TTD1-OTH-WS-STD2 | K1712: Goods
B1713: Item Fulfillment | C1713: 2024-09-03T00:00:00.000 | D1713: 433569 | E1713: 23491 Salvatore Tranchina | F1713: F | G1713: Inventory Asset : Finished Goods | H1713: 8.04 | I1713: NA Games-STORE | J1713: TTD1-OTH-WS-PLU2 | K1713: Goods
B1714: Item Fulfillment | C1714: 2024-09-03T00:00:00.000 | D1714: 433563 | E1714: Justin Hayes | F1714: F | H1714: 7.91 | I1714: NA Games-STORE | J1714: TTD1-OTH-WS-PLU1 | K1714: Goods
B1715: Item Fulfillment | C1715: 2024-09-03T00:00:00.000 | D1715: 433610 | E1715: 23550 Caleigh Rozmenoski | F1715: F | G1715: Inventory Asset : Finished Goods | H1715: 6.84 | I1715: NA Games-STORE | J1715: NAV1-OTH-WS-PLU4 | K1715: Goods
B1716: Item Fulfillment | C1716: 2024-09-03T00:00:00.000 | D1716: 433580 | E1716: 23501 Brett Story | F1716: F | G1716: Inventory Asset : Finished Goods | H1716: 7.92 | I1716: NA Games-STORE | J1716: TTD1-OTH-WS-PLU1 | K1716: Goods
B1717: Item Fulfillment | C1717: 2024-09-03T00:00:00.000 | D1717: 433600 | E1717: Kyle Marshall | F1717: F | H1717: 3.78 | I1717: NA Games-STORE | J1717: TTD1-OTH-WS-STD1 | K1717: Goods
B1718: Item Fulfillment | C1718: 2024-09-03T00:00:00.000 | D1718: 433561 | E1718: Matthew Payte | F1718: F | H1718: 4.31 | I1718: NA Games-STORE | J1718: TTD1-OTH-WS-PUZ1 | K1718: Goods
B1719: Item Fulfillment | C1719: 2024-09-03T00:00:00.000 | D1719: 433587 | E1719: 23515 Zain Ansari | F1719: F | G1719: Inventory Asset : Finished Goods | H1719: 8.05 | I1719: NA Games-STORE | J1719: TTD1-OTH-WS-PLU2 | K1719: Goods
B1720: Item Fulfillment | C1720: 2024-09-04T00:00:00.000 | D1720: 433630 | E1720: 23580 Jared Chiusano | F1720: F | G1720: Inventory Asset : Finished Goods | H1720: 8.04 | I1720: NA Games-STORE | J1720: TTD1-OTH-WS-PLU2 | K1720: Goods
B1721: Item Fulfillment | C1721: 2024-09-04T00:00:00.000 | D1721: 433630 | E1721: 23580 Jared Chiusano | F1721: F | G1721: Inventory Asset : Finished Goods | H1721: 7.92 | I1721: NA Games-STORE | J1721: TTD1-OTH-WS-PLU1 | K1721: Goods
B1722: Item Fulfillment | C1722: 2024-09-04T00:00:00.000 | D1722: 433624 | E1722: 23563 Amelia Sexton | F1722: F | G1722: Inventory Asset : Finished Goods | H1722: 4.96 | I1722: NA Games-STORE | J1722: DIS7-OTH-WS-MAT1 | K1722: Goods
B1723: Item Fulfillment | C1723: 2024-09-05T00:00:00.000 | D1723: 433638 | E1723: Shane Dundon | F1723: F | G1723: Inventory Asset : Finished Goods | H1723: 3.78 | I1723: NA Games-STORE | J1723: TTD1-OTH-WS-STD2 | K1723: Goods
B1724: Item Fulfillment | C1724: 2024-09-05T00:00:00.000 | D1724: 433638 | E1724: Shane Dundon | F1724: F | G1724: Inventory Asset : Finished Goods | H1724: 3.78 | I1724: NA Games-STORE | J1724: TTD1-OTH-WS-STD1 | K1724: Goods
B1725: Item Fulfillment | C1725: 2024-09-05T00:00:00.000 | D1725: 433639 | E1725: 23587 Shelby Story | F1725: F | G1725: Inventory Asset : Finished Goods | H1725: 10.14 | I1725: NA Games-STORE | J1725: NAV1-OTH-WS-PLU2 | K1725: Goods
B1726: Item Fulfillment | C1726: 2024-09-06T00:00:00.000 | D1726: 433641 | E1726: 23599 Autumn Harrnacker | F1726: F | G1726: Inventory Asset : Finished Goods | H1726: 7.91 | I1726: NA Games-STORE | J1726: TTD1-OTH-WS-PLU1 | K1726: Goods
B1727: Item Fulfillment | C1727: 2024-09-09T00:00:00.000 | D1727: 434960 | E1727: 23246 Nathaniel Salada | F1727: F | H1727: 9.17 | I1727: NA Games-STORE | J1727: TIR1-OTH-WS-PLU3 | K1727: Goods
B1728: Item Fulfillment | C1728: 2024-09-09T00:00:00.000 | D1728: 434947 | E1728: 23620 nathan bryce | F1728: F | G1728: Inventory Asset : Finished Goods | H1728: 14.61 | I1728: NA Games-STORE | J1728: TTD1-OTH-WS-PGS1 | K1728: Goods
B1729: Item Fulfillment | C1729: 2024-09-09T00:00:00.000 | D1729: 434959 | E1729: JONATHAN Wright | F1729: F | G1729: Inventory Asset : Finished Goods | H1729: 14.61 | I1729: NA Games-STORE | J1729: TTD1-OTH-WS-PGS1 | K1729: Goods
B1730: Item Fulfillment | C1730: 2024-09-09T00:00:00.000 | D1730: 434960 | E1730: 23246 Nathaniel Salada | F1730: F | H1730: 8.09 | I1730: NA Games-STORE | J1730: TIR1-OTH-WS-PLU2 | K1730: Goods
B1731: Item Fulfillment | C1731: 2024-09-09T00:00:00.000 | D1731: 434955 | E1731: 23630 Judah Joslyn | F1731: F | G1731: Inventory Asset : Finished Goods | H1731: 8.81 | I1731: NA Games-STORE | J1731: DIS7-OTH-WS-PLU1 | K1731: Goods
B1732: Item Fulfillment | C1732: 2024-09-09T00:00:00.000 | D1732: 434959 | E1732: JONATHAN Wright | F1732: F | G1732: Inventory Asset : Finished Goods | H1732: 14.96 | I1732: NA Games-STORE | J1732: NAV1-OTH-WS-PGS1 | K1732: Goods
B1733: Item Fulfillment | C1733: 2024-09-09T00:00:00.000 | D1733: 434955 | E1733: 23630 Judah Joslyn | F1733: F | G1733: Inventory Asset : Finished Goods | H1733: 10.58 | I1733: NA Games-STORE | J1733: NAV1-OTH-WS-PLU3 | K1733: Goods
B1734: Item Fulfillment | C1734: 2024-09-09T00:00:00.000 | D1734: 434954 | E1734: 23629 Mary Strassmann | F1734: F | G1734: Inventory Asset : Finished Goods | H1734: 10.13 | I1734: NA Games-STORE | J1734: NAV1-OTH-WS-PLU1 | K1734: Goods
B1735: Item Fulfillment | C1735: 2024-09-10T00:00:00.000 | D1735: 433654 | E1735: 23644 Constance Cha | F1735: F | G1735: Inventory Asset : Finished Goods | H1735: 6.84 | I1735: NA Games-STORE | J1735: NAV1-OTH-WS-PLU4 | K1735: Goods
B1736: Item Fulfillment | C1736: 2024-09-13T00:00:00.000 | D1736: 433664 | E1736: 21389 Vernon Porter | F1736: F | H1736: 8.05 | I1736: NA Games-STORE | J1736: TTD1-OTH-WS-PLU2 | K1736: Trails through Daybreak PS5
B1737: Item Fulfillment | C1737: 2024-09-13T00:00:00.000 | D1737: 433664 | E1737: 21389 Vernon Porter | F1737: F | H1737: 7.92 | I1737: NA Games-STORE | J1737: TTD1-OTH-WS-PLU1 | K1737: Trails through Daybreak PS5
B1738: Item Fulfillment | C1738: 2024-09-16T00:00:00.000 | D1738: 433675 | E1738: 23700 Dallas Raney | F1738: F | G1738: Inventory Asset : Finished Goods | H1738: 7.91 | I1738: NA Games-STORE | J1738: TTD1-OTH-WS-PLU1 | K1738: Goods
B1739: Item Fulfillment | C1739: 2024-09-16T00:00:00.000 | D1739: 433670 | E1739: 23680 Rylee Wight | F1739: F | G1739: Inventory Asset : Finished Goods | H1739: 6.84 | I1739: NA Games-STORE | J1739: NAV1-OTH-WS-PLU4 | K1739: Goods
B1740: Item Fulfillment | C1740: 2024-09-16T00:00:00.000 | D1740: 433671 | E1740: Ronda Warren | F1740: F | H1740: 3.78 | I1740: NA Games-STORE | J1740: TTD1-OTH-WS-STD1 | K1740: Goods
B1741: Item Fulfillment | C1741: 2024-09-16T00:00:00.000 | D1741: 433674 | E1741: 23697 Luis Nolasco | F1741: F | G1741: Inventory Asset : Finished Goods | H1741: 3.78 | I1741: NA Games-STORE | J1741: TTD1-OTH-WS-STD1 | K1741: Goods
B1742: Item Fulfillment | C1742: 2024-09-16T00:00:00.000 | D1742: 433674 | E1742: 23697 Luis Nolasco | F1742: F | G1742: Inventory Asset : Finished Goods | H1742: 3.78 | I1742: NA Games-STORE | J1742: TTD1-OTH-WS-STD2 | K1742: Goods
B1743: Item Fulfillment | C1743: 2024-09-17T00:00:00.000 | D1743: 433692 | E1743: 23665 Sara Ludwig | F1743: F | G1743: Inventory Asset : Finished Goods | H1743: 10.59 | I1743: NA Games-STORE | J1743: NAV1-OTH-WS-PLU3 | K1743: Goods
B1744: Item Fulfillment | C1744: 2024-09-18T00:00:00.000 | D1744: 433704 | E1744: 23297 angela victoria | F1744: F | G1744: Inventory Asset : Finished Goods | H1744: 6.84 | I1744: NA Games-STORE | J1744: NAV1-OTH-WS-PLU4 | K1744: Goods
B1745: Item Fulfillment | C1745: 2024-09-19T00:00:00.000 | D1745: 433712 | E1745: 1123 ToniMarie DiNunzio | F1745: F | G1745: Inventory Asset : Finished Goods | H1745: 7.92 | I1745: NA Games-STORE | J1745: TTD1-OTH-WS-PLU1 | K1745: Goods
B1746: Item Fulfillment | C1746: 2024-09-23T00:00:00.000 | D1746: 434756 | E1746: 23751 Steven Pham | F1746: F | G1746: Inventory Asset : Finished Goods | H1746: 9.16 | I1746: NA Games-STORE | J1746: TIR1-OTH-WS-PLU3 | K1746: Goods
B1747: Item Fulfillment | C1747: 2024-09-23T00:00:00.000 | D1747: 434735 | E1747: 1123 ToniMarie DiNunzio | F1747: F | G1747: Inventory Asset : Finished Goods | H1747: 8.04 | I1747: NA Games-STORE | J1747: TTD1-OTH-WS-PLU2 | K1747: Goods
B1748: Item Fulfillment | C1748: 2024-09-23T00:00:00.000 | D1748: 434768 | E1748: 23764 Pearl T | F1748: F | G1748: Inventory Asset : Finished Goods | H1748: 7.91 | I1748: NA Games-STORE | J1748: TTD1-OTH-WS-PLU1 | K1748: Goods
B1749: Item Fulfillment | C1749: 2024-09-23T00:00:00.000 | D1749: 434768 | E1749: 23764 Pearl T | F1749: F | G1749: Inventory Asset : Finished Goods | H1749: 8.05 | I1749: NA Games-STORE | J1749: TTD1-OTH-WS-PLU2 | K1749: Goods
B1750: Item Fulfillment | C1750: 2024-09-23T00:00:00.000 | D1750: 434764 | E1750: 23751 Steven Pham | F1750: F | G1750: Inventory Asset : Finished Goods | H1750: 14.61 | I1750: NA Games-STORE | J1750: TTD1-OTH-WS-PGS1 | K1750: Goods
B1751: Item Fulfillment | C1751: 2024-09-24T00:00:00.000 | D1751: 434831 | E1751: Michael Phung [189244] | F1751: F | H1751: 8.04 | I1751: NA Games-STORE | J1751: TTD1-OTH-WS-PLU2 | K1751: Goods
B1752: Item Fulfillment | C1752: 2024-09-24T00:00:00.000 | D1752: 434813 | E1752: Nicholas Allen | F1752: F | H1752: 4.31 | I1752: NA Games-STORE | J1752: TTD1-OTH-WS-PUZ1 | K1752: Goods
B1753: Item Fulfillment | C1753: 2024-09-24T00:00:00.000 | D1753: 434902 | E1753: Raymond Dinse | F1753: F | G1753: Inventory Asset : Finished Goods | H1753: 14.97 | I1753: NA Games-STORE | J1753: NAV1-OTH-WS-PGS1 | K1753: Goods
B1754: Item Fulfillment | C1754: 2024-09-24T00:00:00.000 | D1754: 434865 | E1754: Carolyn Rolbiecki | F1754: F | H1754: 6.84 | I1754: NA Games-STORE | J1754: NAV1-OTH-WS-PLU4 | K1754: Goods
B1755: Item Fulfillment | C1755: 2024-09-24T00:00:00.000 | D1755: 434837 | E1755: Raul Arroyo Rodriguez | F1755: F | H1755: 10.14 | I1755: NA Games-STORE | J1755: NAV1-OTH-WS-PLU1 | K1755: Goods
B1756: Item Fulfillment | C1756: 2024-09-24T00:00:00.000 | D1756: 434845 | E1756: 21868 Lewis Luu | F1756: F | H1756: 10.59 | I1756: NA Games-STORE | J1756: NAV1-OTH-WS-PLU3 | K1756: Goods
B1757: Item Fulfillment | C1757: 2024-09-24T00:00:00.000 | D1757: 434837 | E1757: Raul Arroyo Rodriguez | F1757: F | H1757: 6.84 | I1757: NA Games-STORE | J1757: NAV1-OTH-WS-PLU4 | K1757: Goods
B1758: Item Fulfillment | C1758: 2024-09-24T00:00:00.000 | D1758: 434837 | E1758: Raul Arroyo Rodriguez | F1758: F | H1758: 10.13 | I1758: NA Games-STORE | J1758: NAV1-OTH-WS-PLU2 | K1758: Goods
B1759: Item Fulfillment | C1759: 2024-09-24T00:00:00.000 | D1759: 434837 | E1759: Raul Arroyo Rodriguez | F1759: F | H1759: 10.58 | I1759: NA Games-STORE | J1759: NAV1-OTH-WS-PLU3 | K1759: Goods
B1760: Item Fulfillment | C1760: 2024-09-24T00:00:00.000 | D1760: 434831 | E1760: Michael Phung [189244] | F1760: F | H1760: 7.92 | I1760: NA Games-STORE | J1760: TTD1-OTH-WS-PLU1 | K1760: Trails through Daybreak
B1761: Item Fulfillment | C1761: 2024-09-24T00:00:00.000 | D1761: 434845 | E1761: 21868 Lewis Luu | F1761: F | H1761: 10.14 | I1761: NA Games-STORE | J1761: NAV1-OTH-WS-PLU2 | K1761: Goods
B1762: Item Fulfillment | C1762: 2024-09-24T00:00:00.000 | D1762: 434839 | E1762: Aaron Myers | F1762: F | H1762: 4.32 | I1762: NA Games-STORE | J1762: TTD1-OTH-WS-PUZ1 | K1762: Goods
B1763: Item Fulfillment | C1763: 2024-09-24T00:00:00.000 | D1763: 434845 | E1763: 21868 Lewis Luu | F1763: F | H1763: 10.13 | I1763: NA Games-STORE | J1763: NAV1-OTH-WS-PLU1 | K1763: Goods
B1764: Item Fulfillment | C1764: 2024-09-24T00:00:00.000 | D1764: 434845 | E1764: 21868 Lewis Luu | F1764: F | H1764: 6.84 | I1764: NA Games-STORE | J1764: NAV1-OTH-WS-PLU4 | K1764: Goods
B1765: Item Fulfillment | C1765: 2024-09-25T00:00:00.000 | D1765: 434911 | E1765: Sylvanus Bloice [170248] | F1765: F | H1765: 3.78 | I1765: NA Games-STORE | J1765: TTD1-OTH-WS-STD2 | K1765: Goods
B1766: Item Fulfillment | C1766: 2024-09-25T00:00:00.000 | D1766: 434911 | E1766: Sylvanus Bloice [170248] | F1766: F | H1766: 3.78 | I1766: NA Games-STORE | J1766: TTD1-OTH-WS-STD1 | K1766: Goods
B1767: Item Fulfillment | C1767: 2024-09-27T00:00:00.000 | D1767: 434919 | E1767: 20019 Josh Foster | F1767: F | H1767: 7.91 | I1767: NA Games-STORE | J1767: TTD1-OTH-WS-PLU1 | K1767: Trails through Daybreak PS5
B1768: Item Fulfillment | C1768: 2024-09-27T00:00:00.000 | D1768: 434919 | E1768: 20019 Josh Foster | F1768: F | H1768: 8.04 | I1768: NA Games-STORE | J1768: TTD1-OTH-WS-PLU2 | K1768: Trails through Daybreak PS5
B1769: Item Fulfillment | C1769: 2024-09-27T00:00:00.000 | D1769: 434926 | E1769: 23797 Karissa Gilbertson | F1769: F | G1769: Inventory Asset : Finished Goods | H1769: 6.84 | I1769: NA Games-STORE | J1769: NAV1-OTH-WS-PLU4 | K1769: Goods
B1770: Inventory Adjustment | C1770: 2024-09-30T00:00:00.000 | D1770: 3152 | F1770: F | G1770: Inventory Asset : Finished Goods | H1770: -20.09 | I1770: NA Games-STORE | J1770: - No Item - | K1770: Goods
B1771: Inventory Adjustment | C1771: 2024-09-30T00:00:00.000 | D1771: 3168 | F1771: F | G1771: Inventory Asset : Finished Goods | H1771: 1585.72 | I1771: - No Division - | J1771: - No Item - | K1771: - No Game Title -
B1772: Inventory Adjustment | C1772: 2024-09-30T00:00:00.000 | D1772: 3151 | F1772: F | G1772: - Split - | H1772: -65.1 | I1772: NA Games-STORE | J1772: - No Item - | K1772: Goods
B1773: Inventory Transfer | C1773: 2024-09-30T00:00:00.000 | D1773: 1995 | F1773: F | G1773: Inventory Asset : Finished Goods | H1773: 0.01 | I1773: NA Games | J1773: PNY1-OTH-WS-TSH3 : PNY1-OTH-WS-TSH3-XL | K1773: Goods
B1774: Item Fulfillment | C1774: 2024-09-30T00:00:00.000 | D1774: 434962 | E1774: NISA Operations | F1774: F | H1774: 38.37 | I1774: NA Games-STORE | J1774: PBR2-OTH-WS-STD5 | K1774: Goods
B1775: Item Fulfillment | C1775: 2024-09-30T00:00:00.000 | D1775: 434962 | E1775: NISA Operations | F1775: F | H1775: 28.77 | I1775: NA Games-STORE | J1775: PBR2-OTH-WS-STD4 | K1775: Goods
B1776: Item Fulfillment | C1776: 2024-09-30T00:00:00.000 | D1776: 434962 | E1776: NISA Operations | F1776: F | H1776: 28.77 | I1776: NA Games-STORE | J1776: PBR2-OTH-WS-STD2 | K1776: Goods
B1777: Item Fulfillment | C1777: 2024-09-30T00:00:00.000 | D1777: 434962 | E1777: NISA Operations | F1777: F | H1777: 28.77 | I1777: NA Games-STORE | J1777: PBR2-OTH-WS-STD1 | K1777: Goods
B1778: Item Fulfillment | C1778: 2024-09-30T00:00:00.000 | D1778: 434962 | E1778: NISA Operations | F1778: F | H1778: 28.77 | I1778: NA Games-STORE | J1778: PBR2-OTH-WS-STD3 | K1778: Goods
A1779: Total - COGS-Online Store:Goods_Material Costs | H1779: SUM(R[-113]C:R[-1]C) -> 9630.870000000003
A1780: Total - COGS-U.S. Online Store | H1780: SUM(R[-116]C,R[-1]C) -> 50078.69999999993
A1781: Total - Cost of Goods Sold-North America | H1781: SUM(R[-1597]C,R[-1]C) -> 464670.68999999994
A1782: Total - Cost of Goods Sold | H1782: SUM(R[-1762]C,R[-1639]C,R[-1]C) -> 816070.7699999999
A1783: Total - Cost Of Sales | H1783: SUM(R[-1]C) -> 816070.7699999999
A1784: Gross Profit | H1784: 0-R[-1]C -> -816070.7699999999
A1785: Net Ordinary Income | H1785: R[-1]C-0 -> -816070.7699999999
A1786: Net Income Before Taxes | H1786: R[-1]C+0 -> -816070.7699999999
A1787: Net Income | H1787: +R[-1]C-0 -> -816070.7699999999